ПРОЛОГ	ПРОЛОГ
сотворившего, и через это видимое восходим к Невидимому.
Нъ не
шествѣе ны есть требѣ, но вѣра — тою бо можемъ видѣти Того. Егда же видѣмъ, в
годы и в часы приступающа и дождь дающа, и сию растящу, и травою покрываему, и
нивы волнующася, и зеленующася дубравы, и обрастъша горы, и родивша овоща,
пустимъ на хвалу языкъ, и рцѣмъ съ божественым Давидомъ, и с тѣмъ воспоимъ,
рекуще, яко: «Возвеличишася дѣла твоя, Господи. Вся премудростию сътворилъ
еси».[2] Егда слышимъ пѣснивыя птица,
различными гласы поюща красныа пѣсни, славиа же звѣждуща, косы же и соя,
иволгы, и желны, и щуры же и изокы, ластовици же и враньца, и ины птица, яже
бесчисмене, — симь ся глумимь, славяще Творца.	Но не
восшествие нам требуется, а вера, ибо благодаря ей мы можем увидеть Его. Когда
же увидим Его, в сроки свои приступающего и дождь земле дающего, а ее растящую
и травой покрываемую, и нивы волнующиеся, и зеленеющие дубравы, и порастающие
лесом горы, и зреющие плоды, то используем язык для хвалы и скажем с
божественным Давидом, воспоем с ним, говоря: «Возвеличились дела твои, Господи!
Все премудростью сотворил еси!» Когда слышим, как певчие птицы поют всякими
голосами прекрасные песни, соловьиные трели, голоса дроздов и соек, иволг и
дятлов, кузнечиков и цикад, ласточек и жаворонков и иных птиц, а они бесчисленны,
— тогда мы, умиляясь, славим Творца.
Не яцѣ же
бо суть инии творци — тии бо готовою вещью творят, а Сий вся от небытиа изведе
и дасть небывшимъ бытие. Удобь бо Ему от небытиа творити. Сице бо и древле
сътвори, спроста же рещи, и по вся дни творить. Не бо но от готовых творить
телесъ животомъ телеса, и от небывших творить душа, но не всѣмъ животомъ, но
точью человѣкомъ. И птицами творит птиц, а пяавающими плавающая, и инѣхъ родовь
кьихъждо своимъ родомъ премѣняеть. Такоже и земными плоды, и ораными, и
садимыми приносить человѣкомъ. Преж земля ни орана, ни сѣяна прорасти всякого
сада имена и образы плежущаго, и четвероногаго рода, и водное естество роди,
якоже повелѣно ему бысть, и иже в водахъ живуть животная и иже по
воздуху проходять. А саму же ту землю, небо и воздух, и водное естество, и
огненый свѣтъ не вещи повелѣ извести, нъ не бывша николи же, и изведе от
небытия в бытие, Самъ Творитель бывъ кораблю сему великому, рекше твори сея,
Сам же править и премудра съсудѣ корабля. Се ны сказа верховный Его пророкъ
Моисей, от сего премудраго Творца, Господа Бога, и Владыкы приимъ на горѣ
Синайстѣй.	Не таков
Он, как другие творцы, что создают из готовой материи, а Он все вывел из
небытия и дал бытие небывшим. Легко ведь Ему из небытиятворить. Так Он в
древности мир сотворил, так, попросту сказать, и во всякий день творит. И не из
готовых тел творит Он тела живым; а из небытия творит души, но не всем живущим,
а только человеку. И птицами творит птиц, а плавающих плавающими, и иных родов
каждого делает соответствующим его роду. Так же и земные плоды, сеянные и
садимые, приносит людям. Прежде чем начали пахать и засевать землю, Он
прорастил все виды растений и создал виды пресмыкающихся и четвероногих, и
водное естество родил таким, каким повелено ему быть, и тех, что в воде живущие
существа, и передвигающиеся по воздуху. А сами эти землю, небо, воздух, воду,
огненный не материи Он повелел произвести, но Сам их, никогда не бывших, вывел
из небытия в бытие, Сам Творцом явившись этому великому кораблю, то есть
творению этому, Сам же и правит мудреными снастями корабля. Так нам сказал
верховный Его пророк Моисей, восприняв это от премудрого Творца, Господа Бога и
Владыки, на Синайской горе.
Си же
словеса шесть, господи мой, не о себе мы есмы сътворили, но ово от Ексамера
святаго Василиа истовая словеса, ово же и разумы от него приемлюще, такоже и от
Иоанна, а другое от другых: аще есмы кождо что почитали иногда, такоже есмы
сплатили ее.	Эти же
шесть слов, господин мой, не сам я сочинил, но иное взял нз верных слов
Шестоднева святого Василия, а иное по смыслу у него заимствовал, также и у
Иоанна, а другое у других: что мне когда-либо приходилось читать, то я и
соединил.
Яко же се
бы кто минуемь владыкою, аще мимоходящу владыцѣ, восхотѣлъ бы храмъ ему
сътворити. Не имущу же ему чимъ сътворити, шедъ бы к богатымъ и спросилъ бы от
них — от ового мраморъ, а от другаго бръселиа, ти стѣны бы возградилъ, и
мраморомъ помостилъ прошениемъ от богатыхъ. И покрыти хотящу, и не имущу
противу стѣнамъ тѣмъ и помосту мраморному достойна покрова, лѣсу бы исплелъ
потонку храму тому, и створилъ, и покрылъ соломою, и двери наплѣталъ терниемъ,
и тако затворъ сотворил. Сице бо достоить неимущему в дому своемь ничтоже.	Это похоже
на то, как если бы кто-нибудь, кого минует, ходя мимо, его господин, захотел бы
построить ему хоромы. Не имея же из чего строить, пошел бы он к богатым людям и
попросил бы у них — у одного мрамор, у другого бревна, и возвел бы стены, а
мрамором, выпрошенным у богатых, вымостил бы пол. И захотел бы те хоромы
покрыть, но не имея материала, достойного стен и мраморного пола, сплел бы сетку
на том доме и покрыл бы его соломой, а двери сплел бы из прутьев и такой же
сделал бы запор. Так ведь остается поступить не имущему в своем доме ничего.
Сице бо
есть нищий нашь умъ: да не имы в дому своемъ ничтоже, чюжими возгради словесы,
приложи же и от нищаго дому своего, но акы солому и лѣсы — словеса своя. Аще
владыка, милуяй его, все то акы своя труды приемлеть его, ему же владыцѣ
Господь Богь надъ владыками даждь сию жизнь добрѣ угаждающу Тебѣ рая доити съ
преподобными мужи всѣми.	Таков же и
нищий наш ум: не имея у себя дома ничего, строит он из чужих слов, добавляя
понемногу из своего нищего дома, но вроде соломы и прутьев — свои слова. Если
владыка, снисходя к нему, все эти труды его примет как свои, то дай этому
владыке Господь, Бог над владыками, угодить Тебе в этой жизни и со всеми
преподобными мужами до рая дойти.
Аминь.	Аминь.
<...>	<...>
СЛОВО ШЕСТАГО ДНИ	СЛОВО ШЕСТОГО ДНЯ
Яко же
смердъ и нищь человѣкъ и страненъ, пришед издалеча к преворамъ княжа двора и
видѣвъ я, дивится и, приступивъ къ вратомъ, чюдится, въпрашая, и вънутрь въшед,
видѣть на обѣ странѣ храмы стояща украшены
камениемъ и древомъ истесаны, и прочее въ дворець
въшед и узрѣвъ полаты высокы и церкви, издобрены без года камениемъ и древомъ и
шаромъ, изутрь же мраморомъ и мѣдью, съребром же и златом, таче не съвидый,
чьсому приложити их, нѣсть бо того видѣлъ на своей земли развѣ хызъ лѣпленъ и
убогъ, ти акы погубивъ си умъ чюдиться имъ ту. Но аще ся прилучится ему и князь
видѣти, сѣдяща въ срачицѣ бисеромъ покыданѣ, гривну цатаву на выи носяща и
обручи на руку, и поясомъ вольрьмитомъ поясана, и меч златъ при бедрѣ висящь,
обаполы его боляры стояща въ златыхъ гривнах и поасѣх и обручих, ти его аще его
кто вопрашаеть, възвращьшася на свою землю, рекый: «Что видѣ тамо?», — рече:
«Не вѣдѣ, како вы повѣдѣ того. Свои бы бѣсте очи умѣлѣ достоинѣ чюдитися той
красотѣ». Тако же и азъ не могу достойнѣ тоя доброты и чина сказати, но самъ
кождо васъ, очима плотныма видя и умомъ безплотнымъ домышляя, паче ся
можеть извѣстнѣе чюдитися. Свои бо очи никомуже сължетѣ, аще и тѣ ся другоици
блазнитѣ. Но обаче тѣ извѣстнѣиши есть иного. Видя бо небо утворено звѣздами,
солнцем же и мѣсяцемъ, и землю злакомъ и древомъ, и море рыбами всяцѣми
исполнено, бисеромь же и всяцѣми рунесы пиньскыми, пришед же къ человѣку, и умъ
си акы погублю, чюдяся, и недомышлюся: въ коль малѣ тѣлѣ толика мысль, обыидущи
всю землю и выше небесъ възыдущи. Гдѣ ли есть привязанъ умъ тъй? Како ли изыдый
ис тѣла проидеть кровы насобыя, проидеть въздух и облакы минеть, солнце и
мѣсяць и вся поясы, и звѣзды, ефиръ же и вся небеса, и въ томъ часѣ пакы въ
тѣлѣ ся своемъ обрящеть? Кыима крилома възлѣтѣ? Кыим ли путемъ прилетѣ? Не могу
ислѣдѣти. И точию се вѣдѣ рещи съ Давидомъ: «Удивися разумъ Твой, мною укрѣпися,
не возмогу противу ему», «Възвесели мя, Господи, тварью твоею, и дѣломъ руку
Твоею възрадуюся»,[3]
яко же «Възвеличишася душа Твоя, Господи, вся
премудростию сътвори».[4]	Как смерд и
нищий человек или странник, придя издалека к оградам княжеского дворца и увидав
их, удивляется и, подойдя к воротам, восхищается, расспрашивая, и, внутрь войдя
и видя стоящие с обеих сторон хоромы, украшенные камнем и деревом резным, а
затем, во дворец войдя и увидав высокие палаты и церкви, богато украшенные
камнем, деревом и живописью, а изнутри мрамором, медью, серебром и золотом, не
знает, чему их приравнять, ибо не видел он в своей земле ничего, кроме жалких и
убогих хижин, и как безумный удивляется этому тут. А если случится ему и князя
увидеть, сидящего в облачении, осыпанном бисером, с гривной изукрашенной на шее
и обручами на руке, поясом красным препоясанного и с мечом золотым, при бедре
висящим, с двух сторон его бояр, стоящих в золотых гривнах, поясах и обручах,
тогда, если кто спросит его по возвращении в свою землю, говоря: «Что ты там
видел?», — он скажет: «Не знаю, как вам рассказать о том. Лишь своими глазами
можно достойно подивиться той красоте». Так же и я не могу достойно сказать о
том хорошем устроении и чине, но каждый из вас сам, очами телесными видя и умом
бестелесным домышляя, больше и с лучшим знанием дела может удивляться. Свои
ведь очи никому не солгут, хотя и те иной раз ошибаются. Однако же они извещают
лучше прочего. Увидав же небо, украшенное звездами, солнцем и месяцем, и землю
— злаками и деревьями, и море, рыбами всякими наполненное, бисером и всякими
завитушками ракушек, и переходя к человеку, как бы ума лишаюсь от удивления и
не могу понять, откуда в таком малом теле столь высокая мысль, способная обойти
всю землю и выше небес взойти. К чему привязан ум тот? Как, исходя из тела,
проходит он сферы одну за другой, проходит воздух и минует облака, солнце,
месяц, и все пояса, и звезды, эфир, и все небеса и тотчас же вновь оказывается
в своем теле? На каких крыльях он взлетел? Каким путем прилетел? Не могу
проследить. Только и знаю, что говорить вместе с Давидом: «Удивился разум Твой,
мною укрепился, не возмогу против него», «Возвеселил меня, Господи, творением
твоим, и делам рук Твоих я возрадуюсь», ибо «Возвеличились дела Твои, Господи;
всё премудростию сотворил».
