Понеже убо испръва, егда начинашеся строити мѣсто то, тогда многы недостаткы бываху; лишение всѣх потребных послѣдняго ради нестяжаниа и конечняа дѣля пустоты, еже не имѣти им ниоткудуже всякого утѣшениа, но и прочиа всякыа нужныа потребы, откуда бо имѣти хотяху кое любо потребование. Елма же пусто бяше мѣсто то, и не бѣ тогда окрестъ мѣста того ни селъ близъ, ни дворовъ. По многа же времена и пути пространнаго не бяше къ мѣсту тому, но нѣкоею узкою и прискръбною тѣсною стъзею, акы беспутием, нужахуся приходити к ним. Великий же и широкый путь вселюдскый отдалече, не приближаася мѣста того, ведяшеся; окрестъ же манастыря того все пусто, съ вся страны лѣсове, всюду пустыня: пустыни бо в рѣсноту нарицашеся. И сице жившим имь дондеже исплънишася дние лѣт, яко, мню, множае пяти на десяти.	Сначала, когда начинала устраиваться обитель эта, тогда многого не хватало; лишены были монахи всего необходимого из-за совершенной бедности и безлюдности того места, так что ждать им неоткуда было какого-нибудь утешения, а также всяких нужных вещей, и неоткуда было им получить что-либо нужное. Ведь пустынным было место то, и не было тогда вокруг места того ни сел поблизости, ни домов. Долгое время и дороги хорошей не было к месту этому, но по одной узкой, и плохой, и неудобной дороге, как по бездорожию, вынуждены были приходить к монастырю. Большая и широкая дорога проезжая была далеко, на большом расстоянии от места того проходила; вокруг же монастыря того было безлюдно, со всех сторон леса, всюду пустынь: пустынью справедливо называлось это место. Так жили монахи, пока не прошло много лет, — я думаю, больше пятнадцати.
Паки же по днех, непщую яко въ днех княжениа князя великого Ивана, сына Иваня, брата же Симионя,[137] тогда начаша приходити христиане, и обходити сквозѣ вся лѣсы оны, и възлюбиша жити ту. И множество людий всхотѣвше, начаша съ обаполы мѣста того садитися, и начаша сѣщи лѣсы оны, яко никомуже възбраняющу им. И сътвориша себѣ различныя многыя починьци, преждереченную исказиша пустыню и не пощадѣша, и сътвориша пустыню яко поля чиста многа, якоже и нынѣ нами зрима суть. И съставиша села и дворы многы, и насѣяша села, и сътвориша плод житенъ, и умножишася зѣло, и начаша посѣщати и учящати въ монастырь, приносяще многообразная и многоразличнаа потребованиа, имъже нѣсть числа. Но мы до здѣ сию рѣчь оставльше, а на предреченную бесѣду обратимся, еже от начатка слова начах повѣдовати: о всяцей худости и о недостатцѣх нужных потребъ, без нихже не мощно обрѣстися.	Через некоторое время — думаю, что во время княжения князя великого Ивана, сына Ивана, брата же Симеонова, — начали приходить сюда христиане, проходя через леса те, и понравилось им здесь жить. И многие люди захотели остаться там, начали по обе стороны места этого селиться, и начали рубить леса те, — ведь никто не запрещал им. И сделали они себе многие выселки, прежнюю изменив пустынь, и, не пощадив ее, преобразили пустынь в широкое чистое поле, которое и теперь мы видим. И построили они села, и дома многие, и засеяли поля, и собрали урожай, и умножилось весьма их число, и начали они приходить и часто посещать монастырь, принося разнообразные и различные нужные вещи, которым не было числа. Но мы теперь эти размышления оставим, а к прежнему повествованию вернемся, — к тому, о чем в начале главы я начал говорить: о всяческой бедности и недостатке в нужных вещах, без которых нельзя обойтись.
Егда испръва начинашеся създаватися мѣсто то, егда немножайшим братиям живущим в нем, егда немнози бяху приходящеи и приносящеи, тогда начастѣ скудости бываху потребных, яко многажды на утриа и хлѣбу не обрѣстися. Да кто может и сказати недостаткы, бывшаа преподобному отцу нашему Сергию? Испръва, егда начинашеся строитися мѣсто то, овогда убо не достало хлѣба, и мукы, и пшеници, и всякого жита; иногда же не достало масла, и соли, и всякого ястиа брашеннаго; овогда же не достало вина, имже обѣдня служити, и фимиану, имже кадити; иногда же не достало въску, имже свещи скати, и пояху в нощи заутренюю, не имущи свѣщь, но токмо лучиною березовою или съсновою свѣтяху себѣ, и тѣм нужахуся канонархати или по книгам чести, и сице съвръшаху нощная службы своя. Преподобный же Сергий всяку нужю ону, и тѣсноту, и всяку скудость, и недостаткы тръпяше съ благодарениемь, ожидая от Бога богатыя милости.	Когда сначала устраивалось место это, когда немного братьев жило здесь, когда немного было людей, приходящих и приносящих все нужное, — тогда часто недостаток ощущался в необходимых вещах, так что много раз с утра и хлеба не хватало. Да и кто может перечислить все лишения, которые испытывал преподобный отец наш Сергий? В первое время, когда начиналось устроение места этого, порой не было хлеба, и муки, и пшеницы, и всякой пищи; иногда же не было масла, и соли, и всяких съестных припасов; порой не было вина, чтобы обедню служить, и фимиама, чтобы кадить; иногда не было воска, чтобы свечи делать, и пели монахи ночью заутреню, не имея свеч, но только лучиной березовой или сосновой светили себе, и так вынуждены были каноны петь или по книгам читать, и так совершали ночные службы свои. Преподобный же Сергий всякую нужду, и затруднение, и всякую скудость, и лишения терпел с благодарностью, ожидая от Бога большой милости.
И случися въ иное время сицево искушение, понеже съ искушением бывает и милость Божиа: нѣкогда не достало бысть хлѣба и соли у игумена, но и въ всем манастыри бысть оскудѣние всѣхъ брашенъ. Бяше же заповѣдь преподобнаго игумена къ всѣм братиам сицева: аще когда съключится таковое искушение, или хлѣба не достанет, или будет оскудѣние всякого брашна, то не исходити того ради из монастыря, въ весь нѣкую или в село и не просити у мирянъ потребных телесных, но сѣдѣти тръпеливе в монастырѣ, и просити, и ожидати милости от Бога. Да яко же братиам веляше и заповѣдаше, сице паче и сам сиа же творяше и тръпяше, и пребысть три дний или четыре не ядущи ничтоже.	Случилось однажды такое испытание, — потому что с испытанием свершается и милость Божья: как-то не было хлеба и соли у игумена, и во всем монастыре истощилась всякая еда. А была заповедь у преподобного игумена для всех братьев такая: если когда-нибудь приключится такое испытание — или хлеба не будет, или кончится всякая еда, — то не выходить за этим из монастыря в деревню какую-нибудь или в село и не просить у мирян нужного для пропитания, но сидеть терпеливо в монастыре, и просить, и ждать милости от Бога. Как братьям он повелевал и заповедовал, так и сам поступал, и терпел, и оставался три или четыре дня без всякой еды.
Минувъшим же трем днемь, а четвертому наставающу и свитающу, взем сикиру прииде къ единому от старець, живущему въ монастыри его, емуже имя Данилъ, и рече ему: «Слышах, старче, яко хощеши сѣни създати пред келиею си. И азъ того ради приидох, да руцѣ мои не празнуета, и съзиждю я тебѣ». Отвѣща Данилъ и рече ему: «Ей, зѣло хощу и имам издавна таковая приготованиа, но ожидаю древодѣли от села. Тебѣ чинити боюся, егда како велику мзду възмеши от мене». Рече же ему Сергий: «Аз не зѣло велика възданиа требую от тебе, но имаши ли гнилыя хлѣбы, зѣло бо хотѣниемь въсхотѣ ми ся ясти таковыя хлѣбы. Иного же болѣ сего ничтоже не требую, ни прошу от тебе мздовъздааниа: у мене николиже обрѣтаются таковии хлѣби. А не глаголи, старче, еже ожидати тебе иного древодѣли мимо мене; и кто есть тебѣ инъ сице древодѣль, якоже азъ?» Старець же Данилъ изнесе ему решето хлѣбовъ гнилых, скрилевь, глаголя: «Аще сицевыя въсхотѣся тебѣ вещи той, и се съ тщаниемь въздаю ти; болѣ же сего не имам». Отвѣща Сергий: «Досыти ми есть и се, и довлѣет ми сие преизлише. Но обаче снабди а до девятаго часа, азъ бо преже даже руцѣ мои не поработасте и преже труда мъзды не приемлю».	Когда прошло три дня и четвертый уже наступал и светало, Сергий взял топор, и пришел к одному из старцев, живущему в монастыре его, по имени Данило, и сказал ему: «Слышал я, старче, что хочешь ты сени соорудить перед кельей своей. И я для этого пришел, чтобы руки мои не были праздными, построю сени тебе». В ответ Данило сказал ему: «Да, я очень хочу и давно собираюсь это сделать, но жду плотников из села. С тобой договариваться боюсь, как бы ты большую плату не взял с меня». Сказал ему Сергий: «Я не очень большую плату прошу у тебя, но нет ли у тебя гнилого хлеба, потому что очень хочется мне поесть такого хлеба. Ничего же другого сверх этого я не прошу, не нужно мне никакой платы: у меня нет и такого хлеба. Не говори, старче, что ты будешь ждать другого плотника вместо меня; кто у тебя будет лучшим плотником, чем я?» Старец же Данило вынес ему решето гнилого хлеба, наломанного, и сказал: «Если вот такого захотелось тебе, то вот, я охотно отдаю тебе; а больше этого у меня нет». Отвечал Сергий: «Довольно мне и этого, и это больше, чем нужно мне. Но только прибереги хлеб до девяти часов, потому что я прежде, чем руки мои не потрудились, и до работы, платы не беру».
И то рек, препояса чресла своа крѣпко и нача дѣлати и тесати от утра до вечера. И дьскы вся истеса, тако же и столбы издолъбе и поставль, Богу помагающу ему, сѣни съгради до вечера и съвръши а. Поздѣ же сущи, яко въ вечернюю годину, Данилъ старець пакы изнесе ему решето хлѣбовъ уреченных, цѣна мъзды его, еже руцѣ его поработаста. Сергий же приимь сиа, и предложи а пред собою, и сътворь молитву благословениа, и нача ясти с водою токмо, и не бѣ варива, ни соли, ни влагы; и обое съвокупя и обѣд, и вечерю ядяше. И нѣкоторым от братиа видяшеся от устъ его яко дымъ малъ исходящь, егда таковыа ядяше хлѣбы. И тогда друг другу преклоншеся, глаголааху: «Воле, братие, колико есть тръпѣние мужа сего и въздръжание его! Яко пребысть четыре дни ничтоже не ядый и на четвертый сущу поздѣ гнилым хлѣбом алкоту свою утѣшаше и уставляше; и то же не даром хлѣб гнилый, но драгою цѣною прекупивъ, ядяше».	И сказав это, опоясал чресла свои крепко и начал работать и тесать с утра до вечера. И доски все обтесал, также и столбы обработал и поставил, с Божьей помощью сени построил к вечеру и поставил их. Уже поздно, в вечернее время, Данило-старец снова вынес ему решето хлебов тех, плату за дело рук его. Сергий же взял хлеб, и положил его перед собой, и попросил в молитве благословения, и начал есть хлеб с водой, а другого не было ничего — ни вареного, ни соли, ни питья; было это ему и обедом, и ужином. Некоторые из братии видели, что из уст Сергия как будто дымок исходил, когда он такой ел хлеб. Тогда, друг к другу наклонившись, говорили они: «Вот, братья, каково терпение мужа этого и воздержание Сергия! Ведь он четыре дня ничего не ел и на четвертый только поздно гнилым хлебом голод свой утоляет и усмиряет; и хлеб гнилой не даром, но, дорогой ценой получив, ест».
Нѣкоторый же от мних поропта[138] единъ брат тогда на Сергиа: не ядоша бо и по два дни. И оскръбишася, не имуще что вкусити, и приидоша к нему, и пред ним поимы и поносы творяху, глаголюще: «Плѣсневии хлѣби! Еще ли нам въ миръ не исъходити просити хлѣба? Се убо на тя смотрихом, якоже учил ны еси; и се тебе слушающе нынѣ уже изчезаем от глада. Того ради утро рано изыдем от мѣста сего камо къждо потребных ради. Да не пакы възвратимся сѣмо, уже не могуще к тому тръпѣти бываемых: недостатковъ и скудости здѣ». Не вси же пороптаху, но нѣкоторый брат единъ от них.	Один же из братьев возроптал тогда на Сергия: ведь не ели они больше двух дней. И возмутились иноки, оставшись без еды, и пришли они к Сергию, и стали они его ругать и поносить, говоря: «Заплесневел хлеб у нас! Доколе нам к мирянам не ходить просить хлеба? Вот мы на тебя смотрели, как ты учил нас; послушались мы тебя и теперь вот умираем от голода. Поэтому утром рано уйдем с этого места куда нужно за едой, и больше мы не возвратимся сюда, не в силах будучи терпеть здесь лишений и скудости». Не все, однако, роптали, но некий брат, один из них.
