И бѣ видѣти Феодора изрядна въ добродѣтелех сиающа, и въ телѣсном възрастѣ и благолѣпии мнозѣ, и въ премудрости и разумѣ много разсудителна. И тако многых его ради добродѣтели от всѣх почитаем бѣ, и день от дни и превъсхожаше слава о нем, яко нѣкогда и старцу святому Сергию болѣзновати о чести и славѣ много о нем; и молитвы непрестанно къ Богу всылаше, въ еже съвръшити ему течение без претъкновениа. Мнози же ученици Феодоровѣ въ добродѣтелѣх зѣло провосиаша изряднѣ, яко произведеным быти въ честныя игуменства, но и на епископьства въ великодръжавныя грады. Въ нѣкое же время прилучися сему чюдному мужю Феодору въ Царѣградѣ быти; и тамо от патриарха киръ Нила вселеньскаго велми почтенъ бысть и въ архимандритѣх въ всѣх русскых старѣйшиньству сподобляеться, въ еже Симановьскый честнѣйши монастырь в Руси Феодоровъ строится въ патреарше имя.[177] И въ время строениа на другомъ мѣсте основана бысть церковь камена архимандритом Феодоромъ, чюдна зѣло, въ имя пречистыя Богородица честнаго ея Успениа. И тако сему бывающу, на томъ мѣстѣ благодатию Христовою устроенъ бысть монастырь[178] славенъ, въ еже и донынѣ от всѣхь зрится и почитается. Мы же на предлежащее възвратимся, о немже намъ слово.	И видели Федора светло в добродетелях сияющим, в зрелости и благолепии многом, весьма премудрого и умом рассудительного. Так из-за многих его добродетелей он всеми почитаем был, и день ото дня росла слава о нем, так что порой старец святой Сергий весьма беспокоился о чести и славе его; и молитвы непрестанные к Богу обращал, чтобы не случилось какого-либо Федору преткновения. Многие же ученики Федора в добродетелях прославились великих, так что произведены были в честные игумены, а также в епископы в больших городах. Однажды пришлось этому чудесному мужу Федору в Царь-граде быть; и там вселенским патриархом, владыкой Нилом, он очень почтен был и среди архимандритов всех русских высшей чести удостоен, потому что на Руси Симоновский досточтимый монастырь Федора переходит в подчинение патриарха. И во время устройства монастыря на другом месте основана была церковь каменная архимандритом Федором, прекрасная весьма, в память честного Успения пречистой Богородицы. Так все это сделано было, и на том месте по благодати Христа устроен был монастырь славный, который и сегодня все видят и почитают. Мы же к прежнему возвратимся, о чем речь идет.
По времени же Феодоръ, архимандритъ честный, възведенъ бысть на архиерейство града Ростова,[179] и тако пребысть лѣта доволна чьстнѣ зѣло, яко же свѣтилнику на свѣщницѣ сиающу. И тако упас добрѣ врученную ему паству, къ Господу отиде в лѣто 6903 месяца ноября в 28. Сиа же до здѣ съкратим о Симоновьской обители; подобающее же да приложится здѣ.	Позднее же Федор, архимандрит честный, возведен был в архиереи города Ростова, и так прожил он долгие годы весьма славно, как свеча на подсвечнике горящая. Так он достойно пас порученное ему стадо и к Господу отошел в год 6903 (1395), месяца ноября в двадцать восьмой день. Мы же теперь прекратим этот рассказ о Симоновской обители и к следующим событиям обратимся теперь.
О ВИДѢНИИ АГГЕЛА, СЛУЖАЩЕ СЪ БЛАЖЕНЫМ СЕРГИЕМ	О ВИДЕНИИ АНГЕЛА, СЛУЖАЩЕГО С БЛАЖЕННЫМ СЕРГИЕМ
Иногда же еще пребывающу Феодору освященному въ обители у блаженнаго Сергиа, служащу святому Сергию божественую литургию съ предреченным Стефаном, братом своимь по плоти, и сему Феодору, сроднику его с ним. Предреченному же Исакию молчалнику стоящу въ церкви, якоже прежде помянухом, мужю добродѣтелну ему сущу зѣло, и сего ради откровено бысть ему: зрит въ олтари четвертаго служаща с ними мужа чюдна зѣло, емуже видѣние странно и несказанно, въ свѣтлости велицей, и образомь сиающа, и ризами блистающася. И бывшу прьвому въходу, и тъй аггелообразный и чюдный муж изыде въслѣд святого, емуже сиающе, яко солнце, лица его, не можаше зрѣти на нь; ризы же его необычны, чюдны, блистающеся, в них же мечтание златостройно зрится. И се въпрашаеть Исаакие близ стояща отца Макариа: «Что зрѣние се чюдное, отче? Кто есть зримый и чюдный съй муж?» Макарие же сподобленъ бысть сего зрѣниа, муж в велицѣй свѣтлости дѣлании, рече: «Не вѣдѣ, чадо, ужасно бо видѣние и не исповѣдимо зрю, но мню его, чадо, съ князем пришедша»; бѣ бо тогда Владимеръ в монастыри.[180] Приступльша же въпросиша нѣкоего, иже съ князем, аще есть священник с ним пришедый; и рекоша: «Ни». И о сем истинно увѣдѣша, аггела Божиа быти служаща с ними.	Однажды, когда еще жил Федор священный в обители у блаженного Сергия, служил святой Сергий божественную литургию с выше упоминавшимся Стефаном, братом своим родным, и с этим Федором, родственником своим. Известный же Исаакий-молчальник стоял в церкви; и поскольку он был, как мы раньше сказали, муж добродетельный весьма, откровение было ему: видит он в алтаре четвертого служащего с ними мужа, чудесного весьма, а облик его — удивительный и несказанный, светлости великой, — и внешностью он сиял, и одеждами блистал. И во время первого выхода этот ангелоподобный и чудесный муж вышел вслед за святым, и сияло, как солнце, лицо его, так что Исаакий не мог на него смотреть; одежды же его необычны — чудесные, блистательные, а на них узор златоструйный видится. И вот спрашивает Исаакий поблизости стоящего отца Макария: «Что за видение это чудесное, отче? Кто этот явившийся чудесный муж?» Макарий же, удостоенный этого видения — мужа великой светлости, — сказал: «Не знаю, чадо, ужасное видение и несказанное я вижу, но думаю, чадо, что он с князем пришел»; ведь тогда был Владимир в монастыре. Они подошли и спросили одного из людей князя, с ними ли пришел священник; и ответил тот: «Нет». И точно узнали они, что ангел Божий служил в алтаре.
И нынѣ нѣсть потреба глаголати; и якоже по скончании святыа литургиа получивше подобно врѣмя, наединѣ приступивше къ святому Сергию они ученици его, иже бывше достойнѣ чюднаго зрѣниа, въпрашают его о сем. Онъ утаити хотя, глаголя: «Что видѣсте чюдно, чада? Служившу божественую литургию Стефану, брату моему, и сыну его Феодору, и мнѣ недостойному с ними, иному же никому служащему священнику с нами». Ученици крѣпляахуся, моляще святого, да извѣститъ имъ, глаголя: «О чада любимаа! Аще Господь Богъ вам откры, аз ли могу се утаити? Егоже видѣсте, аггелъ Господенъ есть; и не токмо нынѣ днесь, но и всегда посѣщением Божиимь служащу ми недостойному с ним. Вы же, еже видѣсте, никому же повѣдайте, дондеже есмь в жизни сей». И тако удивишася зѣло.	Но тогда нельзя было говорить; а по окончании святой литургии, улучив подходящий момент, наедине подошли к святому Сергию те ученики его, которые были удостоены чудесного видения, и спросили его о том, кто это. Сергий утаить хотел, говоря: «Что вы увидели чудесного, чада? Служил божественную литургию Стефан, брат мой, и сын его Федор, и я, недостойный, с ними, а больше никакой священник не служил с нами». Ученики же упорствовали, умоляя святого, чтобы он сказал им, и тогда он открылся: «О чада любимые! Если Господь Бог вам открыл, смогу ли я это утаить? Тот, кого вы видели, — ангел Господень; и не только сегодня, но и всегда по воле Божьей служу с ним я, недостойный. Но то, что вы видели, никому не рассказывайте, пока я не уйду из жизни этой». Ученики же удивлены были весьма.
Сиа же сказаниа пред ним послѣдують, о съставлении монастырей от ученикь святого, емуже на Дубенкѣ; сему же монастырю начало сказанию сие.	Эти рассказы о создании монастырей учениками святого должны следовать за рассказом об основании монастыря, который был на Дубенке; а о начале этого монастыря рассказ вот какой.
О ПОБѢДѢ ЕЖЕ НА МАМАА И О МОНАСТЫРѢ, ИЖЕ НА ДУБЕНКѢ	О ПОБЕДЕ НАД МАМАЕМ И О МОНАСТЫРЕ НА ДУБЕНКЕ
Бысть убо Богу попущающу за грѣхы наша, слышано бысть, яко ординьскый князь Мамай въздвиже силу велику, всю орду безбожных татаръ, идет на Рускую землю; и бяху вси людие въ страсѣ велицѣ утѣсняеми. Князь же великодръжавный, иже тогда скыпетры Русскых странъ обдержа, достохвалный и побѣдоносный, великий Дмитрей да глаголется.[181] Сей убо прииде къ святому Сергию, якоже велию вѣру имѣа къ старцу, въпросити его, аще повелитъ ему противу безбожных изыти: вѣдяше бо мужа добродѣтелна суща и даръ пророчьства имуща. Святый же, яко услыша сиа от великого князя, благословивъ его, молитвою въоружив, и рече: «Подобает ти, господине, пещися о врученном от Бога христоименитому стаду. Поиди противу безбожныхь, и Богу помагающу ти, побѣдиши и здравъ въ свое отечьство с великыми похвалами възъвратишися». Великый же князь рече: «Аще ми Богъ поможет, отче, поставлю монастырь въ имя пречистые Богоматере». И сиа рекъ, въсприемь благословение, отиде, поиде скоро.	Известно стало, что Божиим попущением за грехи наши ордынский князь Мамай собрал силу великую, всю орду безбожных татар, и идет на Русскую землю; и были все люди страхом великим охвачены. Князем же великим, скипетр Русской земли державшим, был тогда прославленный и непобедимый великий Дмитрий. Он пришел к святому Сергию, потому что великую веру имел в старца, и спросил его, прикажет ли святой ему против безбожных выступить: ведь он знал, что Сергий — муж добродетельный и даром пророческим обладает. Святой же, когда услышал об этом от великого князя, благословил его, молитвой вооружил и сказал: «Следует тебе, господин, заботиться о порученном тебе Богом славном христианском стаде. Иди против безбожных, и если Бог поможет тебе, ты победишь и невредимым в свое отечество с великой честью вернешься». Великий же князь ответил: «Если мне Бог поможет, отче, поставлю монастырь в честь Пречистой Богоматери». И, сказав это и получив благословение, ушел из монастыря, и быстро отправился в путь.
И тако събравъ вся воя своа, приспѣ противу безбожных татаръ: и увидѣвъ силу их зѣло множество, сташа сомнящеся, страхомь мнози от них обиати быша, помышляюще, что сътворити. И се внезаапу въ той час приспѣ борзоходець с посланием от святого, глаголюще: «Без всякого съмнѣния, господине, съ дръзновениемь поиди противу свирѣпьства их, никакоже ужасатися, всяко поможет ти Богъ». И абие князь великый Дмитрие и все воиньство его, от сего велику дръзость въсприимше, изыдоша противу поганых, сие слово рекь: «Боже великый, сътворивый небо и землю! Помощникь ми буди на противъникы святому ти имени». И тако сразившеся, многа телеса падааху, и Богу помогшу великому побѣдоносному Дмитрею, и побѣждени быша погании татарове и конѣчнѣй пагубѣ предани быша: видѣвше бо окааннии на себѣ богопустный гнѣвъ и Божие негодование, вси на бѣжание устремишася. Крестоносная же хоруговь доволно гнавъ въслѣд спротивных, множьство бесчислено убиваше: овии же язвени отбѣгоша, иных же живых руками яша. И бяше чюдно зрѣние и дивна побѣда; иже преже блистающася оружиа, тогда же вся окровавлена кровьми иноплеменных, и вси образы побѣды ношааху. И зде збысться пророчьское слово: «Единъ гоняше тысящу, а два тму».[182]	Собрав всех воинов своих, выступил он против безбожных татар; увидев же войско татарское весьма многочисленное, они остановились в сомнении, страхом многие из них охвачены были, размышляя, что же делать. И вот внезапно в это время появился гонец с посланием от святого, гласящим: «Без всякого сомнения, господин, смело выступай против свирепости их, нисколько не устрашаясь, — обязательно поможет тебе Бог». Тогда князь великий Дмитрий и все войско его, от этого послания великой решимости исполнившись, пошли против поганых, и промолвил князь: «Боже великий, сотворивший небо и землю! Помощником мне будь на противников святого твоего имени». Так началось сражение, и многие пали, но помог Бог великому победоносному Дмитрию, и побеждены были поганые татары, и полному разгрому подверглись: ведь видели окаянные против себя посланный Богом гнев и Божье негодование, и все обратились в бегство. Крестоносная хоругвь долго гнала врагов, множество бесчисленное их убивая; и одни ранеными убежали, других же живыми в плен захватили. И было чудесное зрелище и удивительная победа; те, кто прежде блистали оружием, тогда все были окровавлены кровью иноплеменников, и все трофеи победные носили. И тут сбылось пророческое слово: «Один преследовал тысячу, а двое тьму».
Святый же тогда по предреченному, яко прозорливый имѣя даръ, вѣдяше, яко близ вся бываемаа. Зряше издалече, бяше растоаниа мѣстом и многы дни хождениемь, на молитвѣ съ братиею Богу предстоа о бывшей побѣдѣ на поганыхь. Малу же часу мимошедшу, яко до конца побѣжени быша безбожнии, вся предсказоваше братиам бывшаа святый: побѣду и храборство великого князя Дмитриа Ивановича, преславно побѣду показавша на поганых, и от них избиеных сих по имени сказа и приношение о них всемилостивому Богу принесе.	Святой же, как было сказано, пророческим обладая даром, знал обо всем, словно находился поблизости. Он видел издалека, с расстояния во много дней ходьбы, на молитве с братией к Богу обращаясь о даровании победы над погаными. Когда немного времени прошло, так что окончательно побеждены были безбожные, все предсказал братьям святой: победу и храбрость великого князя Дмитрия Ивановича, славную победу одержавшего над погаными, и из русского войска убитых по имени назвал Сергий, и службу за них всемилостивому Богу совершил.
