Князь же великий не возвратися к Вологдѣ, но поиде ко Твери, сослася с великимъ княземъ тверскимъ з Борисомъ Александравичем.[33] Пришедшу же ему во Тверь, и князь великий тверский дал ему у себя опочинути и честь велику воздасть ему и дары многи. Князь великий Василей Васильевич обручал тогда за болшаго сына своего за князя Ивана дщерь у великого князя Бориса Марью.[34] Мнози же боляре со многими людьми приидоша к великому князю во Тверь.	Князь же великий не возвратился к Вологде, но пошел к Твери, снесясь с великим князем тверским Борисом Александровичем. Когда же он пришел в Тверь, то князь великий тверской пригласил его отдохнуть с дороги, оказал ему великую честь и дал многие дары. Тогда князь великий обручил своего старшего сына князя Ивана с дочерью великого князя Бориса Марией. Многие же бояре с многочисленными слугами перешли к великому князю в Тверь.
А коли князь Дмитрей выпущал еще великого князя, а князь Василей Ярославич в Литвѣ будя, а того не вѣдая, здумал с боляры великого князя, что, оставивъ жены и дѣти в Литовской земли, поити искати великого князя, как его выняти изо Углеча, и учиниша себѣ срок всѣм снятись в Литовской земли волости в Пацинѣ.[35] И еще не вышедшим из Литовской земли, князь Василей Ярославич иде во Мстиславль, а с ним Ряполовские три да и князь Иванъ Стрига, да Ощера, и иные многи дѣти боярские с ними, а в Дебрянцѣ князь Семен Оболенской да Басенокъ да многие же дѣти боярские с ними, и в то время прииде вѣсть князю Василию во Мстиславль, что князь велики выпущенъ, а дана ему Вологда, и пригонил Данило Башмак.[36] А в Дебряньскъ пригонилъ къ князю Семиону нѣкто киянинъ Полтинкою зовут, а лежалъ тотъ на Москвѣ от княгини Настасьи Олелковы[37] на вѣстехъ про великого же князя да из Дебряньска погонилъ к Киеву, а сказал имъ ту же вѣсть, с чѣмъ и Башъмакъ пригонилъ. Князь же Василей Ярославичь со всѣми людьми и с бояры, и женами, и с дѣтми поидоша изо Мьстиславля, а изъ Дебряньска князь Семенъ да Басенок, такоже съ всѣмъ, и снидошась в Пацинѣ.	А когда князь Дмитрий еще только выпускал великого князя из заточения, то князь Василий Ярославич, будучи в Литве и еще не зная этого, договорился с боярами великого князя, что они, оставив жен и детей в Литовской земле, попытаются добраться до великого князя и похитить его из Углича. И установили срок, когда всем встретиться в Литовской земле в городе Пацине. И когда они еще не вышли из Литовской земли, князь Василий Ярославич пошел в Метиславль, а с ним трое Ряполовских, да князь Иван Стрига, да Ощера, и иные многие дети боярские с ними, а в Дебрянске были князь Семен Оболенский да Басенок и также многие дети боярские; как раз в то время пришла весть к князю Василию в Мстиславль, что князь великий выпущен и дана ему Вологда. И прискакал с этой вестью Данило Башмак. В Дебрянск же прискакал к князю Симеону некий киевлянин, прозванный Полтинкой, который был послан в Москву княгиней Настасьей Олельковой для получения вестей про великого князя, а из Дебрянска поскакал к Киеву и рассказал им ту же весть, с которой примчался Башмак. Князь же Василий Ярославич со всеми людьми, и с боярами, и с женами, и детьми отправился из Мстиславля, а из Дебрянска — князь Семен и Басенок, также со всеми людьми, и сошлись они в Пацине.
И пригонилъ къ нимъ туто Дмитрей Ондрѣевъ, что уже князь великий пошол с Вологды къ Бѣлуозеру, да оттоле и къ Твири. Они же оттоле поидоша вси вмѣстѣ со многими людьми. Пришедшимь же имъ в Елну, и срѣтошась с ними татарове, и начаша межи собѣ стрѣлятися. По сем же татарове начаша Руси кликати: «Вы хто есть?» Они же отвещаша: «Москвичи, а идемъ со княземъ с Васильемъ Ярославичемъ искати своего государя великого князя Василья Васильевича, сказывають его выпущена. А вы кто есте?» Татарове же рекоша: «А мы пришли из черкас съ двѣма царевичи Махметевыми дѣтми, и с Касымом да съ Ягупомъ».[38] Слышели бо про великого князя, что братья над нимъ зраду учнили и они пошли искати князя великаго за передьнее его добро и за его хлѣбъ: «Много бо добра его до нас было». И тако сшедшеся и укрѣпившеся межю себе, поидоша вкупѣ, ищущи великого князя, како бы ему помощи.	И тут к ним прискакал Дмитрий Андреев с вестью, что князь великий пошел из Вологды к Белоозеру, а оттуда к Твери. Они же тогда пошли все вместе с многими людьми. Когда же они пришли в Ельню, встретились с ними татары, и началась между ними перестрелка. Потом татары стали кричать русским: «Вы кто такие?» Те же ответили: «Мы москвичи, а идем с князем Василием Ярославичем искать своего государя великого князя Василия Васильевича, говорят, что он выпущен. А вы кто такие?» Татары же сказали: «А мы пришли из черкас с двумя царевичами, сыновьями Махмета, — Касымом и Ягупом». Ибо они слышали про великого князя, что братья ему изменили, и пошли его искать, чтобы отплатить ему за оказанное им добро и угощение: «Много он сделал нам добра». И так, сойдясь и договорясь между собой, они пошли вместе, ища великого князя, чтобы ему помочь.
А князь Дмитрей Шемяка и князь Иванъ Можайской еще стояли тогда на Волоцѣ.[39] А князь великий послалъ в ту пору к Москвѣ изгоном боярина своего Михаила Борисовича Плѣщѣева[40] с малыми зѣло людми, какъ мощно бы имъ проити мимо рать княжу Дмитрееву. И тако проидоша мимо всю рать, никим же видимы, и приидоша к Москвѣ в нощи противу Рожества Христова, в самую же завтреню приидоша к Никольскимъ воротомъ. А в ту пору въ град въехала к завтрени княгини Ульяна княжа Васильева Володимерича[41] къ празднику, и вратом отвореным бывшимъ. Они же часа того внидоша въ град. Намѣсьтник же княж Дмитреевъ Федоръ Галичский[42] Пречистые от завтрени убѣже. А княжа Иванова намѣстника Василья Чешиху, бѣжаща из града на кони, изнимал истобничишко великие княгини, Ростопчею звали, и приведе его к воеводамъ, и оковаша его; а прочих дѣтей боярьских, княжихъ Дмитреевых и княжихъ Ивановых, имающе, грабяху и коваху. А гражанъ приведоша к целованию за великово князя за Василья, а град начаша крѣпити.	А князь Дмитрий Шемяка и князь Иван Можайский тогда еще находились на Волоке. Князь же великий послал тогда тайно к Москве своего боярина Михаила Борисовича Плещеева с совсем немногими людьми, чтобы они могли пробраться мимо войска князя Дмитрия. И они прошли через все войско никем не замеченные, и пришли к Москве в ночь на Рождество Христово, подошли к Никольским воротам в самую заутреню. А в ту пору в город въехала к праздничной заутрене княгиня Ульяна, жена князя Василия Владимировича, и ворота были отворены. Они же тотчас вошли в город. Наместник же князя Дмитрия Федор Галицкий бежал с заутрени из церкви Пречистой. А наместника князя Ивана Василия Чешиху, убегавшего из города на коне, захватил истопничишка великой княгини по прозвищу Ростопча, и привел его к воеводам, и посадил его в оковы; прочих же детей боярских князя Дмитрия и князя Ивана, забирая в плен, грабили и заковывали. А горожан привели к присяге великому князю Василию и начали укреплять город.
А князь велики поиде к Волоку на Шемяку и на Можайсково со многою силою. Они же в недоумѣни бывше: се от Тфири на них князь велики идеть, а се прииде к ним вѣсть, что царевичи идут да князь Василей Ярославичь со многою же силою, а Москва уже взята, а от них люди одинако бѣжатъ. И тако побегоша къ Галичю, а оттолѣ на Чюхлому, и ту вземъ с собою матерь великаго князя, великую княгиню Софью, побѣже на Коргополе. А князь велики поиде за ними, а княгиню великую отпустилъ к Москвѣ, и пришед, ста под Углечемъ. Прииде же туто к нему князь Василей Ярославич да с ним бояре великого князя прежеречении; и стоявъ поду Углечем, взят его. Убиен же бысть тогда подъ градомъ литвинъ, храбрый человѣкъ Юшко Драница.	А князь великий пошел к Волоку на Шемяку и на Можайского со многой силой. Они же были в смятении: вот от Твери на них идет князь великий, а вот к ним приходит весть, что идут царевичи и князь Василий Ярославич со многими силами, Москва уже взята и люд от них все как один бегут. И тогда побежали они к Галичу, а оттуда на Чухлому и, взяв там с собой мать великого князя, великую княгиню Софью, бежали в Каргополь. А князь великий пошел за ними, великую княгиню отправив к Москве, и, придя, стал под Угличем. Туда же пришел к нему князь Василий Ярославич, а с ним уже упомянутые бояре великого князя и, осадив Углич, взяли его. Убит же был тогда под городом литовец, храбрый человек Юшко Драница.
И оттоле поиде князь велики къ Ярославлю, и ту придоша к нему царевичи Касым да Ягуп. Изъ Ярославля же послалъ князь велики къ князю Дмитрею боярина своего Василья Федоровича Кутузова, прося у него матери своея, великии княгини Софѣи, глаголя ему тако: «Брате князь Дмитрей Юрьевич, коя тебѣ и хвала, что держишь у себе матерь мою, а свою тетку? Чѣм сѣмъ хощешь мнѣ мьститися? А яз уже на своемь столѣ на великом княженьи».	И оттуда князь великий пошел к Ярославлю, а там к нему пришли царевичи Касым и Ягуп. Из Ярославля же послал князь великий к князю Дмитрию своего боярина Василия Федоровича Кутузова, прося у него отпустить свою мать, великую княгиню Софью, говоря ему так: «Брат мой, князь Дмитрий Юрьевич, что тебе за добро, что ты держишь у себя мою мать, а свою тетку? Чем ты мне так отомстишь? А я уже на своем престоле, на великом княжении».
И отпустив же того, поиде самъ назад к Москвѣ, и прииде на Москву февраля въ 17, в Пяток сырный.	И, отпустив посла, пошел сам назад к Москве, и пришел в Москву 17 февраля, в Пяток сырный.
Болярин же великого князя пришед изглагола та вся князю Дмитрею, и множайша его. Князь же Дмитрей, обдумав з боляры своими, рече: «Что, брате, томити мнѣ тетку, госпожу свою великою княгиню? А сам бѣгаю, а люди себе надобныи, а уже истомленыи, а еще бы сеѣ стеречи, лучши отпустити ея ис Каргополя».	Боярин же великого князя, придя, сказал это все князю Дмитрию, и многое сверх того. Князь же Дмитрий, посовещавшись со своими боярами, сказал: «Зачем, брат, мне томить мою тетку, госпожу великую княгиню? Сам я в бегах, люди самому надобны, а уже утомлены, и еще ее стеречь. Лучше отпустить ее из Каргополя».
А с нею послал князь Дмитрей болярина своего Михайло Феодоровича Сабурова[43] да детей боярских с ним. Слышавше князь великий, что мати его отпущена, а уже близко, и поиде противу ея. И срѣтошась у Троицы в Сергиевѣ монастыри, и оттоле поиде с матерью к Переславлю, а Михайло Сабуровъ и с прочими, добил челом великому князю, не возвратишась к Шемякѣ, не оста-шась у великого князя служити ему.	А с нею князь Дмитрий послал боярина своего Михаила Федоровича Сабурова и с ним детей боярских. Князь великий, услышав, что мать его отпущена и находится уже близко, пошел навстречу ей. И встретились у Троицы в Сергиевом монастыре, и оттуда пошел он с матерью к Переяславлю, а Михаил Сабуров с прочими, бив челом великому князю, не возвратились к Шемяке, но остались у великого князя служить ему.
