Нѣхто христолюбивый купец, Михайло Марковъ, имѣя любовъ ко святому старцу Михайлу. Идущю ему торговати за море, и бывшю ему за моремъ год и возъвращуся ему взадъ, идущю по морю, и бысть буря велия, валы великы, и бьющуся кораблю о дно моря, и бысть бѣда велия. Нача купець плакати и призывати Бога на помощь и угодника его Михайла. Рече же купець Михайлу: «Гоподине Михайло, былъ еси мнѣ помощникъ при животи, нынѣ о мнѣ грѣшнем Богу помолися!» И явися купцу Михайла в той час на морѣ, а дръжи корабль за нос и невидим бысть. И бысть тишина велия. Избавльшуся кораблю от потопа.	Некий христолюбивый купец, Михаила Марков, глубоко чтил святого старца Михаилу. Когда однажды пошел он торговать за море и, пробыв за морем год, возвращался назад, то поднялась сильная буря, вздымались волны великие, било корабль о дно моря, наступила великая беда. Начал купец плакать и призывать Бога на помощь и его угодника Михаилу. Взывает купец к Михаиле: «Господин Михаила, был ты мне помощником при жизни своей, теперь о мне, грешном, Богу помолись!» И явился Михаила купцу без промедления на море, удерживая корабль за нос, и сразу исчез. И наступила полная тишина. Избавился корабль от потопления.
И пришедшю купцю в домъ свой, прославиша Бога и угодника его Михайла. И обрекъся память творити до своего живота. И бысть тако.	И когда вернулся купец в дом свой, то прославил Бога и угодника его Михаилу. И взял на себя обет чтить память святого до своей смерти. Так и было.
Иное проречение — Микифору попу.[36] Панагѣю[37] украл, и онъ молвить, Михайло, Микифору попу: «Будеши похапъ!» И с техъ мѣстъ у попа ни ума и ни памети. И повелѣ Михайло горнъ раскопати, ажь панагѣя в горну.	А вот другое пророчество Михаилы — Никифору-попу. Украл тот панагию, и он, Михаила, говорит Никифору-попу: «Ума лишишься!» И после этих слов у попа ни ума, ни памяти. И велел Михаила печь разобрать, а панагия в печи.
Инное. Бысть налога на манастыръ от Еуфимия владыкы от Пръваго: захотѣлъ куны взяти. И взяша конъ воронъ изъ манастыря. И Михайло владыцѣ рече: «Мало поживеши, останется все!» И с тѣхъ мъсть разболися владыка и преставилъся.	И еще. Стал владыка Евфимий Первый притеснять монастырь — захотел деньги с монастыря получить. И взял из монастыря коня вороного. И Михаила владыке говорит: «Мало тебе жить, останется все!» И с тех пор разболелся владыка и преставился.
Приѣхал посадникъ Иванъ Васильевич Немиръ[38] на манастыръ, а Михайла по манастырю ходит. И Михайло спросил посадника: «Что ѣздѣши?» И посадникь отвѣща ему: «Быль есмь у пратещи своей, у Ефросеньи, да приѣхалъ есмъ у тебя благословится». И Михайло рече ему: «Что твоя, чадо, за дума — ѣздишь думаешь ж жонъками?»[39] И посадникъ рече ему: «Будет у насъ князь велики на лѣто да хочет воевать землю, а у нас есть князь — Михайло Литовъской».[40]	Приехал посадник Иван Васильевич Немир в монастырь, а Михаила по монастырю ходит. И Михаила спросил посадника: «Что ездишь?» И посадник отвечает ему: «Был я у пратещи своей, у Ефросиний, да приехал к тебе благословиться». И Михаила сказал ему: «Что это, чадо, за совет у тебя такой — ездишь да с бабами совещаешься?» И посадник в ответ ему: «Летом придет на нас князь великий — хочет подчинить себе землю нашу, а у нас уже есть князь — Михаил Литовский».
И отвѣща ему Михайло: «То у вас не князь — грязь! Разошлите послы к великому князю, добивайте челом. И не уймете князя, будеть с силами к Новугороду, и не будеть вамъ Божия пособия. Станет князь великий в Бурегах и роспустить силу свою на Шолонѣ,[41] и попленить новгородцевъ многых: иных на Москву сведеть, а иных присѣчет, а иных на окупъ даст. И Михайло князь о вас не станет, помочи от него не буде. И послати вамъ преподобнаго отца владыку да посадникы,[42] да добивать челом ему, челобитье примать да и куны изъемлеть. Да по малѣ времени князь великый опять будетъ, да город возметь, да всю свою волю учинитъ, да Богъ дасть ему».	И ответил ему Михаила: «То у вас не князь — грязь! Пошлите послов к великому князю и бейте ему челом. А не умолите князя, придет он со своим войском к Новгороду и не будет вам Божьей помощи. Станет князь великий в Бурегах, и пошлет силу свою по Шелоне, и попленит новгородцев многих, иных в Москву уведет, а иных — казнит, а у иных выкуп потребует. А Михаил-князь за вас не встанет, помощи вам от него не будет. И придется посылать вам преподобного отца владыку да посадников да бить великому князю челом, и он челобитье ваше примет, и много денег с вас потребует. Да в скором времени после того князь великий опять придет и город возьмет да все по своей воле установит, и Бог поможет ему».
И събысся тако.	Так все и сбылось.
Богу нашему слава и нынѣ, и присно, и въ вѣкы. Аминь.	Богу нашему слава и ныне, и присно, и во веки веков. Аминь.
