Евъфиянинъ же Ахиллей[22] сиаше паче въсѣх человѣкъ, ратемъ побѣдникъ, силенъ и крѣпкорукъ, егоже и ироа нарицаху. Сего поставиша царие ратиначалника.[23] Бѣ же рать многочислена, 1170 кораблей исходять убо ото отечества. Посланъ убо бываеть Ахиллей и от храбрых друзии, и на островы наподоша и поплениша сушю. И тщахуся напасти на Трой, яко многым богатствомъ кыпя бяше, и хотяще отмьстити обиду Елены ради.	Евфинянин же Ахиллей сиял более всех людей, победитель в битвах, сильный и крепкорукий, его же и героем называли. Сего поставили цари воеводой. Было же войско многочисленное: 1170 кораблей отошли от родной земли. Послан был Ахиллей и другие храбрецы, и на острова напали и попленили побережье. И жаждали напасть на Трою, так как исполнена она была великим богатством, и хотели отомстить за обиду, нанесенную похищением Елены.
Видѣвше же трояне толику рать, собравьше себѣ пособникы: кари и лукаани, миси и меони, и фруги[24] и придруживше весь асийскый языкъ и род, противу изведоша бесчислено множество. Въ Трои же вяще 50 тысящь мужей. И много время проводиша, брань творяще. Исперва добрѣ ополчахуся на брань, да якоже искусиша Ахиллеево стремление и храбрость, сѣдяху, при стенах заключившеся.	Увидев такое войско, троянцы созвали к себе на подмогу карийцев, ликийцев, мисиев, меонов, фригийцев и, заключив союз со всеми азиатскими народами и племенами, выставили против {греков) великое множество. Было же в Трое более пятидесяти тысяч мужей. И многое время прошло в битвах. Сперва смело вступали в сражение, но когда испытали на себе рвение и храбрость Ахиллеса, то засели, запершись, за стенами.
Потом же нѣкая жена, именемъ Велеша,[25] волъхвующи, еяже пророчицю нарицаху, иже обладаше волъшествиемъ морьскими волънами, у неяже убиша кошуту боляре Агамена царя, и сего ради разгнѣвася и пусти волнение на море, да погубить вся корабля греческыа. И озлобистася царя, и вопросиша Колкаша попа. Он же повѣда имъ, яко кошуты ради хощеть васъ потопити пророчица и глаголет, яко, «аще не дастъ Агаменъ царь мнѣ своеа дщери Цвѣтаны,[26] не имамъ их пустити». Царь же Агамень оскорбися зѣло и, не хотя, дасть свою дщерь Цвѣтану. И устави бурю. И приидоша под Трой.	Потом же некая жена, именем Велеша, которую считали пророчицей, ибо с помощью волшебства повелевала она морскими волнами, разгневалась, потому что бояре царя Агамена убили ее лань, подняла на море бурю, чтобы погубить все корабли греческие. И опечалились цари, и спросили совета у жреца Колкаша. Он же поведал им, что из-за лани своей хочет вас потопить пророчица и говорит, что «если не даст мне Агамен царь дочери своей Цветаны, то не пропущу их (через море}». Царь же Агамен очень опечалился и против желания отдал свою дочь Цветану. И утихла буря. И приплыли под Трою.
И изыде противу имъ Екторъ царь,[27] Приамовъ сынъ, инии мнози боляре. И нача стрѣляти Екторъ царь стрѣлою со огнемъ, и единемъ пущениемъ погружаше три корабля греческыа. И Аякшь Соломоничевъ защити своимъ щитомъ 17 кораблей от живаго огня Екторъва.[28] И поиде Менелае царь на вѣре, нача Приаму говорить, да отдастъ Елену царицю. Александръ же не хотяше, но восхотѣ поразити Менелаа, аще бы его Приамъ царь не защитилъ. И потом Екторъ царь творяше брань и поражаше множество греческых вой на всякъ день, и бояшеся гласа Ахиллеева.[29] И поиде Ахиллей под своимъ знаменемъ противу Ектору царю: и состася, и ястася за рукы, и не хотѣста ся бити в той день. И бяху плѣнили гречестии витези Рижеуша попа дщерь Рижеуду. И видѣвъ ю Агаменъ царь, братъ Менелаевъ, яко добра зѣло, и взятъ ю себѣ в жену, а Рижеушь бѣ попъ сынъ Тебуга бога.[30] И, увѣдевъ, Тебугхъ разгнѣвася зѣло и пусти своимъ волъшвениемъ великъ недугъ въ греческую войску; и мнози умираху, дондеже обратиша дщерь Рижеуша попа.	И вышел против них Ектор царь, сын Приама, иные многие бояре. И начал стрелять Ектор царь огненными стрелами и одним выстрелом поражал три корабля греческих. Но Аякш, сын Соломоников, своим щитом загородил семнадцать кораблей от живого огня Екторова. И пошел Менелай царь на переговоры, стал уговаривать Приама, чтобы вернул Елену царицу. Александр же того не хотел и хотел убить Менелая, если бы того Приам царь не защитил. А затем Ектор царь выходил на битву и ежедневно сражал множество греческих воинов, страшась (лишь) голоса Ахиллеева. И вышел Ахиллей под своим знаменем против Ектора царя, и сошлись, и взялись за руки, и решили не сражаться в тот день. А греческие витязи пленили Рижеуду, дочь жреца Рижеуша. И увидел Агамен царь, брат Менелая, как она красива, и взял ее себе в жены, а Рижеуш жрец был сыном бога Тебуша. И, узнав об этом, Тебуш страшно разгневался и наслал колдовством своим жестокую болезнь на греческое войско; и многие умирали, пока не вернули дочь жреца Рижеуша.
Потом же трояны дръзостны сотвори Поламидова смерть, притупи Ахилеево стремление, любляше бо Ахиллей Паламида зѣло и сего ради разгнѣвася и не хотяше изыти на брань.[31] Дисефесь Нисиотенинъ храняше ненависть на Паламида и оболга его к царема, яко трояном хощеть добра. И побиша Поламида камениемъ. О горе! Какова твориши зависти! Он же ничесоже рекъ, точию глагол сей: «О убогаа истинно! Тебе плачю, ты бо первѣе мене погибе!» И тако умре.[32] Ахиллей же тяжце проплакавъ о немъ и не хотяше изыти на брань. И от сего бысть дерзость Ектору и того пособникомъ. И составляють на еллинны брань крѣпкоратьную, и падають, якоже класы, греческая, сиречь еллиньская, телеса, и езера кровемъ пролиашеся. И моляху Ахиллея поити на брань, и не преклонися, дондеже убиенъ бысть Патроклие, егоже зѣло любляше Ахиллей, от руку крѣпкою Екторовою.[33] И сие того принуди потещи на трояны. Изыде убо Ахиллей на брань, огнемъ дыхая, и разбиваеть полкы, и побиваеть первоборца. И пакы призываеть Приамъ на помощь амозони.[34] И пакы брань крѣпка. Умирають мнози, и ото всѣх убо пусть бысть Приам. И умоли Тавтантиа, индийскаго царя,[35] и посылаеть множество бесчислено воиньства. Индиане же вси чернообразни, их же видѣвше гречестии еллини въ странных зрацѣхъ, и убояшеся от зрака их, и оружиа и от звѣрей устрашишася, ихже индиа кормить, нощию бѣжати мысляху и оставити Трой. Но обаче ополчишася к черьнообразнымъ, и индѣйскыми кровьми очервишася нивиа, и Скомандрови струя обращахуся кровьми. В сих же наста еллиномъ торжество, паче же и варваром, и всѣмъ покой от ратей и трудовъ. И убо еллиньстии, еже есть гречестии, и тройское множество воедино смѣшахуся и никомуже содѣяти ничесоже никтоже смѣяше праздника ради.	А потом придала троянцам храбрость гибель Паламеда, так как угасла дерзость Ахиллея, ибо очень любил Ахиллей Паламеда и разгневался из-за его гибели, и не хотел выходить на битву. Дисевес Нисиотенин, хранивший ненависть к Паламеду, оклеветал его перед царями, будто бы он добра желает троянцам. И был забит Паламед камнями. О горе! Что творишь ты, зависть! Паламед же не сказал ни слова, только изрек: «О бедная истина! Тебя оплакиваю, ибо ты раньше меня погибла!» И так он умер. Ахиллей же горько оплакивал его и не хотел выходить на битву. И это придало дерзость Ектору и его соратникам. И начинают они с эллинами битву жестокую, и падают, как колосья, тела греков, то есть эллинов, и проливаются озера крови. И просили (греки) Ахиллея выйти на битву, и не соглашался он, пока не был убит могучей рукой Ектора Патрокл, которого очень любил Ахиллей. И это побудило его выйти против троянцев. Вышел Ахиллей на брань, (словно) огнем пышущий, и громит полки, и убивает лучших воинов. И тогда призывает Приам на помощь амазонок. И снова брань была лютая. Погибают многие, и все меньше остается соратников у Приама. И упросил он Тавтантия, индийского царя, и тот прислал бесчисленное множество воинов. Индийцы же все темнолицы, и, видя их необычный облик, греки-эллинцы устрашились их вида, и оружия их и зверей, которых приручили индийцы, испугались, и задумали ночью бежать и оставить Трою. Но все же вышли против темнолицых, и кровью индийской обагрились поля, и струи Скамандра смешались с кровью. И в это время настали дни праздничные у эллинов, а также у варваров, и всем был отдых от битв и трудов. И тогда толпы эллинов, то есть греков, и троянцев смешались, и никто никому не смел никакого зла причинить по случаю праздника.
Потомь же видѣ сонъ в нощи царица Евътропиа, жена Ектора царя, сына Приамава. И возъбнувъ от сна, прииде в ложницю свекра своего, Приама царя, и нача со слезами глаголати ему, да не пущаеть сына своего Ектора во утрие на брань ко Ахиллею, яко убиенъ, рече, будеть. И сказа ему сонъ: «Видѣх, яко изыде ис Троя мечка, а изь греческыа войскы вепрь, и начаста ся бити. И посече вепрь мечку, и вовлече его во греческыа полкы, и ктому не видѣх его. И аще пустиши Ектора, не чай его видѣти». И утѣшивъ ея Приамъ и проводи ю в ложьницю. И егда бысть заутро, уготовася Екторъ царь на брань ко Ахиллею. И изыдоша противу его Тройскыа госпожа, и мати его, Екама царица, и жена его, и сестры его, и возбраняху ему, да не исходить на брань, он же не послушаше. И мати его, Екама царица, молящи не изыти и спастися, плачющи и ятра отверзающи единою рукою, другию же сосца изношаше и глаголаше: «О чадо! Сих усрамися и мене самую помилуй; аще когда ти сосца сиа придах, забыти творящи дѣтьскых скорбей, помяни убо воспитание оно и даруй ми, еже пощадѣти ся самому».[36] И жена его, вземши, метну сына его перед нимъ и моляше: «Помилуй, — рече, — мене самую и сего любезнаго!» И не послушаше. Она же рече: «О Екторе, пожди мене мало!» И шедши в ложницю, совлече брачинныа ризы, и облечеся въ черныа вдовичныя, и пришед пред него и глагола: «О Екторе, аще ся не обратиши, имамъ сиа азъ носити по тебѣ». И симъ не преложи его на жалость, и не послуша, но поиде противу Ахиллею. И съшедшеся, не бишася в той день, но завѣтъ положиша, еже битися заутро. И в той день уби Екьторъ седмь уровъ греческых, еже есть седмь полкъ.[37] И заутро изыде Екторъ царь и нача битися со Ахиллеемъ. И наѣха Ахиллей Ектора и, убивъ, прободе его. И паде мертвъ. И въземъ его, Ахиллей и понесе на свой станъ. Потом же разбиваеть и полкы и побиваеть ратоборца.	Потом же увидела ночью сон царица Евтропия, жена Ектора царя, сына Приамова. И, проснувшись, пришла она в спальню свекра своего, Приама царя, и начала со слезами говорить ему, чтобы не пускал утром сына своего Ектора биться с Ахиллеем, ибо, — сказала, — будет он убит. И поведала ему сон: «Видела я, что вышел из Трои медведь, а из греческого войска — вепрь, и начали биться. И распорол вепрь медведя, и утащил его в греческие полки, и более не видела его. И, если отпустишь Ектора, не надейся его больше увидеть». И Приам, утешив ее, проводил до спальни. И, когда настало утро, приготовился Ектор царь к сражению с Ахиллеем. И вышли навстречу Ектору знатные троянки, мать его, Екама царица, и жена его, и сестры его, и стали уговаривать, чтобы не ходил он на битву, но Ектор их не послушал. Мать его, царица Екама, умоляла его не ходить и спасти свою жизнь, плакала и, обнажив одной рукой грудь и указывая другой на сосцы, говорила Ектору: «О чадо мое! Постыдись груди моей и пожалей меня; когда давала я тебе эту грудь, забывал ты свои младенческие печали, так вспомни же, как кормила тебя, и воздай же мне за это, пощадив себя самого». И жена его, взяв сына его, бросила его перед Ектором и взмолилась: «Пожалей, — сказала, — меня и его, любимого!» И не послушал он. Она же сказала: «О Ектор, подожди меня немного!» И, пойдя в спальню, сняла с себя дорогие одежды, и оделась в черные вдовьи, и, подойдя к Ектору, сказала: «О Ектор, если не повернешь назад, то суждено мне их носить по тебе». Но и этим не вызвала в нем жалости, и не послушал, а пошел навстречу Ахиллею. И, сойдясь, не бились в тот день, но порешили биться наутро. И в тот день перебил Ектор семь уров греческих, то есть семь полков. А наутро вышел Ектор царь и стал сражаться с Ахиллеем. И напал Ахиллей на Ектора и, пронзив его, убил. И пал Ектор мертвым. И взял тело его Ахиллей, и понес в свой стан. И потом громит он полки и убивает ратоборцев.
