Убиену же бывшю Екьтору, дерзосердому столпу тройскому, мужу тяжку и храброму, во оружиах воспитану, язвы носящю на персех бесчисленыя. Преже, дажь еллини не пришьли и составили брань, соплеташеся сей съ юньци дивиими. Видѣвше же сие тройсции вельможа и господие, начаша жалостно плакати. И взя Приамъ царь на себе нищиа и худыя ризи и гусли и поиде въ греческую войску[38] и нача пытати Ахиллеева стану, глаголя: «Егоже днесь богъ наставитъ, да мене накормит и напоить, грешнаго и страннаго». И, доиде на Ахиллеевъ станъ, и нача густи в гусли жалостно зѣло. И даша ему от вечеря своея ясти и пити. И по вечери легоша спати, упившеся. Уснуша же и стражие. И Приамъ царь нача искати сына своего, Ектора царя, и обрѣте его на постели мертва со Ахиллеемъ лежаща. И видѣвъ его, Приамъ и воздохнувъ от сердца зѣло. Ахиллей же възбнувъ и устрашися, и рече ему: «Кто еси ты?» Он же рече: «Азъ есмь Приамъ царь, ищу сына своего, Ектора царя». Рече же Ахиллей: «Аще ты еси, азъ от страха твоего мертвъ есмь!» И рече Приамъ: «Не бойся, господине! От младеньства нѣсмь того сотворилъ, да спяща витезя погублю, но прошю сына своего Ектора». И рече Ахиллей: «Аще кленеши ми ся, азъ понесу Ектора на своею плещу въ Трой по вѣре и клятвѣ, да здравъ вниду и изыду». И вземъ Ахиллей заутро Ектора и понесе его въ Трой и предастъ тройскымъ госпожамъ. И начаша его плакати. И рече Приамъ царь ко Ахиллею: «Поидевѣ въ церковь Аполона клятися, еже к тому не воеватися, дабы остало сѣмя Трою, и дам ти свою дщерь Поликсену, коя во всѣх госпожах тройскых добрѣйши».[39] И въ церкви кляся первѣе Приамъ и отступи. И преклонься Ахиллей клятися. И ту себе скры Александръ Фарижь, Приамовъ сынъ, и Дифовъ,[40] и устрѣли Ахиллеа ядовитою стрѣлою в пяту, занеже бѣ весь вооруженъ, точию плеснѣ его без желѣза.[41] И избѣгоша вонъ. Ахиллей же пад на издыхании послѣднемъ. Ощути же сиа Дисевес, яздяше бо с нимъ, и с ним Диогенъ и Ея Теламоненинъ,[42] вкупѣ же убо въ церковъ въскочивше, обрѣтоша крѣпкаго ироя, еже есть Ахиллея, лежаща и кровми облиана, и угасъша, и едва дышюща и движюща языкь, и хотящима очима его покрытися тмою. Якоже убо видѣста его, проплакаста. И напад на перси его Ея Великий с плачемъ, ко Ахиллею рече: «О, ратемъ разрушителю, исполине крѣпкорукий! Кто погубити тя возможе, лвояростьнаго?» Он же, едва прогласивъ, рече: «Убиста мя лестию Александръ Фарижь и Дифовъ». И сиа рекъ, изъдше.	Так убит был Ектор, дерзкий сердцем, опора троянцев, муж могучий и храбрый, с детства не расстававшийся с оружием, имевший на груди бесчисленные шрамы от ран. Прежде, когда еще не пришли эллины и не начали войну, сражался он с дикими быками. Видя случившееся, троянские вельможи и мужи начали горько плакать. И надел Приам царь на себя нищенское рубище, и, взяв гусли, пошел в греческое войско и стал расспрашивать, где стан Ахиллея, говоря: «Да наставит его сегодня бог, чтобы он накормил и напоил меня, грешного странника». И, придя в Ахиллеев стан, начал грустно наигрывать на гуслях. И вынесли ему с ужина еды и питья. И после ужина легли все, захмелев, спать. Уснули и стражи. И Приам царь стал искать сына своего, Ектора царя, и нашел его мертвого, лежащего в постели Ахиллея. И, увидев его, Приам тяжело вздохнул. Ахиллей же, проснувшись, устрашился и спросил: «Кто ты?» Приам же сказал: «Я Приам царь, ищу сына своего Ектора царя». Сказал же Ахиллей: «Если это ты, то я от страха перед тобой словно мертвый!» И сказал Приам: «Не бойся, господин мой! С младенческих лет я того не совершил, чтобы погубить спящего витязя, но прошу (тело) сына своего Ектора». И сказал Ахиллей: «Если клянешься мне, что я целым и невредимым войду и выйду, то, веря тебе и твоей клятве, я сам понесу на своих плечах тело Ектора в Трою». И наутро взял Ахиллей Ектора, и отнес его в Трою, и отдал троянским госпожам. И стали его оплакивать. И сказал Приам царь Ахиллею: «Пойдем с тобой в храм Аполлона, поклянемся, чтобы больше не воевать, чтобы осталось семя троянское, и дам я тебе свою дочь Поликсену, которая прекраснее всех троянок». И в храме первым поклялся Приам и отошел. И склонился Ахиллей для клятвы. Но спрятались там Александр Фариж, Приамов сын, и Дифов, и поразили ядовитой стрелой Ахиллея в пятку, ибо он был весь в доспехах, только ступни его были не защищены железом, и выбежали (стрелявшие) вон. Ахиллей же упал на последнем издыхании. Почувствовав (недоброе), Дисевес, который приехал с Ахиллеем, и Диоген, и Ея Теламонианин — все вместе вбежали в храм и нашли могучего героя, то есть Ахиллея, лежащего и залитого кровью, и угасающего, и едва дышащего, и шевелящего языком, и очи его уже готовы были застлаться тьмой. Когда увидели его (вбежавшие), заплакали. И упал на грудь ему Ея Великий с плачем и спросил Ахиллея: «О, завершающий (победой) рати, исполин крепкорукий! Кто смог погубить тебя, львояростного?» Он же слабым голосом произнес: «Убили меня обманом Александр Фариж и Дифов». И, сказав это, испустил дух.
Видѣв же сиа Приамъ царь, озлобися зѣло, и совлече со Ахиллеа оружие все, и пусти ко обѣма царема и сказа имъ. како вѣру его, еже со Ахиллеемъ, преступиша, и «аще велита, да тѣло его принесу к вама». И плакаша зѣло, видѣвше оружие Ахиллеево, и повелѣста Приаму царю сожещи тѣло его и всыпати в корчагъ. «Да сотворим, — рече, — гробъ его на далечной земли». И сотвори Приамъ тако: сожже плоть его и всыпа въ златый корчагъ и посла царемъ. И видѣвше царие и гречестии полци, дивишася, глаголюще: «О сило и слава Ахиллеева! Како тя не совзимаху вси градове и отоце, и сде единъ корчагъ златъ нѣсть тебе полонъ!»	Видя все это, Приам царь очень опечалился, и снял с Ахиллея доспехи, и отправил к обоим царям, и поведал им, как договоренность его с Ахиллеем нарушили, и (сказал): «Если повелите, то тело его принесу вам». И плакали горько, видя оружие Ахиллеево, и повелели Приаму царю сжечь тело его и (золу) всыпати в урну. «Да создадим, — сказали, — могилу его в дальней земле». И сделал Приам так: сжег тело его и всыпал (золу) в золотую урну и послал царям. И, видя ее, цари и воины греческие удивлялись, говоря: «О сила и слава Ахиллеева! Как тебя не могли вместить все города и острова, а здесь единая золотая урна тобою не наполнена».
Видѣвши же Екама царица, яко хощеть скончатися Трой, посла сына своего меньшаго Полидвора и с ним злата много к Полинещеру царю[43] на онъ полъ моря, иже царствовавше всей Погажи, дабы остало сѣмя Трою. Потом же пакы быша мужеубиениа и закланиа, и пакы кровьми облиася земля Тройская, и пакы окровавлени быша Скомандровы струа, дондеже волъхвы имъ пророчествомъ изрекоша, яко «нѣсть мощно ратию взяти Троа, но токьмо лестию единою». И абие содѣяше коня дрѣвена велика зѣло и затвориша в немъ мужа храбры, и сами отоити творяхуся ко отечеству своему. Коня же оставиша у пристанища и сами скрывшеся во острове.[44] Видѣвше же трояне пристанища пуста, коня же единаго стояща, и недоумѣюще, дивляхуся. Исперва убо мняху все прелесть, коня же погубити мышляху, во огнь или въ море воврещи, но занеже прииде время, еже взяту быти Трою, во град увѣщавьше внести коня, яко образъ и корысть от сопротивных. И ови убо внесоша его, и питиемъ и играмъ себе въдавше, и уснуша глубокимъ съномъ. Мужие же крыющиеся изшедше молкомъ и зажгоша храмы и пламень воздвигоша великъ.[45] И сие видѣвше еллини, въскоре пловуще, приидоша къ Трою, и вратомъ отверьстомъ бывшимъ от преже вшедших, яко вода влияшася множество войска греческаго. Твердонырному же сице приату бывшю Трою.	Екама царица, увидев, что суждено погибнуть Трое, отправила сына своего младшего Полидвора и с ним золота много на другой берег моря к Полинещеру царю, который царствовал всей Погажией, чтобы осталось семя троянское. Потом же снова была гибель мужей и жертвы, и снова кровью была залита земля Троянская, и снова обагрены были волны Скамандра, пока волхвы им пророчество не возгласили, что нельзя оружием взять Трою, но только одной хитростью. И тогда сделали они коня деревянного огромных размеров и заперли в нем мужей храбрых, а сами сделали вид, что отплыли к своему отечеству. Коня же оставили у пристани, а сами скрылись на острове. Увидели троянцы, что берег пуст и остался на нем только конь, и удивились, недоумевая. Сперва подумали, что все это хитрость, и хотели коня уничтожить — сжечь или в воду сбросить, но так как настало время, когда суждено было быть взятой Трое, то решили в город ввести коня как вражеский трофей и добычу. И те, кто ввез его, предались пиршеству и играм, и заснули глубоким сном. Мужи же спрятанные тихо вышли и зажгли храмы, и пламень поднялся в небо. И, увидев это, эллины, поспешно приплыв, приступили к Трое, и так как ворота были открыты прежде вошедшими (в город), то словно вода хлынуло (туда) многочисленное греческое войско. Так был взят твердобашенный город Троя.
Инде же пишеть,[46] сткломъ и мѣдью и воскомъ сотвориша фарижа сера, тѣм же образомъ, аки конь,[47] и в нем затвориша 300 витез, сирече боляръ вооруженных. И егда его ввезоша во град, врата разоривше, не прошедшу ему во врата, тогда воини разбивше мечными[48] главами сткло, изскочивше, многи изьсѣкоша. Достиже же и все мьножество войска въ караблих и по суху, изсѣкоша тройскыя вельможа, а инѣх в море пометаша.	В другом же месте пишется, что из стекла, меди и воска был изготовлен серый конь, видом подобный коню, и в нем заперли триста витязей, то есть бояр вооруженных. И, когда ввозили его в город, то ворота разрушили, ибо не проходил он в ворота, и тогда воины разбили остриями мечей стекло, выскочили и многих посекли. Подоспело и все множество войска в кораблях и посуху, иссекли троянских вельмож, а других побросали в море.
Изведоша же Александра и Елену царицю к Менелаю. И рече ему Елена: «О, господи царю! Ты бысть вяще[49] кривъ, чему мя остави со Александром Фарижемъ, да мене прельстить своимъ неверьствомъ». И отвѣща ей царь: «О, госпоже Елено! Яко отселе азъ сотворю, да тебе инъ никтоже не прельстить». И повелѣ еа и со Александром усѣкнути.[50] И с ними Поликсену, дщерь Приама царя, повелѣ усѣкнути на гробѣ Ахиллееве, яко ея ради погибе.[51] И Екаму царицю, матерь ея, даша на подѣлъ, с нею же прочая госпожа и болярыни. Ведоми же плакаху зѣло, царица же Екама утѣшаше их: «Азъ имамъ ваша слезы утолити». И прочеа жены восхищаеми бяху от чертогъ новонасаженных и младенци ударяеми бываху о стѣну, и земля наводняема бяше кровъми падающих. И, — спроста рещи — плачь вся содержаше и все лютое и горкое содержаше град. И огневи предають и попаляють от основаниа, еже во градѣх прекраснаго и преизряднаго Троя.	Привели же Александра и Елену царицу к Менелаю. И сказала ему Елена: «О, господин мой царь! Ты был совсем слеп, если оставил меня с Александром Фарижем, чтобы он прельстил меня своим обманом». И отвечал ей царь: «О, госпожа Елена! Я сейчас сделаю так, что никто другой тебя не соблазнит». И приказал отрубить ей и Александру головы. И с ними Поликсену, дочь Приама царя, приказал казнить на могиле Ахиллея, так как из-за нее он погиб. А Екаму царицу, мать ее, и вместе с нею прочих знатных горожанок и боярынь раздали (победителям). Ведомые (в полон) горько плакали, царица же Екама утешала их: «Я смогу ваши слезы осушить». И других женщин выволакивали из чертогов новопостроенных, и младенцев разбивали о стены, и земля пропиталась кровью убитых. И, попросту говоря, плач стоял повсюду, и все лютое и тяжкое выпало на долю города. И огню предали и сожгли до основания прекраснейшую и славнейшую среди городов Трою.
И увѣдѣв о сиа царь Полинещеръ и повелѣ заклати Полидвора царя, Приамова сына и воврещи его в море. И ту присташа корабли гречестии. И взятъ Екама царица ведро, еже почерьсти воду, и обрѣте сына своего мертва, и возопи гласомъ велиимъ, плачющися. Тогда слышавъ Полинещеръ царь, изыде на утѣшение Екаме царици. И въсташа с нею тройскыа госпожа и збодоша царя Полинещера ножи. Сиа увѣдѣвше гражене, побиша их камениемъ.[52]	И, уведав об этом, царь Полинещер приказал убить Полидвора царя, Приамова сына, и бросить его в море. И тут пристали корабли греческие. И взяла царица Екама ведро, чтобы зачерпнуть воды, и нашла труп сына своего, и закричала громким голосом, рыдая. Услышав это, вышел Полинещер царь, чтобы утешить Екаму царицу. И поднялись на него троянки вместе с нею, и искололи Полинещера ножами. Увидев это, горожане забросали их камнями.
Возврати же ся Менелае царь со всѣми грекы с побѣдою и съ великою честию, стоя под Троемъ 10 лѣт и 7 мѣсяць. И тако скончася Тройское царство.	Возвратился же Менелай царь со всеми греками с победой и с великой славою, простояв под Троей десять лет и семь месяцев. И так пало Троянское царство.
Написа же повесть о тройском пленении творець Омиръ.[53] Ахиллей же бѣ сынъ царя Каеты, а индѣ пишеть Фирелеша.[54]	Написал же повесть о пленении Трои песнотворец Омир. Ахиллей же был сыном царя Каеты, а иные пишут — Фирилеша.
