У святаго и живоноснаго Гроба Господня створи въмѣсто мене до земля метаний, 12 такожде и святыя Голгофы и в Гефсимании[31] и блаженому и святому моему владыце патриарху, яко недостойный азъ Никон рабъ рабом его, и прочим владыкамъ моимъ и отцемъ, подобнѣ же и братьямъ, иже прилучатся ту, метания всѣм, да помолятся о мнѣ, яко да мя помилует Богъ и съхранитъ мя, недостойнаго, молитвами Богородица и всѣх святыхъ, аминь.	У святого и живоносного Гроба Господня сотвори за меня 12 земных поклонов, а также у святой Голгофы и в святой Гефсимании, и блаженнейшему и святому моему владыке патриарху, ибо я недостойный, Никон, раб рабов его, и остальным владыкам моим и отцам, а также братьям, которые там окажутся, земные поклоны всем, пусть помолятся обо мне, чтобы помиловал меня Бог и сохранил меня, недостойного, молитвами Богородицы и всех святых, аминь.
СЛОВО 37. ТОГОЖДЕ О ДУХОВНЫХ И ВЪЗЛЮБЛѢНЫХ ОТЕЦЪ И БРАТЬИ НАШИХ ИВИРОХ К ДУХОВНОМУ МОЕМУ ЧАДУ ИНОКУ ГЕРАСИМУ 	СЛОВО 37. ТОГО ЖЕ О ДУХОВНЫХ И ВОЗЛЮБЛЕННЫХ ОТЦАХ И БРАТЬЯХ НАШИХ ИВИРАХ К ДУХОВНОМУ МОЕМУ ЧАДУ МОНАХУ ГЕРАСИМУ
Послахом прежде, духовное мое чадо, Божественая Писания от патриархия же Антиохийския и святаго Симеона Чюдотворца обители, и мое, недостойнаго, имуща книжная свѣдительства и извѣщения о духовных наших братьяхъ, нарицаемые цатох, показующе тѣх непорочное отвсюду благодатью Христовою, въ яже о вѣрѣ и распрях и сънмицах чистом быти таковымъ свершенѣ и всякого зазора вышим благодатью Христовою. Сице паки и здѣ о духовных и любимых отцѣхъ и братьях наших ивирох, еже Богъ укрѣпи и дарова за молитвъ святыхъ, съвъкуплеше, и еже обрѣтохом от Божественых Писаний, съчетахом сия и послахомъ тебѣ Божья ради любве и подобныя ей къ искренему. И ты паки другым ти подай и исполняя божественыя любве уставъ, яко да явѣ будут сия, яже предварших лѣтъ в различных книгах лежащая от небреженья же не испытуема, ниже являема, и сице рещи погребена и яко въ мрацѣ крыема. Сего ради азъ, недостойный Никонъ, иже по духу отець твой, поспѣшьством Божиимъ сия трудолюбьствовавъ, послах ти первая убо о духовныхъ наших братьях, нарицаемых цатѣ, и ныне пакы о духовных и любовных наших отцехъ и братьях ивирохъ, яко да азъ, недостоиный Никон, рабъ тѣх святыя молитвъ и любве божественыя бъвъ Божию милость на себе привлеку, якоже изначала и прежде обои, азъ же и сии отци наши и братья, божественымъ Духомъ усвояеми, божественою любовью уставъ исполняюще дѣлом и словом елико по силѣ.	Отправили мы тебе прежде, духовное мое чадо, Божественные Писания от Антиохийской патриархии и монастыря святого Симеона Чудотворца и от меня, недостойного, послание, содержащее письменные свидетельства и известия о духовных наших братьях, называемых цатами, показывающие их непорочность со всех сторон, благодатью Христовой, в отношении веры, раздоров и (тайных) сборищ, совершенно чистыми и стоящими выше всякого подозрения, благодатью Христовой. Таким же образом и здесь еще о духовных и возлюбленных отцах и братьях наших ивирах, что Бог укрепил и даровал по молитвам святых и что обрели мы в Божественных Писаниях, собрали мы и совокупили и отправили тебе ради божественной любви и подобной ей любви к ближнему. И ты это передай другим, исполняя заповедь божественной любви, чтобы стало явным то, что с прежних лет было записано в различные книги и из-за пренебрежения не было ни исследовано, ни выявлено, и, можно сказать, погребено, и, как во мраке, скрыто. Поэтому я, недостойный Никон, духовный отец твой, с Божьей помощью в этом потрудившись, послал тебе сперва о духовных наших братьях, называемых датами, теперь же о духовных и возлюбленных отцах и братьях наших ивирах, чтобы мне, недостойному Никону, рабу их святой молитвы и божественной любви, привлечь на себя милость Божию, ибо изначально и прежде обе стороны, я и отцы наши и братья, приобщаясь к божественному Духу, наполнялись установлением божественной любви, по мере сил, делом и словом.
Сии бо духовнии и възлюблении отци наши и братья изначала убо вѣдѣние обращениа ихъ от суетных идолъ к истинний християньстий вѣрѣ блаженый Феодоритъ епископъ Кирьскый в Церковнѣм списании повѣдуют[32] о иже от гръцкыя земля пленены блаженыя оны въ женах добродѣтелныя Нонны,[33] како языкъ ивирскый обра<тися> на християньство от суетъных идолъ, и убо яже таковаго начала тамо сказует. Въ другой же паки повѣстнѣй книзѣ пишет сице: яко въ царство великого Константина[34] Иверия въ православную вѣру приде и християньство прият, уврачевана бывши от нея. Сыну бо царя ивирскаго въ лютѣ недузѣ бывшю, царь, увѣдѣвъ, християнинъ бысть, и тъи же и вси. И храмъ моляше царя създати. Царь же еже убо о съпружници бывшее чюдо хваляше же и славляше, храм же не хотяше създати. Лѣту же мимошедшю, тый на ловъ изиде. И человеколюбивый же Владыка того якоже Паула улови, мрак бо на нь внезапу напад, не оставляше напред пойти. И ловящеи убо солнечныя лучя обычно наслаждахуся, тъ же единъ невидѣния связанъ бысть язами. Въ недоумѣнии же сый, и умѣние обрѣте спасения. И абие мрак онъ прейде на свѣт. И призвавъ иже Веселеила, начялохудожника, примудрости исполнившаго, и того сподоби благодатью, якоже божественый описати храм. Они же основание копаху же и зиждаху. И яко свершися храм, трѣбоваху свещенника обрѣсти. И сему обрѣтение чюдная жена створи, увѣща бо началника языку оному къ гричкому послати царю и просити да послет ему учителя благочестью.	Что касается этих духовных и возлюбленных отцов наших и братьев, то изначально сведения об их обращении от суетных идолов к истинной христианской вере рассказывает блаженный Феодорит, епископ кирский, в Церковной истории, о той от греческой земли плененной блаженной среди женщин и добродетельной Нонне, как ивирский народ обратила к христианству от суетных идолов, и о начале этого так рассказывает. В другой же исторической книге написано так: в царствование Константина Великого Иверия пришла к православной вере и приняла христианство, будучи излечена ею. Ибо когда сын царя ивиров находился в тяжелой болезни, царь, узнав об этом, стал христианином, и все (вокруг него). И Нонна попросила царя построить храм. Царь же, восхваляя чудо, произшедшее у его супруги, храм же создать не хотел. Спустя год вышел он на охоту. И человеколюбивый Владыка его уловил, как и Павла, ибо на него внезапно напал мрак, не позволяя идти вперед. И те, кто вместе с ним охотились, как обычно, наслаждались солнечными лучами, он же один был связан путами слепоты. Оказавшись в состоянии непонимания, он обрел понимание спасения. И сразу тот мрак изменился на свет. И, призвав Веселеила, первостроителя, исполненного мудрости, удостоил его благодати описать божественный храм. И стали они копать основание и строить. И когда храм был окончен, нужно было найти священника. И его обретение сотворила удивительная женщина, ибо она убедила главу того народа отправиться к царю греческому и просить его прислать учителя благочестия.
Царь же великый Констянтинъ, съ обрадованиемъ посланьникы приимъ, посла имъ Еустафья, патриарха Антиохийскаго, съ многою честью. И шед тамо, крести и всих съ царемъ и освяти въсъзданый храм, и створи имъ сборнаго епископа, въобразивы ему божественым уставом под властию быти патриарху Антиохийскому. Царь же ивирскый и съвѣтницѣ его уставиша патриарху антиохийскому въ подани ему ароматом святаго мира токмо тысящу селъ въ земли ивиръстий, яко да от прихода их подаются аромата миру. Въ Антиохии бо бѣ уставъ освящатися миру, и оттуду подаяшеся по всему миру. Инде бо не освящашеся миро. И зде убо тако.	Великий же император Константин, с радостью приняв послов, отправил им Евстафия, патриарха антиохийского, с большой честью. И, придя туда, он крестил всех вместе с царем и освятил созданный храм, и поставил им соборного епископа, установив, что он, по божественному уставу, подчиняется патриарху антиохийскому. Царь же ивиров и его советники постановили патриарху антиохийскому за доставление ароматов святого мира только тысячу сел в стране Иверии, чтобы от их приношений поставлялись ароматы мира. Потому что существовал устав освящать миро в Антиохии, и оттуда оно доставлялось по всему миру. Ибо в других местах миро не освещалось. Здесь сказано таким образом.
Паки в другой книзѣ повестнѣй глаголет, яко при Констянтинѣ царѣ Копронимѣ,[35] патриарху сущю блаженому Феофилакту въ Антиохии, придоша от Ивирия инока два и възвѣстиша блаженому Феофилакту, яко в нужди суть християнѣ селъ иверьских, не имуще сборнаго архиепископа. От дний бо блаженаго Анастасья, священномученика и патриарха Антиохийскаго, не поставлен бысть им архиепископъ сборный остроты ради путныя и заеже не смѣяти кому агарянъ ради мимо ходий.[36] И сборным судом своих митрополитъ и архиепископъ и епископъ повелитѣлное писание даст ивиром поставлятися от епископъ прѣдѣла его, иже въ дни тыя сборному архиепископу ивирскому, поеже быти избранию от них, и створити и жребий, и по жребью идеже божественая благодатью объявитъ, поставитъ того по церковному уставу. И створиша написано въспоминание о том и съшедый сборъ и запечатьливъ въдаст им, и поста<ви> единого от обою посланую мниху, Иване именемъ. Бяху же села патриархова въ Иверии тысяща изначала уставлена; и устави даяти на коеждо лѣто по времени патриархомъ дань от тѣх селъ его, златник тысящу окуплени ароматом святаго мира.[37] И на всяко лѣто даяхуся даже до Ивана святаго патриарха Иерусалимского. При Орестѣ святѣйшем патриарси Антиохийстемъ, идущи ему на моление киръ Василию,[38] уставлено же бысть въспоминание имѣти патриарху Антийохийскому единому в Иверии,[39] и посылати екзарха[40] на посѣщение о ересехъ и истязании о душевных съблазнох и взимати уряжденая от селъ онѣх.	В другой же исторической книге говорится: при императоре Константине Копрониме и антиохийском патриархе Феофилакте из Иверии прибыли двое монахов и сообщили блаженному Феофилакту, что христиане иверийских сел пребывают в нужде, не имея соборного епископа. Потому что со времени блаженного Анастасия, священномученика и патриарха Антиохии, для них не был рукоположен соборный архиепископ по причине трудности пути, и поскольку никто не смеет через земли агарян пройти. И по соборному решению митрополитов, архиепископов и епископов того места он дал ивирам повелительное послание, чтобы соборный архиепископ Иверии рукополагался от епископов его страны: после избрания у них бросить жребий, и после жребия, если божественная благодать такому проявится, того утвердить по церковному уставу. И сделали письменный документ об этом, и собравшийся собор, подтвердив его, вручил им и рукоположил одного из двух посланных монахов по имени Иван. Было же установленных изначала владений патриарха в Иверии тысяча; и постановил (собор) платить ежегодно патриархам, которые правят, дань от тех имений в тысячу златников за покупку ароматов святого мира. И ежегодно давали вплоть до святейшего патриарха Иерусалимского Иоанна. При святейшем патриархе Антиохийском Оресте, когда он шел с миссией к (императору) кир Василию, было установлено, что в Иверии поминается только антиохийский патриарх и он может посылать экзарха для наблюдения за ересями и расследования духовных согрешений и чтобы взимать установленное от тех имений.
Паки же въ дѣлных иже въ Халкидонѣ святаго сбора пишетъ сице: яко уставлено же бысть миро всюду освящатися; первѣе бо от Антиохийскаго тоцью освящашеся. Увѣдевше же яко даровъ ради даемо бывает, уставлено бысть всюду от епископъ освящаему быти. Царь же любезни учредивъ сборъ 630 отець, отпусти когождо во свояси. Въ послѣдних же временох при Констянтинѣ цари Мономасѣ[41] и блаженемъ патриарси Антиохистем киръ Феодорѣ[42] възнице плевелом сѣятель нѣкый[43] от епископъ въ Иверии. Тѣмьже и различна послания киръ Феодоръ и с кувуклисием посла[44] въ Иверию, исправивъ вся иже тамо бывшая соблазны благодатью Божиею, усердьем же и божественою ревностью иже тамо божественых отець и епископъ. Яже послания зде обрѣтаются въ Чюдотворци и святѣм Симеонѣ у игумена кир Иоанна, произволением Дипотатово. Въ каковых убо посланиих пишеться повеление и рукоположение патриарха киръ Феодора посланми, въ тогдашнее время бывшее сборному иверийскому кир Иоанну.	Опять-таки в деяниях святого Халкидонского собора написано, что было установлено освящать миро повсюду; ибо сначала оно освящалось только в Антиохии. Когда стало известно, что оно дается за дары, было постановлено, чтобы освящалось епископами повсюду. Император же, благосклонно учредив собор 630 отцов, отпустил каждого восвояси. Позднее, при императоре Константине Мономахе и блаженном патриархе антиохийском кир Феодоре, появился некий сеятель плевелов среди епископов в Иверии. Поэтому кир Феодор с кувуклисием послал в Иверию различные письма, исправив все произошедшие там недоразумения благодатью Божией, усердием и божественной ревностью там находящихся божественных отцов и епископов. Эти письма находятся здесь, в святом Симеоне Чудотворце у игумена кир Иоанна Дипотата. В этих посланиях содержится повеление о рукоположении, писанное в то время патриархом кир Феодором каталикосу Иверии кир Иоанну.
