ТРЕТЬЯГО СЛОВА СУТЬ СТИХОВЕ ВСИ 1654	ВСЕГО В ТРЕТЬЕМ СЛОВЕ 1654 СТИХА
СЛОВО 3	СЛОВО 3
1. Яко ничтоже творит душа или дѣйствует кромѣ тѣла, но его всѣми уды дѣйствует и познаваеться, какова есть и колика.	1. Что душа ничего не совершает и не делает помимо тела, но действует только с помощью всех его членов, а через это и познается, какова она и какая.
2. Яко аще не въ свершенъ възрастъ приидут уди и части телесныя, дѣйства душевная неявлена суть.	2. Что если не полностью разовьются члены и части тела, действия душевные останутся непроявленными.
3. Яко аще что от удовъ телесных погибнет или инако вредиться, бездѣльствуеть душа к служенью его.	3. Что если какой-нибудь из членов тела погибнет или иначе повредится, душа окажется не в состоянии действовать присущим этому члену образом.
4. Убо в коей части тѣла пребыванье уму мнѣти достоить.	4. В какой части тела следует считать пребывающим ум.
5. Яко сраслена есть душа телеси и вкупѣ душа и вкупѣ и тѣло, не бо прежнѣйшее единъ другаго.	5. Что сращена душа с телом и одновременно появились душа и тело, а не одно прежде другого.
6. Яко, тѣлу разрушаему, не сраздрушаеться с ним и душа, и како бесмертное и славное с мертвым и неславным создано бысть, и которое котораго первозданно бысть.	6. Что с разрушением тела не разрушается с ним и душа; и о том, как бессмертное и славное было создано со смертным и бесславным, и что чего первозданней.
7. Убо кто согрѣшивы въо Адамѣ изначала — душа или тѣло, и яко смерть не мука есть, но врачеванье и смотренье добрѣйшее, и яко душа, дондеже привязана есть сей плоти, мысленая видѣти не может.	7. Кто согрешил в Адаме сначала — душа или тело, и — что смерть не мука, но врачевание и прекрасное предусмотрение, и что душа, пока привязана к этой плоти, мысленного видеть не способна.
8. Иже по образу и по подобью кое есть, и кто от обою имат то — душа или тѣло.	8. Что у человека по образу и что по подобию, и кто из обеих обладает этим — душа или тело.
9. Убо тлѣнна ли Адамова плоть или нетлѣнна создана бысть.	9. Тленной или нетленной была создана Адамова плоть.
10. И гдѣ хощем глаголати преже отшедшие сущиа душа; яко в последний день хощем вси от вѣка усопшеи вскреснути и какови.	10. Где следует считать пребывающими души прежде отошедших, и — что в последний день все от начала веков умершие воскреснем и какими.
11. Христосъ, сшед въ адъ, вся ли иже от вѣка тамо сущая душа свободи, по Писанию, или ни, и како и ким образом познают душа каяждо свое тѣло в въскресении.	11. Христос, сойдя в ад, все ли от века там находящиеся души освободил, по Писанию, или нет, и как и каким образом каждая душа опознает свое тело при воскресении.
12. Яко обещно тогда быти и познанье на всѣх, дондеже ови от десныя, ови же ошююю разлучаються, и тако будет паки праведным познание, грѣшным же ни.	12. Что все тогда будут узнавать всех, пока не разделятся на стоящих справа и слева, после чего одни только праведные будут узнавать друг друга, а грешные нет.
13. Яко на воскресение всячьская тварь обновиться в нетлѣние к лучше добротѣ и видѣнию, — подобнѣ и человѣчьская телеса, с ними же и душа, но не тричастны будут тогда, якоже нынѣ, но отимуться двѣ части от них — ярость и желание.	13. Что с воскресением всяческая тварь обновится, сделавшись нетленной и став лучше и красивей, также и человеческие тела, а с ними и души, но не трехчастны, как теперь, они тогда будут, ибо отнимутся две части у них — способности ярости и влечения.
14. И еще о въскресении.	14. И еще о воскресении.
НАЧАЛО ТРЕТЬЯГО СЛОВА	НАЧАЛО ТРЕТЬЕГО СЛОВА
Душа: Се другое взискание, се и другое впрошенье. От нихже впросих тя вчера и во втором словѣ, многа ми явила еси и многа сказала ми еси. Хотѣх же увѣдѣти, гдѣ хощем глаголати преже умершихъ душа быти: аще въ адѣ речеши ми, — да гдѣ есть адъ? Рци ми се явственѣ, рци и не облѣнися.	Душа: Вот новая тема, вот и новый вопрос. Из того, о чем я спросила тебя вчера, во втором слове, ты многое мне раскрыла и много мне сказала. А теперь я захотела разузнать, что надлежит нам думать о том, где пребывают души прежде умерших: если «в аду» скажешь мне, — где ад? Ответь мне на это ясно, ответь, не поленись.
Плоть: Невнимателна о мнозѣ еси, о душе моя. Аще бо бы внимала, смѣреная, от ихже прочитаеши и от ихже поеши многажды на который же день, хотяше многая навыкнути и разумети вся си, учителя не бы требовала, ниже сказателя. Слышано ли бысть се, владычице, да не знаеши сия, но впрашаеши рабу свою, мене оканную!	Плоть: Ты очень невнимательна, о душа моя. Ведь если б ты внимала смиренно тому, что читаешь и что многократно каждый день поешь, то очень много узнала бы, и поняла все это, и не имела бы потребности ни в учителе, ни в толкователе. И слыхано ли это, владычица, не знать этого и спрашивать свою рабу, меня, окаянную!
Душа: Аще убо не навыкну от тебе, от кого научюся? От Писания слышах, еже впрашати убо лучше есть и еже свѣтовати мьногых спасително есть.	Душа: Коль от тебя не узнаю, у кого научусь? А из Писания я слышала, что спрашивать полезно и советоваться со многими спасительно.
Плоть: Да что есть и каково дѣло, еже имаши, и где скытаеться умъ, и где обьходит, скажи.	Плоть: Да какое же дело теперь тебя занимает, и где, скажи, твой ум скитается и блуждает.
Душа: Кое убо дѣло — еже испытовати божественое: и отнуду же придох, и еже ради вины, и кто есть зижитель мой, и како честнѣйшю всѣх иже в мирѣ створи мя тварей и под руку далъ есть скоты же и звѣря, и гад, и птица, и ина глаголю вся, небо с своими ему, земля и иная паки, — и како мя затворилъ есть в тебѣ смраднѣй, и идеже паки поиду, отлучився тебе конечнѣй.	Душа: Такое дело — постигать божественное: откуда я пришла, и по какой причине, и кто создатель мой, и почему, создав меня высшей всех сущих в мире тварей и подчинив мне животных, зверей, и гадов, и птиц, и прочее, можно сказать, все: небо вместе с тем, что в нем, и землю, и иное, — при этом он поместил меня в тебе, смрадной, и куда потом я пойду, с тобой, наконец, расставшись?
Плоть: Право убо отвѣща ми, и добрѣ отглагола; сия поучайся всегда; сия тебѣ да суть дѣло; да навыкнеши от них лучшая, божественая.	Плоть: Ты правильно ответила и хорошо сказала; и это постигай всегда; пусть это будет твоим делом, чтобы ты научилась лучшему и божественному.
Душа: Азъ убо се желаю воину и хощю поучение незабытно имѣти ми в сѣхъ. Но якоже вепрь калу радуеться и сквернѣ и на кождо день валяеться, услажаяся в немь, тако и ты, всезлая плоти, всяко с сими плотьскыми своими страстми и сластьми студными и скверными дѣянми съкверниши мя на кождо день, валяющися в них без боязни, якоже свинья, и низъвлачиши мя долѣ, и никакоже оставляеши мя горняя зрѣти и мудрьствовати, и в горняя входити. Зрительное угасила еси — еже есть умъ мой. И како взмогу навыкнути, помрачена сущи и ослѣплена всячесьскы, зрѣти не имущи!	Душа: Я ведь того и желаю всегда и хочу хорошее поучение об этом услышать. Но как свинья, что нечистотам радуется и скверне и каждый день валяется в них, наслаждаясь, так и ты, презлая Плоть, вечно этими своими плотскими страстями, и усладами постыдными, и скверными деяниями оскверняешь меня каждый день, валяясь в них безбоязненно, словно свинья, и вниз меня влечешь, и никак не позволяешь мне взглянуть ввысь, о горнем помышлять и к горнему стремиться. Способность видеть, то есть ум мой, во мне ты угасила. И как смогу я понимать, будучи помраченной и ослепленной во всем и видеть неспособной?
Плоть: Да вѣдѣ ты водиши мя и ты всяко носиши! Да вѣдѣ ты обращаеши мя, якоже снузнець коня. Азъ убо кромѣ тебе ничтоже отнудь творю: ниже доброе, ниже злое, ни посреднее спроста. Да что мя укаряеши много и что мя бесчестиши? Или убо добрѣ, или злѣ живемъ — твое еже хотѣти.	Плоть: Да ведь ты руководишь мною, ты меня повсюду носишь! Ты ведь управляешь мною, как всадник конем. Я без тебя вовсе ничего не совершаю: ни добрых дел, ни злых, ни тех, что между злым и добрым. Так за что же ты меня укоряешь и за что бесчестишь? Хорошо ли, дурно ли мы живем — зависит от твоей воли.
Душа: Непщюеши, злѣйшая, благословленѣ противится мнѣ? Но нѣсть, ты якоже рече, нѣсть, якоже глаголеши! Но — якоже конь сверѣпъ, егоже глаголють Етиарь,[1] неудержим, зловидень и непокоренъ зѣло, внегда хопит узду, стища зубы своими, и въздвигъ выю яростнѣ и к брегом устремиться и в пропасть, и рассѣлины, и ровища калная и самъ себе низъринет вкупѣ со всадникомъ; аще ли въспящаеться, то паки горше есть, — сицевому подобно стражем обѣ вкупѣ. Сверѣпѣеши, якоже онъ предреченъ мною конь, вражедная, и тогда не могу повести тя, якоже хощю, но яможе ты хощеши, водиши мя нехотящю. Аще убо ураню тя жезлом и умучю тебе, или гладом озлобя тя и жестоцѣм житием, аще труды тебѣ наведу многы и великы и подвигы нанесу ти, яко да постражеши — да некако буяеши, и играеши, и скачеши отнуд, — и положю долу тя мертву, полумрщвену паки, — въ еже показати тя паки покориву быти, и не имамъ служащаго ми, ниже помагающаго, не имам с ким добродѣтели сдѣяти! И како сию да стяжю и како сию створю?	Душа: Полагаешь, злейшая, что разумно мне перечишь? Но не так обстоит дело, как ты сказала, не так, как говоришь! Но словно конь свирепый, что зовется Сиртиарий, неудержимый, страшный и весьма непокорный, когда грызет узду, стиснув ее зубами, и, шею яростно задрав, к берегам устремляется, и в пропасти, и в ямы, в рвы, наполненные грязью, сам себя повергает вместе со всадником; если же попятится, то будет еще хуже, — подобно этому и мы страдаем обе вместе. Ты, враждебная, свирепеешь, как этот названный мной конь, и тогда я не могу вести тебя, куда хочу, но ты, куда хочешь, несешь меня против моей воли. Если же я побью тебя палкой и помучу тебя или голодом накажу тебя и суровой жизнью, если трудами нагружу тебя многими и тяжелыми и работы возложу на тебя такие, чтобы пострадала ты — чтоб не буйствовала больше, не озоровала, не скакала совсем, — умерщвленной и полумертвой низложу тебя, чтобы заставить тебя быть покорной, то лишаюсь тогда своего слуги и помощника, и не с кем мне будет добрых дел сделать! Как добродетель тогда стяжать и сотворить мне?
Аще ли же упокою тя и угожю ти, паки на мя въстаеши злѣ и ратуеши мя бѣснѣ, и низълагаеши мя долѣ в дѣяния неправедна. Обаче помагаеши ми нѣкогда створити любимая к Богу, пособьствуеши мя во многая, но и ратуеши мя; и помощника имам те, и съперника паки, и ратника нещадна, и врага же сверѣпа. Горе, горе мне! Како: враг — и друг любы мнѣ! И что сдѣяти, недоумѣю, и что створю, не вѣмъ. Аще убо створилъ бы Богъ, да свобожюся тебе, изъшла бы твою темницю и зловонья смраде, изъшла бых убо, наставлена от ангела, вскорѣ в моя си, в мое отечество, и, яже в мирѣ оставльши, в премирных жила бых.	А если же дам тебе покой и угожу тебе, вновь на меня восстаешь со злобой и бешено воюешь со мной, и низвергаешь меня вниз, в деяния неправедные. Однако же иногда ты помогаешь мне совершить любимое Богом, способствуешь мне во многом, но воюешь со мной; и помощник ты мне, и соперник разом, противник беспощадный и враг свирепый. Горе, горе мне! Как это: враг — и друг мой любимый! Как мне поступить, не знаю, и что сделать, не ведаю. Если бы дал Бог от тебя освободиться, вышла бы я из твоей зловонной и смрадной темницы, быстро пошла бы, наставляемая ангелом, в мое отечество и, оставив все мирское, в надмирном мире жила бы.
Плоть: Много възвысися, о душе, много възнеслася еси — яко невеществена и добра и яко превышши, яко мыслена и словесна, и бесмертна сущи, и яко от вышняго и небеснаго мира, сей миръ убо нѣсть достоинъ тебѣ, азъ есмь злородна, азъ есмь раба от сего мира тлѣньнаго, премѣннаго и сквернаго, от четырех его всѣх ставъ вся есмь — и мерзка, и сквернава, и нечиста, якоже глаголеши. И глаголи еже хощеши, госпожа бо ми еси. Но убо яже укаряеши злую мене, юже бесчестиши, — аще мя не бы имѣла, владычице, не бы достойна мѣдницю.	Плоть: Слишком возвысилась ты, о душа, и чрезмерно вознеслась: и невещественна ты, и добра, и все-то ты превосходишь, и осмысленна ты, и словесна, и бессмертна, и происходишь из вышнего небесного мира, а этот мир недостоин тебя, а я злородна, я раба из этого изменчивого и скверного мира, из всех его четырех стихий вся состою, и мерзка я, и скверна, и нечиста, как ты говоришь. И говори, что хочешь, ведь госпожа ты мне. Но хотя ты меня и называешь, укоряя, злой и бесчестишь, но если бы ты меня не имела, владычица, не стоила бы ты и медяка.
Душа: Да како обесрамися, и како обесчестиши мя, и како охуди мя? Хощу навыкнути, еже рече.	Душа: С чего ты потеряла стыд, с чего бесчестишь ты меня, что унижаешь? Хочу понять твои слова.
Плоть: Вонми, прочее, и слыши, и не огорчевайся отнудь, ни же гнѣвайся на мя всуе туне тако, елма обезчивихся тебѣ, елма обесрамихся и стыдение отложих от моего лица. Рьку тебѣ истину, или хощеши, или не хощеши. И вонми здѣ смысленѣ и разумѣй яже глаголю.	Плоть: Тогда внимай и, слыша, не огорчайся и не гневайся на меня понапрасну, как если бы я бесчестила тебя, как если бы я обнаглела и стыд отложила от лица моего. Скажу тебе правду, хочешь ты того или не хочешь. Послушай теперь осмысленно и разумей, что я буду говорить.
Кромѣ ссуд моих удовъ, госпоже, Творца своего и Бога славословити не можеши, — аще не имаши сдѣлницю мене и помощницю свою. Но ниже благодарити яко творенье Создателя, ни о нихже согрѣшила еси сама покаятися можеши кромѣ слезъ и въздыхания, якоже она блудница и Петръ. Внегда убо мене отлучишися, разумѣеши, кто еси?	Без помощи моих органов, госпожа, Творца своего и Бога не можешь ты славословить, — если ты не имеешь меня своей сотрудницей и помощницей. Без меня не можешь ты ни возблагодарить своего Создателя как его творенье, ни покаяться в согрешениях со слезами и воздыханиями, как это сделали блудница оная и Петр. Со мной расставшись, разумеешь ли, кто ты есть?
Душа: Да како отнудь глаголеши и како имаши уста и всяко противь глаголеши ми и не срамляешися?!	Душа: Да как только вообще язык твой поворачивается говорить мне такое, и при этом ты не стыдишься?!
