Аще ли хощеши увѣдѣти естество и доброту тѣла оного якова и колика, — звѣздам точно являеться и лунѣ, яко наго не требоваше одежа ни покрова, но якоже солнце само своею наготою украшаеться ныне, такоже и оно оставлено бысть естественным. От того совлече ту и облече и в мерзкое и гнусное и скверное се; обаче не измѣни перстнаго существа, но премѣни ему естества, еже исперва, и от Едема изрину его тогда абие, и взбрани ему причаститися древу и плоду жизньному, милуя его, не завидя же, да не будет, животу бесмертьному, но удержавая добрѣе устремленье грѣховное. Смерть бо, прочее, не мученье бывает, но врачеванье добрѣйше и спасенье паче, и смотренье, державная, премудрости исполнено, удержавает бо яко намнозѣ греха устремленье, умры бо, рече, оправдися от нея. Прочее, работаеть души елико силу имат: или 10, или 20, или 50 лет, или много убо дващи толико глаголю, — и тако разрушаеться, растлѣвает же и в четыри сия отходит сставы, от нихже сставленье от Бога прият: яко от земля — паки в землю, по глаголу Его.	Хочешь узнать о природе и красоте тела того — каковы и какой меры, — звездам подобным было оно и луне, ибо нагое не нуждалось ни в одеждах, ни в покрове, но как солнце само своей наготой украшается ныне, так же и оно оставлено было естественным благообразием украшаться. Совлек он с нее то тело и облек ее в мерзкое, и гнусное, и скверное это; не изменил он, однако, самой его земной сущности, но переменил изначальную природу и из Эдема изгнал его тотчас, и запретил ему прикасаться к дереву жизни и его плоду, — жалея его, не отказывая, ни в коем случае, в жизни бессмертной, но наилучшим образом удерживая устремленность ко греху. Смерть, таким образом, не местью оказывается, но врачеванием наилучшим и скорее спасением, устроением, державная, премудрости исполненным, так как в большой мере удерживает устремление ко греху, ибо умерший, говорят, уже за него наказан. Итак, рабствует оно душе, насколько силу имеет: или десять, или двадцать, или пятьдесят лет, или, если долго, дважды столько, — а затем разрушается, подвергается тлению и распадается на четыре те составные части, из которых Богом было составлено; из земли исшедшее снова уходит в землю, по слову его.
Ты же, госпоже моя, нага оставлена бывъши, уединена всячьскы, не имущи тѣла и еже тя здѣ сдержащаго яко съжителя имѣя, — паче же та сдержит то, и стяжет, и имат, — абье убо всходить в своя ея: аще схранила есть добро еже по образу ея неблазньно и чисто и настоящем житии, яко умна — ко умным, яко и невеществена — невещественым, — тоя, глаголю, сродником, ангелом святымь свѣтозарным же свѣтлым в горний миръ. Аще свѣтла, къ свѣтлым сочтаваеться абие, яко от вышних — горѣ, и радости исполняеться. Аще ли очернися и помрачися вся въ страстехъ пагубьных и нечистых паки, к темным и мрачным ангеламъ сочтаваеться, яко темна — темным и мрачным лицем, яко тѣх сдѣлавши хотѣния и дѣла. От дѣяньи своих душа въображаються и каяждо являеться, якова есть и колика убо: дѣла свѣта светлы и свѣтоносны, дѣла же тмы черны и мрачны творят. Душа бо, господыни моя, с тѣлом въспитана, къ видимым симъ и чювственым попущьшися, ничтоже бестелесно когда видѣвши спроста, дондеже привязана есть сей земнѣй плоти; внегда же совлечеться, видит невъзбранно.	Ты же, госпожа моя, нагой оставлена, будучи одинокой совершенно, не имея тела, которое тебя здесь содержало и сожителем имело, — а скорее, ты содержишь его, и образуешь, и имеешь — тотчас восходишь в свою область: если хорошо сохранила то, что у тебя по образу Божию, неоскверненным и чистым в настоящей жизни, то как умственная — к умственным, как и нематериальная — к нематериальным, к своим, имею в виду, родственникам, ангелам святым, светозарным и светлым, в вышний мир. Если душа светла, со светлыми сочетается тут же; будучи от вышних, восходит вверх и радости исполняется. Если же она погрязла и помрачилась вся в страстях пагубных и нечистых, то к темным и мрачным ангелам причисляется; будучи темной — к темным и лицами мрачным, так как их она выполняла желания и дела. От дел своих душа получает образ и каждая является такой, какова она есть: дела света делают светлыми и светоносными, дела же тьмы черными и мрачными. Душа ведь, госпожа моя, с телом воспитана, ко всему видимому и чувственному прилепившись, ничего бестелесного никогда не видит, пока привязана к этой земной плоти; когда же она совлечет ее, видит без помех.
Се тебѣ притча конець сдѣ въсприятъ. Аще ли не мнить ти ся подобнѣ реченая рещися, яже рѣхом притча нынѣ въ словѣ, испытай, что ни что есть притча, — ни всячьскы имат, притча позънавай, госпоже, равное въсприемлет, зане и не бывала притча, якоже рѣхом, но тождьство паче.	Вот тебе смысл этой притчи. Если же тебе кажется, что нами здесь сказанное выражено неподобающим образом, ибо я говорила притчей, поинтересуйся тем, что такое притча, и знай, госпожа, что притча не во всем в равной мере точна; иначе она и не была бы притчей, но скорее тождеством.
Душа: Да коего глаголеши человѣка, рабыне, рци ми, имущаго якоже мощно еже по образу Божию и по подобию Его, — сам бо реклъ еси — тѣло се тлѣнное или душю самую? Моусии человѣка рече по образу Божию еже изначала первозданнаго быти.[16] И како наречеться человѣкъ безъдушное тѣло? И пакы же словесное души како наречеться, не сущу телу человѣка отнудь? Рече бо нѣгдѣ Моисий в Бытии тако: «И созда Богъ человѣка персть от земля». Се тѣло человѣка нарече, о рабыне. «И тако дуну на лице его дыханье животно, — якоже пишет, — словесно и божествено, и бысть человѣкъ въ душу живу тогда».[17] Еже по образу, рабыне моя, в чом отдамы — и в плоти ли, служителнице, или въ души самой?	Душа: А что в человеке, рабыня, скажи мне, имеет, насколько это возможно, образ Божий и подобие его, ты говоришь? Что он имел в виду — тело это тленное или же душу? Моисей сказал, что человек первозданный был создан по образу Божию. А можно ли назвать человеком бездушное тело? И опять же, можно ли назвать так словесную силу души, если не будет тела у человека совершенно? Сказал ведь, кажется, Моисей в Книге Бытия так: «И создал Бог человека из праха земного». Это он о теле человеческом сказал, рабыня. «И затем вдунул в лицо ему дыхание жизни, — как он пишет, — словесное и божественное, и стал человек душою живою тогда». То, что по образу, рабыня моя, в чем оно находится — в плоти ли, служительница, или в самой душе?
Плоть: Слыши, господыне моя, сдѣ речение Павлово и разумѣеши искомое удобь от сего: «Елико внѣшний нашь человѣкъ растлѣваеть, толико внутрений обнавляеться вяще».[18] И два убо человѣка наречена съединена, внутреняго и внѣшняго, человѣкы именует, си рѣх душа и тѣло — обоих тако. Но убо воистину человѣкъ душа глаголеться. Не смотряй, господыне моя, внешняго человѣка, ниже сумнися отнуд о создании его, то бо покрывало есть и одѣвало тоя. Еже по образу же — душа, и по подобию его. Не мни же, господыне моя, человѣка глаголитися тѣло се тлѣнное и человѣка внѣшняго. Но егда убо Писание услышиши, глаголющее: «Створим человѣка по образу Своему»,[19] — и внутреняго разумѣвай человѣка, душевное существо, не явлено се, но скровеное, си невидимое и незримое естеством. Истиннѣе же яко внутрь паче есмы. По внутренему бо человѣку «азъ» паче есмь, внѣшняя же не «азъ», но «моя» разумѣвай. Не рука бо «азъ», прочее, или нога «азъ» паки, но «азъ» — словесное души в лѣпоту. Рука же убо, и нога, и прочая части человѣчьскаго тѣла суть уди. Тѣло бо ссуд есть васнь, и колесница, и соузъ души человечестѣй. Воистину же человѣкъ душа глаголеться. А помыслъ убо — властник страстемъ и владыка. По властному убо бывати ту вѣмы и паки в помысленѣм стяжаньи быти ради истиннѣйшая части быти ума ея и премудрости, яже Богъ дарова тому.	Плоть: Послушай, госпожа моя, здесь изречение Павлово и уразумеешь искомое из него: «Насколько внешний наш человек истлевает, настолько внутренний больше обновляется». Двух соединенных человек упоминая, он называет так, внутренним и внешним человеком, душу и тело, обоих. Но ведь по-настоящему-то человеком душа называется. Не смотри, душа моя, на внешнего человека и не обманывайся относительно его сути, ибо это лишь покрывало и одежда той. А что касается образа и подобия, относится к душе. Не думай, госпожа моя, что человеком называется это тленное тело, человек внешний. Но когда слышишь Писание, говорящее: «Сотворим человека по образу Своему», — то внутреннего подразумевай человека, душевное существо, которое не явленно, но сокровенно, и невидимо, и незримо по природе. Больше правды в том, что мы преимущественно внутренней жизнью живем. Ибо ко внутреннему человеку более «я» относится, под внешним же — не «я», но «мое» подразумевай. Не рука ведь «я», стало быть, и не нога «я», опять же, но «я» — это, конечно же, разумность души. Рука же, и нога, и прочие части человеческого тела суть члены. В соответствии с этим тело есть орудие, колесница и союзник души человеческой. Воистину же человеком душа называется. А разум — господин страстей и владыка. Мы знаем, что она должна быть покорной владыке и пребывать в стяжании смысла, при помощи истиннейшей части ума ее и посредством мудрости, которую Бог тому даровал.
Подражаваеть бо нѣкако умъ человѣчьскы Бога, во мъгновеньи бо обтичет вся, и сообращаеться, — и вечерняя, вкупѣ и всточная, паки и ужная, и сѣверная, и яже под землею, и небесная же убо и невходимая она, — не сущьством своим, не непщюй се отнудь, — мечтаньем же единѣм помысленым, госпоже. Единъ бо Богъ существом и естеством, сице и премудростью Своею, и силою же паки, имат неописаное выше всякого естества. Еже по образу, владычице, обладателно знаменуеть. Якоже никтоже вышши на небеси есть Бога, всех Творца — видимых и невидимых, сице никтоже на земли вышши от человѣкъ есть. Но якоже имат Богъ всѣх владычьство, сице далъ есть и тебѣ бесловесных и животных, всѣми убо владем вкупѣ, скоты же и звѣрми, и всѣми господьствуем — птицами, и гады, и рыбами, всѣми и животными, ихже положилъ есть Богъ в сем мирѣ. Сим есмы, якоже показася, по образу Божию.	Походит ведь некоторым образом ум человеческий на Бога, ибо во мгновение обходит он все и охватывает — и запад, и восток, и юг, и север, и то, что под землей, и что на небесах, и то, куда нет входа, — но не существом своим — вовсе этого не подумай, — а представлением только мысленным, госпожа. Одному ведь Богу с его существом и естеством, а также премудростью и силой свойственна неописуемость, превышающая всякую природу. То, что по образу, владычица, обозначает властвующее. Как никого нет на небесах выше Бога, Творца всех, видимых и невидимых, так никого на земле нет выше человека. И как Бог владычествует всем, так и тебе подчинил бессловесных животных, чтобы мы вкупе всеми владели и над всеми скотами и зверями господствовали — над птицами также, и змеями, и рыбами, и всем живым, что поместил Бог в этот мир. Вот что у нас, как показано, по образу Божию.
А еже по подобию — мы исправляемъ от хотѣния нашего и произволенья же, на подобительное взводимся тому. Подобны быти тому далъ есть власть нам, вложивъ, прочее остави повелѣнию нас дѣлателя быти свѣтом и хотѣнием — еже к нему, госпоже моя, подобна глаголю — и яко да конець, прочее, будеть нашему труду, дѣланья мзда. Вонми, душе, и разумѣй, яко да всяко будет исправление твое, а не чюжо то, тебѣ остави се, еже по подобию быти, яко же рече: «Будите свершени, якоже свершенъ есть наш небесный Отець»[20] же и Владыка, яко солнце свое сияеть на вся, злыя же и благыя, и дождить паки сице. Аще же и ты, госпоже моя, злобоненавистна будешь, и непамятозлобна, и кротка, братолюбива и милостива, Богу поподобишися тѣм. Еже по образу убо Богъ дарова тебе — еже имѣти словесное, и обладателное тако же, и самовластное же в себѣ, господыне. Бываеши и по подобию — благостию, аще хощеши. Аще бо и по подобию тя бы Богъ створилъ, где ть благодать, страстна? Чесого ради венчалася бы? Царство небесное како отверзло ти ся бы? Добро есть душе спастися от подвигъ и от трудовъ, яко долж ы въздание, а не дар ы благодать, еже есть неразумѣва и лениваго раба.	А то, что по подобию, — то мы осуществляем в зависимости от желания нашего и произволения, путем уподобления возводясь к нему. Дал он нам, вложив, возможность уподобиться ему. И оставил нашему произволению, быть ли нам по своей воле и желанию создателями его, госпожа моя, подобия, чтобы это и было венцом нашего труда, платой за работу. Внимай, душа, и разумей: чтобы именно твоим был успех, а не чужим, тебе предоставил он это, быть по его подобию, о чем и сказал: «Будьте совершенны, как совершенен Отец ваш небесный» и Владыка, ибо солнце его сияет на всех, на злых и на добрых, и мочит дождь тоже так же. И если ты, госпожа моя, ненавистницей зла будешь, незлопамятной, кроткой, братолюбивой и милостивой, то Богу уподобишься. То, что по образу Бог даровал тебе, — иметь разум и власть, а также свободу своей воли, госпожа. Бываешь и подобной — благостью, если захочешь. Ведь если бы по подобию тебя Бог сотворил, на что тебе благодать, о страстная? За что венчалась бы? Царство небесное как открылось бы тебе? Прекрасно для души спастись за подвиги и труды, получив спасение как долг и награду, а не как подарок и милостыню, подобно неразумному и ленивому рабу.
Душа: Добрѣ и сия рекла еси и ктому не сумнюся. Обаче и еще ми сие скажи, о рабыне: тѣло праотца Адама, рци ми, како создано бысть убо — тлѣнно ли, или нетлѣнно, мертвено или не тако?	Душа: Хорошо и это ты сказала, и больше я не сомневаюсь. Однако вот что еще скажи мне, рабыня: тело праотца Адама, объясни мне, каким было создано — тленным или нетленным, смертным или же нет?
