И во едину отъ нощей, побудивъ служителя, самъ шедъ, сѣде на празе церковнѣмъ. Служителю же коснящу, отець же, ото многаго труда мало въздремавъ, и зритъ во снѣ: и се врата манастыря отверзошася, и множество людей со свѣщами грядутъ къ церкви, и посреди ихъ князь Георгие Васильевичь. И, пришедъ, поклоны сотвори церкви, и поклонися отцу до земля, и отець подобно ему. И въпроси его отець, глаголя, яко: “Ты уже, государь, преставися”. Онъ же тако рече: “Отче...”. “Да каково тебѣ нонече?” Онъ же рече: “Твоими молитвами далъ ми Богъ добро, отче, понеже сего ради, яко, егда шествуя противу агарянъ безбожныхъ подъ Олексинъ,[79] у тебѣ чисто покаяхся”. И, егда начя звонити служитель церковный, отець же възбнувъ, и удивися необычному зрѣнию, и прослави Бога.	И в одну из ночей, разбудив служителя, сам пошел и сел на пороге церкви. Служитель медлил, а отец, устав от многого труда, задремал и видит во сне: ворота монастыря открылись, и множество людей со свечами идет к церкви, и среди них князь Георгий Васильевич. И, подойдя, поклонился церкви и отцу до земли, и Пафнутий сделал так же, как он. И вопросил его отец, говоря так: “Ты уже, государь, умер?” Он же сказал: “Отче...” “Каково тебе нынче?” Князь же ответил: “Твоими молитвами Бог дал мне добро, отец, так как когда я шел против безбожных кочевников под Алексин, принес тебе чистое покаяние”. И когда начал звонить церковный служитель, отец проснулся и удивился необычному видению, и прославил Бога.
Бѣ же той князь много время душею ко отцу приходяше и безъженно и чисто житие живый. И глаголаше той же князь: “Коли пойду на исповедь ко отцу Пафнутию, и ноги у мене подгибаютца”. Толико бѣ добродѣтеленъ и богобоязнивъ».	Тот князь долгое время приходил к Пафнутию как к духовному отцу и жил в чистоте, не зная женщины. И говорил тот князь: “Как пойду на исповедь к отцу Пафнутию, и ноги у меня подгибаются”. Таким был добродетельным и богобоязненным».
О татехъ	О ворах
Повѣдаша намъ и се: «Имяше убо отець нашь супругъ воловъ, на них же самъ и братъ монастырьскую работу творяху, и въ лѣтнее время пометаху ихъ внѣ обители, въ чястинѣ лѣса. Во время же нощи татие, пришедше, оброташа ихъ и восхотѣша отвести и лишити отца отъ любезныя ихъ работы. И пребыша всю нощь, блудяще по чястине лѣса, дондеже заря осия. И видѣвше ихъ манастырьстии работници, и къ старцу приведоша. Онъ же, наказавъ ихъ, ктому не восхищати чюжа ничтоже, и повелѣ имъ дати пищу, и отпусти ихъ».	Поведали нам и это: «Имел наш отец пару волов, на которых вместе с братом выполнял монастырскую работу, и в летнее время оставил их вне обители, в чаще леса. Ночью пришли воры, обротали их и хотели увести, лишив отца Пафнутия любимой им работы. И всю ночь блуждали они в чаще леса, пока не рассвело. И увидели их монастырские работники, и привели к старцу. Он же, наказав им никогда не брать ничего чужого, повелел их накормить и отпустить».
Повѣдаша намъ ти же ученици отца Пафнутия, яко нѣкий старець старъ (имя тому старцу Еуфимие), духовенъ же зело и даръ слезамъ многъ имый, яко не точию въ келии, но и въ церкви на всякомъ правиле выну слезы теплы безъ щука испущаше. Хотя же Богъ показати отцу и инѣмъ прочимъ, яко не суетни того бяху слезьг, но по Бозе.	Поведали нам те же ученики отца Пафнутия,, что некий старый инок (имя его Евфимий), очень духовный человек, имел такой великий слезный дар, что не только в келий, но и в церкви на всякой службе безмолвно испускал теплые слезы. И захотел Бог показать отцу Пафнутию и другим монахам, что не суетные то были слезы, но обращенные к Богу.
Два брата нѣкая любовь имуще между собою, отець же о семъ негодоваше, они же сего ради тай мышляху отити отъ обители. И во время божественыя литургия преже реченный старець Еуфимие обычное ему дѣло творяше: въ мнозе умилении слезы теплы испущаше — и възрѣвъ на отца и на поющихъ съ нимъ. Бяху же съ нимъ въ лице и она два брата. Старець же Еуфимие зритъ и изъ-за нихъ выникнувша нѣкоего мурина, имуща на главѣ клобокъ остръ зело, самъ же клокатъ, отъ различныхъ цвѣтовъ клочье имый; и въ рукахъ крюкъ желѣзенъ имый, имже начятъ преже реченная два брата привлачити къ собѣ за ризы ихъ. И, внегда привлекъ, хотяше хватити рукама, и абие желѣзное то орудие безсилно бываше и отскакаше.	Некие два брата имели любовь между собою, отец же Пафнутий был недоволен этим, поэтому они задумали тайно уйти из монастыря. И во время божественной литургии старец Евфимий, о котором говорилось выше, творил обычное для него дело: в сильном умилении испускал теплые слезы — и посмотрел на Пафнутия и на поющих с ним. Были с ним на клиросе и оба те брата. Старец Евфимий видит: из-за них высунулся некий мурин, на голове которого был очень острый колпак, а сам он был клокат, и клочья были разного цвета; и в руках он держал железный крюк, каким тех братьев стал за ризы притягивать к себе. И, когда привлекал и хотел схватить руками, внезапно железное то орудие лишалось силы и отлетало в сторону.
И отъ сего разумѣти есть, яко: егда врагъ всѣвааше имъ помыслъ еже не покоритися старцу и изыти отъ обители, они же приимаху его и согласоваху ему, сего ради и тъй удобно привлачаше ихъ; егда же супротивляхуся помыслу и отлагаху его, тогда и желѣзное то орудие безсилно бываше и отскакаше отъ нихъ.	И это надо понимать так: когда враг внушал им мысль не покоряться старцу и уйти из монастыря и они принимали помысл и действовали согласно ему, бесу было легко притягивать их; когда же сопротивлялись помыслу и отвергали его, тогда железное то орудие лишалось силы и отлетало в сторону от них.
Егда же начяша чести святое Евангелие, тогда муринъ той безъ вести бысть, и по скончянии же Евангелие паки явися, по первому образу творяше; и во время Херувимския пѣсни паки исчезе, по скончянии же тоя явися, по тому же творяше. Егда же възгласи ерѣй «Изрядно пречистей владычице нашей Богородици», страшный той муринъ, яко дымъ, исчезе и ктому не явися.	Когда же начали читать святое Евангелие, тогда тот мурин исчез, а по окончании Евангелия снова явился и стал совершать прежние дела; и во время Херувимской песни опять исчез, а по окончании той явился и стал делать так же, как прежде. Когда же возгласил иерей «Изрядно пречистой владычице нашей Богородице», тот страшный мурин, как дым, исчез и больше не являлся.
Старець же онъ, видѣвъ сиа, зело въ трепете бысть и яко во иступлении прейде все время службы. По скончании же литургиа, пришедъ, исповѣда отцу. Блаженный же, призвавъ реченныя иноки, поучивъ ихъ еже не приимати отъ врага всѣемая помыслы и не таити ихъ, но исповѣданиемь истерзати.	Тот старец, видевши это, был в сильном волнении и в великом смятении пребывал все время службы. По окончании литургии, прийдя, поведал виденное отцу Пафнутию. Блаженный же, призвав названных монахов, наставил их не принимать внушаемые врагом мысли и не скрывать их, а искоренять покаянием.
Повѣдаша намъ ученици отца Пафнутия, блаженый Иосифъ. «Нѣкогда, — рече, — посланъ быхъ отцемъ въ градъ Воротынескъ, ко князю,[80] сущему тамо, нѣкоихъ ради потребъ и обрѣтохъ его въ скорби велицей: занеже имѣ нѣкоего человѣка, зело любима ему, добродѣтелна и боголюбива, еже повсегда совѣтоваше ему полезная, именемъ Матфия, по отчю имени Варнавинъ; сынъ же князя того ненавидяше его, яко отцу его не по его воли совѣтоваше, и сего ради повелѣ убити его нѣкоему человѣку отъ служащихъ ему; отцу его не вѣдущу.	Поведали нам ученики отца Пафнутия, блаженный Иосиф. «Некогда, — рассказывал Иосиф, — был я послан отцом в город Воротынск к бывшему там князю ради некоторых нужд и нашел его в великой скорби: у князя был некий человек, очень любимый им, добродетельный и боголюбивый, который всегда давал ему полезные советы, по имени Матвей, по отчеству Варнавин; сын же князя ненавидел его, так как тот давал отцу советы не такие, как он хотел, и поэтому приказал одному из своих слуг убить его; князь же об этом ничего не знал.
Убиену же ему бывшу, въсхотѣ всесилный Богь мстити кровь праведнаго, възопившую къ нему от земля, якоже Авелева древле.[81] И сего ради сынъ князя того, повелѣвый его убити, помале напрасною смертию умре; такоже и убивый праведнаго повелѣниемъ его злою смертью и напрасною умре. Мати же того убици восхотѣ сотворити въ третий день, якоже обычай есть, приношение приносити о немъ. Священникъ же облекса въ санъ, посла взяти у творящаго просфиры, хотя проскомисати, еже принести приношение о убици. Творяй же просфиры откры пещь, хотя изяти ихъ и послати къ священнику, — обрѣте пещь, полну крови. Священникъ же и вси обрѣтшиися со страхомъ многимъ прославиша Бога, отомъстивъшаго кровь праведнаго, безъ правды излиянную, и отъ сего разумѣша, каково осужение приаша убившии праведнаго, яко всякаа помощи лишени быша».	Когда убили Матвея, захотел всесильный Бог отомстить за кровь праведного, возопившую к нему от земли, как в древности Авелева. И поэтому сын князя, приказавший убить Матвея, вскоре внезапно умер; также и убивший праведного по его приказу умер злой и неожиданной смертью. Мать того убийцы захотела на третий день по обычаю принести дары в память о нем. Священник же облачился в одежды, послал за просфорами, желая начать проскомидию, чтобы принести дары об убийце. Пекущий просфоры открыл печь, чтобы взять их и отправить к священнику, — и увидел печь, полную крови. Священник же и все бывшие с ним в великом страхе прославили Бога, отомстившего за кровь праведного, несправедливо пролитую, и поняли, какое наказание приняли убийцы праведного, ибо были лишены они всякой помощи».
Той же отець Иосифъ повѣда намъ. «Слышаахъ, —рече, — у отца Пафнутия, яко блаженый Петръ Чюдотворець, преосвященный митрополитъ всея Руси, въ соборной церкви пречистыя Богородица честнаго ея Успениа, еже самъ созда, нача молитися о нѣкоихъ дѣлехъ земскихъ. И пришедъ къ нему инокъ, келейникъ его, прозваниемъ Цѣлада, и глагола ему: „Ты молишися и хощеши услышанъ быти, а въ казнѣ у тебе три рубли". Онъ же въ той часъ повелѣ ему раздати нищимъ и абие получи прошение, о немже моляшеся». Вижь ми, каково нестяжание имяше блаженый сей, и сего ради нареченъ бысть «новый чюдотворець».	Тот же отец Иосиф поведал нам. «Слышал, — говорил, — от отца Пафнутия, как блаженный Петр Чудотворец, преосвященный митрополит всея Руси, в соборной церкви Успения пречистой Богородицы, которую сам создал, начал молиться о некоторых государственных делах. И пришел к нему монах, его келейник, по прозванию Целада, и сказал ему: “Ты молишься и хочешь быть услышан, а в казне у тебя три рубля”. Петр тотчас повелел ему раздать деньги нищим и сразу же получил то, о чем просил в молитве». Смотри, какое нестяжание имел этот блаженный, вот почему он был назван новым чудотворцем.
Той же отець Иосифъ повѣда намъ. «Нѣкий, — рече, — разбойникъ, именемъ Ияковъ, прозваниемъ Черепина, лютъ зѣло, и, помянувъ своя злая, прииде къ старцу Пафнутию, и облечеся во иноческый образъ. И помале, отложивъ образъ, начатъ паки разбивати. И нѣкогда стоящу отцу Пафнутию во вратѣхъ манастыря, Ияковъ же грядый на конѣ мимо манастырь, отець же глагола ему: “Горе тебѣ, страстниче, сугубо зло сотворилъ еси: отвергъ иноческый образъ и на первое зло возвратися, яко песъ на своя блевотины!” Онъ же извлекъ саблю и восхотѣ пресѣщи его, и ударивъ ею по верѣе, за нюже отець ускоривъ скрытися.	Тот же отец Иосиф поведал нам. «Некий, — говорил, — разбойник, именем Яков, прозванием Черепина, был очень жесток, и, вспомнив все совершенное им зло, пришел к старцу Пафнутию, и постригся в монахи. Но вскоре, отказавшись от монашества, стал снова разбойничать. И однажды, когда отец Пафнутий стоял в монастырских воротах, а Яков ехал мимо на коне, отец-игумен сказал ему: “Горе тебе, побежденный страстями человек, двойное зло сотворил ты: отверг монашество и возвратился к первоначальным злым делам, как пес на свои блевотины!” Разбойник достал саблю и хотел убить Пафнутия, но удар пришелся по верее, за которую отец успел скрыться.
Потомъ же въспомянувъ своя злая, и усрамився възъвратитися ко отцу Пафнутию, и поиде ко отцу Варъсунофию, въ Савиной пустыни живущу во отходе,[82] и у него сконча животъ свой въ покоянии, слезахъ. Слышавъ отець Пафнутие, рече: “Сего ради дарова ему Богъ таковый конець, занеже не предавывалъ ни единого человѣка на смерть, но и дружене своей възбраняше, и хотящихъ убиеннымъ быти, отъемъ, пускаше”».	Потом, вспомнив свои злые дела и постыдившись вернуться к отцу Пафнутию, пошел он к отцу Варсонофию, который жил в пустыне за пределами Саввина монастыря, и там окончил жизнь свою в покаянии и слезах. Услышав об этом, Пафнутий сказал: “Того ради даровал ему Бог такой конец, что ни одного человека не предал он смерти, и дружине своей запрещал, и тех, кого хотели убить, взяв, отпускал”».
Повѣдаше нѣкий инокъ. «Нашедшимъ, — рече, — нѣкогда агареномъ, по Божию попущению, грѣхъ ради нашихъ, и много зело поплениша христианъ. Единъ же отъ варваръ взятъ инока и дѣвицу: инока же, связавъ, поверже, а дъвицу веде въ кущу свою и мало отшедъ. Дѣвица же глагола иноку: “Господине отче, разумѣхъ, что хощетъ мнѣ сотворити безаконникъ сей; и аще ударю его ножемъ, нѣсть ли мнѣ грѣха?” Онъ же рече: “Богъ благословитъ тя, тщи: сего ради онъ, разъярився, убиетъ тя, и будеши съ мученики”. И пришедъ онъ, и восхотѣ коснутися ея, она же удари его ножемъ въ руку. Онъ же, разъярився, вземъ мечь, изсѣче ея, и бысть мученица Христова.	Поведал некий монах: «Во время нашествия кочевников, по Божьему попущению, ради грехов наших, многие христиане попали в плен. Один из язычников взял в плен монаха и девицу: монаха, связав, он бросил на землю, а девицу отвел в жилище свое и ненадолго ушел. Девица сказала монаху: “Отец мой и господин, я знаю, что хочет со мной сотворить этот беззаконный; если ударю его ножом, не будет ли на мне греха?” Он же ответил: “Бог благословит тебя, дочь моя: язычник, придя в ярость от этого, убьет тебя, и ты будешь с мучениками”. И пришел враг, и хотел коснуться ее, она же ударила его ножом в руку. Он, разгневавшись, взял меч и иссек ее, и стала она мученицей Христовой.
