МАЛАЯ ЧЕЛОБИТНАЯ	МАЛАЯ ЧЕЛОБИТНАЯ
Ино тако говорит Петръ, волоский воевода: «Что ихъ много, коли у нихъ сердца доброго нѣту и смерти боятся, не хотят умрети. Всегда богатые о войне не мыслят, а мыслят о упокое. Хотя и богатырь обогатѣет, и онъ обленивеетъ».	И так еще говорит Петр, молдавский воевода: «Что из того, что их много, раз нет у них верного сердца, а смерти боятся и умирать не хотят. Богач никогда не мечтает о войне, а о покое мечтает. Пусть хоть богатырь разбогатеет, и тот обленится».
Тако говорит Петръ, волоский воевода: «Воинника держати, как сокола чредити:[34] и всегда сердца имъ веселити, а ни в чем на него кручины не напускати».	Так говорит Петр, молдавский воевода: «Воина содержать, что сокола кормить: всегда ему сердце веселить, никакой печали к нему не подпускать».
Ино тако говорит Петръ, волоский воевода: «Таковому силному государю годится со всего царьства своего доходы себѣ в казну имати, и из казны своея воинником серца веселити, ино казнѣ ево конца не будет. Который воинникъ лют будет против недруга государева смертною игрою играти и крѣпко будет за вѣру християнскую стояти, ино таковым воинником имяна возвышати и серца имъ веселити, и жалованья имъ из казны своея государевы прибавливати, и иным воинником серца возвращати, и к себѣ ихъ блиско припущати, и во всем имъ вѣрити и жаловати ихъ, послушати во всем и любити ихъ, аки отцу детей своих, и быти до них щедру. Щедрая рука николиже не оскудевает и славу царю собирает. Что государю щедрость к воинником, то его и мудрость».	И так еще говорит Петр, молдавский воевода: «Нужно, чтобы столь могущественный государь со всего царства доходы брал себе в казну и из казны своей воинам сердце веселил, тогда казне его конца не будет. Кто из воинов отважно будет вести смертную игру с врагом государевым и крепко стоять за веру христианскую, то таковому воину и честь воздавать, и сердце веселить, и жалованье прибавлять из государевой казны, и к таким воинам — сердце обращать, к себе их приближать, верить им во всем, просьбы их выслушивать обо всем, любить, как отец детей своих, и быть к ним щедрым. Щедрая рука вовек не оскудевает, а славу царю созидает. Какова щедрость государя к воинам, такова и мудрость его».
А про тебя, про государя, про великого царя благовѣрного говорит Петръ, волоский воевода: «Таковому государю годится держати дватцать тысячь юнаков храбрых со огненною стрельбою[35] гораздо ученою и стрельбы поляницъ со украины[36] на поле при крепостехъ от недруга, от крымского царя, и оброчивши их из казны своим жалованьемъ государевым годовым. И онѣ навыкнут в поле жити и от недруга, от крымского царя, воевати. Ино та ему дватцать тысечь лутчи будет ста тысящ, а украины его будут всѣмъ богаты и не оскужены от недругов. А мочно ему таковому сильному царю то все учинити».	А о тебе, государь, о великом благоверном царе, говорит Петр, молдавский воевода: «Нужно, чтобы такой государь держал против врага, крымского хана, двадцать тысяч храбрых витязей с огнестрельным, хорошо подготовленным оружием и огневые заставы на границах степи и обеспечивал их ежегодно из казны государевым жалованьем. И приспособятся они в степи жить и защищать его от врага, крымского хана. И эти двадцать тысяч будут тогда для него лучше, чем сто тысяч. И приграничные области все богаты будут и не в разоренье от врага. Есть у него, у столь сильного царя, возможность все это устроить».
Тако говоритъ Петръ волоский воевода, про греческое царьство: «Велможи греческия при царе Констянтине Ивановиче царьством обладали[37] и крестное целование ни во чтоже ставили, и изменяли, и царьство измытарили своими неправедными суды, от слез и от крови християнския богатѣли и богатство свое наполнили нечистым собранием. А сами обленивели, за вѣру християнскую крѣпко не стояли и царя укротили от воинства своими вражбами, и прелестными путми, и ерестными чародѣйствы. И тѣмъ царьство греческое, и вѣру християнскую, и красоту церковную выдали иноплемянником турскимъ на поругание. А нынѣ сами греки за свою гордость и за беззаконие, и за ленивство свое вѣру християнскую у царя у турсково откупают: и великие оброки даютъ царю турскому, а сами в неволе у царя у турсково за свою гордость и за ленивство живут. Греки и сербы наймуются овецъ пасти и верблюдов у турского царя, и лутчие греки, и они торгуютъ».	Так говорит Петр, молдавский воевода, о греческом царстве: «При царе Константине Ивановиче управляли царством греческие вельможи и крестное целованье ставили ни во что, совершали измены, несправедливыми судами своими обобрали они царство, богатели на слезах и крови христиан, пополняли богатство свое бесчестным стяжаньем. Сами они обленились и не стояли крепко за веру христианскую и в царе укротили воинственность ворожбой, путями соблазна, еретическим чародейством. Таким образом отдали они иноплеменникам-туркам на поругание и греческое царство, и веру христианскую, и красоту церковную. А теперь сами же греки за гордость свою, за беззаконие, за свою лень откупают у турецкого царя веру христианскую: большой оброк платят они турецкому царю, а сами — за гордыню свою и за лень — в неволе живут у турецкого царя. Нанимаются греки и сербы пасти овец и верблюдов у турецкого царя, а знатные греки, так те торгуют».
Говорит Петръ, волоский воевода, с великими слезами про ту вѣру християнскую руского царьства. И просят у Бога всѣ, государь, во умножение вѣры християнския от восточнаго царьства, от рускаго царя благовѣрнаго и великого князя Ивана Васильевича всеа Русии. Тѣмъ царьством руским ныне и хвалится вся греческая вѣра, и надѣются от Бога великого милосердия и помощи Божии свободити руским царемъ от насильства турскаго царя-иноплемянника.[38]	С великим чувством говорит Петр, молдавский воевода, о вере христианской царства русского. И все просят Бога, государь, чтобы царство восточное и русский царь — благоверный и великий князь всея Руси Иван Васильевич — укрепили христианскую веру. Вся греческая вера гордится теперь этим русским царством, ожидая от Бога великого милосердия и помощи Божьей, чтобы освободиться с помощью русского царя от насилий турецкого царя-иноплеменника.
И говорит Петръ, волоский воевода: «Таковое силное, и славное, и всѣмъ богатое то царьство Московское! Есть ли в том царьстве правда?» Ино у него служит москвитинъ Васка Мерцалов, и он того спрашивал: «Ты гораздо знаешь про то царьство Московское, скажи ми подлинно!» И он стал сказывати Петру, волоскому воеводе: «Вѣра, государь, християнская добра, всѣмъ сполна и красота церковная велика, а правды нѣту».[39] Ктому Петръ волоский воевода заплакал и рекъ тако: «Коли правды нѣтъ, ино то и всего нѣту».	И говорит Петр, молдавский воевода: «Сильно и прославленно и всем богато это царство Московское! А есть ли в этом царстве правда?» А служит у него москвитянин Васька Мерцалов, и он спросил того: «Все ты знаешь о царстве том Московском, скажи мне истинно!» И стал тот говорить Петру, молдавскому воеводе: «Вера, государь, христианская добра, во всем совершенна, и красота церковная велика, а правды нет». Тогда Петр, молдавский воевода, заплакал и так сказал: «Коли правды нет, так ничего нет».
Тако говорит Петръ, волоский воевода: «Истинная правда Христос есть, сияет на всѣ небесныя высоты и на земныя ширины, на преисподния глубины многочисленно светлѣе солнца. Всѣ ему колѣна поклонилися небесныя и земныя, и преисподния, и всѣ его святое имя восхвалили и прославили, яко святъ Господь Богъ нашь, силен и крѣпок, и безсмертенъ, и велик Богъ християнский, и чюдна дѣла его, долготерпелив и многомилостивъ. И в котором царьстве правда, в том царстве и Богь пребывает и гнѣвъ Божий не воздвизается на то царьство. Нѣтъ сильнее правды в божественном Писании. Правда Богу сердечная радость, а царю великая мудрость и сила. Помилуй, Господь, вѣры християнския тоя от неправды. Тако боролся диявол всѣми неправдами з грѣки, не любячи вѣры християнския, для тово что вѣра християнская Богу люба; всѣхъ вѣръ лутчи, Богь ее любит, и диявол изборол всякою неправдою. Ино нынѣ на то надѣются, что пишут мудрыя философи и дохтуры о благовѣрном царѣ и великом князе Иване Васильевиче всеа Русии, что он будет мудръ и введет правду во свое царство».	И так еще говорит Петр, молдавский воевода: «Христос есть истинная правда, ярче солнца освещает он всю небесную высоту и земную ширину и бессчетные глубины преисподние. Поклонились ему все племена небесные, земные и преисподние, все восхвалили и восславили имя его святое, ибо свят Господь наш Бог, силен и крепок, и бессмертен, велик христианский Бог, и чудесны дела его, долготерпелив и многомилостив. В каком царстве правда, там и Бог пребывает, и не поднимается Божий гнев на это царство. Ничего нет сильнее правды в божественном Писании. Богу правда — сердечная радость, а царю — великая мудрость и сила. Помилуй, Господи, веру эту христианскую от их неправды. Так всею неправдою боролся с греками дьявол, ненавидя христианскую веру, потому что вера христианская Богу любезна: больше других вер любит ее Бог, а дьявол одолел всякой неправдой. Теперь только на то я надеюсь, что пишут мудрые философы и докторы о благоверном царе и великом князе всея Руси Иване Васильевиче, что будет он мудр и введет правду в свое царство».
И тако говорит Петръ, волоский воевода, и просит у Бога милости, моляся: «Боже, дай милосердие свое великое, чтобы та его мудрость не обинулася благовѣрнаго и великого царя, и толко бы по нашимъ грѣхом да не то царство руское осталося, и просияло вѣрою християнскою волное царство, и нам было нѣчим говорити греческой вѣре, яко жидом и ормяном нѣчим говорити, что нѣтъ у них волнаго царя и царства волнаго. А мы тѣмъ царством християнским руским греческой вѣре хвалимся». И тако говорит Петръ, волоский воевода: «Поблюди его, Господи, многолѣтно и на умножение вѣры християнской».	И так еще говорит Петр, молдавский воевода, и просит милости у Бога с молитвой: «Боже, дай милосердие свое великое, чтобы эта мудрость не покинула великого благоверного царя, и только бы, вопреки грехам нашим, устояло русское царство и просветилось верой христианской независимое царство, а нам не приходилось бы говорить греческой вере, как иудеям или армянам приходится говорить, что нет у них независимого царя и независимого царства. Мы же царством этим русским и христианским перед греческою верою гордимся». И так говорит Петр, молдавский воевода: «Сохрани его, Господи, на многие лета и на укрепление веры христианской».
Да о том добрѣ дивится Петръ, волоский воевода, и говорит так: «Великий государь, силный царь благовѣрный такия великия досады терпитъ от своего недруга от казанскаго царя.[40] Тот ему пущей недруг, казанской царь, не надобет ему тако много терпѣти. Так был Магмет-царь, салтан турской, к Царюграду дань давал, з благовѣрным царемъ жил в велии смирении и безбранно,[41] а отецъ его был разбойник на море и турскую землю осилел и засѣлъ,[42] и потом грѣх ради наших Магмет-салтан, турской царь, разбойнический род, асилел, Царьград взял и благовѣрнаго царя Констянтина потребил, и красоту церьковную обезчестил, и звон церковный поотнимал, и кресты с церквей поснимал, и образы чудотворные из церквей нечестно выносил, и в церквах мизгити подѣлал на свои скверныя молитвы».	И вот чему сильно удивляется Петр, молдавский воевода, и так говорит: «Великий государь, сильный и благоверный царь, столь большие терпит обиды от врага своего, царя казанского. Это ему самый злой враг, царь казанский, не надо ему столько терпеть. Так и царь Магомет, турецкий султан, платил дань Царьграду, с благоверным царем жил в полном мире без войн, но отец его был морской разбойник и землю Турецкую одолел и захватил, а после за грехи наши султан Магомет, царь турецкий, разбойничьего рода, накопил силы и занял Царьград, благоверного царя Константина погубил и красоту церквей обесчестил: истребил церковный звон, снял кресты с церквей, и с позором вынес он из церквей чудотворные иконы, а в церквах устроил мечети для своих скверных молитв».
