МАЛАЯ ЧЕЛОБИТНАЯ	МАЛАЯ ЧЕЛОБИТНАЯ
И Петръ, волоский воевода, говорит и Бога молит: «Боже, поблюди и буди милостивъ над руским царем благовѣрным и великом княземъ Иваном Васильевичем всеа Русии, и над царством его, да не уловили бы его тако же велможи его вражбою от ереси своей и лукавъством своим, да не укротили бы его от воинства, бояйся смерти, чтобы имъ, богатым, не умирати. Якоже благовѣрнаго царя Констянтина Ивановича Царяграда велможи укротили от воинства вражбою ереси своея и ленивства ради лукавством своимъ, и онѣ царство вѣрное потеряли, царя благовѣрнаго потребили иноплемянническим мечем. Давно то не хвалят мудрыя философи, что которые велможеством к царю приближаются не от воинския выслуги и не от иныя которыя мудрости, ино про тѣ мудрыя философи говорят тако: «То есть чародѣи и еретики, у царя счастие отнимают и мудрость царьскую, и к себѣ царьское сердце зажигают ересью и чародѣйствомъ, и воинство кротят». И то говорит Петръ, волоский воевода: «Таковыхъ годится огнем жещи и иные лютые имъ смерти предавати, чтобы лиха не множилося. Без лица имъ вина, что воинство у царя кротят и мысль царьскую отнимают. А царю без воинства не мочно быти: ангели Божии, небесныя силы, и тѣ ни на един час пламенного оружия из рукъ своих не выпущают, стрегут рода християнского от Адама и до сего часа, да и тѣ службою своею не скучают. А царю как без воинъства быти? Воинником царь силенъ и славен. Царю быти благодатию Божиею и мудростию великою на царьстве своем, а до воинников быти аки отцу до детей своих щедру. Что царьская щедрость до воинников, то его и мудрость. Щедрая рука николиже не оскужает и славу себѣ великую збирает».	Так говорит Петр, молдавский воевода, и молит Бога: «Боже, сохрани и милостив будь к благоверному русскому царю великому князю всея Руси Ивану Васильевичу и к царству его, чтобы не уловили и его также вельможи еретической своей ворожбой и своим коварством, чтобы не укротили его воинственный дух, боясь смерти, чтобы им, богачам, не погибать. Вот ведь благоверного царя царьградского Константина Ивановича укротили вельможи воинственный дух еретической своей ворожбой и коварством от лени, так что потеряли они православное царство и царя благоверного сгубили мечом иноплеменника. Издавна не одобряют того мудрые философы, что иные становятся вельможами при царе не по своим военным заслугам, не по другим каким дарованьям, так что про таких так говорят мудрые философы: «Это чародеи и еретики, удачу отнимают у царя и царскую мудрость, ересью и чародейством распаляют на свою пользу царское сердце, а воинский дух укрощают». И еще говорит Петр, молдавский воевода: «Таких надо в огне сжигать и другим лютым смертям предавать, чтобы не умножились беды. Без меры и вина, что воинский дух царя укрощают и замыслы царские пресекают. А царю нельзя быть без воинского духа: ангелы Божьи, небесные силы, и те ни на один миг не выпускают из рук своих пламенное оружие, от Адама и доныне охраняют род христианский, — и те службой своей не томятся. А царю как без воинского духа быть? Воином силен и славен царь. Царь на престоле своем — благодать Божья и мудрость великая, а к воинам своим щедр, как отец к детям. Какова щедрость царя к воинам, такова и мудрость его. Щедрая рука никогда не оскудевает, а славу себе великую приобретает».
Да то говорит Петръ, волоский воевода: «У благовѣрного царя Констянтина во Царѣграде воинники оскужали и нищили, а мытари богатѣли. А иные воинники, видячи тот непризор благовѣрного царя к воинству, и онѣ оставивши воинство да на мытарствах прелщалися, и царьство Констянтиново оскужали и казну цареву. А сами мытари богатѣли: пошлют его гдѣ собрати царьския казны, ино на царя гдѣ взяти десять рублев, и онѣ на царя десять рублев возмутъ, а на себя по сту рублевъ. А хто их посылают, велможи царьския, и тѣ с ними, мытари, делилися, а царьство благовѣрного царя Констянтина оскужали и казну цареву, а сами богатѣли от крови от слез рода християнского. А велможи друг о друге печаловалися царю Констянтину о кормлениях, и о градѣхъ, и о намѣстничествѣ, яко голодны пси, хистяся на кровь и на слезы рода християнского. А царь все ихъ волю творилъ, во всемъ им сердце веселил и усобную войну на царство свое напущал велможъ своих, и всѣмъ Бога разгнѣвилъ».	И так еще говорит Петр, молдавский воевода: «У благоверного царя Константина беднели и нищали воины, а богатели сборщики налогов. И иные из воинов, видя это пренебрежение к воинству благоверного царя, оставляли военное дело и прельщались сбором налогов, разоряли царство царя Константина и царскую казну. Но сами сборщики богатели: пошлют его куда собирать в царскую казну, и где бы взять в пользу царя десять рублей, возьмет десять рублей в пользу царя, а сто рублей в свою пользу. А с теми, кто посылал их, с вельможами царскими, сборщики эти делились и разоряли царство благоверного царя Константина и царскую казну, и сами богатели на крови и слезах рода христианского. А вельможи друг перед другом выпрашивали у царя Константина кормления, города и наместничества, бросаясь, как голодные псы, на кровь и на слезы рода христианского. А царь во всем исполнял их волю, во всем веселил им сердце, так что впустил в свое царство междуусобную войну своих вельмож и во всем прогневил Бога».
Да тако рек Петръ, волоский воевода: «Суд был греческой неправеден, купля их была нечиста: купец не умѣл товару своему цены уставити. Первое душу продастъ, тоже и товаръ продастъ. Нечисто собрание их было. А велможи царьския на градѣхъ и на волостях домышлялися лукавством своим, дияволским прелщением: мертвых новопогребеных из гробов вынимали, да тѣ гробы порожни загребали, а того мертвеца рогатиною исколовши или саблею изсѣкши, да кровью вымажут, да богатому человѣку в дом подкинут. Да изца ему ябедника поставят, которой Бога не боится, да осудивши его неправеднымъ судом, да подворье его и богатество все разграбят. Нечисто богатѣли дияволским прелщением, а царьския грозы к ним не было. Всѣмъ Бога разгнѣвили. Ино про то Господь Богъ разгнѣвася на них неутолимым гнѣвом своим святымъ, посла на них плѣнъ иноплемянника Магметя салтана, турского царя, Амуратова сына от ниского колѣна разбойническаго роду, и Магмет-салтан потребивши Царьград и царя Констянтина вземши вѣру християнскую себѣ в мочь Богомъ выдана грѣхъ ради для их гордости, что они мир отбивали от царя жалобников к царю не припущали. А управы во царстве Констянтинове никому не было от велмож Констянтиновых. А они, велможи, сами обиду во царстве дѣлали и царство оскужали. То они не мир от царя отбивали и не жалобников, отбивали онѣ от царя Божие милосердие, да и отбили».	И так еще сказал Петр, молдавский воевода: «Суд был у греков неправедный, торговля у них была бесчестная: не мог купец товару своему назначить цену. Вперед душу свою продаст, потом и товар продаст. Бесчестно совершалось у них приобретение. А царские вельможи благодаря своему коварству и дьявольскому соблазну додумывались до того, что выкапывали только что захороненных покойников из могил, пустые могилы засыпали, а покойника, исколов рогатиной или разрубив саблей и измазав кровью, подбрасывали в дом богача. Потом выставят истца-клеветника, который Бога не боится, и, осудив неправедным судом, разграбят двор его и все богатство. По дьявольскому соблазну бесчестно они богатели, а царской власти над ними не было. Во всем гневили они Бога. Потому разгневался на них за это Господь Бог неутолимым и святым своим гневом, предал их в рабство иноплеменнику, турецкому царю султану Магомету, сыну Амурата, низкого разбойничьего рода, так что истребил султан Магомет Царьград и царя Константина и покорил своей власти веру христианскую, преданную Богом за грехи и за гордыню их, потому что отстраняли они от царя мир, не подпускали к нему жалобщиков. И никто не видел справедливости от вельмож в царстве Константина. Но сами они, вельможи, чинили в царстве притеснения и разоряли царство. Так что они не мир от царя отстраняли и не жалобщиков, отстраняли они от царя милосердие Божие, да и отстранили».
И тако рек Петръ, волоский воевода, со слезами радѣючи вѣре християнской: «По грѣхом по нашим сталося, что впали есми невѣрному в неволю иноплемяннику для беззакония великого греческаго, что греки тмы для да свѣтъ оставили, во всем вь ересь впали, Бога разгнѣвили неутолимым гнѣвом. И невѣрный иноплемянник, да познал силу Божию: Магмет-салтан, турской царь, взявши Царьград, да уставил правду и праведный суд, что Богъ любит, во всемъ царстве своем, и утѣшил Бога сердечною радостию. За то ему Богъ помогает: многия царства обладал Божиею помощию. А онъ великую правду во царство свое ввел и купцемъ куплю уставил купити и продати однѣм словом хотя на тысящу рублевъ. Да тако рек: «Дѣлайте правду во царстве моем богоданном. Видите вы то, иже Богъ любит правду, а за неправду гнѣвается неутолимым гнѣвом своим: како есть мнѣ, малому царю, выдал Богь великого царя. Держитеся заповеди Божии и наживайте в поте лица своего. Якоже отцу нашему первому приказал Богь Адаму, создав его и дав ему всю землю в мочь, и велѣлъ дѣлати землю и в поте лица ясти хлѣбъ, и Адам заповедь Божию исполнил, и нам такоже годится во всем Бога послушати, правдою сердечною ему радость воздати».	И так еще со слезами сказал Петр, молдавский воевода, радея о вере христианской: «И стало так по грехам нашим, что попали мы в рабство иноплеменнику за великое беззаконие греков, потому что оставили греки свет ради тьмы, впали в ересь во всем и прогневили Бога гневом неутолимым. А вот нехристь-иноплеменник, тот осознал Божью силу: султан Магомет, турецкий царь, захватив Царьград, во всем своем царстве установил справедливость и справедливый суд, какой любит Бог, и утешил Бога сердечной радостью. И за это помогает ему Бог: многими царствами завладел он с Божьей помощью. И вот он великую справедливость установил в своем царстве и снабдил уставом купеческий торг, так что только на слово можно и купить, и продать хоть на тысячу рублей. И так он сказал: «Творите правду в моем, Богом данном, царстве. Глядите же, как Бог любит правду, а за неправду гневается неутолимым гневом: ведь мне, невеликому царю, выдал Бог великого царя. Держитесь заповеди Божьей, наживайтесь в поте лица своего. Как наказал Бог нашему праотцу Адаму, когда создал его и дал ему во власть всю землю и велел обрабатывать землю и в поте лица своего есть хлеб, а Адам заповедь Божью исполнил, так и нам также нужно во всем слушаться Бога и правдою воздать ему сердечную радость».
И тако рек Петръ, волоский воевода: «Богъ не вѣру любит, правду. Истинная правда — Христосъ, Богь нашь, Сынъ Божий возлюбленный, в Троице едине божествѣ неразделимый, едино божество и сила. Да оставил нам Евангилие — правду, любячи вѣру християнскую надо всѣми вѣрами, указал путь Царства небеснаго. Греки Евангилие чли, а иныя слушали, а воли Божии не творили, на Бога хулу положили, вь ересь впали. И во всемъ диявол прелстил велмож Констянтиновых, всю его волю дияволскую творили и Бога прогнѣвали. И сами прелщалися, и царство Констянтиново все на прелщение привели, и потеряли вѣру християнскую. Тѣ же прелесники дияволскую волю творили. Коли Адама Господь Богъ из рая выгнал, а онъ заповедь Божию преступил и тогда диявол его искусил и запись на него взял,[43] — и Адам было во вѣки погинул. И Господь Богъ милосердие свое учинил волною страстию своею святою и Адама возвел изо ада, и рукописание растерзалъ. И един Богъ над всѣмъ свѣтом. То есть которыи записываются в работу во вѣки, прелщают, дияволу угожают, и которые прелщаются для свѣтлые ризы да во вѣки записываются в работу, — тѣмъ оба погибают во вѣки».	И так еще сказал Петр, молдавский воевода: «Не веру любит Бог, правду. Истинная правда — Христос, Бог наш, Сын Бога возлюбленный, нераздельный в божестве единой Троицы, едино божество и сила. И оставил он нам Евангелие — правду, а любя веру христианскую больше всех других вер, указал путь в Царство небесное. А греки читали Евангелие, иные же слушали, но Божьей воли не исполняли, возвели хулу на Бога и впали в ересь. Соблазнил дьявол вельмож Константина, исполнили они целиком дьявольскую волю, а Бога прогневили. Сами соблазнились и царство Константина на соблазн навели, а веру христианскую потеряли. Они же, прельстители, дьявольскую волю исполняли. Когда Господь Бог изгнал Адама из рая — ведь он заповедь Божью нарушил, а дьявол тогда подверг его искушению и расписку с него взял, — то навеки было погиб Адам. Но проявил свое милосердие Господь Бог своими добровольными страданиями, извел Адама из ада и расписку разорвал. Над всем миром один Бог. А есть такие, кто расписывается в рабстве навеки тем, что прельщают и дьяволу угождают, и такие, кто прельщается на блистательные одеяния и тоже расписывается в рабстве навеки, — и те и другие гибнут навеки».
