Онъ же егда възимаху градъ, Богу поспѣшествующю ему, украдеся средѣ вой, и въскочи въ яму глубоку, от неяже бѣ путь невидимъ къ пещере, и ту обрѣте 40 мужь лучьших таящихся, и всяка пристроя ту бысть, яже на потребу тѣлу. Стражие бо сѣдяху около града, и не мощно бысть убѣжати. И по два дни таяшеся. Въ третий же день, нѣкую жену емше стражие мучяху, и та мучима, исповѣда на того и яже с нимъ. Абие Еуспасианъ посла два тысячьскаа съ тщаниемъ, Павлина и Галикана, вывабити Иосифа и вдати ему руку. И та шедша молястася ему, на спасение десницю даяста, но сей не послуша бояся мучениа, зане зла много створилъ имъ при брани. И гемонъ же и третиаго тысячьскаго посла къ нему знаемаго друга, именемъ Никанора. И сей пришедъ почиташе ему римскую кротость и милосердиа плѣннымъ, и приложи, яко храбръства его дѣля и мудрости не възненавидять, но паче дивятся. «Гемонъ же теснѣтся вывести тя къ собѣ не на муку, но хранити тя хотя. Аще бы хотѣлъ на зло тя вабити, то не послалъ бы мене, друга твоего, ни азъ бых послушалъ его на прелесть тобѣ».	А он, когда брали город, с Божьей помощью, спрятался среди воинов и прыгнул в глубокую яму, из которой шел невидимый путь к пещере, и обнаружил, что в ней скрываются сорок лучших мужей, и тут были всякие припасы на потребу телу. Ведь вокруг города находилась стража, и невозможно было убежать. И два дня он скрывался. На третий день стража схватила одну женщину и пытала, и та под пыткой указала на него и тех, кто был с ним. И сразу Веспасиан послал двух трибунов с поспешностью — Павлина и Галликана, выманить Иосифа и обещать ему безопасность. И эти двое, отправившись, просили его и в знак безопасности давали правую руку, но тот не послушал, боясь мести, потому что много зла сотворил им на войне. Полководец же третьего трибуна послал к нему, о котором знали, что он был его другом, именем Никанора. И тот, явившись, говорил ему о доброте римлян и их милосердии к пленным и добавил, что благодаря своей храбрости и уму он вызовет у них не ненависть, но скорее восхищение. «Полководец же старается вывести тебя к себе не на пытку, но желая спасти тебя. Если бы он хотел выманить тебя, чтобы причинить зло, то не послал бы меня, твоего друга, да и я не послушал бы его, если бы нужно было обманывать тебя».
Иосифу же двоумующу, вои хотяху съ гнѣвомъ закурити пещеру. И сей увѣдѣвъ грозу их, въспомяну сны нощныя, имже Богъ показа ему будущаа на иудѣя бѣды. Бысть же на разрѣшение сномъ хитръ и мога разумѣти, яже Богъ кажеть с покровомъ, и священныхъ книгъ пророческыхъ не утаилося от него, зане иерѣй бысть и от иерѣйскаго племене родися. И въ той час духа исплънився, и рассуди страшнаа видѣниа соннаа, и принесе къ Богу тайную молитву глаголя: «Понеже иудѣйскъ род, зиждителю, осклаблено ми ся мнить прѣдъ твоима всевидящима очима и всю вазнь преводилъ еси на римляны и поручилъ еси имъ свою крѣпость, и мою душю избавилъ еси проповѣдати будущаа, и се твоимъ святымъ повелѣниемъ даю руцѣ римляномъ волею, и кленуся святымъ твоимъ именемъ, яко не живота дѣля въсхожю, ни предати хотя отечьство, но послужити твоей славѣ и силе, и проявити ми яже показа».	И поскольку Иосиф колебался, воины хотели в гневе поджечь пещеру. И он, узнав об этой угрозе, вспомнил ночные сны, в которых Бог показал ему несчастья, которые обрушатся на иудеян. Он же хорошо толковал сны и умел понимать то, что Бог показывал прикровенно, и ничто из священных пророческих книг не было для него тайной — ведь он был священник и происходил из рода священников. И в тот час преисполнился духа и растолковал страшные сонные видения и вознес к Богу тайную молитву, говоря: «Поскольку род иудейский, о творец, кажется мне лишившимся силы пред твоими всевидящими очами и всю удачу ты перенес на римлян и наделил их своею мощью, а мою душу спас, чтобы я возвещал о будущем, — и вот, по твоему святому повелению, я добровольно даю руку римлянам и клянусь твоим святым именем, что выхожу не ради спасения жизни и не желая предать отечество, но послужить твоей славе и силе, чтобы сделать явным то, что ты мне показал».
И тако рекъ, простре руку к Никонору. Иудѣи же иже с нимъ, очютивше его хотяща вылести, и обьступивше въпияху, яко велми постенеть отечьскый законъ, и дряхлъ будеть Богъ, иже създа иудѣомъ душа обидящаа смръти и непокориви. «Животъ ли любиши, Иосифе? Тръпиши ли видѣти свѣтъ работный? Велми ускорилъ еси на забыть, коликы научилъ еси умирати за свободу. А лжу славу приялъ еси о мужествѣ, и всуе еси былъ мудръ, оже уповаеши от них спастися, ихъже сердце раскровави. Но аще ты ума своего забылъ еси, но намъ подобаеть промыслити о отечьскомъ законѣ. Се ти мечь: аще въгрузиши въ свою утробу волею, то будеши вѣчный воевода июдѣйскъ; аще ли не хощеши, умреши от нашихъ рукъ, акы прѣдатель». Тако глаголюща обнажиша мечь на нь, аще дасться римляномъ.	И сказав так, протянул руку Никанору. А иудеяне, которые были с ним, узнав, что он хочет выйти, окружили его, крича, что сильно восстенает отеческий закон и опечалится Бог, который сотворил иудеянам души непокорные и презирающие смерть. «Или ты любишь жизнь, Иосиф? Но потерпишь ли ты видеть свет рабства? Ты слишком быстро забыл, скольких сам научил умирать за свободу! А лжива слава о твоем мужестве, и всуе был ты мудр, если надеешься спастись от тех, чье сердце раскровавил! Но если ты позабыл свой ум, то нам подобает позаботиться о законе отцов. Вот тебе меч: если вонзишь в свою утробу своею волей, то будешь вечно воеводой иудеян, если же не хочешь — умрешь от наших рук как предатель». С этими словами они обнажили на него меч <опасаясь, что> он предаст себя римлянам.
Иосифъ же убояся насилства их, и мня обиду Божественую, аще прежде повелѣниа Божиа умреть, начя мудрити къ нимъ яже при нужн, и рече: «Въскую на ся смръти ищемъ? Въскую възлюбленнаа разлучяемъ — душю и тѣло? Мните ли мене измѣнившася? Но не измѣнихся. Лѣпо при брани убиену быти от ратныхъ рукъ. Аще бо римскаго мечя боюся и крыюся, то достоинъ есмь въ истинну своею рукою и своимъ мечемъ умрети. Аще ли щадять насъ плѣнныхъ, то како намъ не достоить ли помиловати себе? Добро ли свободы ради умрѣти, то мнѣ любо прѣд полкомъ. Нынѣ кде плъкъ? Кто с нами биется? Страшивъ же есть вкупѣ иже не умираеть, егда достойно, и иже умираеть, егда не достойно. Что же боящеся не внидемъ к римляномъ? Смръти ли? Да въскую егоже ся боимъ чаемо от врагъ, сами на ся влечемъ нуждею? Работу ли кто поносить? Нынѣ же та велми есмы свободни. Храборъ ли мнится вамъ еже ся рѣжеть? Ни, нъ слабейши всѣхъ человѣкъ, якоже кръмникъ волнъ убояся, прежде бури потопи корабль. Саморѣзание же кромѣ естества есть, и вдано никоторому животну, ни можеть обрѣсти ниединого собою умирающаго. Естественый бо законъ крѣпокъ въ всѣхъ животу хотѣти. Того ради и отъимающихъ от насъ животъ врагъ мнимъ, и Бога прогнѣваеть человѣкъ, егда ся дару его поругаеть, и безаконствуеть прѣд очима его. Всяка плоть смрътна есть и от тлѣнна естества създанна, душа же безъсмрътна выину, и Божественымъ подобиемъ въ телеси пребываеть. Аще ли кто погубить чюжь кровъ, вданое ему на съхранение, то наречется лукавъ и невѣренъ, и всѣмъ непотребенъ. Аще же кто разлучить кровъ Божий от своего тѣла, какъ можеть утаитися от обидимаго? Аще работенъ убѣжить от господина, аще и лукавъ есть, достоинъ есть муцѣ. Сами же прекраснаго владыкы и предобраго, Бога бѣгающе, не будемъ ли нечтиви? Не вѣсте ли, яко выходять от сего жития по естественому закону, взятый от Бога длъгъ отплативше, егда хощеть взяти? То тѣмъ слава вѣчнаа, и доми тверди, и роди памятни, а душа ихъ чисты и непорочны пребывають у святаго небеснаго мѣста и чають оттуду въспять вселитися имъ въ своя телеса, егда възвратятся вѣци. И пакы, иже на ся възложивше руки, то душа ихъ адъ темный приемлеть, Отець же и Богъ и до правнукъ мучить ихъ. Тѣмъ възненавидѣно се прѣдъ Богомъ, и законодавець нашь повелѣ до запада солнечьнаго лежати безъ погребениа тѣлесомъ самоубийць; по инѣм же землямъ и десниця мрътвых отрѣзають. Достойны есмы, о друзи, съ правдою ходити, а не приложити къ напастемъ человѣческымъ гнѣва зиждителева. Се моея рѣчи конець. Не могу предатель собѣ быти. Иноплеменници зовуть на спасение — азъ ли хощю на мечь налечи? Не буди ми се. Аще же и по вдании рукы убиють мя, то яко вѣнцемъ побѣднымъ вѣнчянъ отъиду, имѣя невѣрство ихъ луче цѣсарства».	Иосиф же испугался, что они будут действовать силой, и считая пренебрежением по отношению к Богу, если он умрет прежде Божия повеления, начал хитрить с ними, потому что положение было безвыходное, и сказал: «Почему мы ищем себе смерти? Почему мы разлучаем возлюбленных — душу и тело? Вы считаете, что я изменился? Но я не изменился! Хорошо умереть в битве от рук врага. Если я боюсь римского меча и укрываюсь, то в самом деле я достоин умереть от своей руки и своего меча. Но если нас щадят, взяв в плен, то разве нам не должно помиловать себя самих? А что прекрасно умереть за свободу — то мне это любо перед войском. А сейчас — где войско? Кто с нами бьется? Равно труслив тот, кто не умирает, когда подобает, и кто умирает, когда не подобает. Так чего же мы боимся, что не выходим к римлянам? Смерти? Но почему то, чего мы боимся, ожидая этого от врагов, мы сами на себя навлекаем насильно? Если же кто поносит рабство, то теперь мы очень свободны?! Или же вам кажется храбрым тот, кто сам себя убивает? Напротив, это — слабейший из всех людей, подобный кормчему, который, испугавшись волн, прежде бури потопил корабль. Самоубийство же противоестественно и не дано ни одному животному — ведь ни одно из них себя не убивает. Во всех силен естественный закон — хотеть жить. Поэтому отнимающих у нас жизнь мы считаем врагами, и прогневает Бога человек, если дар его отдает на поругание, и творит беззаконие пред очами его. Всякая плоть смертна и создана из тленного естества, душа же вечно бессмертна и пребывает в теле по Божественному подобию. Если кто-нибудь погубит чужой залог, данный ему на сохранение, то его назовут коварным и вероломным, с которым никому нельзя иметь дело. Если же кто разлучит Божий залог от своего тела, то как может он укрыться от того, кому нанес обиду? Если раб убежит от господина, даже плохого, то он достоин кары. Но убегая сами от прекрасного и предоброго владыки — от Бога, не окажемся ли мы нечестивцами? Разве вы не знаете, что из этой жизни уходят по естественному закону, отплатив взятый у Бога долг, когда он захочет взять? И таким — слава вечная и дома крепкие и потомки не забывающие, а души их, чистые и непорочные, пребывают в месте святом и небесном и ждут, когда вернутся обратно и вселятся в свои тела после того, как обратятся века. Но те, кто на себя налагает руки, — их души темный ад принимает, а Отец и Бог мучит их до правнуков их. Потому ненавистно это пред Богом, и законодатель наш установил, чтобы до захода солнца тела самоубийц лежали без погребения; в других же странах и правую руку у мертвых отрезают. Мы достойны, о други, ходить с правдой, а не добавлять к человеческим бедам гнева творца! На этом свое слово кончаю. Не могу быть предателем самому себе. Иноплеменники зовут нас на спасение — и я ли захочу броситься на меч? Да не будет этого! Если же после того, как я дам им руку, они убьют меня, то я паду, как бы увенчанный победным венцом, предпочитая их вероломство царству».
Таковаа многа глагола Иосифъ к нимъ, браня имъ от саморѣзаниа. Они же заградивше уши отчаяниемъ, обьступиша и, убити хотяща, поругающе и хуляще на слабость. Онъ же ового именемъ нарицаа, на другаго же съ грозою зря, ового же за руку попадаа, различными рѣчми отреваше от себе. И тии еще стыдящеся от своего воеводы акы при плъку и срамляющеся, никтоже възложи рукы на него.	Много подобных слов говорил к ним Иосиф, удерживая их от самоубийства. Они же, заградив уши отчаянием, обступили его, собираясь убить, понося и хуля за слабость. А он, одного называя по имени, на другого глядя с угрозой, третьего хватая за руку, разными речами отталкивал их от себя. А их, еще сохранявших уважение к своему военачальнику, как в строю, удерживал стыд, и никто не поднял на него руку.
И сей, поручивъ спасение свое Богу строителю, рече: «Понеже благоволилъ Богъ умрѣти намъ, числомъ да убиени будемъ: на негоже конець числа будеть, да той будеть убиенъ от втораго». Тако рекъ, почте числа мудростию, и тѣмъ пребляди вся, и убиени быша вси другъ от друга, развѣи единого. И тъснася, да не осквернить десниця кровию сродническою, помолися тому, и оба вынидоста жива. И поведоша а къ Еуспасияну, а римляне вси течяху на позоръ, и бысть кличь разноличенъ, овѣмъ радующимся о Осифовѣ плѣнении, овѣмъ грозящимся, овѣм же велящимъ мучити и убити врага, овѣм же дивящимся премѣнению житийскому. Еуспасианъ же повелѣ утвердити и, да послеть и къ Нерону.	И он, предоставив спасение свое Богу-промыслителю, сказал: «Поскольку благая воля Бога — нам погибнуть, умрем по счету: на ком закончится счет, пусть будет убит следующим». И сказав так, рассчитал числа с хитростью, и тем обманул всех, и все были убиты друг другом, кроме одного. И он, стремясь не осквернить руки родственной кровью, упросил того, и оба вышли живыми. И повели их к Веспасиану, а римляне все устремились на зрелище, и поднялся разноголосый крик: одни радовались, что Иосифа взяли в плен, другие выкрикивали угрозы, третьи требовали пытать и убить врага, а иные дивились превратности жизни. Веспасиан же приказал взять его под стражу, чтобы послать к Нерону.
О градѣ Иерусалимѣ и о церкви и о катапѣтазмѣ	О городе Иерусалиме, и о храме, и о завесе
Како бѣ град Иерусалимъ	Каким был город Иерусалим
