Пришедъши внутрь приимаше равность церковьнаа, егоже высота 60 локотъ. Мѣсто же се шестьдесятное дѣлится надвое: первое же 40 локотъ, в немже быша три дѣла пречюднаа и преславнаа всѣмъ человѣкомъ: свѣтилникъ и трапеза и кадилница.[43] На свѣтилницѣ же бысть 7 свѣщникъ, по подобию 7 звѣздъ небесныхъ, нареченныя планитъ.[44] На трапезѣ быша 12 хлѣба, по подобию числу поясомъ небеснымъ и по образу лѣтъ. На кадилници же быша 13 темиана, събираеми от всѣхъ морь, и от всея вселенныя, и от всѣхъ пустынь, назнаменающа, яко вся от Бога и къ Богу. Внутрьнѣе же мѣсто 20 лакотъ невидимо есть катапетазмою другою, и ничтоже в немъ не стояше, ни лежаше, и непроходимо бысть и нескврънно и невидимо всѣми, нареченнаа святаа святыхъ. И подлѣ ребра долнѣе црькви учястишася и умножишася храми тревръхнии, на высоцѣй же странѣ не таци быша храми, зане бѣ тесно.	Входившие внутрь попадали в нижний ярус храма, высота которого шестьдесят локтей, Место же это в шестьдесят локтей разделяется на две части: первая — в сорок локтей, в которой находились три вещи, изумительные, слава о которых распространилась повсюду, — светильник, стол и кадильница. На светильнике было семь лампад, по подобию семи звезд небесных, называемых планетами. На столе было двенадцать хлебов, подобно числу поясов небесных и по образу лет. На кадильнице же было тринадцать тимьянов, собираемых со всех морей, и со всей обитаемой земли, и со всех пустынь, означающих, что все от Бога и к Богу. Внутреннее же место — двадцать локтей, невидимое за другой завесой, и ничего в нем не стояло и не лежало, и оно было недоступно для входа и скверны и невидимо для всех, называемое «святая святых». И вдоль боковой стороны нижнего храма вплотную друг к другу стояло множество строений с тремя крышами, на высокой же стороне строения были не такие из-за тесноты.
На внѣшнее же лице церкви зряще ужасахутся очима и душами: златыми дсками тлъстыми оковано бѣ всюду, противу же солнечному сиянию огненъ взоръ пущаше. Яко на чисто солнце нелзѣ възрѣти, но мжить всякъ, тако и очи не хотящихъ зрѣти на ню помижаетася. Мимоходящим же на ню зрящимъ являшеся яко гора исплънена снѣга: на нихъже бо мѣстех не ковано бѣ златом, бѣлеяшеть бо ся зѣло. На връху же всажени быша златы гвозды и велици и длъзи, и части, яко стрѣлы и остры, да никоторыйже птичь сѣдъ осквернить верха. Камение имже създано бысть, быша по полупяту десяту локотъ въ долготу, а възвыше по пяти, а вшире по 6. Прѣд тою же бысть жрътвеникъ,[45] высотою 15 лакотъ, а вшире 8 лакотъ, и въ долготу такожде, на четыри углы създанъ, выходя от единого угла, образомъ акы рогъ, и въсходъ же на нь от полудния. Създано же бысть безъ желѣза, и николиже не прикоснется ему желѣзо. Окрестъ же церкви и жрътвеника обыиде акы вѣнець, заграда камена прекрасна, лакте възвыше, бранящи народ и от иерѣй. Прокаженым же и трудоватымъ ни въ градъ да не дадяхуть входити, женам же браняху прѣити заграды тоя чистымъ и нечистымъ. И мужемъ не очистившимся възбраняху от внутреняго двора, такоже иерѣомъ.	Лицевая сторона храма, обращенная наружу, поражала глаза и души смотрящих: везде она была окована толстыми золотыми пластинами и при солнечном сиянии казалась пылающей огнем. Как на чистое солнце нельзя взглянуть, но жмурится всякий, так и глаза против воли смотрящих на него зажмуривались. Когда же смотрели на него, проходя мимо, он казался горой, покрытой снегом: в тех местах, где не было оковано золотом, он ярко сверкал белизной. Наверху же были всажены золотые острия — большие, длинные, частые и острые, как стрелы, чтобы никакая птица, сев, не осквернила верха. Камни, из которых он был построен, были по сорок пять локтей длиной, по пять высотой и шириной по шесть. Впереди был жертвенник высотой пятнадцать локтей, а в ширину восемь локтей и столько же в длину, сделанный четырехугольным, выступающий с одного угла наподобие рога; восходят же на него с южной стороны. Он был сделан без железа, и никогда не прикоснется к нему железо. Вокруг же храма и жертвенника обходит, как венец, красивейшая каменная ограда, в локоть высотой, отгораживающая народ от священников. Прокаженным же и больным даже в город не позволяли входить, а женщинам запрещали переходить ту ограду, что между чистыми и нечистыми. И мужчин не очистившихся не допускали во внутренний двор, так же и священников.
Иже родънии иерѣи быша, не мощно служити слѣпотою или хромотою или рукою, идяху внутрь съ здравыми и цѣлыми иерѣи, и чясть емлюще с тѣми равно, а въ священныя ризы не облачяхуся. На жрътовникъ бо и на церковь въсхожаху иерѣи непорочнии, и облекшеся въ усъ, и паче говѣюще от вина, страшащеси, да ничтоже не прѣступят въ службѣ. И архиерѣй въсхожаше с ними не по вся дни, но въ суботы и в новыя мѣсяця и въ отечьскыя праздникы великыя. Егда служаше, ризы[46] его быша кромѣ от иерѣй. Покрыяше бо прѣд до голений и прѣпоясникомъ, а исподъ полотном, връху же облачяшеся въ ризу круглу до ногъ, уакинфомъ устроена. И около ея висять колоколи злати и роидья такоже; клаколи же прообразують громъ, а родиа млънию. И вѣнець прилѣпливаше ризу къ персемъ, пятью же поясъ обиатъ от злата и от пръфира, и от кока, и от уса, и от уакинфа, имже и катапетазма устроена бе — вины ради, еяже рекохомъ. И надъ тѣмъ висяшеся емофоръ, златомъ кованъ, образъ имущь бронный. Подлѣ же его два щита, златомъ кованы, и в нею насрѣди сардоникы, велици и прекраснии, в нихъже написано начяльници колѣна иудѣйска. На друзѣй же странѣ висяху 12 камени на 4 чясти раздѣлени: на пръвой сарди, и топазъ, изморагдъ, а на вторѣй анфраксъ, иаспи и самфиръ, и на третьей ахати, амефисъ, лигури, и на четвертой ониксъ, вирилъ, хрусолифъ. Главу же покрываше вѣнцемъ вусинскомъ, покрытъ уакинфом, а над нимъ инъ златъ вѣнець, на немже написана быша крестомъ священныи грамоты и четворица[47] Въ сию же ризу не облачяшется въ ино врѣмя, развѣ егда служаше в непроходимѣй единою лѣта, егда обычай всѣмъ говѣти Бога.[48] Въ ины же праздникы въ простѣйшаа ризы облачяшеся.	Те из рода священников, кому нельзя было служить из-за слепоты, или хромоты, или <увечной> руки, входили внутрь со здоровыми и неувечными священниками, получая ту же часть, что и они, но в священные ризы не облачались. На жертвенник же и в храм входили священники непорочные, облекшиеся в виссон и воздерживающиеся в особенности от вина, опасающиеся малейшего нарушения в службе. И первосвященник входил с ними не во все дни, но в субботы и первые дни месяца, а также в большие праздники, установленные предками. Когда он служил, ризы его отличались от священнических. Ибо перед он закрывал до голеней опоясывающей тканью, а низ — полотном; сверху он облачался в круглую ризу, доходящую до ног, сделанную из синей ткани. И кругом на ней висят золотые колокольчики и яблоки: колокольчики служат образом грома, а яблоки — молнии. И повязка прикрепляла ризу к груди, вокруг нее — пять поясов из золота, багряницы, червленицы, виссона и синей ткани, из которых была сделана и завеса, — почему, мы уже сказали. А над ней свисал омофор, сделанный из золота, имеющий вид брони. Внизу его — два щита, кованные из золота, и в середине у них — большие и прекрасные сардониксы, на которых написаны родоначальники колен иудейских. На другой стороне были прикреплены двенадцать камней, разделенных на четыре части: в первой сердолик, топаз, изумруд, во второй карбункул, яшма и сапфир, в третьей агат, аметист, лигурий, а в четвертой оникс, берилл, хризолит. Голову же он покрывал повязкой из виссона, сверху — синей тканью, а поверх — еще одним золотым венцом, на котором были написаны крестом священные буквы, составляющие четверицу. В эту ризу он не облачался в другое время, но только когда служил в <святилище>, куда никому нельзя было входить, — один раз в год, когда все по обычаю говеют Богу. В другие же праздники он облачался в более простые ризы.
О градѣ, о церкви, о дворѣ	О городе, о храме, о дворе
О градѣ же и о церкви и обычаи пакы изречемъ, яже оставихомъ.	О городе, о храме и об обычаях мы еще скажем, что опустили.
Сынъ же нарекомый Антоний създанъ бысть межи двѣма комарама церковьныма, над высокымъ камениемъ 50 лакотъ възвыше. Строение же бѣ Ирода цѣсаря, иже камень сей покры дсками мраморяными от корене до верху, красоты дѣля и плъзости дѣля, да невъзможно будеть внити и изыти. И прѣд сыномъ създа стѣну трий локотъ възвыше, и потомъ сынъ създалъ възвыше 40 лакотъ. Внутренее же его мѣсто цѣсарьскый дворъ бѣ: храми прекрасни и потребни, и комары, и бани великы, и воинскыи дворы широкы. Зане вся потребнаа имяше, подобяшеся граду силному, егда зане вся быша в немъ прекраснаа и различнаа, бысть же жилище цѣсарьское. И образомъ сынъ сей на углы четырми сынъ обиатъ бысть, три възвыше быша по пятидесятъ лакотъ, четвертый же на въсточнѣй странѣ 70 лакот, яко видѣти от него церковь, идѣже сѣдяще стражие римстии съ оружиемъ при праздницѣ блюдааху, да не разратятся людие. Церковьный бо градъ бысть граду самому акы дѣтинець,[49] сынъ же Антоний вышний и твержий црьковнаго града. Вышний же градъ имяше оприснь дѣтинець — Иродовы полаты.[50] Везефа же разлучится от Антония и от полунощия призрить на церковь. О градѣ же и о стѣнахъ, елико ми мощно, измолвихъ.	Крепость же, называемая Антониевой, была построена между двумя крытыми галереями храма, на высоком камне в 50 локтей высотой. Это было сооружение царя Ирода, который покрыл этот камень мраморными плитами от основания до верха — для красоты и ради пользы, чтобы невозможно было ни войти, ни выйти. И перед крепостью он построил стену в три локтя высотой и потом построил крепость 40 локтей в высоту. Ее внутреннее пространство было царским дворцом: прекрасные и удобные дома, крытые галереи, большие бани и широкие дворы для воинов. Поскольку там было все необходимое, она была похожа на сильный город; поскольку все в ней было прекрасно и разнообразно — на царское жилище. Имея вид башни, она по четырем углам была окружена башнями, три были в высоту по пятьдесят локтей, а четвертая на восточной стороне — семьдесят локтей, так что с нее можно было видеть храм, и на ней сидела римская стража с оружием, наблюдая во время праздников, чтобы народ не поднял мятеж. Таким образом, кремль вокруг храма был по отношению к городу как детинец, а Антониева крепость — еще более укрепленной, чем храмовый кремль. Верхний же город имел свой особый детинец — Иродовы палаты. Везефа же отделяется от Антониевой крепости и с северной стороны смотрит на храм. О городе и о стенах, насколько мог, я рассказал.
Мятежници[51] же от цръкьве по вся дни биющеся съ дѣлающими приспу, и въ 27 день преждереченнаго мѣсяца[52] таку лесть сътвориша: заднюю комару между соломенемъ и връхомъ исплъниша хвороста съ смолою и съ сѣрою, потом же творяхутся акы бѣгающе. И к тому мнози от несмотрящихъ устремльшеся нападоша на отступльшаа, и поставиша лествиця и възлѣзоша горѣ на комары. И абие иудѣи пожгоша, и располѣвшюся огню, всюда обступи вся, и не можахуть како промыслити и метахутся назад въ пропасти, инии же къ супостатомъ исъкрушахутся, а инии изгорѣшася, а инии изрѣзашяся. Кесарь же гнѣвашеся на погыбшаа, зане безъ повелѣния възлѣзоша, но обаче съжалиси о нихъ. И не могущю никомуже помощи имъ, се бысть утѣха истляющимся, понеже видяше кесарь, за негоже кождо ихъ душю полагаше, кличюще бо и поскачюще и молящеся другъ другу, да въспомогуть, имже лзѣ, и гласы свѣтлы пущающе, с похвалами и с веселиемъ умираху. Инии же къ комарнѣй стѣнѣ прибѣгше, широцѣ сущи, и от огня избавишася. Обступльше же ихъ иудѣи биюща я, падоша вси.	О взятии Иерусалима
Единъ же от нихъ уноша, именемъ Логинъ, дѣло сътвори достойно памяти. Иудѣи бо не могуще убити, даяхуть ему руку, молящеся да слѣзеть къ нимъ. Братъ же его Корнилий, противу ему стоя, въпияше къ нему, да не посрамить своего рода, ни укорить вой римскыхъ. И сей, послушавъ его, и извлекъ мечь, всѣмь на нь зрящимъ въгрузи в ся. Токмо же Арторий лестию от огня избы: тъй бо призва своего Лукья, своего товарника, и рече к нему великымъ гласомъ: «Тебе оставлю наслѣдника моему стяжанию, аще приступль ухитиши мя». Оному же бодро притекшю, съвержеся на нь и живъ бысть; Лукий же от тяжасти зараженъ бысть, и падъ ниць на камени умре.	Мятежники, все дни ведя из храма бой с теми, кто делал насыпь, в 26-й день указанного месяца устроили такую хитрость: заднюю крытую галерею между верхней перекладиной и крышей наполнили хворостом со смолой и серой, а потом притворились, что убегают. И тогда многие, неосмотрительно бросившись, напали на отступивших, поставили лестницы и влезли вверх на галерею. И сразу же иудеяне подожгли <их>, и огонь, разгоревшись, окружил всех отовсюду, и они, бессильные что-либо предпринять, бросались назад в пропасть или падали к противникам; некоторые сгорели, а иные погибли от меча. Цезарь же разгневался было на погибших за то, что они влезли без приказа, но, однако, проникся к ним жалостью. И поскольку никто не мог им помочь, утешением для горящих было то, что их видел цезарь, за которого каждый из них полагал душу; крича, прыгая, умоляя друг друга помочь, если кто может, и испуская радостные возгласы, они умирали с похвалою и весельем. А некоторые, прибежав к широкой стене галереи, спаслись от огня. Обступившие их иудеяне рубились с ними, и они все погибли.
Си лесть печяль възложи на римляны за мало время, потом же научишася блюсти от льсти иудѣйскы, имже многажды спакостишаси, не вѣдуще градныхъ мѣстъ и нрава мужь. И пожжены быша комары до Иоаннова сына, егоже създа, егда биашеся съ Симономъ.[53] Утру же бывшю, римляне съ сѣверныя комары иждегоша.	Один же из них, юноша по имени Логин, совершил поступок, достойный памяти. Иудеяне не могли его убить и давали руку, упрашивая, чтобы он слез к ним. Но его брат Корнелий, стоя напротив него, кричал ему, чтобы он не посрамил своего рода и не навлек позора на римских воинов. И тот, послушав его, извлек меч на глазах у всех и вонзил в себя. Только Арторий хитростью спасся от огня: он позвал своего товарища Луция и громко сказал ему: «Тебя оставляю наследником своего имущества, если ты подойдешь и поймаешь меня». И когда тот быстро подбежал, он рухнул на него и остался жив; Луций же был повален тяжестью и, упав лицом на камень, умер.
