КАКО КРЕСТИСЯ ВОЛОДИМЕРЪ, И ДѢТИ СВОЯ КРЕСТИ, И ВСЮ ЗЕМЛЮ РУСКУЮ ОТ КОНЦА ДО КОНЦА, И КАКО КРЕСТИСЯ БАБА ВОЛОДИМЕРОВА ОЛГА[1] ПРЕЖЕ ВОЛОДИМЕРА. СПИСАНО ИАКОВОМЪ МНИХОМЪ	КАК КРЕСТИЛСЯ ВЛАДИМИР, И ДЕТЕЙ СВОИХ КРЕСТИЛ, И ВСЮ ЗЕМЛЮ РУССКУЮ ОТ КРАЯ ДО КРАЯ, И КАК ЕЩЕ ДО ВЛАДИМИРА КРЕСТИЛАСЬ БАБКА ВЛАДИМИРОВА ОЛЬГА. НАПИСАНО ИАКОВОМ МОНАХОМ
Отче, благослови!	Отче, благослови!
Паулъ святый апостолъ, церковный учитель и свѣтило всего мира, посылая къ Тимофею писание, глаголаше: «Чядо Тимофею, еже слыша от мене многыми послухы, тоже предай вѣрнымъ человѣкомъ, иже доволнѣи будуть и иныхъ научити».[2] И блаженый апостолъ Лука евангелистъ къ Феофилу писаше, глаголя: «Понеже мнози начаша повѣсти дѣяти о извѣстныхъ вещехъ, бывшихъ въ насъ, изволися и мнѣ, ходившю исперва и по всѣхъ писати тебѣ, державный Феофиле, да разумѣеши, о нихъже начатъ Исусъ творити же и учити».[3] Къ тому Феофилу написа Дѣяния апостольская и Еуангелие святый апостолъ Лука, по томъ многыхъ святыхъ писати начаша жития и мучения. Тако же и азъ, худый мнихъ Иаковъ, слышавъ от многыхъ о благовѣрнемъ князѣ Володимери всея Руския земля, о сыну Святославлѣ[4], и мало събравъ от многыя, добродѣтели его написахъ, и о сыну его, реку же святою славную мученику Бориса и Глѣба,[5] како просвѣти благодать Божия сердце князю рускому Володимеру, сыну Святославлю, внуку Игореву[6], и возлюби ̀и человеколюбивый Богъ, «хотяй спасти всякого человѣка и въ разумъ истинный приити»,[7] и вжада святого крещения.	Павел, святой апостол, церковный учитель и светило всего мира, посылая к Тимофею писание, говорил: «Чадо Тимофей, то, что слышал от меня при многих свидетелях, передай верным людям, которые будут способны и других научить». И блаженный апостол Лука евангелист к Феофилу писал, говоря: «Так как многие начали повествовать о известных событиях, случившихся с нами, захотелось и мне описать тебе, достопочтенный Феофил, исследовав все сначала и по порядку, чтобы уяснил ты, как начал Иисус творить и учить». Для того же Феофила написал Деяния апостольские и Евангелие святой апостол Лука, а после жития и мучения многих святых начали описывать. Так и я, ничтожный монах Иаков, слышавший от многих о благоверном князе всей Русской земли сыне Святослава Владимире, и собрав из многого немногое, написал о добродетелях его, а также о двух сыновьях его, святых славных мучениках Борисе и Глебе. И написал, как благодать Божия просветила сердце князя русского Владимира, сына Святослава, внука Игорева, и как, «желающий всякого человека спасти и к познанию истины привести», возлюбил его человеколюбивый Бог — и возжаждал князь святого крещения.
«Якоже жадаеть елень на источники водныя»,[8] тако вжада благовѣрный князь Володимеръ святого крещения, и Богъ сътвори хотѣние его. Пишеть бо ся: «Волю боящихся его сътворить и молитву ихъ услышить и спасеть ̀я».[9] И самъ рече Господь: «Просите и преимите, ищите и обрящите, толчете и отверзется вамъ. Всякъ просяй приемлеть, ищай обрящеть, толкущему отверзется».[10] И паки рече: «Иже вѣру иметь и крестится, и спасенъ будеть, а иже вѣры не имать, не крестится, осужен будеть».[11] Взиска спасения и прия о бабѣ своей Олзѣ, како шедши къ Царюграду, и прияла бяше святое крещение, и пожи добрѣ предъ Богомъ, всими добрыми дѣлы украсившися, и почи с миромъ о Христѣ Исусѣ и въ вѣрѣ блазѣ. То все слышавъ князь Володимеръ о бабѣ своей Олзѣ, нареченѣй въ святомъ крещении Елене, тоя и житие подража, такоже и святыя царици Елены[12], матере великаго царя Коньстантина житию ревнуя въ всемъ. И разгоряшеся Святымъ Духомъ сердце его, хотя святого крещения. Видя же Богъ хотѣние сердца его, провидя доброту его, и призрѣ съ небесѣ милостью своею и щедротами. И въ Троицы славимый Богъ Отецъ, и Сынъ, и Святый Духъ на князя Володимера, «испытая сердца и утробы»,[13] Богъ праведенъ, вся предвѣдый, и просвѣти сердце князю Рускыя земля Володимеру прияти святое крещение.	«Как жаждет олень водного источника», так возжаждал благоверный князь Владимир святого крещения, и исполнил Бог желание его. Ибо пишется: «Волю боящихся его исполнит, и молитву их услышит, и спасет их». И сам Господь сказал: «Просите и получите, ищите и найдете, стучите и откроется вам. Всякий просящий получит, ищущий найдет, стучащему откроется». И еще сказал: «Кто уверует и крестится, тот спасен будет, а кто не уверует и не крестится, тот осужден будет». Он искал спасения и узнал о бабке своей Ольге, как, пойдя в Царьград, приняла она святое крещение, и жила, как следует по-божески, всеми добрыми делами украсившись, и почила с миром о Иисусе Христе и в благой вере. То все услышав о бабке своей Ольге, нареченной в святом крещении Еленой, князь Владимир и в жизни ей стал подражать, как и святой царице Елене, матери великого царя Константина, следуя во всем. И разгорелось Святым Духом сердце его, желая святого крещения. Видя желание сердца его, Бог, зная о доброте его, снизошел с небес на князя Владимира милостью своею и щедротами. И Бог Отец, и Сын, и Святой Дух в Троице славимый, «проникающий в сердце и существо» Бог праведный, все предвидящий, просветил сердце князю Русской земли Владимиру, чтобы принял он святое крещение.
Крести же ся самъ князь Володимеръ, и чада своя, и весь домъ свой святымъ крещениемъ просвѣти, и свободи всяку душу, мужескъ полъ и женескъ, святого ради крещения. И възрадовася, и възвеселися о Бозѣ Давыдьскы князь Володимеръ, и аки святый пророкъ дивный Аввакумъ «о Господѣ веселяся и радуяся»[14] о Бозѣ Спасѣ моемъ. О, блаженное время и дьнь добрый, исполненъ всего блага, в онъже крестися Володимеръ князъ, и нареченъ бысть въ святомъ крещении Василей! И даръ Божий осѣни его, благодать Святого Духа освѣти сердце его, и навыче по заповѣди Божии ходити и жити добрѣ о Бозѣ, и вѣру тверду удержа неподвижиму. Крести же и всю землю Рускую от конца до конца, и поганьскыя боги, паче же и бѣсы, Перуна и Хъроса,[15] и ины многы попра, и съкруши идолы, и отверже всю безбожную лесть. И церковь созда камену во имя пресвятыя Богородица[16], прибѣжище и спасение душамъ вѣрнымъ, и десятину ей дасть, тѣмъ попы набдѣти и сироты, вдовица и нищая. И потомъ всю землю Рускую и грады вся украси святыми церквами. И отвержеся всея диаволи льсти, и прииде от тмы диаволя на свѣтъ съ чады своими, приде къ Богу, крещение приимъ, и всю землю Рускую исторже изъ устъ диаволь и къ Богу приведе, и къ свѣту истиному. Рече бо Господь пророкомъ: «Изводяй от нечестия нечестиваго, аки уста моя еси».[17] И бысть князь Володимеръ аки уста Божиа и человекы изъ лести диаволя къ Богу приведе. О, колика радость и веселие бысть на земли! Ангели възвеселишася и арахангели, и святыхъ дуси възыграшася. Самъ рече Господь: «Колика радость бываеть на небесѣхъ о единемъ грѣшницѣ кающимся».[18] Толико бес числа душь по всей земли Руской приведены къ Богу святымъ крещениемъ, похвалы всякыя дѣло постойно створи и радости духовныя полно.	Крестился сам князь Владимир, и детей своих, и весь дом свой святым крещением просветил, и освободил каждую душу, и мужского пола, и женского, крещением святым. И возвеселился, как Давид, и возрадовался Богу князь Владимир, и «веселился, и Господу радовался», как святой пророк дивный Аввакум, Богу Спасу своему. О, блаженное время и день добрый, исполненный всякого блага, в который крестился Владимир князь и назван был в святом крещении Василий! И дар Божий осенил его, и благодать Святого Духа осветила сердце его, и научился по заповеди Божьей поступать, и жить добродетельно по-божьи, и веру соблюдал твердо и непоколебимо. Он крестил всю Русскую землю из конца в конец — и отверг нечестивое наваждение, и языческих богов, а вернее бесов, Перуна и Хорса, и других многих попрал, и сокрушил идолов. И церковь построил каменную во имя пресвятой Богородицы, прибежище и спасение душам верным, и десятину ей дал, чтобы о попах заботиться, и о сиротах, и о вдовицах, и о нищих. И потом всю землю Русскую и города все украсил святыми церквами. И отверг весь дьявольский обман, и пришел от тьмы дьявольской на свет с детьми своими, пришел к Богу, крещение приняв, и всю землю Русскую вырвал из пасти дьявола и к Богу привел, и к свету истинному. Ведь сказал Господь устами пророка: «Отводящий от нечестия нечестивого, ты — как уста мои». И был князь Владимир как уста Божий и людей от обмана дьявольского к Богу привел. О, сколько радости и веселия было на земле! Ангелы возрадовались и архангелы, и души святых воспряли. Сам Господь сказал: «Какая радость бывает на небесах, если хоть один грешник раскается». Бесчисленны души, приведенные к Богу святым крещением по всей земле Русской, исполнено дело, похвалы всякой достойное и радости духовной полное.
О блаженый и треблаженый княже Володимерѣ, благовѣрне, и христолюбиве, и страннолюбче, мъзда твоа многа предъ Богомъ! То же блаженый Давыдъ глаголаше: «Блаженъ человекъ, егоже ты накажеши, Господи, и от закона твоего научиши ̀и, да укротиши ̀и от дний лютъ».[19] Блаженый князь Володимеръ, уклонився от службы диаволя, и прииде къ Христу Богу, Владыцѣ своему, и люди своя приведе, и научи ̀я служити Богу, Самъ бо рече Господь: «Иже створить и научить, се великъ наречеться въ царствии небеснемъ».[20] А ты, блаженый княже Володимере, бысть апостолъ въ князехъ, всю землю Рускую приведъ къ Богу святымъ крещениемъ, и научи люди кланятися Богу, славити и пети Отца, и Сына, и Святаго Духа. И вси людие Рускыя земля познаша Бога тобою, божественый княже Володимере. Възрадовашася ангельстии чини, агници честнии, нынѣ радуются вѣрныи, и воспѣша, и въсхвалиша! Аки младенци еврейстии съ вѣтвьми усрѣтоша Христа, вопиюще: «Осанна Христу Богу, побѣдителю смерти!»,[21] тако и новоизбраннии людие Руския земля въсхвалиша Владыку Христа с Отцемъ и Святымъ Духомъ. И къ Богу приближившеся святымъ крещениемъ, и диавола отврьгшеся, и службы его поругашася, и поплеваша бѣсы, и познаша Бога истиннаго, творца и съдѣтеля всей твари. И поють по вся дни живота и на всякъ часъ пѣснь чудную, хвалу архангельскую: «Слава въ вышнихъ Богу, и на земли миръ, въ человецѣхъ благоволение!»[22] И ты, блаженый княже Володимере, подобно Констянтину Великому[23] дѣло сътвори, яко онъ вѣрою великою и любовью Божиею подвигся. Утверди всю вселеную любовию и вѣрою, и святымъ крещениемъ просвѣти весь миръ, и законъ Божий по всей вселенѣй заповѣда. И разруши храмы идольския съ лжеименными богы, и святыя же церкви по всей вселенѣй постави на хвалу Богу, в Троицы славимому Отцу, и Сыну, и Святому Духу, и крестъ обрѣте, всего мира спасение. С блаженою и богомудрою матерью своей святою Оленою и съ чады многы приведе къ Богу святымъ крещениемъ бещисленое множество. И требища бѣсовсьскыя потреби, и храмы идольскыа разруши, и церквами украси всю вселеную и грады, и заповѣда въ церковахъ памяти святыхъ творити пѣнии и молитвами, и праздникы праздновати на славу и на хвалу Богу. Тако же и блаженый князь Володимеръ сътвори съ бабою своею Олгою.	О блаженный и трижды блаженный князь Владимир, благоверный, и христолюбивый, и гостеприимный, велика награда твоя от Бога! То же блаженный Давид говорил: «Блажен человек, которого ты наставишь, Господи, и закону твоему научишь его, и сохранишь его в горькие дни». Блаженный князь Владимир, отказавшись от службы дьяволу, пришел к Христу Богу, своему Владыке, и людей своих привел, и научил их Богу служить. Ибо сам Господь сказал: «Тот, кто совершит и научит, тот великим назван будет в царстве небесном». А ты, блаженный князь Владимир, был апостолом в князьях, всю землю Русскую приведя к Богу святым крещением, научил людей своих поклоняться Богу и славить и петь Отца, и Сына, и Святого Духа. И все люди Русской земли через тебя познали Бога, божественный князь Владимир. Возрадовались ангельские чины, агнцы славные, теперь радуются верные, и воспели, и восхвалили! Как дети еврейские с ветвями встретили Христа, возглашая: «Осанна Христу Богу, победителю смерти!», так и новоизбранные люди Русской земли восхвалили Владыку Христа с Отцом и Святым Духом. И к Богу святым крещением приблизившись, и дьявола отвергнув, и службы его поругав, и бесов оплевав, истинного Бога познали, творца и создателя всего сущего. И поют во всякий день и час своей жизни песнь чудную, хвалу архангельскую: «Слава в вышних Богу, и на земле мир, и в человецех благоволение!» И ты, блаженный князь Владимир, подобно Константину Великому, дело совершил, как он, верой великой и любовию к Богу подвигнут был. Утвердил Константин всю вселенную любовью и верою, и святым крещением просветил весь мир, и закон Божий по всей вселенной заповедал. И разрушил храмы идольские с ложно возвеличенными богами, а церкви святые по всей вселенной поставил во славу Бога, в Троице славимого, Отца, и Сына, и Святого Духа, и крест обрел, всего мира спасение. С блаженной и богомудрой матерью своей святой Еленой и с детьми многими привел к Богу святым крещением людей бесчисленное множество. И жертвенники бесовские истребил, и храмы идольские разрушил, и украсил церквами и города, и всю вселенную, и повелел пением и молитвами в церквах память святым совершать и праздники праздновать во славу и хвалу Богу. То же блаженный князь Владимир и бабка его Ольга совершили.
