Блаженый же князь Володимеръ, внукъ Олжинъ, крестився самъ, и чяда своя, и всю землю Рускую крести от конца до конца, храмы идольскыя и требища всюду раскопа и посѣче,[24] и идолы съкруши, и всю землю Рускую и грады честными церкви украси, и памяти святыхъ въ церквахъ творяще пѣниемъ и молитвами, и празноваше свѣтло праздники Господьскыя. И три трапезы поставляше: первую митрополиту съ епископы, и съ черноризцѣ, и съ попы; вторую нищимъ и убогымъ; третью собѣ, и бояромъ своимъ, и всѣмъ мужемъ своимъ. Подобя ся царемъ святымъ, блаженый князь Володимеръ, пророку Давыду, царю Иезекѣю,[25] и треблаженому Иосѣю,[26] и великому Коньстянтину, иже избраша и изволиша Божий законъ боле всего, и послужиша Богу всѣмъ сердцемъ, и получиша милость Божию, и наслѣдиша рай, и прияша царство небесное, и почиша со всѣми святыми, угожьшими Богу. Тако же и блаженый князь Володимеръ, послуживъ Богу всимъ сердцемъ и всею душею. Не дивимся, възлюбленѣи, аще чюдесъ не творить по смерти, мнози бо святии праведнѣи не створиша чюдесъ, но святи суть. Рече бо нѣгдѣ о томъ святый Иоаннъ Златоустый:[27] «От чего познаемъ и разумѣемъ человека свята, от чюдесъ ли, или от дѣлъ?» И рече: «От дѣла познати, а не от чюдесъ, много бо и вълсви чюдесъ створиша бѣсовскымъ мечтаниемъ». И бяху святѣи апостоли, и бяху лжии апостоли, и бѣша святѣи пророци, и бяху лжии пророци, слугы диаволя, ино чюдо, самъ сотона преображается въ ангелъ свѣтелъ. Но от дѣлъ разумѣти святого, яко же апостолъ рече: «Плодъ духовный есть любы, радость, терпѣние, благовѣрие, благость, кротость и въздержание. На таковыхъ нѣсть закона».[28] Блаженый же князь Володимеръ всимъ сердцемъ и всею душею Бога възлюби и заповѣди его взыска и съхрани. И вся страны боахуся его и дары ему приношаху. Възвеселися, и възрадовася о Бозѣ и о святѣмъ крещении, и хваляшеся, и славяше Бога о всемъ томъ князь Володимеръ. И сице в радости смирениемъ сердца глаголаше: «Господи Владыко благый, помянулъ мя еси и привелъ мя еси на свѣтъ, и познахъ тя, всея твари творца. Слава ти, Боже всѣхъ, Отче Господа Бога нашего Исуса Христа! Слава ти съ Сыномъ и Святымъ Духомъ, сице мя помиловавъ. Въ тмѣ бяху, диаволу служа и бѣсомъ, но ты мя святымъ крещениемъ просвѣти. Акы звѣрь бяхъ, многа зла творях въ поганьствѣ и живяхъ акы скотина, но ты мя укроти и наказа своею благодатью. Слава ти, Боже в Троицы славимый, Отче, и Сыне, и Святый Душе! Троице Святая, помилуй мя, настави мя на путь твой и научи мя творити волю твою, яко ты еси Богъ мой!» Князь же Володимеръ поревнова святыхъ мужь дѣлу и житию ихъ, и възлюби Аврамово[29] житие и подража странолюбию его, Иаковлю[30] истину, Моисѣеву[31] кротость, Давыдово безлобие, Констянтина, царя великого, перваго царя кристианского, того подражая правовѣрие, боле же всего бяше милостыню творя князь Володимеръ. Иже немощныа и старыа не можаху доити княжа двора и потребу взяти, то въ домы имъ посылаше, немощнымъ и старымъ, всяку потребу блаженый князь Володимеръ даяше. И не могу сказати многыа его милостыня, не токмо въ дому своемъ милостыню творяше, но и по всему граду, не въ Киевѣ единомъ, но и по всей земле Руской. И въ градѣхъ, и въ селѣхъ, вездѣ милостыню творяше, нагыа одѣвая, альчныя кормя и жадныя напаяя; странныа покоя милостью; церковникы чтя, и любя, и милуя, подавая имъ требование, нищая, и сироты, и вдовица, и слѣпыя, и хромыя, и трудоватыя, вся милуя, и одѣвая, и накормя, и напаяя.	Блаженный князь Владимир, внук Ольгин, крестившись сам, и детей своих, и всю землю Русскую крестил из конца в конец. Храмы и жертвенники идольские всюду раскопал и посек, и идолов сокрушил, города и всю землю Русскую церквами украсил, и память святым в церквах совершал пением и молитвами, и праздновал светло праздники Господни. Три стола накрывал: первый митрополиту с епископами и монахами, и с попами; второй нищим и убогим; третий себе, и боярам, и мужам всем своим. Подражал царям святым блаженный князь Владимир, пророку Давиду, царю Иезекии, и трижды блаженному Иосии, и великому Константину, которые избрали и предпочли закон Божий всего превыше, и послужили Богу всем сердцем, и получили милость Божию, и наследовали рай, и приняли царство небесное, и почили со всеми святыми, угодившими Богу. Подобен же им блаженный князь Владимир, послуживший Богу всем сердцем и всей душой. Не станем удивляться, возлюбленные, что чудес он не творит после смерти, потому что многие святые праведные не сотворили чудес, но святы они. Как сказано об этом где-то у святого Иоанна Златоуста: «Как узнаем и понимаем человека святого, по чудесам или по делам?» И сказал: «По делам узнаем, а не по чудесам, потому что и волхвы много чудес сотворили бесовским наваждением». И были святые апостолы и были лжеапостолы, и были святые пророки и были лжепророки, слуги дьявола, и еще чудо — сам сатана превращается в светлого ангела. По делам узнаем святого, как апостол сказал: «Плод духовный — любовь, радость, терпение, благоверие, благость, кротость и воздержание. На таковых нет закона». Блаженный князь Владимир, возлюбя всем сердцем и всей душой Бога, заповеди его познал и соблюдал. И все страны боялись его и дары ему приносили. И возвеселился, и возрадовался Богу и святому крещению, и благодарил, и славил Бога за все то князь Владимир. И так в радости со смирением в сердце говорил: «Господи Владыка благой, помянул ты меня и привел на свет, и познал я тебя, творца всего сущего. Слава тебе, Боже всех, Отец Господа нашего Иисуса Христа! Слава тебе с Сыном и Святым Духом за то, что меня помиловал. Во тьме я был, дьяволу служа и бесам, но ты меня святым крещением просветил. Как зверь был, в язычестве много зла творил и жил, как скотина, но ты меня благодатью своей укротил и научил. Слава тебе, Боже, в Троице славимый, Отец, и Сын, и Дух Святой! Троица Святая, помилуй меня, наставь на путь истинный и научи меня исполнять волю твою, так как ты — Бог мой!» Князь Владимир следовал делу святых мужей и жизни их, и восхитился жизнью Авраама и подражал гостеприимству его, возлюбил Иаковлеву истину, Моисееву кротость, Давидово беззлобие, более же всего Константину, царю великому, первому царю христианскому, подражая в правоверии, милостыню творил князь Владимир. Если немощные и старые не могли дойти до княжеского двора и взять необходимое, то блаженный князь Владимир к ним домой посылал и все, что нужно, давал. Не могу описать многие его милости — милосердие проявлял не только в доме своем, но и по всему городу, не только в Киеве одном, но и по всей земле Русской. И в городах, и в селах, везде оказывал милосердие, нагих одевая, голодных кормя, жаждущих поя, странствующим покой давая; церковников чтя, и любя, и милуя, подавал им нужное, нищих и сирот, и вдовиц, и слепых, и хромых, и страждущих, всех миловал, и одевал, и кормил, и поил.
Такоже пребывающу князю Володимеру въ добрыхъ дѣлехъ, благодать Божия просвѣщаше сердце его и рука Господня помогаше ему, и побѣжаше вся врагы своя, и бояхутся его вси. Идѣже идяше, одолѣваше: радимицѣ[32] побѣди и дань на нихъ положи, вятичи[33] побѣди и дань на нихъ положи, и ятвягы[34] взя, и сребреныя болгары[35] побѣди, и на козары[36] шедъ, побѣди я и дань на них положи.	Когда князь Владимир добрые дела совершал, то Божья благодать освещала сердце его и рука Господня помогала ему, и побеждал всех врагов своих, и боялись его все. На кого шел, одолевал: радимичей победил и дань на них положил, вятичей победил и дань на них положил, ятвягов взял, и серебряных болгар победил; и хазар, пойдя на них, победил и дань на них положил.
Умысли же и на грѣческый крадъ Корсунь[37] и сице моляшеся князь Володимеръ Богу: «Господи Боже Владыко всѣхъ, сего у тебе прошю: даси ми градъ, да прииму и да приведу люди кристианы и попы на всю землю, и да научать люди закону кристианскому». И послуша Богъ молитвы его, и прия градъ Корсунь, и взя съсуды церковныя, и иконы, и мощи священомученика Климента[38] и иныхъ святыхъ.	Замыслив поход на город греческий Корсунь, так молился князь Владимир Богу: «Господи Боже, Владыка всех, одного у тебя прошу: дай мне город, чтобы взял и привел людей христиан и попов на всю землю, и пусть учат людей закону христианскому». И услышал Бог молитву его, и взял он город Корсунь, и сосуды церковные, и иконы, и мощи священномученика Климента и других святых.
И въ ты дни бѣаста цари два въ Цариградѣ, Констянтинъ и Василий,[39] и посла къ нимъ Володимеръ, прося у нихъ сестры оженитися, да бы ся болма на кристианский законъ направилъ. И даста ему сестру свою, и дары многы присласта ему, и мощи святыхъ даста ему.	И в те дни были два царя в Царьграде: Константин и Василий. И послал к ним Владимир, прося у них сестру себе в жены — да укрепится он еще больше в законе христианском. И дали они ему сестру свою, и дары многие прислали ему, и мощи святых дали ему.
И тако добрѣ поживе благовѣрный князь Володимеръ и сконча житие свое въ правовѣрнѣй вѣрѣ о Христѣ Исусѣ Господѣ нашемъ и съ благовѣрною Олгою. И та бо шедши къ Царюграду, приала бяше святое крещение, и много сътворивъ добра въ житии семъ предъ Богомъ, и сконча житие свое въ добрѣй вѣрѣ, и почи съ миромъ, в руцѣ Божии душю предавше. И еще живу сущю Володимиру князю, рать бяше от печенѣгъ, Володимеръ же бяше болѣзнию одержимъ, въ той же болѣзни предасть душю свою въ руцѣ Божии.	И так добродетельно прожил благоверный князь Владимир, и окончил жизнь свою в правоверной вере о Христе Иисусе Господе нашем, как и благоверная Ольга. Она прежде него, пойдя в Царьград, приняла святое крещение, и много сделав добра в этой жизни пред Богом, кончила жизнь свою в истинной вере, и почила с миром, в руки Божий душу предав. И когда была война с печенегами, еще был жив Владимир князь, но болен, и от этой болезни предал душу свою в руки Божий.
Молитва святого князя Володимера. Володимеръ князь, отходя свѣта сего, сице моляшеся, глаголя: «Господи Боже мой, не позналъ тебе бяху, но помиловалъ мя еси и святымъ крещениемъ просвѣтилъ мя еси, и познахъ тя, Боже всѣхъ, святый творче всея твари, Отче Господа нашего Исуса Христа, слава ти съ Сыномъ и Святымъ Духомъ! Владыко Боже, не помяни моей злобѣ, не позналъ есмь тебе въ поганьствѣ, нынѣ же тя знаю и ведаю, Господи Боже мой, помилуй мя. Аще мя хочеши казнити и мучити за грѣхы моя, казни самъ мя, Господи, бѣсомъ не предай же мене!» И сице глаголя и моляся Богу, преда душю свою съ миромъ ангеламъ Господнимъ и успе. «Праведныхъ бо души въ руку Божию суть»,[40] «и мъзда имъ от Господа, и строение имъ от Вышняго, того ради приимуть вѣнець красоты от руки Господни».[41]	Молитва святого князя Владимира. Владимир князь, отходя от света сего, так молился, говоря: «Господи Боже мой, не познал я тебя, но помиловал ты меня и святым крещением просветил меня, — и познал я тебя, Боже всех, святой творец всего сущего, Отец Господа нашего Иисуса Христа, слава тебе с Сыном и Святым Духом! Владыка Боже, не помяни моего зла, не знал я тебя в язычестве, теперь же знаю тебя и ведаю. Господи Боже мой, помилуй меня. Если хочешь меня казнить и мучить за грехи мои, казни сам, Господи, не предавай меня бесам!» И так Богу молясь, предал душу свою с миром ангелам Господним и умер. «Праведных души в руках Божьих», «и награда им от Господа, и воздаяние им от Вышнего, и примут они венец красоты из руки Господней».
По святомъ крещении поживе блаженый князь Володимеръ 28 лѣтъ.[42] На другое лѣто по крещении къ порогамъ ходи,[43] на третье Корсунь городъ взя,[44] на четвертое лѣто церковь камену святыя Богородица заложи,[45] а на пятое лѣто Переяславль заложи,[46] въ девятое лѣто десятину от имения своего блаженый христолюбивый князь Володимеръ вда церкови святѣй Богородицѣ.[47] О томъ бо и самъ Господь рече: «Идѣже есть съкровище ваше, ту и сердце ваше будеть».[48] Блаженый же князь Володимеръ имяше съкровище свое на небесѣхъ, съкрывъ милостынею и добрыми своими дѣлы, тамо и сердце его бѣ въ царствии небеснѣмъ. И Богъ поможе ему, и сѣде въ Киевѣ на мѣстѣ отца своего Святослава и деда своего Игоря. А Святослава князя печенѣзѣ убиша, а Ярополкъ[49] сѣде въ Киевѣ на мѣстѣ отца своего Святослава; и Олегъ, идый съ вои у Вруча града, ся обломи мостъ съ вои, и угнетоша Олга[50] въ гребли, а Ярополка убиша[51] въ Киевѣ мужи Володимеровѣ. И сѣде въ Киевѣ князь Володимеръ въ осмое лѣто по смерти отца своего Святослава, мѣсяца июня в 11, въ лѣто 6486.[52] Крестилъ же ся князь Володимеръ въ десятое лѣто по убьении брата своего Ярополка.[53] И каашеся и плакаше блаженый князь Володимеръ всего того, елико створи въ поганьствѣ, не зная Бога. Познавъ же Бога истиннаго, творца небу и земли, покаявся всего и отврьжеся дьавола и бѣсовъ, и всея службы его, и послужи Богу добрыми дѣлы своими и милостынею. Успе съ миромъ мѣсяца июля в 15 дьнь, въ лѣто 6523 о Христѣ Исусѣ Господѣ нашемъ.	После святого крещения прожил блаженный князь Владимир двадцать восемь лет. На другой год после крещения к порогам ходил, на третий год Корсунь город взял, на четвертый год церковь каменную святой Богородицы заложил, а на пятый год Переяславль заложил, в девятый год десятину блаженный христолюбивый князь Владимир дал церкви святой Богородицы из достояния своего. Об этом и сам Господь сказал: «Где сокровище ваше, там и сердце ваше будет». А блаженный князь Владимир сокровище свое на небесах милосердием и добрыми делами скрыл, там и сердце его было в царстве небесном. И Бог помог ему, и сел в Киеве на месте отца своего Святослава и деда своего Игоря. А Святослава князя печенеги убили, а Ярополк сел в Киеве на месте отца своего Святослава. И когда Олег шел с воинами у Овруча города, обломился мост с воинами, и задавили Олега во рву, а Ярополка убили в Киеве люди Владимира. И сел в Киеве князь Владимир в восьмой год после смерти отца своего Святослава, 11 июня, в год 6486 (978). Крестился князь Владимир в десятый год после убийства брата своего Ярополка. Каялся и оплакивал блаженный князь Владимир все то, что совершил в язычестве, не зная Бога. Познав же Бога истинного, творца неба и земли, покаявшись во всем и отвергнув бесов и дьявола и служение ему, послужил Богу добрыми своими делами и милосердием. Преставился с миром 15 июля 6523 (1015) года о Христе Иисусе Господе нашем.
