6 ЯНВАРЯ	6
ЯНВАРЯ
МЕСЯЦА ГЕНВАРЯ ВЪ 6 ДЕНЬ. ВЪСПОМИНАНИЕ ТВОРИМЪ СВЯТЫХ БОГОЯВЛЕНИИ[1] ГОСПОДА БОГА И СПАСА НАШЕГО ИСУСА ХРИСТА	МЕСЯЦА
ЯНВАРЯ В 6-Й ДЕНЬ. ВОСПОМИНАНИЕ ТВОРИМ СВЯТОГО БОГОЯВЛЕНИЯ ГОСПОДА БОГА И
СПАСИТЕЛЯ НАШЕГО ИИСУСА ХРИСТА
Хотяй Господь Богъ нашь «исполнити всю правду»[2] и «вся иудейская
законы уставити»,[3]
да никтоже от нихъ речеть, яко противенъ Богу есть, и написаному закону Моисеомъ[4] противумудръствуетъ, видѣвъ иудеи къ Иоанну грядуща, и той крещаше я въ Иерданѣ-рецѣ, прииде же и Самъ къ Иоанну, глаголя: «Прииди и крести мя, не яко требуя оцыщениа, но яко очистити хотя миру грѣхи». Иоаннъ же, яко пророкъ Духомъ Святымъ вѣдый его Сына суща Божиа, не смѣяше крестити его. Егда увѣдѣ затояща себе и повелѣвающа крестити, тогда съ страхом и трепетомъ простре руку на святый его верхъ.[5]
И абие
отверзошася небеса и прииде же небесе глас, глаголя: «Се есть Сынъ мой възлюбленый, о немъ же благоизволих!».[6]	Господь
Бог наш, желая всю правду исполнить и соблюсти все иудейские законы, — да никто
из них <иудеев> не скажет, что противен Богу и мудрствует против закона,
записанного Моисеем, видя, что иудеи идут к Иоанну, и тот крестит их во
Иордане-реке, и сам пришел к Иоанну, говоря: «Приди ко мне и крести меня, не
как нуждающегося в очищении, но как стремящегося очистить грехи миру». Иоанн
же, будучи пророком, с помощью Духа Святого зная, что он — Сын Божий, не смел
его крестить. Когда же увидел, что он настаивает и повелевает крестить
<себя>, тогда со страхом и трепетом простер руку на святую Его главу. И
внезапно отверзлись небеса, и с небес донесся голос, говорящий: «Это — Сын мой
возлюбленный, в котором мое благоволение!»
