В ТОЙ ЖЕ ДЕНЬ. ПИСАНИЕ ЖИТИА И МУКИ СВЯТАГО ЕУСТАФИА И ЖЕНЫ ЕГО ФЕОПЕСТИА, И ЧАДУ ЕЮ АГАПИА И ФЕОПИСТА	В ТОТ ЖЕ ДЕНЬ. ОПИСАНИЕ ЖИТИЯ И МУЧЕНИЯ СВЯТОГО ЕВСТАФИЯ, И ЖЕНЫ ЕГО ФЕОПИСТИИ, И ДЕТЕЙ ИХ АГАПИЯ И ФЕОПИСТА
В дни царьства Траияня,[1] идольстии жрътвѣ одръжащи, бѣ етеръ стратилатъ,[2] именемъ Плакида, добра рода и славна, богатъ же зѣло паче всѣхъ златомъ и прочею службою; еллинъ же бѣ вѣрою, а дѣлы праведными украшашеся, алчющая насыщая, жаждущая напаяа, нагыа одѣвая, впадающимъ в бѣду помагая, ис темница изимаа, и всѣмъ людемъ отнюдъ помогая. Имѣ же и жену тояжде вѣры и си же дѣла творящю. Родиста же два сына и въспитаста а в той же добрѣй воли. Бѣ же тако прослулъ мужь сьй доброю дѣтелию и крѣпостию и силою, яко вси погании и варвари[3] именованиемъ токмо бояхуся его. Бѣ бо храборъ велий и ловецъ худогъ, по вся дни весело ловя. Человѣколюбецъ же Богъ, призвавый всегда вездѣ сущая достойны его, не позрѣ его въ тмѣ идольских жрътвъ, но якоже писано есть, яко: «Всякъ человѣкъ, бояйся Бога, въ всякомъ языцѣ, приятъ имъ есть»,[4] въсхотѣ сего спасти сицемъ образомъ: отшедшю бо ему въ единъ отъ днии по обычаю на ловъ свой и съ слугами своими, явися ему стадо елений ходяще; и растрои воя, и начя гонити. И видѣ елень болий въ всемъ стадѣ и краснѣй; отлучи же ся елень той от стада, отлучи же ся и Плакида с маломъ чадѣ, и начятъ с ними гонити по немъ. Гонящим же, изнемогоша всѣмъ, Плакида же единъ начятъ гонити по немъ, отлучи же ся далече от дружины. Долго же гонящу ему, елень той взиде на камень высокъ и ста на немъ. Приѣхавъ же близъ стратилатъ, не сущю ни единому с нимъ отъ слугъ, помышляше же в себѣ, которымъ образомъ уловилъ бѣ. Богъ же, съдръжай и устраяй всячьскиа пути на спасение человѣкомъ, той паче улови явлениемъ своимъ, не якоже Корнилия Петром, но якоже Павла гоняща.[5] Долго же стоящу Плакидѣ и зрящу и дивящуся, показа ему Богъ чюдо сицемъ образомъ, да якоже при Валамѣ проглагола оселъ его человѣчьски.[6] Такожде и сей показа над рогама же еленема образъ святаго креста, свѣтящься паче солнца, посредѣ же рогу образъ святаго тѣла Христова.[7] Гласъ же человѣческъ Богъ вложи вѣ елень, и рече к нему, глаголя: «О Плакидо! Что мя гониши? Се тебе ради пришелъ есмъ на животнѣмь семъ явитися тебѣ. Азъ есмь Иисус Христос, егоже ты нынѣ не вѣдый чтеши. Добрыя бо твоа дѣтели, яже ты твориши нищим, взидоша пред мя, да того ради приидохъ явитися тебѣ на животнѣмъ семъ възловить тебѣ, нѣсть бо праведно моему приятелю вязити в сѣти неприязненѣ». Си слышавъ стратилатъ и пристрашенъ бѣ, спаде с коня; годинѣ же минувши въста, хотя истѣе видѣти, и рече: «Кто есть глас сей, иже слышу, явися мнѣ глаголя, да вѣрую в тя!» Рече же к нему Господь: «Разумѣй, Плакидо, азъ есмь Иисус Христос, сътворей небо и землю от не сущихъ; азъ есмъ сътворей солнце на просвѣщение дни, луну же и звѣзды въ просвѣщение нощи; азъ есмь създавый человѣка от земля и спасениа ради человѣческа явихся плотию, пропятие же пострадавъ и погребение, и въ третий день въскресохъ».[8] Си слышавъ Плакида, паде на земли, глаголя: «Вѣрую в тя, Господи, яко ты еси творець всячьскимъ и животворець мертвымъ». Рече же к нему пакы Господь: «Аще вѣруеши в мя, иди въ град и приступи къ иерѣю хрестияньску, и проси у него крещениа». Рече же Плакида: «Господи! Велиши ли си повѣдати женѣ моей и чадома моима, да и ти вѣру имуть?» Рече же Господь: «Повѣждь, и крещьшеся истребитеся от грѣхъ вашихъ. И прииди сѣможде, да тебѣ явѣ сътворю спасеныя тайны». Съшедъ же Плакида, уже вечеру сущу, начятъ повѣдати женѣ своей великая чюдеса Христова, яже видѣвъ. Егдаже сконча глаголя, възопи жена его, глаголющи: «О господи мой! Пропятаго ли видѣлъ еси, егоже христиане чтуть? Тъй бо есть Богъ истинный, спасаяй тацѣми знамении вѣрующая в онь». Еще же възъпи, глаголющи: «Помилуй мя, Господи Иисусе Христе, и оба младенца моя!» Рече же к мужу: «И азъ в мимошедшую нощь видѣхъ и́ во снѣ, глаголющь: утрѣ ты и мужь твой и обѣ чадѣ твои приидѣте к мнѣ и разумѣите, яко азъ есмь Иисус Христос. Пойди убо в сию нощь, да идемь и крестимся: сим бо крещениемь свои ему будемъ». И рече к ней Плакида: «Се же бо и мнѣ рече явлий ми ся». И егда полунощи бысть, таи поимша оба младенца и мало от отрокъ, приидоша к иерѣю. Оставльше же внѣ слугы и възвѣстиша иереови вся видѣниа ею, исповѣдавше же ся вѣровати в Господь нашь Иисус Христос, молиша и́, да дасть имъ знамение крещениа Христова. Он же рад бывъ и прославль Господа Иисус Христа, хотящаго всякого человѣка спасти и в разумь истинный привести, и поимъ а́, молитву сътвори над ними и научи а́ вѣре, крести же во имя Отца и Сына и Святаго Духа. Плакиду же нарече Еустафиа, а жену его Татьяну нарече Феопесту, сына же прьвенца нарече Агапия, а меншаго нарече Феописта; и дасть имъ от святаго причастия святаго тѣла и крове Господа нашего Иисус Христа, и отпусти а́, рекъ: «Богъ буди с вами и царьство свое даждь вамъ! Аз бо разумѣхъ, яко рука Господня над вами есть. Вы же, егда въдворитеся в раи пища, помянете душу мою Иоаннову, ей, молюся вам».	В дни правления Траяна, когда приносили жертвы идолам, был некий стратилат по имени Плакида, человек высокого и славного рода, имеющий более других золота и всякого добра; он был язычником, но украшал себя праведными делами, кормил голодных, поил жаждущих, одевал нагих, помогал бедствующим, освобождал из темниц и вообще стремился помочь всем людям. Была у него жена, той же веры, но, как и он, творила она (добрые) дела. У них родились два сына, и они воспитали их в тех же добрых обычаях. И так как этот муж прославился добродетелями, храбростью и силою, то все чужестранцы и варвары боялись одного только его имени. Он был храбрый воин и искусный охотник и всегда развлекался охотой. Человеколюбец Бог, всегда и везде призывающий к себе достойных себя, не посмотрел на то, что он находится во тьме идолопоклонства, — ведь сказано в Писании: «Человек, боящийся Бога, в любом народе, приятен ему», — захотел спасти его следующим образом: когда однажды Плакида отправился, как обычно, на охоту со своими слугами, появилось стадо бегущих оленей; Плакида расставил охотников и начал гон. И увидел он оленя, самого крупного и самого красивого во всем стаде, и отделился тот олень от стада, Плакида тоже отделился с небольшой свитой и стал с ними преследовать этого оленя. Пока они его преследовали, все обессилели, и Плакида один продолжал гнаться за оленем, и вскоре оказался далеко от его дружины. Долго гнал он оленя, олень вскочил на высокую скалу и стал на ней. Стратилат подъехал ближе, обдумывая, каким бы ему образом поймать оленя, ведь слуг с ним не было. Но Бог, всем управляющий и устраивающий различные пути для спасения людей, уловил он своим явлением — не так, как Корнилия — Петром, а как Павла-гонителя. Долго так стоял Плакида, смотрел и удивлялся, и показал Бог чудо так, как некогда Валааму, когда осел заговорил по-человечески. И еще над рогами оленя показался святой крест, светящийся ярче солнца, и между рогами — образ святого тела Христова. И дал Бог человеческий голос оленю, который сказал ему: «О Плакида! Зачем ты меня гонишь? Это ведь ради тебя пришел я, чтобы явиться тебе в образе этого животного. Я — Иисус Христос, которого ты почитаешь, не ведая. Твои добрые дела, что творишь ты нищим, дошли до меня, и из-за этого я пришел явиться тебе в образе этого животного и уловить тебя, так как несправедливо, чтобы последователь мой увяз в дьявольской сети». Услышав это, стратилат, объятый страхом, упал с коня; через некоторое время он встал и, желая лучше увидеть, сказал: «Кто ты, голос, который я слышу? — явись мне, говорящий, чтобы я уверовал в тебя!» Сказал ему Господь: «Знай, Плакида, я Иисус Христос, сотворивший небо и землю из небытия; я, сотворивший солнце, чтобы дать свет дню, и луну и звезды, чтобы дать свет ночи; я, создавший человека из земли, ради спасения человека явился во плоти, претерпел распятие и погребение и в третий день воскрес». Услышав это, Плакида упал на землю и сказал: «Верую в тебя, Господи, верую, что ты творец всего и животворец мертвых». И снова сказал ему Господь: «Если веруешь в меня, иди в город, обратись к христианскому священнику и проси у него крещения». Плакида же сказал: «Господи! Велишь ли сказать об этом моей жене и детям моим, чтобы и они уверовали?» Сказал Господь: «Расскажи им; крестившись, вы очиститесь от ваших грехов. А потом приди сюда, я тебе раскрою тайны спасения». Вернувшись домой, когда уже был вечер, Плакида стал рассказывать жене своей о великих чудесах Христа, которые он видел. Когда он кончил, жена воскликнула: «О господин мой! Ты видел распятого, которого чтут христиане? Он есть Бог истинный, такими знамениями спасающий верующих в него!» И еще она воскликнула: «Помилуй меня, Господи Иисусе Христе, и обоих моих младенцев!» И сказала она мужу: «И я прошлой ночью видела его во сне, и он сказал: “Завтра ты, и муж твой, и оба ребенка придете ко мне и поймете, что я есть Иисус Христос”. Давай пойдем этой ночью и крестимся: этим крещением мы станем ему свои». И сказал ей Плакида: «То же самое сказал мне тот, который мне явился». И когда наступила полночь, с обоими младенцами и несколькими слугами пришли они к священнику. Оставив слуг снаружи, они (вошли) и рассказали священнику обо всех видениях; объявили себя верующими в Господа нашего Иисуса Христа и просили его свершить над ними таинство крещения Христова. Священник обрадовался и прославил Господа Иисуса Христа, который хочет спасти всякого человека и привести его к истине, и, взяв их, сотворил он над ними молитву, научил их вере и крестил их во имя Отца и Сына и Святого Духа. Плакиду он назвал Евстафием, а жену его Татьяну — Феопистией, сына — первенца — Агапием, а меньшого — Феопистом; и причастил их святого тела и крови Господа нашего Иисуса Христа, и отпустил их, сказав: «Бог да будет с вами и да даст вам царствие свое. Я понял, что рука Господня над вами. Вы же, когда будете в раю, помяните мою душу, Иоанна, прошу вас!»
Утру же бывшу, и поимъ Еустафий мало снузникъ с собою, взиде на гору. Близ же бывъ мѣста, идѣже бѣ видѣние видѣлъ, отсла слугы, рекъ: «Поищете лова». Он же мало претръпѣвъ, паде ниць, вопия и глаголя: «Молюся тебѣ, Господи Иисусе Христе, разумѣхъ, яко ты еси Христос, сын Бога живаго, и вѣрую въ Отецѣ и Сынъ и Святый Духъ; и нынѣ приидох и молюся божеству твоему, да ми вѣсто сътвориши, еже ми си реклъ». Рече же к нему Господь: «Блаженъ еси, Еустафие, приимъ баню благодати моеа; нынѣ съвлеклъся еси истлѣннаго человѣка и облъкся еси в неистлѣннаго.[9] Нынѣ имать явитися дѣло твоеа вѣры. Понѣже оставилъ еси диавола, ищеть на тя напасти етеры; сю же аще претръпиши, приимеши вѣнецъ побѣды.[10] Се бо възнеслъся еси богатьством житиа, и смиритися имаши богатьствомъ духовным; и не мози въспятитися, поминая на древнюю славу свою, и якоже угодилъ еси земному царю, такоже потщися побѣдити диавола и хранити мою вѣру: другый бо Иовъ явитися имаши в напастехъ.[11] Блюди убо, да не взыдеть на сердце твое хула. Егда бо смиришися, прииду к тебѣ и устрою тя въ славѣ твоей пръвѣй». И си рекъ Господь, взыде на небеса, рекъ къ Устафиеви: «Нынѣ ли хощеши, да ти приидеть напасть или в послѣдняа дни?» Рече же Еустафий: «Молюся тебѣ, Господи, аще нѣкако да мимоидеть реченное, нынѣ повелѣ, да приидеть напасть. Но даждь, Господи, силу и съхрани ны от зла помышлениа, да не смутятся сердца наша». Рече же к нему Господь: «Подвизайся и крѣпися, Еустафие, благодать моа с вами буди».	Наступило утро, и Евстафий, взяв с собой нескольких всадников, поехал на гору. Около того места, где ему было видение, он отослал слуг, сказав им: «Поищите лова». И, немного подождав, упал ниц, восклицая: «Молюсь тебе, Господи Иисусе Христе, знаю, что ты Христос, сын Бога живого, верую в Отца и Сына и Святого Духа; а теперь я пришел и молюсь божеству твоему, чтобы ты открыл мне то, о чем говорил мне тогда!» И сказал ему Господь: «Блажен ты, Евстафий, ибо принял баню моей благодати; теперь ты стряхнул с себя тленного человека и облекся в нетленного. Ныне же проявится дело твоей веры. Поскольку ты отошел от дьявола, он хочет для тебя какой-нибудь беды; если перенесешь ее, примешь венец победы. Ты вознесся богатством житейским, а теперь должен смириться богатством духовным; не вздумай отступить, вспомнив свою прежнюю славу,— как ты угодил земному царю, постарайся победить дьявола и хранить мою веру: ты будешь вторым Иовом в несчастьях. Опасайся, чтобы хула не вошла в твое сердце. Когда смиришься, приду к тебе и устрою тебя в прежней славе». И, сказав это, Господь взошел на небеса, говоря Евстафию: «Хочешь ли, чтобы несчастье пришло к тебе сейчас или потом?» И сказал Евстафий: «Молю тебя, Господи, если никак нельзя избежать предначертанного, пусть ныне придет бедствие. Но дай, Господи, силу и сохрани нас от злого помышления, и пусть не смутятся наши сердца!» Сказал ему Господь: «Борись и крепись, Евстафий, с вами будет моя благодать».
