МѢСЯЦА ИЮЛЯ В 11 ДЕНЬ. ЖИТИЕ СВЯТЫЯ БЛАЖЕННЫЯ И РАВНОАПОСТОЛНЫЯ И В ПРЕМУДРОСТИ ПРЕСЛОВУЩИЯ ВЕЛИКИЯ КНЯГИНИ ОЛГИ, НАРЕЧЕННЫЯ, ВО СВЯТОМЪ КРЕЩЕНИИ ЕЛЕНЫ, ИЖЕ БЫСТЬ ПРЕДТЕЧА РУСКАГО РОДА ВО БЛАГОЧЕСТИЕ К БОГУ И О МУЖЕСТВЕННОМЪ ЕЯ ПОДВИЗѢ, И КАКО В ЦАРСТВУЮЩЕМ ГРАДЕ ПОЛУЧИ СВЯТОЕ КРЕЩЕНИЕ, И О ПРЕСТАВЛЕНИИ ЕЯ, И О ПРИНЕСЕНИИ МНОГОЧЮДЕСНЫХ И НЕТЛѢНЫХ МОЩЕЙ ЕЯ, И ОТЧАСТИ ПОХВАЛА.	МЕСЯЦА ИЮЛЯ В ОДИННАДЦАТЫЙ ДЕНЬ. ЖИТИЕ СВЯТОЙ БЛАЖЕННОЙ И РАВНОАПОСТОЛЬНОЙ И СЛАВНОЙ В ПРЕМУДРОСТИ ВЕЛИКОЙ КНЯГИНИ ОЛЬГИ, НАРЕЧЕННОЙ ВО СВЯТОМ КРЕЩЕНИИ ЕЛЕНОЙ, КОТОРАЯ БЫЛА ПРЕДВОЗВЕСТНИЦЕЙ БЛАГОЧЕСТИЯ К БОГУ В РУССКОМ НАРОДЕ, И О МУЖЕСТВЕННОМ ЕЕ ПОДВИГЕ, И КАК В ЦАРЬГРАДЕ ПОЛУЧИЛА СВЯТОЕ КРЕЩЕНИЕ, И О ПРЕСТАВЛЕНИИ ЕЕ, И О ПРЕНЕСЕНИИ МНОГОЧУДЕСНЫХ И НЕТЛЕННЫХ МОЩЕЙ ЕЕ, И ПОСИЛЬНАЯ ПОХВАЛА
Благослови, отче.	Благослови, отче.
Приидѣте вси правовѣрнии всея Руския земля собори, всяко достояние и всякъ возрастъ, возрадуемся Господеви и поклонимся, и припадемъ, поюще ему пѣснь в веселии, хваляще и благословяще пресвятое имя его и великую милость, юже сотвори дивно с нами, яко воцарися в нас и укрѣпил есть нас неподвижно вѣровати ему, единому в Троицы Отцу и Сыну и Святому Духу, истинному Богу нашему, яко той сотвори нас и призва ко своей благодати, стяжав нас себѣ люди изрядны, царское священие, язык святъ, очистив водою и освятив Духом Святым, и пременивъ нас от прелести идолскаго помрачения, тмы грѣховныя, в познание свѣта божественыя его благодати и истинны, и показавый нас сыны свѣта и сыны дневи. Не ходатай бо, ни ангелъ, ни апостоли, ни пророцы, ни учителие и изряднии, ни книжницы премудрии, ни вѣтии словеснии научиша ны в познание таковыя превеликия божественныя благодати, но сам Господь Исусъ Христосъ,[1] яко вѣсть своим неизреченным промыслом конечное свое милосердие, богатно хотя излияти в Рустей земли.	Приидите, все правоверные всей Русской земли соборы, всякое сословие и всякий возраст, возрадуемся Господу, преклонимся и припадем пред ним, воспевая ему песнь в веселии, восхваляя и благословляя пресвятое имя его и великую милость, которую он дивно даровал нам, воцарившись в нас и укрепив нас незыблемо веровать ему, единому в Троице Отцу и Сыну и Святому Духу, истинному Богу нашему, ибо он сотворил нас и призвал к своей благодати, сделав нас для себя людьми избранными, — князь освящен, и народ свят, очистив нас водою и освятив Духом Святым, избавив нас от коварства дьявольского помрачения, тьмы греховной, в познание света божественной его благодати и истины, и показал нас сынами света и сынами дня. Ибо не посланник, не ангел, не апостолы, не пророки, не учители избранные, не книжники премудрые, не витии сладкоречивые научили нас познанию такой великой божественной благодати, но сам Господь Иисус Христос, ибо знает он своим неизреченным промыслом последнее свое милосердие, щедро желая излить его на Русской земле.
Зачало. И тако первѣе благоволи вдохнути благодать свою в душу немощнѣйшаго сосуда женскаго состава; аще и по естеству немощенъ бяше сосуд, но великое сокровище благодати блюдомо есть в сосудѣ; и кто может украсти е? Его же сосуда избра Господь вдовствена и целомудрена, премудрости и разума исполнена, и всюду кипяща духовным благовонием; еще же самодержавна, яко же властию земнаго царствия, выше же сих и над страстьми телесными царствуя. Бяше во всей жизни своей святая и богомудрая и равноапостолная великая княгиня Олга, претворенная во святом крещении Елена, ея же памят празнуем днес. Юже произведе Плесковская страна, иже от области царствия великия Руския земли, от веси именуемыя Выбутцкая,[2] близ предѣл немеческия власти жителей, от языка варяжска, от рода же не княжеска, ни велможеска, но от простых людей. От Варяг бо Русию прозвахомся, а преже словени быхом. Еще бо граду Пскову[3] не сущу, но бяше тогда началный град во странѣ той, зовомый Изборескъ,[4] идѣже преже господьствуя Труворъ,[5] брат перваго рускаго великаго князя Рюрика,[6] иже бѣ свекоръ сея блаженныя Олги; ея же молитвою и пронаречением наздася преславный град Псковъ. Блажен еси и преблажен Богом препрославленый граде Пскове, яко всесилный Богъ отъ страны твоея произведе и породи нам таковый чюдный плод благоцветущий, блаженную Олгу. Блажени есмы и мы, сподобившеся от Бога получити таковый благоплодный царственый зрѣлый сад, благочестиемъ умноженый, пресладкий добродѣтелми и добролиственный благоуправлением; им же мы вси, яко благосѣннолиственымъ древом покрываеми, от всякого вреда вражия избавляемся душевне и телесне, от него же и пресладкаго вкуса богоразумия насыщаеми веселимся.	Зачало. И так прежде всего благоволил он вдохнуть благодать свою в душу слабого вместилища женской природы; и хотя по естеству вместилище это немощно, но великое сокровище благодати сохраняется во вместилище, и кто может его украсть? Вместилище это, избранное Господом, вдовствует и целомудрствует, исполнено премудрости и разума, распространяет всюду духовное благоухание; кроме того, вместилище это самодержавно, как властью земного царства, так, и более того, и над страстями телесными властвуя. Таковой была во всей жизни своей святая, богомудрая и равноапостольная княгиня Ольга, нареченная во святом крещении Еленой, память которой празднуем ныне. Ее породила Плесковская страна, часть владений великой Русской земли, из села, называемого Выдубица, близ границ с немецкими землями, из народа варяжского, не из рода княжеского ни вельможеского, но из простых людей. Варяги называли нас русью, а прежде мы были славяне. Еще не было города Пскова, а был тогда предшествующий ему город, названный Изборском, где прежде правил Трувор, брат Рюрика, первого великого князя русского, который был свекром этой блаженной Ольги; по ее молитвам и предсказанию создан был преславный город Псков. Блажен и преблажен и ты, препрославленный город Псков — всесильный Бог из твоей земли произвел и породил нам такой чудный благоцветущий плод, блаженную Ольгу. Блаженны и мы, удостоенные Богом получить такой благоплодный, царственный, цветущий сад, благочестием умноженный, добродетелями преисполненный, благонравием расцветший; все мы им, как пышно разросшимся древом, покрываемся, от всякаго вреда вражия избавляемся душой и телом, сладкого вкуса богоразумия от него насыщаясь, веселимся!
Пророчество и благословение Рустей земли святаго апостола Андрея Первозваннаго.[7] Благодатию и человѣколюбием Господа Бога и Спаса нашего Исуса Христа, исполняющаго пророчество и благословение святаго и великаго во апостолѣх Андрея Первозваннаго, егда проповѣдая слово Божие въ Синопии и в Херсонии, и оттоле бывшу ему на рецѣ на Днѣпре, и тамо на горах помолися и крестъ постави, и благослови и пророчествова на том мѣсте бытие Киева града и всей Рустей земли святое крещение. Оттоле же пришедъ, идѣже нынѣ великий Новград стоит, и тамо жезлъ свой водрузи въ веси, нарицаемѣй Грузино,[8] идѣже нынѣ есть церковь во имя святого апостола Андрея Первозваннаго. Пробразоваше же божественым крестом в Рустей земли священное чиноначалие.	Пророчество и благословение Русской земле святого апостола Андрея Первозванного. Благодатью и человеколюбием Господа Бога и Спаса нашего Иисуса Христа, исполняющего пророчество и благословение святого и великого Андрея Первозванного, — когда, проповедуя слово Божие в Синопии и в Херсонии, пришел он оттуда на реку Днепр, и там на горах помолился он и крест поставил, и благословил, и предсказал, что на том месте будет город Киев, и свершится Русской земли святое крещение. Потом пришел он в то место, где ныне стоит Великий Новгород, и там водрузил он свой жезл, в селе, называемом Грузино, где ныне церковь во имя святого апостола Андрея Первозванного. Крест божественный Андрея Первозванного знаменовал, что в Русской земле будет священная иерархия.
О первомъ великомъ князе Рюрикѣ Руском. Жезлом же прообрази в Руси самодержавное царское скипетроправление, иже начася от Рюрика, его же выше рѣкохом, иже прииде из Варяг в великий Новъград со двема братома своима и съ роды своими, иже бѣ от племени Прусова, по его же имени Пруская земля именуется. Прус же брат бысть единоначалствующаго на земли римскаго кесаря Августа, при нем же бысть неизреченное на земли рождество Господа Бога и Спаса нашего Исуса Христа, превѣчнаго Сына Божия, от Пресвятаго Духа и от Пречистыя Приснодѣвы Мария. Великий же князь Рюрик в великом Новѣграде самодержавствуя, ту и скончася. Сына же своего Игоря видѣ мала суща, — остави яко двою лѣт, — его же и всю державу свою поручи князю Олгу, иже бѣ от рода его. Олег же многим странамъ одолѣ и на Царѣграде дани и выходы взимаше при царѣ Лвѣ Премудром и брате его Александре.[9]	О первом великом князе Рюрике Русском. Жезл знаменовал и самодержавное царское правление, начавшееся с Рюрика, о котором прежде мы сказали, что пришел он из Варяжской земли в Великий Новгород с двумя братьями своими и со всем родом своим, и был он от племени Прусова, по имени которого именуется Прусская земля. Прус был братом единоначальствующего на земле римского кесаря Августа, при котором свершилось неописуемое земными словами рождество Господа Бога и Спаса нашего Иисуса Христа, превечного Сына Божия, от пресвятого Духа и от пречистой Приснодевы Марии. А великий князь Рюрик в Новгороде Великом самодержавствовал и тут и скончался. Видя, что сын его Игорь мал, — ибо оставил он его двухлетним — поручил он сына своего и всю державу свою князю Олегу, который был из его рода. Олег же многие страны победил и с Царьграда дани и подати взимал при царе Льве Премудром и сыне его Александре.
