И потом блаженная Еуфросиния заложи церковь камену Святаго Спаса;[23] от начатка же Святаго Спаса до совершения церкви — 30 недѣль. И се хощу вам, братие, чюдо сказати. Бѣ муж, именем Иван, приставник над дѣлатели церковными, к немуже прихожаше глас многажды, свитающи дни, глаголя: «О, Иоанне, востани, поиди на дѣло Вседержителя Спаса!» И во един от дний, востав, прииде ко блаженной Еуфросинии и рече ей. «Ты ли, госпоже, присылаеши понужати меня на дѣло?» Она же рече: «Ни». И паки, разсмотривши, премудрая жена рече ему: «Аще не аз тя возбужаю, а кто тя позывает на таковое дѣло, того послушай сприлѣжно с потщанием».	И потом блаженная Евфросиния заложила каменную церковь Святого Спаса, от начала <закладки> Святого Спаса до завершения церкви — 30 недель. И вот, братья, хочу я рассказать вам о чуде. Был человек, по имени Иван, начальник над церковными строителями, которому много раз на рассвете дня слышался голос, говорящий: «Вставай, Иван, иди на стройку Спаса-Вседержителя!» И в один из дней, встав, пришел он к блаженной Евфросинии и сказал ей: «Это ты, госпожа, присылаешь понуждать меня к работе?» И сказала она: «Нет». И еще, поразмыслив, сказала ему премудрая жена: «Хоть и не я тебя бужу, но ты того, кто призывает тебя к таковому делу, слушайся с тщанием и усердием».
И паки другое чюдо скажю вам, добрии послушницы. Уже скончаней бывши церкви, и мала недоставшимъ плитам, нѣчимъ бяше верха совершити. И поискавше и не обрѣтоша ничтоже. И печаловашеся о том и воздыхающи и рече: «Слава тебѣ, Владыко, вседерьжителю и человѣколюбче, даровавый нам сия болшая! Дай намъ и меншая, имже свершится церковь твоя!» И тако ей помолшися, заутра по строению Божию обрѣтошася плиты в пещи.[24] И в том дни совершиша церковь и поставиша крестъ. Преподобная же Еуфросиния, видѣвше совершену церковь, возрадовася душею. И бысть священие и велия радость всѣм крестияном. И собравшися князи, и силнии мужи, и черноризцы, и простии людие, и бысть радость, и празноваша дни многи, разыдошася кождо их во свояси.	И еще другое расскажу вам чудо, добрые слушатели. Когда окончена была уж церковь, не хватило немного кирпичей и нечем было довести до конца главу. Искали их и ничего не нашли. И опечалилась из-за этого <Евфросиния> и со вздохом сказала: «Слава тебе, Владыка, вседержитель и человеколюбец, даровавший нам сие великое! Дай же нам и малое, чем завершится твоя церковь!» И вслед за тем, как она так помолилась, нашлись на утро кирпичи в печи по Божьему устроению. И в тот день закончили строить церковь и поставили крест. А преподобная Евфросиния, видя церковь законченной, возрадовалась душой. И было освящение и великая радость всем христианам. И собрались князья, и знатные люди, и чернецы, и простые люди, и была радость, и праздновали много дней, и разошлись каждый восвояси.
Видѣв же преподобная, яко исполнил Богъ желание сердца ея, и вшедши в церковь, паде ницъ на земли, и воздохнувши со слезами, и нача глаголати: «Ты, Господи, сердцевидче, благодателю, Боже богом! Милостивый Господи, призри на храм свой, яже создах во имя твое, — якоже рече Соломон: „Вышний в нерукотвореннах церквах живет".[25] Ты же, Господи, призри на мя, недостойную рабу твою Еуфросинию, и на рабы твоя сия, яже собрах во имя твое: да приимши иго твое легкое[26] на выя своя и поидут во слѣд тебе. И сотвори я овца двора твоего, и буди им пастух и дверник, да ни един от них не будет восхищен волкомъ губителя диявола. И буди им, Господи, оружие и забрало, да не приидет на ны зло и рана не подвигнется к телесем нашим.[27] И не погуби нас со безаконии нашими, и на тя упование наше положихом, яко ты еси Бог знающим тя, и тебѣ хвалу воздаю до послѣдняго ми издыхания в вѣки. Амикь».	А преподобная, увидав, что Бог исполнил желание ее сердца, войдя в церковь, пала ниц на землю и, испустив слезное воздыхание, стала говорить: «Ты, Господи, сердцеведец и благ податель, Бог богов! Милостивый Господи, призри на храм свой, что создала я во имя твое, — как сказал Соломон: «Вышний в нерукотворных церквах живет». Ты, Господи, окажи мне милость, недостойной рабе твоей Евфросинии, и сим рабам твоим, что собрала я во имя твое: да, приняв легкое твое бремя на свои выи, последуют они за тобой. И сотвори их овцами твоего двора, и будь им пастух и вратарь, чтобы никто из них не был похищен волком губителя-дьявола. И будь им, Господи, оружием и забралом, чтобы не пала на нас беда и язва не обрушилась на тела наши. И не погуби нас со беззакониями нашими, на тебя упование наше возлагаем, ибо ты Бог знающих тебя, и тебе буду воздавать хвалу до последнего моего издыхания во веки. Аминь».
Сестры же учаше, сице глаголющи: «Се собрах вы, яко кокошъ птенца своя под крылѣ, в паствину свою яко овцы, да пасетася в заповѣдехъ Божиих, да яз веселым сердцемъ подвизаюся учити вас, видящи плоды ваша трудныя. И толик дождь проливаю к вам учением, а нивы ваша во единой мѣре стоят, не ратующе, ни поступающе горе, а год приспѣвает во свершение, и лопата на гумнѣ лежит.[28] Но боюсь, егда будет плевел в вас, и предани будете огню неугасимому. Потщитеся, чадо мое, убѣжате того всего, но сотворитеся пшеницы и смелетеся в жерновах смирением и молитвами и постомъ, да хлѣб чистъ принесетеся на трапезу Христову». Сице же и всегда учаше беспрестани, яко мати чадолюбивая, к дѣтем своим любовь показующи.	И поучала она сестер, говоря так: «Для того собрала я вас, как наседка птенцов своих под крылья, как овец в свою паству, чтобы паслись вы в заповедях Божиих, чтобы мне с радостным сердцем подвизаться в вашем учении, видя плоды вашего труда. И такой дождь проливаю я на вас ученьем, а <сердечные> ваши нивы остаются в том же состоянии, не вспаханные и не возвышающиеся горе, а ведь время приближается к свершению, и лопата на гумне лежит. И боюсь я, как бы не было в вас плевелов и не были бы вы преданы неугасимому огню. Постарайтесь, чада мои, избежать всего этого, сделайтесь пшеницей и смелитесь в жерновах смирения, молитвы и поста, чтобы принесены вы были чистым хлебом для трапезы Христовой». И так всегда поучала она их беспрестанно, как чадолюбивая мать, проявляя любовь к своим детям.
Мы же, братие, на предлежашее возвратимся. Видевши же преподобная Еуфросиния монастырь свой украшен и всего блага исполнен, умысли создати вторую церковь камену, Святыя Богородица.[29] И ту свершивши, и иконами украси и, светив, дасть ю мнихом,[30] и бысть монастырь велик. И видѣвши монастыря два, превелика зело, пребогата, и рече в себѣ: «Слава тебѣ, Владыко! Благодарю тя, Святый! Что есми восхотѣла, то еси дал и скончал еси желание сердца моего, Господи!» И рече: «Господи, помилуй мя и скончай прошение мое, — да бых видѣла Пречистую Богородицу Одигитрию в сей церкви». И посла слугу своего Михаила в Царьград к цареви, нарицаемому Мануилу, и к патриарху Луцѣ з дары многоцѣнными, просящи от нею образа Святыя Богородицы, еже бѣ евангелистъ Лука написал[31] три иконы, и еще в жизни сей сущии Святой Богородицы, и постави едину во Иеросалимѣ, а другую в Царѣграде, а третию въ Ефесе. Она же с прилежанием прошаше Ефеской иконы Святой Богородицы. Видѣв же царь любовь ея, и посла в Ефес семсот оружников своих и принесе икону Святыя Богородица в Царьград. Патриархъ же Лука собра епископы и соборы вси Святыя София,[32] и благослови, и дасть образ Святыя Богородица слузѣ преподобныя. Он же с радостию прият и принесе госпоже своей Еуфросинии.	Мы же, братья, возвратимся к прежнему. Преподобная Евфросиния, видя свой монастырь украшенным и исполненным всяческих благ, задумала создать вторую каменную церковь, Святой Богородицы. И, завершив ее, украсила ее иконами, и, освятив, отдала ее монахам, и сделался большой монастырь. И, видя два столь больших и богатых монастыря, сказала она в уме: «Слава тебе, Владыка! Благодарю тебя, Святый! Что пожелала я, то ты дал и исполнил желание сердца моего, Господи!» Сказала она: «Господи, помилуй меня и исполни прошение мое, — чтобы мне видеть Пречистую Богородицу Одигитрию в этой церкви». И послала она слугу своего Михаила в Царьград к царю, именем Мануил, и к патриарху Луке с драгоценными дарами, прося у них образа Святой Богородицы, <из тех> трех икон, что написал евангелист Лука еще при земной жизни Святой Богородицы и поставил одну в Иерусалиме, другую в Царьграде, а третью в Эфесе. Она же с усердием просила Эфесской иконы святой Богородицы. И царь, видя ее любовь, послал в Эфес семьсот своих воинов и принес икону Святой Богородицы в Царьград. А патриарх Лука собрал епископов и весь соборный причт Святой Софии, и благословил, и дал образ Святой Богородицы слуге преподобной. И он принял его с радостью и принес своей госпоже Евфросинии.
Она же, внесши в церковь Святые Богородицы и поставивши ю и воздѣвши руцѣ, и рече: «Слава тебѣ, Господи! Слава тебѣ, Владыко, сподобивый мя видѣти во днешний день образ Матере твоея!» И сия рекши, украси ю златом и камением многоцѣнным, и устави в вся вторники носити ю по святым церквам, украсивши всю землю полотскую своимъ боголѣпнымъ монастырем.	И внесла она ее в церковь Святой Богородицы, поставила <там> и, воздевши руки, сказала: «Слава тебе, Господи! Слава тебе, Владыка, сподобивший меня сегодня видеть образ Матери твоей!» И, сказав это, украсила она ее золотом и драгоценными камнями и постановила всегда по вторникам носить ее по святым церквам, украшая <так> всю полоцкую землю своим богоблаголепным монастырем.
И видѣвши, яко посѣти Богъ монастырь ея, и вожделѣ доити святаго града Иеросалима и поклонитися Гробу Господню и всѣм святым мѣстомъ, — и видѣти, и целовати, и тамо живот скончати. Видѣвши же стадо божественых овец совокуплено множество, радовашеся им, яко своему спасению; на всякъ день учаше терпѣнию, воздержанию; уныя же учаше душевней чистотѣ и бестрастию телесному, говѣнию благообразну, ступанию кротку, гласу смиренну, слову благочинну, ядению и питию безмолвну, при старѣйших — молчати, мудрѣйших — послушати, ко старѣйшим — покорени, к точным и меньшим — любовь без лицемѣрия, мало вѣщати, а множайшее разумѣти. Тако бо бяше дан дар сей блаженей Еуфросинии от Бога: аще кто ея вопрошаше о которой вещи, она же ему разрешаше то, — и добро получаше. Но всѣх хотяше имѣти яко единодушно.	И, видя, что посетил Бог ее монастырь, возымела она сильное желание дойти до святого града Иерусалима и поклониться Гробу Господню и всем святым местам — видеть их, и целовать, и закончить там жизнь. Видя собранным в стадо множество Божиих овец, радовалась она о них, как о своем спасении; всякий день учила она их терпению и воздержанию; юных учила душевной чистоте и телесному бесстрастию, благопристойному благоговению, кроткому поведению, чтобы говорили они смиренно, чтобы слова их были благочинны, чтобы ели они и пили в безмолвии, при старших чтоб молчали, мудрых бы слушали, старшим покорялись, к равным и меньшим нелицемерную любовь имели, <учила> меньше говорить, а больше думать. Таков дан был дар сей блаженной Евфросинии от Бога: если кто спрашивал ее о каком-то деле и она ему это разрешала, — то получалось во благо. Она хотела, чтоб у ней все были как одна душа.
