И посла по всей братии своей, повѣда им мысль свою, яко она восхотѣ ити во Иерусалимъ. Они же, слышавше вѣсть сию, з жалостию многою сьѣхашеся отвсюду ко блаженней Еуфросинии и моляху ея со слезами, да бых не оставила сирых. Она же утѣшаше благим своим смыслом, яко мати дѣти своя любящи. И любимый ей брат, нарицаемый во святемъ крещении имянем Вячиславъ,[33] и приѣхавъ к сестрѣ своей Еуфросинии со княгинею и з детми своими, и пришед, и поклонися ей, глаголя: «Госпожа моя мати и сестро! Что оставляеши мя, правителю души моей и свѣте очию моею?» И горко ему плачющеся, блаженная же Еуфросиния повелѣ ему ити, гдѣ бы обитал. Дѣти же его повелѣ оставити о сестрѣ своей Евдокѣи. Дан же бѣ дар блаженней Еуфросинии от Бога: аще кого озряше очима своима, то разумѣяше, в коем человѣцѣ сосуд будет избран Богови. Тогда же блаженная, видѣвши братаннѣ свои, и рече има: «Хощу ваю обручати жениху безсмертному и ввести ваю в чертог Царства его». Онѣма же послушающа, усладися душа их паче сота медвена словесем преблаженныя; падшима на ногу ея и глаголаста к ней: «Воля Господня да будет и твоя святая молитва. Якоже хощеши, и сотвори нама, госпоже». Преподобная же, с радостию и с поспѣшением призвавши брата своего, и рече ему: «Аз хощу пострищи Кираанну и Олгу», — тако бо ю бяста нарекая родителя. Смяте же ся отецъ ею о словеси семъ и рече: «Госпожа моя, что ми хощеши творити? Два плача прилагаеши души моей: да плачюся отхода твоего ради, и зсѣтую чаду дѣля своею». Мати же ею жалостию терзашеся. Блаженная же Еуфросиния пославши призва епископа тогда престолъ правящи Святой Софии, нарицаемаго Дионисия,[34] и введше ю въ церковь, и повелѣ острищи ея и нарече Кираанне Агафия, а Олгѣ Евфимия, — и благословивши ею благословением святых отецъ.	И послала она ко всей своей братии и сообщила им о своем решении, что хочет она идти в Иерусалим. И, услыхав такое известие, в большой горести отовсюду съехались они к блаженной Евфросинии и со слезами молили ее, чтобы не оставляла их она в сиротстве. А она утешала их благими своими доводами, будто любящая мать своих детей. И любимый брат ее, во святом крещении названный именем Вячеслав, приехавший к сестре своей Евфросинии с княгинею и детьми своими, пришел, поклонился ей и сказал: «Госпожа моя матушка и сестра! Зачем ты оставляешь меня, наставница души моей и свет очей моих?» И горько он плакал, а блаженная Евфросиния велела ему идти туда, где он остановился. Детей же его велела она оставить на сестру свою Евдокию. Дан был блаженной Евфросинии дар от Бога: если на кого взглядывала она своими очами, то понимала, кто из людей станет избранным Божиим сосудом. Тогда же, увидев своих племянниц, сказала им блаженная: «Хочу обручить вас с бессмертным женихом и ввести вас в чертог его Царства». И когда услышали они ее, усладились души их больше, чем медвяным сотом, речью преблаженной; пали они к ее ногам и сказали ей: «Да будет воля Господня по твоей святой молитве. Как хочешь, так и сделай с нами, госпожа». И преподобная, радостно и поспешно призвавши брата своего, сказала ему: «Хочу я постричь Кириоанну и Ольгу», — так наречены они были родителями. И отец их пришел в смятение от этих слов и сказал: «Госпожа моя, что ты хочешь со мною сделать? Две скорби ты возлагаешь на мою душу: чтоб плакал я из-за твоего ухода и одновременно скорбел из-за чад своих». Мать же их истерзалась горем. А блаженная Евфросиния послала призвать епископа, правящего тогда престолом Святой Софии, по имени Дионисий, и привела их в церковь, и повелела постричь их, и нарекла имя Кириоанне Агафья, а Ольге — Евфимия, и благословила их благословением святых отцов.
Сама же блаженная Еуфросиния, положивши великий свой наряд обѣма монастырема, з братиею и сестрама, и дасть держати сестрѣ своей Евдокѣе и оба монастыря, сама же поклонившися Святому Спасу и Святѣй Богородицы, и рече: «Господи сердцевидче! Се оставляю дом незатворен никомуже, — и ты, Господи, не затвори от нас твоего Царства!» И тако поиде во Иерусалимъ, поемши брата своего Давыда[35] и сестру свою Еупраксию.	И блаженная Евфросиния, положивши великий свой устав обоим монастырям, братскому и сестринскому, поручила править обоими монастырями сестре своей Евдокии, а сама, поклонившись Святому Спасу и Святой Богородице, сказала: «Господи сердцеведче! Вот оставляю я ни для кого не затворенным дом <твой>, — и ты, Господи, не затвори пред нами твоего Царства!» И отправилась в Иерусалим, взяв с собой брата своего Давыда и сестру свою Евпраксию.
Вси же братия ея горко плакахуся отхода ради госпожи своея. И вси гражане выидоша проводити ея. Старии плакахуся, яко дщери, рекуще: «Увы нам, уже старости нашея, просвѣщение души нашей!» Уныя же глаголаху: «Како зайде свѣте очию нашею! Кто нашу уность восхластит? Вздержание юности нашея, не оставляй нас сирых, но в молитвах своих не забывай нас, госпоже, яже к Богу!»	И вся братия ее горько плакала из-за ухода госпожи своей. И все жители города вышли проводить ее. Старые плакали, как по дочери, и говорили: «Увы нам, опора нашей старости, просвещение душ наших!» А молодые говорили: «Как это закатился свет очей наших! Кто обуздает нашу юность? Юности нашей укрощение, не оставляй нас сирых и не забывай нас, госпожа, в своих молитвах к Богу!»
Она же, целовавши всѣх и благословивши, и возрѣвши на небо, и рече: «Ты, Господи сердцевидче, ходивый со Авраамом, иди и с нами и с рабы твоими, со Еуфросиниею, и з Давыдомъ, и со Евпраксиею!» И тако поидоша сущии с нею.	И она, дав всем целование и благословление, воззрев на небо, сказала: «Ты, Господи сердцеведец, ходивший вместе с Авраамом, иди и с нами, рабами твоими, с Евфросинией, Давыдом и Евпраксией!» И так пошли в путь все, кто был с нею.
О, страшное чюдо! Не бывши ни в коей странѣ, ни во граде, ни в селѣ, нынѣ же, вземши мужскую крѣпость, премину вся грады и власти, приимающе от всѣх честь велику князей. И тако и срѣте ю царь, идый на угры,[36] и послав ю в Царьград с великою честию. Она же пришедши, поклонилася святым церквам и ту сущей великой церкви Святой Софии. И поклонившися, и благословившуся от патриарха и покупивши различныя потребы, темиян и кацию злату, и иде во Иерусалимъ.	О, страшное чудо! Не бывавшая прежде никогда ни в какой стране, ни в селе, ни в городе, теперь прошла она с мужскою твердостью все города и государства, принимая от всех великие княжеские почести. Так и повстречал ее царь, шедший <тогда> на венгров, и с великими почестями направил ее в Царьград. И, придя <туда>, поклонилась она святым церквам и великой тамошней церкви Святой Софии. И, поклонившись и благословившись у патриарха, купив кое-какие необходимые вещи, золотую кадильницу и ладан, пошла она в Иерусалим.
И пришедши во Иерусалимъ, и посла слугу своего Михаила к сущему тамо патриарху, глаголющи: «Владыко святый, сотвори милость на мнѣ: повели ми, да отворят ми ся врата Христова».[37] Он же повелѣ прошению ея быти отворими. И пришедши ко вратом, и паде на земли, глаголюще: «Господи Исусе Христе! Не вмени ми сего во грѣх, занеже изволих изследити по стопам твоим и внидох во святый град сей». И иде ко Гробу Господню,[38] и пришедши и поклонившися, целовавши Гроб Господень, и сущии с нею. И покадивши Гроб Господень златою кадилницею и многоразличными фимияны, и изыде. Обита въ Святѣй Богородицы в Руском монастыри.[39] И во утрии день иде второе ко Гробу Господню и такожде сотвори; и в третий день тожде сотвори. И давши злата много, и воставивши кацию златую на Гробѣ и многоразличныя фимияны, и ставши у Гроба Господня и воздѣвши руцѣ свои, и возрѣвши на небо, со слезами, воздохнувши из глубины сердца, глаголаше: «Господи Исусе Христе, Сыне Божий, рождейся от Приснодѣвы Мария спасения ради нашего, реклъ еси: „Просите, — и приимѣте".[40] Аз же грѣшная, егоже просих, и получих от тебе, Владыко. Се же еще прошу у тебе, милостиве, да скончаю мѣсто прошения моего: приими духъ мой от мене во святем граде твоем Иерусалиме! Пресели мя в вышний град твой Иерусалимъ! Покой мя на лонѣ патриарха Авраама со всѣми угождьшими ти! Аминь». Сице глаголюще, изыде во иже реченную церковь святыя Богородицы, идѣже обитала, ту же, посѣщением Божиим, впаде в недуг и нача болѣти. И лежащи на ложи своем, глаголюще: «Слава тебѣ, Владыко, яко восхотѣ и сотвори мнѣ, рабѣ твоей!»	И, придя в Иерусалим, послала она слугу своего Михаила к тамошнему патриарху со словами: «Святой владыка, окажи мне милость: повели, чтобы отворились мне врата Христовы». И повелел он, чтобы по ее прошению были они отворены. И, придя к вратам, пала она на землю со словами: «Господи Исусе Христе! Не вмени мне это за грех, что возжелала я пройти по твоим стопам и вошла <по твоим следам> во святой сей град». И пошла она ко Гробу Господню, и, придя и поклонившись, целовала она Гроб Господень, также и бывшие с нею. И, покадив Гроб Господень золотой кадильницей и всевозможными фимиамами, ушла. Остановилась она в Русском монастыре у Святой Богородицы. И на другой день во второй раз пошла она ко Гробу Господню и сотворила так же; и на третий день так же сделала. И, подав много злата и водрузив золотую кадильницу с множеством благовоний на Гробе, встала она у Гроба Господня и, воздев руки свои, глядя на небо и вздыхая из глубины сердца, сказала со слезами: «Господи Исусе Христе, Сыне Божий, родившийся ради нашего спасения от Приснодевы Марии, ты сказал: «Просите, — и получите». И я, грешная, что просила, получила от тебя, Владыка. И вот прошу еще у тебя я, милостивый, чтобы исполнилась последняя моя просьба: прими мой дух от меня во святом граде твоем Иерусалиме! Пересели меня в вышний град твой Иерусалим! Упокой меня в лоне патриарха Авраама вместе со всеми угодившими тебе! Аминь». Сказав это, пошла она в упомянутую церковь Святой Богородицы, где остановилась, и тут по воле Божией впала в недуг и разболелась. И лежала она на ложе своем и говорила: «Слава тебе, Владыка, что захотел ты это сотворить мне, рабе твоей!»
И тоя же ради болѣзни не може ити на Иердан.[41] И иде брат ея Давыдъ и сестра ея Еупраксия и сущии с нею. Она же лежаще на ложи своем, хваляще Бога, глаголющи: «Господи! Призри на рабу твою Еуфросинию и помилуй мя!» И приидоша бывшеи на Иерданѣ; она же, с радостию воставше и приимше от них ерданскую воду, и пив, облияся по всему тѣлу своему и, возлегши, рече: «Благословен Богъ, просвѣщая всякого человѣка, грядущаго в мир,[42] в вѣки! Молюся человѣколюбивому Богу, ревнующе Петрову покаянию по отвержении, и не отчая себе, но плакася горко:[43] приим того покаяние, и приими и мене, недостойную рабу твою Еуфросинию, молящуся на противнаго своего врага диявола, — да не возглаголет ми на Страшнемъ твоем Судищи ничтоже пред тобою, Господи, злый враг! Воступих ногама своима на змиеву его главу и супротивихся дерзости его окаянней, надѣющеся на твое человѣколюбие, Господи!»	И из-за той болезни не смогла она пойти на Иордан. И пошел брат ее Давыд и сестра ее Евпраксия и те, кто был с нею. А она лежала на своем ложе, возносила хвалу Богу и говорила: «Господи! Подай помощь рабе твоей Евфросинии и помилуй меня!» И пришли те, кто был на Иордане; и она, с радостью поднявшись и приняв от них иорданскую воду, напилась ее и облилась ею <с ног до головы> — все тело свое и, возлегши, сказала: «Во веки благословен Бог, просвещающий всякого человека, грядущего в мир! Молю человеколюбивого Бога, ревнуя покаянию Петрову после отвержения, когда не отчаялся он, а горько плакал: приняв покаяние его, прими и меня, недостойную рабу твою Евфросинию, молящуюся о супостате своем, враге дьяволе, — да не проговорит злой враг обо мне ничего пред тобою на Страшном Суде твоем, Господи! Я наступила своими ногами на змиеву его главу и противилась дерзости его окаянной, надеясь на человеколюбие твое, Господи!»
И услыша Богъ молитву ея. И посла Господь ангела своего к ней глаголя: «О, блаженная ты еси в женах, и благословен труд твой! Се же отверзоша ти ся двери породныя, и вси анггели собрашася, держаще свѣща, чающе твоего срѣтения, а дар, егоже просиши у Бога, дасть ти ся». И се рек аггелъ, и отиде от нея.	И услышал Бог ее молитву. И послал Господь ангела своего к ней со словами: «Блаженна ты среди жен, и благословен твой труд! Вот открываются тебе двери райские, и собрались все ангелы со свечами, ожидая встречи с тобой, дар, которого просишь ты у Бога, дастся тебе». И, сказав это, ангел отошел от нее.
Блаженная же Еуфросиния возрадовася душею и вскоре посла в Лавру глаголюще: «Се уже приспѣ ми время, да же ми Богъ покоить; а приимите ли мя, что бых легла в церкви Святаго Савы?»[44] Они же обѣщашася к ней, ту сущии черньцы: «Имѣем запрещение от святаго Савы, иже жены не приимати ни коеяже, но се ти есть монастырь Святые Богородицы, Феодосиево общее,[45] в немже лежат жены святыя: мати святаго Савы, мати святаго Феодосия, мати святых безмѣзднику Козмы и Демияна, именем Феодотия,[46] и инии мнози святии. Ту ти подобает лечи».	И блаженная Евфросиния возрадовалась душой и послала спешно сказать в Лавру: «Вот уж приспело мое время, чтобы упокоил меня Бог; примете ли меня, чтобы мне лечь в церкви Святого Саввы?» И бывшие там чернецы пообещали ей: «Есть у нас запрещение святого Саввы — не принимать никого из жен, но вот тебе монастырь Святой Богородицы, общежительный Феодосиев, где лежат святые жены: мать святого Саввы, мать святого Феодосия, мать святых бессребреников Козьмы и Дамиана, именем Феодотия, и многие другие святые. Там тебе подобает лечь».
И приѣхавъ посол ея, возвести Еуфросинии. Она же всѣм тѣм похвали Бога и пославши купи себѣ гроб в комаре Святой Богородицы.[47] И лежа 24 дний, и позна ся во скончании, рече: «Призовите ми прозвитера, и да ми дастъ причащения. Уже бо зватой близ предстоит, ждый повелѣния Владычня». И прииде прозвитер, несый причащения. Она же воставши и поклонися 3-жды, и приимши Пречистое Тѣло, и тако возлеже и предасть душу свою в руцѣ Бога жива, мѣсяца мая въ 24 день иде в покой небесный.	И приехавший <от них> ее посланник передал <это> Евфросинии. И за все это воздала она хвалу Богу и послала купить себе место для погребения в доме Святой Богородицы. И лежала она 24 дня, и, поняв, что приближается ее кончина, сказала: «Позовите ко мне пресвитера, чтобы он дал мне причастие. Ибо уже близко стоит зватай, ожидающий повеления Владыки». И пришел пресвитер, и принес причастие. И она, поднявшись, трижды поклонилась и, приняв Пречистое Тело, легла и предала свою душу в руки Бога живого, месяца мая в 24-й день отошла в покой небесный.
