же живущу ми на Луках на Великих в Сергиеве монастырѣ съ строителем Боголѣпомъ въ единой келии, за седмъ лѣт до вхождения моего в сию пустыню, явися мнѣ Пречистая Богородица образом своим честным, не яве, но сонным видѣнием, сице. Бывшу ми во обители той понамарем, и взыдох на колоколню в полдни, и уснухъ. И видѣх во снѣ столпъ огненъ яко бы в сей странѣ стоящъ. Притек же аз ко огненому столпу оному и видѣх у столпа оного стоящъ образ Пречистыя Богородица Одегитрие,[24]
на золотѣ, в мѣру, яко есть на Тифинѣ[25]
стоит
образ
Одегитрие въ церкви за крылосом[26] на лѣвой странѣ, поставлен ис Старые Русы.[27]
Аз же яко бы у образа того приложился, образ же той горяч велми от оного столпа огненаго. Возбнув же от сна и во ужасѣ быв от видѣния того, осязав же рукою своею чело свое, и ощутих е горяче.	Еще когда я жил в Великих Луках в Сергиевом монастыре в одной келье со строителем Боголепом, за семь лет до прихода моего в эту пустынь, явилась мне Пречистая Богородица образом своим честным, не наяву, а в сонном видении; случилось это так. Будучи в обители той пономарем, поднялся я на колокольню в полдень и уснул. И увидел во сне огненный столп, будто бы в этой стороне стоящий. Приблизился я к тому огненному столпу и увидел стоящую около него икону Пречистой Богородицы Одигитрии, позолоченную, величиной такую,
как
икона
Одигитрии на Тихвине, стоит в церкви за клиросом с левой стороны, принесена из Старой Руссы. Я же будто бы к той иконе припал, а икона была очень горяча от огненного того столпа. Пробудившись от сна, я был в ужасе от этого видения, а когда прикоснулся рукою к своему лбу, то почувствовал, что он горяч.
Видѣние 2 того же образа	Второе видение той же иконы
Егда
же приидох в пустыню сию, после того видѣния за долго время, и возлегох опочити, и уснух. И видѣх во снѣ у пустыни той море, и на том мори образ Пресвятыя Богородица Одигитрие, яков же и преже явльшийся мнѣ, плавает. Аз же стоях на брегу и видѣх от того образа недалече на том же мори бѣсъ поражен лежащъ. Аз же возрѣх на правую страну и видѣх на воздусѣ стояща архаггела, образом же бѣ, якъ Гаврил архаггелъ пишется у Благовѣщения Пресвятыя Богородица, со скипетром. Мнѣ же восхотѣвшу знаменатися у образа Пресвятыя Богородица, яко и преже, но устрашихся воды морския, зане яко потопит мя. И глагола мнѣ архангелъ онъ, стоящий на воздусе: «Почто не дерзаешь приити знаменатися ко образу Пречистѣй Богородици?» Аз же, грѣшный, отвѣщах ему, глаголя: «Господи, боюся». Онъ же глагола ми: «Чего боишися?» Аз ему паки рекох: «Бѣсовского шатания, да не како мя уловит». Архангелъ же паки рече ми: «Не бойся, дерзай къ Пречистому образу». Абие же образ той нача грузитися в море, и оставляется верху воды образа того ношка Свѣтодавцова. Аз же видѣ Божие милосердие к себѣ, что мнѣ оставляется ношка Свѣтодавцова. Аз же, грѣшный, яко бы есмъ в себѣ помыслил, глаголя: «Аще мнѣ и случится потоплену быти от воды, но дабы мнѣ принятися за ношку Свѣтодавца». Абие дерзнух внити в море и ях его за ношку обѣма рукама, и начах плакати со слезами, глаголющи: «Милостивый Свѣтодавче, аще и потоплену ми лучится быти, но дабы с тобою». И абие аки нѣкоторою бурею пренесе мя образ той чрез море и постави мя на брезѣ, на друзѣй странѣ моря. И невидим бысть образ той от мене. И еще видѣх: и се град новъ, и лавицы новы, а купующих и продающих нѣсть. И абие возбнувъ от сна, и во ужасѣ бых велицем, и умилихся о видѣнии томъ.	Когда
же я пришел в эту пустынь, по прошествии многого времени после того видения, лег я отдохнуть и заснул. И увидел во сне у пустыни море, а на том море плавает икона Пресвятой Богородицы Одигитрии, такая же, как и прежде мне явившаяся. Я же стоял на берегу и увидел, что недалеко от той иконы на море лежит пораженный бес. Посмотрел я на правую сторону и увидел стоящего в воздухе архангела, видом же он был такой, как пишется архангел Гавриил
на иконе Благовещения Пресвятой Богородицы, со скипетром. Я захотел перекреститься у иконы Пресвятой Богородицы, как и прежде, но испугался воды морской — вдруг потопит меня. И сказал мне тот архангел, стоящий в воздухе: «Почему не осмеливаешься подойти перекреститься к иконе Пречистой Богородицы?» Я же, грешный, ответил ему: «Господин, боюсь». А он сказал мне: «Чего боишься?» Я ему снова ответил: «Бесовского действия — вдруг меня уловит». Архангел же опять сказал мне: «Не бойся, иди к Пречистой иконе». И вдруг икона та начала погружаться в море, и оставалась над водой только часть ее с изображением ножки младенца Христа. И увидел я Божие милосердие к себе в том, что мне оставлена ножка Светодавца. И я, грешный, будто бы подумал про себя: «Если мне и придется тонуть в воде, но лишь бы мне прикоснуться к ножке Светодавца». Тотчас осмелился я войти в море и взялся за его ножку обеими руками, и начал плакать, проливая слезы и говоря: «Милостивый
Светодавец, если мне придется и потонуть, но лишь бы с тобой». И вдруг как какою-то бурей перенесла меня та икона через море и поставила на берегу, на другой стороне моря. И скрылась от меня та икона. И еще увидел: вот город новый и лавки новые, а покупающих и продающих нет. И тотчас пробудившись от сна, я был в сильном страхе и радости от видения того.
Бѣ же два образа чюдотворныя, образ Живоначалныя Троици да Пречистыя Богородици, стояху в первоначалной келии моей на стѣнѣ, пред ними же стояше свѣтилникъ с маслом горящъ. Аз же, взявъ образ чюдотворный Пресвятыя Богородица на руки свои, начах со слезами плакати, глаголя: «Царице госпоже Богородице, что мене, грѣшнаго, посещаеши милосердиемъ своим? Азъ бо, окаянный, горчае бѣсов!» Абие же прииде ко мнѣ, не вѣм откуду, глас, не во снѣ, но явѣ, глаголя ми: «Подвизайся, узришь бо и не ту едину Божию благодать». Потом же Феодор Сырковъ[28] повелѣ мнѣ церковъ с трапезою поставити во имя Благовѣщения Пресвятыя Богородица.	Были в первой моей келье на стене две чудотворные иконы — Живоначальной Троицы и Пречистой Богородицы, а перед ними стоял зажженный светильник с маслом. И я, взяв в руки чудотворную икону Пресвятой Богородицы, начал плакать, проливая слезы и говоря: «Царица госпожа Богородица, за что ко мне, грешному, проявляешь милосердие свое? Ибо я, окаянный, хуже бесов!» И вдруг услышал я, не знаю откуда, голос, не во сне, а наяву говорящий мне: «Старайся — увидишь и не ту одну Божию благодать». А потом Федор Сырков велел мне церковь с трапезной построить в честь Благовещения Пресвятой Богородицы.
Повѣда мнѣ, Мартирию, нѣкто христианинъ именем Иосифъ, из села из Буборин,[29]
понеже
и сами слышасте от него, сице глаголя: «В лѣтнее время, в полудни, после Петрова дни, канон Козмодамьянова дни,[30]
опочивающу ми в клетѣ своей и спящу, и видѣхвоснѣ, яко бы вшедшу ми на улицу. И видѣх в пустыни сей стоящъ столпъ огненъ от земля до небесе, и ис столпа того рука простерта, аки человѣча, и из руки той прядают искры огнены». Се повѣда Иосиф видѣние свое, занеже показа ему Богъ видѣние се. Бывшу ему нѣкогда велми болну и близ смерти, и посули мнѣ, Мартирию, по себѣ коробью[31] ржи, чим его поминати мнѣ, старцу. Богъ же воздвиже его от болѣзни, и бысть здравъ. Зжалив же ся о оной ржи, посуленыя мнѣ, старцу, и глаголя в себѣ: «За что мнѣ тому старцу дати рожь та? Помилова мя Богъ, и здрав есмъ». И того ради показа ему Богъ и Пречистая Богородица видѣние се на увѣрение ему. Онъ же то видѣв, возбнувъ от сна, абие прииде ко мнѣ в пустыню и прощениа прося у мене, глаголя сице: «Бога ради прости мя, честный отче. Виненъ есмъ пред Живоначалною Троицею и пред Пречистою Богородицею, и пред тобою, отче. Запрети бо ми диавол во умѣ моем, да ти не дам ржи оноя, посуленыя ти. Нынѣ же, честный отче, приими посуленую рожь свою». Аз же глаголах ему: «Господине, аз бо не имѣю у себе жерновов, чим ю смолоть. Но аще будет твое человѣколюбие ко мнѣ, да ты ю измолов и печя, хлѣбами да ми присылаеши». Онъ же тако и сотвори.	Рассказал мне, Мартирию, один христианин, именем Иосиф, из села Буборины — ведь вы и сами слышали от него — вот что: «В летнее время, в полдень, после Петрова дня накануне дня Козьмы и Дамиана, когда лежал я и спал в своей клети, приснился мне сон, будто бы вышел я на улицу. И увидел стоящий в этой пустыни огненный столп от земли до неба, а из того столпа простирается
рука, как человеческая, и из руки той исходят искры огненные». Так рассказал Иосиф свой сон, ибо показал ему это видение Бог. Был он однажды очень болен и находился при смерти, и пообещал мне, Мартирию, после себя коробью ржи, чтобы я, старец, поминал его. Бог исцелил его от болезни, и он выздоровел. Пожалел он ту рожь, обещанную мне, старцу, думая про себя: «За что мне тому старцу давать рожь? Помиловал меня Бог, и выздоровел я». Поэтому и показал ему Бог и Пречистая Богородица это видение, для его уверения. Он же, это увидев, пробудившись от сна, тотчас пришел ко мне в пустынь и, прощения прося у меня, сказал: «Бога ради прости меня, честный отче. Виноват я перед Живоначальной Троицей и Пречистой Богородицей, и перед тобой, отче. Внушил мне дьявол в мыслях моих, чтобы не дал я тебе той ржи, обещанной тебе. Ныне же, честный отче, прими обещанную рожь свою». Я же сказал ему: «Господин, нет у меня жерновов, чтобы ее смолоть. Но если проявится твое человеколюбие ко мне, то, измолов ее, пеки и присылай мне хлебами». Он так и сделал.
После
же сего видѣния, пред поставлениемъ моим во игуменство сея пустыни, почивах бо есмъ в своей келии в чюланѣ. И видѣх во снѣ Пречистую Богородицу в дѣвичии образе, благолѣпна видѣнием, нѣсмъ бо видѣл в человѣцѣх таковы дѣвицы благообразны. Умилена бо лицем, благолѣпна образом, долги зѣницы и брови черны, носъ же средний и похилъ, на главѣ же ей вѣнец златъ и многими цвѣты украшен разными и тяжки у госпожи, — движися! Невозможно же человѣческому роду умом смыслити, ни языком сказати, сияет бо, аки солнце. Сѣдит же в келии моей на лавицы в болшем углу, идѣже и иконы стоят. Аз же яко бы вышед ис чюлана своего и стоях пред нею, зрѣх же на ню прилѣжно и не зводя очей своих с красоты ея. Она же, Царица и Богородица, тако же и на мене противу зря. Аз же на ню невосклонно зрях и видѣх милостивое ея лице, очи же ея бяху слез исполнены, едва мало на пречистое лице ея не канут. И абие невидима бысть от мене. Аз же возбнувъ от сна и во ужасѣ быхъ. Востах же, изыдох ис чюлана своего и вжегъ свѣщу от свѣтилника масленаго, и хотѣх видѣти нескверную дѣву, аще ли она сѣдит в келии моей на мѣсте, идѣже ю видѣх сѣдящу. Изшедшу же ми на среду келии моея, и не видѣх ея на мѣсте оном. Аз же пришед со свѣщею к пречистей образу Одигитрия, иже стоит в келии моей, и видѣх образ той, и познах, яко воистинну явися Пресвятая Богородица тѣм образом, якоже и на иконѣ моей келейной образ ея написанъ.	После
этого
видения, перед поставлением меня на игуменство в эту пустынь, спал я в своей келье в чулане. И увидел во сне Пречистую Богородицу в облике девицы, красивой видом, никогда я не видел среди людей такой пригожей девицы. Добра лицом, красива видом, большие глаза и брови черные, а нос средний с изгибом, на главе же у нее, госпожи, венец златой, украшенный разными большими цветами, — движется! Невозможно человеку ни умом понять, ни языком сказать, ибо сияет, как солнце. Сидит она в келье моей на лавке в большом углу, там, где иконы стоят. А я будто бы вышел из чулана своего и стоял перед нею, смотрел же на нее усердно, не сводя очей своих с красоты ее. И она, Царица и Богородица, тоже на меня смотрела. Я же на нее смотрел не отрываясь и видел милостивое ее лицо, а очи ее были слезами наполнены — едва на пречистое лицо ее не прольются. И вдруг скрылась от меня. Я же пробудился от сна в страхе. Поднялся я, вышел из чулана своего, зажег свечу от лампады и захотел увидеть непорочную деву — сидит ли она в келье моей на месте, где видел ее сидящей. Вышел я на середину кельи своей и не увидел ее на месте том. Тогда я подошел со свечою к иконе Пречистой Одигитрии, которая стоит в моей келье, посмотрел на ту икону и понял, что воистину явилась Пресвятая Богородица тем видом, как и на иконе моей келейной образ ее написан.
По видѣнии же томъ за мало дний ѣздих в Великий Новъград, и в Великом Новѣградѣ по милости Божии и Пречистѣй Богородицы архиепископъ во игуменство мя совершил в пустыню сию, глаголемую Зеленая. А молился есмъ о посѣщении своем Пресвятѣй Богородици сице: «Пречистая Госпоже, Царице Небесная,
посѣщала ты, госпоже, великих чюдотворцев, Иоанна Предтечю, и Сергия и Александра преподобных новых чюдотворцовъ,[32]
и всѣх святых, но то не дивно, понеже они от утробы матерня святи и твоего посѣщения достойни. Сие же велми дивно и чюдно на земли и на небеси будет, аще мя, грѣшнаго и окаяннаго, своим милосердиемъ посѣтишь на увѣрение души моей грѣшной и на утвержение къ святому мѣсту сему». Она же, Пресвятая Богородица, моления моего не презрѣла, и грѣшнаго мя своимъ милосердием посѣтила, и мнѣ, окаянному, явилася.	Вскоре после того видения я ездил в Великий Новгород, и в Великом Новгороде
по милости Божьей и Пречистой Богородицы архиепископ произвел меня в игумены в эту пустынь, называемую Зеленая. А молился я о милости ко мне Пресвятой Богородицы так: «Пречистая Госпожа, Царица Небесная, посещала ты, Госпожа, великих чудотворцев, Иоанна Предтечу, и Сергия и Александра преподобных новых чудотворцев, и всех святых, но это неудивительно, потому что они от материнской утробы святы и твоего посещения достойны. Будет же очень удивительно и чудно на земле и на небесах, если меня, грешного и окаянного, своим милосердием посетишь на уверение души моей грешной и на утверждение этого святого места». И она, Пресвятая Богородица, моления моего не отринула и грешного меня своим милосердием посетила, и мне, окаянному, явилась.
О приходе с Лук с Великихъ на Тифину к Пречистей Богородицы в монастырь[33] и о первом приходе в Зеленую пустыню игумена Мартирия	О приходе игумена Мартирия из Великих Лук на Тихвину в монастырь Пречистой Богородицы и о первом его приходе в Зеленую пустынь
Егда
