же приидох аз с Лукъ с Великих на Тифину къ Пречистей Богородици, бѣ же у Пречистыя Богородицы жительствует ученик мой понамарем, прииде с Лук же Великих прежде мене къ Пречистей Богородици на Тифину, именем Аврамий; начах же и жити с ним въ единой келии на Тифинѣ. Возвѣстих же ему о пустынном жителствѣ, глаголя ему: «Брате Аврамие, хотѣх поискуситися на время в пустынномъ жителствѣ и помышляю ити в Поморие с Тифины, дабы незнаем был от человѣкъ». Аврамие же повѣсть мнѣ повѣда, глаголя сице: «Не ходи ты, отче, в Поморие, ни инуды камо, но иди в пустыню и на мѣсто, иже аз знаю пустыню ту и мѣсто. Шедшу ми нѣкогда от чюдотворного образа Пречистыя Богородица ис церкви с книгою по манастырю, во время вечернее, в мрачне, в трапезу, и возрѣх на небо ко оной странѣ, идѣже нынѣ пустыня сия, и видѣ на небѣ крестъ восиял свѣтелъ, аки лучь, иссаженъ же звѣздами весь, над онымъ пустынным мѣстомъ. Аз же мѣсто то знаю, и воистинну над тѣм мѣстомъ крестъ яви ми ся, мѣсто же то непроходимо бяше, бо во мху стоит. Ты же пойди на мѣсто то и кромѣ того мѣста не ищи иного, живи же в том мѣсте, доколѣ о тебѣ Богъ изволитъ, будетъ бо в томъ мѣсте Божие милосердие». То мнѣ, Мартирию, Аврамие, ученикъ мой, повѣда про сие святое мѣсто.	Когда
же пришел я из Великих Лук на Тихвину в монастырь Пречистой Богородицы, жил там, будучи пономарем, ученик мой именем Авраамий, который пришел раньше меня из Великих Лук к Пречистой Богородице на Тихвину; и начал я жить с ним в одной келье на Тихвине. Поведал я ему об отшельнической жизни, сказав: «Брат Авраамий, хочу испытать себя на некоторый срок в пустынной жизни и думаю идти с Тихвины в Поморье, чтобы люди не знали меня». Авраамий же поведал мне следующее, сказав так: «Не ходи ты, отче, в Поморье или куда-нибудь еще, а иди в пустынь на то место, которое я знаю. Однажды вечером, в сумерках, шел я с книгою по монастырю из церкви, от чудотворной иконы Пречистой Богородицы, в трапезную; и посмотрел на небо в ту сторону, где теперь эта пустынь, и увидел на небе над тем пустынным местом
засиявший крест, светлый, как луч, и весь украшенный звездами. Я место то знаю, и воистину над тем местом крест мне явился; место же то было недоступно, ибо во мхах стоит. А ты пойди туда и кроме этого места не ищи другого, живи же там, покуда тебе Бог даст, ибо будет в том месте Божие милосердие». Так мне, Мартирию, ученик мой Авраамий рассказал про это святое место.
Потом
же азъ в сию пустыню, нарицаемую Зеленую, вселихся. По малѣ же и храм создах во имя Святыя и Живоначалныя Троица.[34]
Начах
же ис часовнѣ образы мѣстныя носити в новую церковъ Святыя и Живоначалныя Троица. И взях образ чюдотворной Святыя Троица, повелѣ же старцу Гурью его нести в церковъ, сам же аз идох за ним съ другим чюдотворным же образом, Пречистыя Богородица Одигитрия. Аз же в церкви начах устраивати образы по мѣстом. Гурий же онъ выйде ис церкви и возрѣ нанебо, и видѣ на небеси крестъ восия, образом же бѣ, якоже крестъ и на церкви Святыя Троица стоит, не звѣздами бо бѣ сотворен, якоже Аврамие, ученикъ мой, прежде видѣл, но просто тако свѣтлостию, якоже и на церкви Святыя Троица крестъ стоитъ, образом же бѣ, яко благословящей крестъ, имже иерей благословляетъ народы.	Потом я в этой пустыни, называемой Зеленая, поселился. Вскоре же и храм построил во имя Святой и Живоначальной Троицы. Начал я из часовни иконы местные носить в новую церковь Святой и Живоначальной Троицы. Взял икону чудотворную Святой Троицы и велел старцу Гурию нести ее в церковь, сам же я шел за ним с другой чудотворной иконой, Пречистой Богородицы Одигитрии. Стал я в церкви расставлять иконы по местам. А тот Гурий вышел из церкви и посмотрел на небо, и увидел на небесах засиявший крест, видом же он был, как крест, стоящий на церкви Святой Троицы, не из звезд составлен, как прежде видел ученик мой Авраамий, а просто светом, как крест на церкви Святой Троицы, похожий на благословляющий крест, которым иерей благословляет народ.
Вы же, братие, слышите и видите, каки Пресвятая Троица и Пречистая Богородица чюдеса творитъ от образа своего: бѣсы отгоняет и болных исцѣляетъ, хромых и слепых здравы сотворяетъ, и многи чюдеса творитъ, вѣдомая же и невѣдомая. Се же, братие, слышаще и видяще такое Божие милосердие и Пречистыя Богородица, кто не удивится и не прославитъ Пресвятыя Троица и Пречистыя Богородица! Молю же ся вамъ, братие, о еже вѣру несумѣнну имѣйте къ святому мѣсту сему, и любовъ межи собою нелицемѣрну имѢйте, и моего словесѣ не попирайте, еже сказах вамъ и заповѣдах, тако творите. Мене же, грѣшнаго, в святых своих молитвах поминайте, да и сами помяновени будете у Господа Бога и у Пречистей Богородицы, и Богъ мира да будет с вами всегда, и нынѣ и присно и во вѣки вѣкомъ. Аминь.	Вы же, братья, слышите и видите, какие Пресвятая Троица и Пречистая Богородица чудеса творит от иконы своей: бесов отгоняет и больных исцеляет, хромых и слепых здоровыми делает, и многие чудеса творит, известные и неизвестные. И вот, братья, слыша и видя такое Божие и Пречистой Богородицы милосердие, кто не удивится и не прославит Пресвятую Троицу и Пречистую Богородицу! Молю же вас, братья, о том, чтобы вы твердую веру имели к этому святому месту и любовь между собой непритворную, и моего слова не попирайте, — как говорил вам и заповедовал, так и делайте. Меня же, грешного, в святых своих молитвах поминайте, тогда и сами помянуты будете у Господа Бога и у Пречистой Богородицы, и Бог мира да будет с вами всегда, и ныне и присно и во веки веков. Аминь.
А писал Зеленыя пустыни дьяк.	А писал Зеленой пустыни дьяк.
