ПОВѢСТЬ О ЖИТИИ ПРЕПОДОБНАГО ОТЦА МАРТИРИА, ЖИВШАГО ВО ОБЛАСТИ ВЕЛИКАГО НОВАГРАДА В ОБОНѢЖСКОЙ ПЯТИНЫ,[1]
В ЗЕЛЕНОЙ ПУСТЫНИ,[2]
ТАКО
НАРИЦАЕМЕЙ, ЯЖЕ САМЪ О СЕБѢ ИСПОВѢДА ОТЦУ СВОЕМУ ДУХОВНОМУ И УЧЕНИКОМЪ СВОИМ, КАКО И ГДѢ ЖИТЕЛСТВОВАШЕ ПРЕЖДЕ ВСЕЛЕНИЯ ЕГО В ПУСТЫНЮ ТУ, И КАКО ОБРѢТЕ Ю, КАКО ЖЕ И ВСЕЛИСЯ, И ХРАМЫ СОЗДА, И ОБЫТЕЛЬ СОСТАВИ. ВСЕЛИ ЖЕ СЯ ОНЪ В ПУСТЫНЮ ТУ ПРИ БЛАГОЧЕСТИВОМ ЦАРѢ И ВЕЛИКОМЪ КНЯЗѢ ИВАНЕ ВАСИЛЬЕВИЧЕ,[3]
ВСЕА
РУСИИ
САМОДЕРЖЦѢ, И ЖИЛ МНОГИЕ ЛЪТА, ПРЕСТАВИСЯ ЖЕ В ТОЙ ЖЕ ОБИТЕЛИ В ЦАРСТВО БОРИСА ГОДУНОВА[4]	АВТОБИОГРАФИЧЕСКАЯ
ПОВЕСТЬ МАРТИРИЯ ЗЕЛЕНЕЦКОГО ПОВЕСТЬ О ЖИТИИ ПРЕПОДОБНОГО ОТЦА МАРТИРИЯ, ЖИВШЕГО В ОБЛАСТИ ВЕЛИКОГО НОВГОРОДА В ОБОНЕЖСКОЙ ПЯТИНЕ, В ПУСТЫНИ, НАЗВАННОЙ ЗЕЛЕНОЙ, ТО, ЧТО САМ О СЕБЕ ПОВЕДАЛ ОТЦУ СВОЕМУ ДУХОВНОМУ И СВОИМ УЧЕНИКАМ: КАК И ГДЕ ЖИЛ ДО ПРИХОДА СВОЕГО В ТУ ПУСТЫНЬ, КАК НАШЕЛ ЕЕ, КАК ПОСЕЛИЛСЯ, ЦЕРКВИ ПОСТРОИЛ И ОБИТЕЛЬ СОЗДАЛ. ПРИШЕЛ ЖЕ ОН В ТУ ПУСТЫНЬ ПРИ БЛАГОЧЕСТИВОМ ЦАРЕ И ВЕЛИКОМ КНЯЗЕ ИВАНЕ ВАСИЛЬЕВИЧЕ, ВСЕЯ РУСИ САМОДЕРЖЦЕ, И ЖИЛ МНОГИЕ ГОДЫ, А УМЕР В ТОЙ ЖЕ ОБИТЕЛИ В ЦАРСТВО БОРИСА ГОДУНОВА
Духовный мой брате Дософею, тайна убо царева добро есть хранити, дѣла же Божия велегласно проповѣдати.[5]
Повѣм ти о себѣ, о еже како и гдѣ жителствовах аз преже вселения моего в сию пустыню, сице. Жилъ бо есмъ преже на Луках на Великих[6] в Сергиеве монастырѣ, в новоначалном мѣстѣ, у строителя тоя обители священоинока Боголѣпа.[7]
В той же обители аз власовъ отъятие и мира отречение сотворих и восприях святый ангельский образ от руки того же священоинока Боголѣпа. Онѣм же поставлен бых келарем,[8]
и вручи мнѣ службу казначейства и понамарства;[9]
и суды умывах, тако же и во всѣх службах монастырскых послужил в послушании отцу своему и братии во обители оной седмъ лѣт.	Духовный мой брат Досифей, тайну цареву следует хранить, дела же Божии громогласно проповедовать. Расскажу тебе о себе, о том, как и где жил я до поселения своего в этой пустыни. Жил же я прежде в Великих Луках во вновь созданном Сергиеве монастыре у строителя той обители священноинока
Боголепа. В той обители я пострижение и от мира отречение совершил и воспринял святой ангельский образ от руки того же священноинока Боголепа. Он поставил меня келарем и поручил мне службу казначея и пономаря; я и посуду мыл, и во всех службах монастырских послужил в послушании отцу своему и братии в обители той семь лет.
И прииде ми помыслъ, еже возлюбити ми пустынное жителство; и совѣщахся с нѣкоторым поваром бѣлцем[10] ити в пустыню, аможе Богъ наставит. Внезапу же приде ко мнѣ в келию мою нѣкий урод ся творя, именем Михаилъ, и реклъ ко мнѣ: «Мартирие, пойди един». Такоже иде и к повару оному и рече ему то же слово: «Пойди един». Паки же аз совѣщахся со оным поваром ити в пустыню в день архистратига Михаила.[11]
В той же день на Луках было священие церкви архистратига Михаила. Егда же начаша священие церкви творити, мы же втай поидохомъ из монастыря и отъидохом от Лукъ шестьдесят поприщъ.[12]
На ту
же нощь паде снѣга в колѣно. И нашли пустыню глубоку и помыслили в той пустыни создати хижицу, но невозможно, понеже снѣгом мох запал, мшить нѣчим. И подле потока нѣкоего, во брегу, в земли, в глине выкопали себѣ хижицу да окрыли ея прутием еловым. Повелѣл же аз дойти своему подругу до веси нѣкоего ради орудиа, имже сотворяется какова любо скважня. Онъ же пойде и не возвратися ко мнѣ ктому, в веси же оной повѣда о мни к единому християнину, глаголя: «Онъсица старецъ живет во оном сице мѣсте». Христианинъ же онъ приходя ко мнѣ и посѣщая мя. Аз же живях в пустыни той и питахся рукодѣлием моим, плетох бо калиги[13] лычны и со онѣм христианином посылах по весем
христианом, они же такожде посылаху со онѣм же христианином потребная мнѣ. Аз же, грѣшный, приимах со благодарением приносимая от них, за них же Бога моля.	И возникло у меня стремление к отшельнической жизни; сговорился я с одним поваром бельцем идти в пустынь, куда Бог наставит. Вдруг пришел ко мне в келью один юродствующий, именем Михаил, и сказал мне: «Мартирий, пойди один». Пошел он и к тому повару и сказал ему те же слова: «Пойди один». Еще раз я договорился с тем поваром идти в пустынь в день архистратига Михаила. В тот же день в Великих Луках было освящение церкви архистратига Михаила. Когда начали освящать церковь, мы втайне вышли из монастыря и отошли от Великих Лук шестьдесят поприщ. В ту же ночь выпал снег по колено. Нашли мы совершенно безлюдное место и хотели там поставить хижинку, но это было невозможно, потому что мох засыпало снегом и нечем было конопатить. И возле какого-то источника, на берегу, в земле, в глине выкопали мы себе землянку и покрыли ее еловыми ветками. Велел я своему товарищу пойти в селение за одной снастью, которой делаются разные дыры. А он пошел и не вернулся больше ко мне, в деревне же той рассказал обо мне одному христианину: «Такой-то старец живет в таком-то месте». И тот христианин приходил навещать меня. Я же жил в той пустыни и питался ремеслом своим: плел из лыка лапти и с тем крестьянином посылал по селам жителям, а они посылали с тем же крестьянином нужное мне. И я, грешный, принимал с благодарностью от них принесенное и молился за них Богу.
В той же пустыни от бѣсов велика страхования принях. Прихождаху бо ко мнѣ и страшаху мя внѣ хижици моей пред дверми, глаголюще к себѣ: «Спит онъ». Единъ же бѣсъ влѣзе в хижу мою и хотя ко мнѣ прикоснутися, аки хотя мя удавити. Молитва же Исусова изо устъ моих исхождаше беспрестани, онъ же отбѣже от мене. Инии же бѣси внѣ келии пред дверми глаголюще оному бѣсу: «Чему ты не дерзаешь на оного?» Бѣсъ же имъ отвѣща: «Поидѣте вы к нему и дерзайте!» Аз же молитву творя и глаголя к нему сице: «О, отпадшие бѣси, что сотворих вам азъ, грѣшный? Вы же мя ввели в сию пустыню[14] и хощете поругатися мнѣ. Аз же, грѣшный, надеюсь на Господа Бога моего Исуса Христа и на Пречисту его Матерь, и на силы небесныя, на Михаила и на Гаврила,[15]
и на своего святого ангела, хранителя души и тѣлу моему, и на всѣх святых».	В той пустыни я от бесов много страха натерпелся. Приходили они и пугали меня, стоя у моей хижины за дверьми и говоря друг другу: «Спит он». А один бес проник в хижину мою и хотел ко мне прикоснуться, как бы желая меня задушить. Я же беспрестанно творил Исусову молитву, и он убежал от меня. Другие же бесы, которые стояли у кельи пред дверьми, сказали тому бесу: «Почему ты не осмеливаешься (напасть) на него?» А бес им ответил: «Пойдите вы сами к нему и дерзните!» Я же, творя молитву, сказал им так: «О, падшие бесы, что сделал вам я, грешный? Вы же привели меня в эту пустынь и хотите подвергнуть меня поруганию. Я же, грешный, надеюсь на Господа Бога моего Исуса Христа и на Пречистую его Мать, и на силы небесные, на Михаила и Гавриила, и на своего святого ангела, хранителя души и тела моего, и на всех святых».
И паки возлегох опочити; и возбнувъ от сна своего, обленив же ся, не востах со одра моего. Приспѣ же день празничен, христолюбецъ же онъ преждереченный потребная принесе ми, отъиде восвояси. Аз же востах и канон[16] отпѣлъ, такожде же и часы,[17]
потом
поставих столецъ и потребная на нем, к ним же не прикоснухся за лѣность свою. Сам же помышляа, глаголя в себѣ: «О, окаянная моя плоть, за лѣность свою недостойна еси воды пити». Потом же прослезихся, глаголя: «Господи превѣчный, Царю Небесный, дух бодръ, а плоть немощна, но дай же ми, Господи, суха хлѣба омочити в воду и душу напитати». И не прикоснухся ни к чему от потребных, кромѣ сухариков и воды. Абие же бысть гром страшен, яко и земли потрястися, и лжица моя съ стола паде на землю.	И в другой раз лег я спать; пробудившись же от сна, промедлил и не встал с ложа своего. А день наступил праздничный, и тот преждеупомянутый христолюбец принес нужное мне и ушел. Я поднялся, отпел канон и часы, потом поставил на стол съестное, но ни к чему не прикоснулся, казня себя за леность. Сам же я думал про себя: «О, окаянная моя плоть, за леность свою недостойна ты и воды пить». Потом прослезился и сказал: «Господи превечный, Царь Небесный, дух бодр, а плоть немощна, но дай же мне, Господи, сухого хлеба омочить в воде и душу напитать». И не прикоснулся я ни к чему от съестного, кроме сухариков и воды. Вдруг загремел сильный гром, так что и земля затряслась, и ложка моя со стола упала на землю.
Потом
же аз, грѣшный, отписалъ ко отцу своему духовному, да благословит мя в пустыни оной жити. Онъ же мя не благослови жити в пустыни, но глагола ми: «Поиди, господине, жити во общее житие».[18]
Аз же, грѣшный, пойдох во град Смоленско помолитися Пречистей Богородици[19] и великим чюдотворцем Аврамию и Ефрѣму.[20]
И онѣ чюдотворцы явишася мнѣ, глаголюще сице: «Подобает ти жити в пустыни, гдѣ Господь благоволит».	Потом
я, грешный, написал к отцу своему духовному, чтобы он благословил меня в пустыни той жить. Но он не благословил меня жить в пустыни, а сказал мне: «Пойди, господин, жить в общежительстве».
Я же, грешный, пошел в город Смоленск помолиться Пречистой Богородице и великим чудотворцам Авраамию и Ефрему. И те чудотворцы явились мне и сказали так: «Должен ты жить в пустыни, где Господь благоволит».
Наказание къ братии игумена Мартириа	Наставление игумена Мартирия к братии
Духовный мой брате Дософею, пишу тебѣ сию духовную памятцу вкратце и кромѣ братии, ты же держи ю у себе Бога ради, доколе Господь о мнѣ благоизволит и возмет мя от житиа сего суетнаго, и не помянет многих моих грѣхов по милости своей.	Духовный мой брат Досифей, пишу тебе эту духовную памятцу кратко и скрытно от братии, ты же держи ее у себя Бога ради до тех пор, пока Господь не благоизволит и не возьмет меня от жизни этой суетной, и не помянет многих моих грехов по милости своей.
Братие
моя
милая,
прошу
у вас того и молю, чтобы есте не надѣялись ни на князя, ни на болярина, ни на какого властеля, имѣли бы есте надежю во всем на Живоначалную Троицу и на Пречистую Богородицу — тѣ вамъ будут во всем помощники и заступники. Имѣйте срамъ къ царю земному и къ его царевичем, и къ властем. Не просите у них ничего, как я, грѣшный, стыдлив к ним был и не просил у них ничего, но во всем есмъ имѣл надежу на Живоначалную Троицу и на Пречистую Богородицу. И чего есмъ у них, у свѣтов, просил, и они мнѣ, грѣшному, даровали. К ним есмъ точию был дерзостенъ всего просити. Тако и вы будите дерзостни к Живоначалнѣй Троици и къ Пречистѣй Богородици и всего у них просите, и кромѣ их помощников себѣ никого не имѣйте. А за земнаго царя, государя нашего, Бога молите, и за его царевичев, и за все его воинство. Понеже онъ, государь, за нас, за грѣшных, стражет и кровь проливаетъ за святыя церкви и за все православное християнство.	Братья мои милые, прошу вас и молю, чтобы вы не надеялись ни на князя, ни на боярина, ни на какого властителя, а имели бы во всем надежду на Живоначальную Троицу и на Пречистую Богородицу — они вам будут во всем помощники и заступники. Имейте почтение к царю земному и к его царевичам, и к властям. Не просите у них ничего, как и я, грешный, почитал их и не просил у них ничего, а во всем надеялся на Живоначальную Троицу и на Пречистую Богородицу. И чего у них, у светов, просил, то они мне, грешному, даровали. У них только осмеливался все просить. Так и вы дерзайте у Живоначальной Троицы и Пречистой Богородицы все просить и кроме них помощников себе никого не ищите. А за земного царя, государя нашего, Бога молите, и за его царевичей, и за все его войско. Потому что он, государь, за нас, за грешных, страдает и кровь проливает за святые церкви и за все православное христианство.
А поминал есмъ, живучи у Пресвятѣй Троици и у Пречистѣй Богородици, слово Иоанна Предотеча, рекшаго къ старцу, хотящему отъити от вертепа и ити в Синайскую гору,[21]
сице:
«Сий
тебѣ
вертепъ лучши Синайскиа горы, аще живеши в нем с вѣрою». Тако и вы, братие, поживите с вѣрою у Живоначалнѣй Троици и у Пречистѣй Богородици, не отходя.	А вспоминал я, живя в монастыре Пресвятой Троицы и Пречистой Богородицы, слова Иоанна Предтечи, который так сказал старцу, хотевшему оставить свою пещеру и идти к Синайской горе: «Эта пещера для тебя лучше Синайской горы, если живешь в ней с верою». Так и вы, братья, живите с верою в монастыре Живоначальной Троицы и Пречистой Богородицы, не уходя.
А нѣчто Богъ изволит, и государь вас учнет жаловать, или учнетъ участие земли давати, или грамоту ободную,[22]
и вы у него не емлите, занеже ободная земля — десница Свѣтодавцова и риза Пречистѣй Богородици, и образ ея чудотворной Та хранит от всякого зла. Аще учнете любовъ нелицемѣрную межи собою имѣти и роптаниемъ аще Свѣтодавца не разгнѣваете и Пречистую его Богоматерь, и учнете тружатися с радостию и от своих праведных трудов питатися, и надѣюся милости Божии и Пречистей Богородици на вас пребывати, якоже и на мнѣ, грѣшнем. А нѣчто Богъ изволит и Пречистая Богородица положити государю на сердце, или милостыню учнет давати по своих родителехъ, или на свѣчи и на фимьянъ,[23]
и на пшеницу, и вы то от государя приимѣте с любовию, яко от Свѣтодавцовы десници, занеже не вы у него того просили, но Богъ и Пречистая Богородица на то его вразумила.	А если Бог изволит, и государь станет вас жаловать, или начнет наделы земли давать, или грамоту отводную, то вы у него не берите, потому что окрестная земля — десница Светодавца и риза Пречистой Богородицы, и образ свой чудотворный
Богородица хранит от всякого зла. Если будете непритворно любить друг друга и ропотом Светодавца и Пречистую Богоматерь не разгневаете, и станете трудиться с радостью и от своих праведных трудов питаться, я надеюсь, что милость Божья и Пречистой Богородицы будет на вас пребывать, как и на мне, грешном. А если Бог и Пречистая Богородица изволят положить государю на сердце, и он станет милостыню давать на поминание своих родителей, или на свечи и фимиам, и на пшеницу, и вы то от государя принимайте с любовью, как от десницы Светодавца, потому что не вы у государя просили, а Бог и Пречистая Богородица на то его вразумили.
О явлении мѣста иконы Пречистыя Богородица	Об указании места иконы Пречистой Богородицы
Азъ
же,
многогрѣшный старецъ Мартирие, не своим изволением, но Божиим благоволениемъ и Пречистыя Богородица поможением вселихся в сию пустыню, на сие святое мѣсто.	Я, многогрешный старец Мартирий, не своевольно, а по Божьему благоволению и с помощью Пречистой Богородицы поселился в этой пустыни, на этом святом месте.
Еще
