СЛОВО ИОАННА БОГОСЛОВА О ПОКОИ СВЯТЫА ВЛАДЫЧИЦА НАША БОГОРОДИЦА И ПРИСНОДѢВЫА МАРИА	СЛОВО ИОАННА БОГОСЛОВА ОБ УПОКОЕ СВЯТОЙ ВЛАДЫЧИЦЫ НАШЕЙ БОГОРОДИЦЫ И ВЕЧНОДЕВЫ МАРИИ
Благослови, отче.	Благослови, отче.
Святей и преславнѣй Богородици и приснодѣвѣй Марии по обычаю на святый гробь Господа нашего восходящи кадить и покланяющи святѣи колѣни, моляще рождешагося из нея Христа Бога нашего дабы к нему шла. Видящи же ю иудеи ходящу на святый гробь, припадоша къ архиерѣом, глаголюще, яко на всякь день Мариа ходить на гробище. Призвавше же архиерѣи стража, еже бѣху учинили, да быша не дали никомуже молитися на святѣмь гробѣ, вопрашаху о нѣй, аще воистину си тако есть? Стражие же отвѣщавше, рекоша, яко ничесоже такова видѣхомь, Богу не оставльшу ихь честнаго прихожения ея видѣти. Во единъ же от дней, пятку сущу, прииде на гробь по обычаю святаа Мариа Богородица, и молитву ей творящи, архангелъ Гавриилъ, съшедь к ней, рече: «Радуйся, рожшиа Христа Бога нашего! Молитва твоа, вшедши на небо, приата бысть. Ты нынѣ по прошению твоему оставльши миръ сей, на небеса къ твоему сыну на животъ истинный непремѣняемый отходиши».	Когда святая и преславная Богородица и вечнодева Мария по обыкновению приходила к гробу Господа нашего кадить, то, приклонив святые колени, молила родившегося из нее Христа, Бога нашего, чтобы дано ей было прийти к нему. Иудеи же, видя ее приходящую к святому гробу, обратились к архиереям, говоря, что Мария всякий день приходит на кладбище. Архиереи же, призвав стражников, которых приставили, чтобы никому не разрешали молиться у святого гроба, стали спрашивать их о ней: правда ли все это? Стражники же в ответ говорили, что ничего подобного не замечали, ибо Бог не давал им увидеть честные ее посещения. В один же из дней, в пятницу, пришла как обычно к гробу святая Мария Богородица, и во время ее молитвы сошел к ней архангел Гавриил и возгласил: «Радуйся, родившая Христа, Бога нашего! Молитва твоя дошла до неба и принята. Ты вскоре по желанию своему, оставив мир сей, отойдешь на небо к сыну своему для жизни истинной и вечной».
Слышавши же си от архангела, возвратися въспять въ Вифлеом,[1] имущи съ собою вкупѣ три дѣвы, яже ей служаху, рече къ дѣвамь: «Принесѣте ми кадилницу, да ся помолю». И принесоша по заповѣданному им, и помолися, рекши: «Господи мой, Иисус Христе, изволивый из мене родитися великиа ради благости твоеа! Услыши глась мой и посли мнѣ апостола Иоанна, да видѣвши его, начну веселитися. И посли же мнѣ святыя апостолы твоа, и иже суть к тебѣ уже отошли и яже суть нынѣ на семь свѣтѣ, на нейже есть кождо странѣ святымь твоимь повелѣнием, да сиа видѣвши, благословлю многое и хвалное имя твое. Надѣю бо ся, яко послушати мене имаши, рабы твоеа, о коемждо прошении».	Услышав все это от архангела, Мария возвратилась обратно в Вифлеем вместе с тремя девами, что прислуживали ей, и сказала она девам: «Принесите мне кадильницу, да помолюсь». И принесли ей, как она повелела, и стала молиться, говоря: «Господь мой, Иисус Христос, изволивший по великой своей благости из меня родиться! Услышь голос мой и пошли ко мне Иоанна апостола, и, увидев его, порадуюсь. И пришли ко мне святых апостолов твоих, и тех, которые уже к тебе отошли, и тех, кто еще на этом свете в разных странах по твоему повелению, чтобы, увидев их, благословила я великое и славное имя твое. Надеюсь, что услышишь эту просьбу мою, рабы твоей».
И молящися ей, приидох азъ Иоаннъ, Духу Святому восхыщшу мя на облацѣ от Ефеса[2] и поставльшу мя на мѣстѣ, идеже лежаше мати Господня. Внидох же к ней и прославль рожьшагося из неа, рѣх: «Радуйся, мати Господня, рождьшиа Христа Бога нашего, веселися, яко с великою славою отходиши житиа сего». И прослави святаа Мариа Бога, зане приидохь азъ, Иоан, к ней, помянувь глас Господень, рекший: «Се мати твоа, и се сынъ твой».[3] И три дѣвы приидоша и поклониша ми ся. И глагола ми Богородица: «Сътвори молитву и възложи кадило». И помолися, тако рекь: «Господи Иисус Христе, сътворивый чюдеса, и нынѣ створи чудеса прѣд рожешею тя. И изыдеть мати твоа от житиа сего, и устрашатся распеншии тя и не вѣровавше в тя». И яко створих молитву, глагола ми святаа Богородица: «Принеси ми кадилницу». И, приемши кадило, рече: «Господи, съврьши о мнѣ, елико ми же ся обѣщалъ преже, даже не взыде на небеса, и яко, егда отхожу от мира сего, приидеши ты и множество ангелъ твоихь съ славою многою къ мнѣ». И глаголахь кь ней азъ, Иоаннъ: «Грядет Господь нашь Иисус Христос Богъ нашь, и узриши и́, якоже ти ся есть обѣщалъ». И отвѣщавши, святаа Мариа рече ми: «Иудеи суть кляли, да егда умру, съжгуть тѣло мое». И, отвѣщавь, рѣхь ей: «Не имать видѣти истлѣниа преподобное и честное тѣло твое». И, отвѣщавши, святаа Мариа рече ко мнѣ: «Принеси кадилницу и вложи кадило, и створи молитву». И бысть глас съ небеси, глаголя: «Аминь». И слышах азъ, Иоаннъ, глас, и рече ми Святый Духъ: «Иоанне, слышиши ли глас, реченьный на небеси?» И егда окончахь молитву, отвѣщавь, рѣхь: «Ей, Господи, слышах и́». И рече ми: «Глас сей, иже слыша, сказает пришествие братиа твоеа апостолъ будущее и святыхь Силъ, яко днесь приидуть к вамь».	Когда так молилась она, пришел я, Иоанн, ибо Дух Святой вознес меня на облаке из Эфеса и поставил меня на том месте, где возлежала мать Господа. Вошел я к ней и, прославив родившегося от нее, сказал: «Радуйся, мать Господня, родившая Христа, Бога нашего, веселись, ибо в великой славе отходишь от жизни этой». И прославила святая Мария Бога за то, что пришел я, Иоанн, к ней, вспомнив о словах Господа, возвестившего: «Вот мать твоя, и вот сын твой». И пришли три девы и поклонились мне. И сказала мне Богородица: «Сотвори молитву и возложи кадило». И помолился я, так говоря: «Господи Иисусе Христе, творящий чудеса, и ныне сотвори чудеса перед родившей тебя. Отойдет мать твоя от жизни этой, и устрашатся распявшие тебя и не верящие в тебя». И когда вознес я молитву, сказала мне святая Богородица: «Принеси мне кадильницу». И, взяв кадило, сказала: «Господи, сделай для меня так, как обещал мне прежде, чем взошел на небеса: когда стану я покидать этот мир, придешь ты и множество ангелов твоих в славе великой ко мне». И сказал ей я, Иоанн: «Придет Господь наш, Иисус Христос, Бог наш, и увидишь его, как он обещал тебе». И сказала мне в ответ святая Мария: «Иудеи поклялись, что когда я умру, то сожгут тело мое». И сказал я ей в ответ: «Не узнает истления преподобное и честное тело твое». И в ответ святая Мария сказала мне: «Принеси мне кадильницу и вложи благовония и сотвори молитву». И был глас с неба, возвестивший: «Аминь!». Услышал я, Иоанн, глас, и возвестил мне Святой Дух: «Иоанн! Слышал ли глас с неба?». И когда кончил я молитву, то ответил: «Да, Господи, слышал его». И сказал мне: «Глас этот, который ты слышал, возвещает скорый приход братии твоей, апостолов, и святых Сил, ибо сегодня придут они к вам».
Азъ же, Иоаннъ, о семь моляхся. И святый Духъ рече къ апостоломь: «Вси вкупѣ, на облакы всѣдше, от конець вселенныа съберитеся въ святѣмь Вифлеемѣ. Ты Симоне-Петре из Рима, Павелъ от Тивериана, Фома от Индия внутрьнѣйшаа, Иаковь от Иерусалима».[4] Андрѣа, братъ Петровь, Филиппъ, Лука и Симонъ Кананей, почившеи, въсташа изъ гробь Святымь Духъмь, к нимже и рече: «Уже не мните, яко въскрешение есть нынѣ, но сего ради въстасте из гробь, да идете на цѣлование и честь и чюдо матере Господня и Бога Спаса нашего, яко приближися день въсхождениа еа на небеса». Марко же сый и еще такожде, и той из Александриа прииде с прочими апостолы, якоже рѣхом — от коаждо страны кождо. Петръ же взятъ бысть на облацѣ и ста межу небом и землею, Святымь Духомь подпираемъ и подобно святымь апостолом. И тѣмь, восхыщеномь на облацѣхь, обрѣтохомся с Петром. И тако, Святымь Духомь съвокуплени, вси приидохомь къ матери Бога нашего и, поклоншеся, рѣхом: «Не бойся, ни скорби! Господь Богъ, рождеися ис тебе, изводить тя из мира сего съ славою». И возрадовавшися о Бозѣ, Спасѣ нашемь, возведься и сѣде на одрѣ и глагола к нам: «Нынѣ вѣру яхъ, яко приидеть Господь нашь с небеси, и вижду и́, и такося изрѣшу от житиа сего, якоже видѣхь вы пришедша. И хощу, да ми повѣсте, како разумевше отрѣшение мое от телесе сего, приидосте ко мнѣ и от коих странь и колицѣмь приидосте сѣмо, зане тако ускористе на мое посѣщение, — не утаи бо мене Господь нашь Иисус Христос и Богъ всѣхь».	И я, Иоанн, помолился об этом. И возвестил Святой Дух апостолам: «Вы все вместе, взойдя на облака, со всех концов вселенной соберитесь в святом Вифлееме. Ты, Симон-Петр, — из Рима, Павел — из Тивериана, Фома — из Индии Внутренней, Иаков — из Иерусалима». Андрей, Петров брат, Филипп, Лука, Симеон Канаит, уже почившие, встали из гробов по воле Святого Духа, сказавшего им: «Не думайте же, что настало время воскресения (мертвых), но сего ради востали вы из гробов, чтобы смогли прийти приветствовать и почтить и увидеть чудеса матери Господа Бога и Спаса нашего, ибо близок день восшествия ее на небеса». Марк же был также, и тот из Александрии пришел с другими апостолами, как сказали мы — из каждой страны каждый. Петр же был вознесен на облаке и пребывал между небом и землей, поддерживаемый Святым Духом, так же, как и все святые апостолы. И те, вознесенные на облаках, оказались вместе с Петром. И так, Святым Духом собранные, все явились к матери Бога нашего и, поклонившись ей, сказали: «Не бойся и не скорби! Господь Бог, родившийся из тебя, изводит тебя из мира этого со славой». И радуясь о Боге, Спасителе нашем, поднялась она и села на одре своем и сказала нам: «Ныне поверила я в то, что придет Господь наш с небес, и увижу его, и освобожусь от жизни, так как вижу вас, ко мне пришедших. И хочу, чтобы вы мне поведали, как вы узнали об отрешении моем от тела и пришли ко мне, и каким образом и из каких стран прибыли вы сюда, а особенно — как успели вы посетить меня, и как не скрыл меня от вас Господь наш, Иисус Христос, Бог всех».
Отвѣщавь же, Петръ рече къ апостоломь: «Кождо, к немуже Святый Духь возвѣсти и заповѣда намь, извѣстите матери Господа нашего». Отвѣщавь же азъ, Иоаннъ, и рѣх: «Азь, егда вхождахь въ святый олтарь службу сътворити въ Ефесѣ, Духъ Святый глагола ми, яко приближися время преставлениа матери Господа Бога твоего. “Ходи в Вифлеомь на цѣлование ея”. И облакь свѣтелъ восхити мя и въ дверех, идеже лежиши, постави мя». Петръ рече: «Азъ в Римѣ живый, къ утреници слышахь глась Святымь Духомь глаголющь къ мнѣ: “Мати Господа твоего, оставляющи миръ сь, на небеса преставлением течение творить. Ходи в Вифлеомь на цѣлование еа”. И се облакь свѣтелъ восхыти мя. И видѣхь и прочая апостолы на облацѣх грядущая ко мнѣ. И глас глаголя къ мьнѣ: “Вси идѣте в Вифлеомь”». Отвѣщавь, Павелъ рече: «И азь въ градѣ, отстоящимь от Рима немалѣмь растояниемь, живы, въ странѣ, нарицаемѣ Тиверианъ, слышахь Святый Духъ, гласомь глаголющь ко мнѣ: “Мати Господа твоего, оставляющи миръ сей, на небеса преставлениемь течение творить. Поиди въ Вифлеом на цѣлование еа”. И се облакь свѣтель восхыти мя и постави мя, идѣже и вы». Отвѣщав же и Фома и рече: «И азь Индийскую страну прошедь, проповѣдаа Христовою благодатию и утвержаа сына сестры царѣ, именем Давдань, мною хотяше знаменатися в полатѣ.[5] И внезапу Духь Святый глагола ко мнѣ: “И ты, Фома, иди въ Вифлеем на цѣлование матери Господа твоего, яко преставление на небеса творить”. И облакь свѣтелъ восхыти мя и постави мя при вас». Отвѣщавь же и Марко, рече: «И азь по закону третиаа годины во Александрѣйстемь градѣ молитву творяхь, егда мя Святый Духь возхыти и приведе мя к вамъ». Отвѣщав же, Иаковь рече: «Мнѣ въ Иерусалимѣ сущу, Святый Духь повелѣ ми, глаголя: “Буди въ Вифлеемѣ, яко мати Господа твоего творить преставление”. И се облакь восхыти мя и постави мя прѣд вами». Отвѣщав же и Матфей рече: «Азъ прославих и прославлю Бога, яко сущу ми в мори влающуся и възмущьшимъся влънам, и внезапу облакь свѣтел осѣни и волнение мутное на тихость преврати, мене же, восхыщь, постави прѣд вами».	Сказал в ответ Петр, обратившись к апостолам: «Каждый из вас, кому возвестил Святой Дух и заповедал, поведайте матери Господа нашего». Отвечал я, Иоанн, и сказал: «Когда вошел я в святой алтарь службу отправлять в Эфесе, то возвестил мне Дух Святой, что приблизилось время преставления матери Господа моего. “Иди в Вифлеем на прощание с ней”. И облако светлое вознесло меня и поставило в дверях дома, где лежишь ты». Петр сказал: «Я, живя в Риме, на заутрене услышал глас, возвещающий мне Духом Святым: “Мать Господа твоего оставляет мир и, умирая, на небо восходит. Иди на прощание с ней в Вифлеем”. И тогда облако светлое вознесло меня. И увидел я и других апостолов, приближающихся ко мне на облаках. И возвестил мне глас, глаголющий: “Все идите в Вифлеем”». И сказал в ответ Павел: «Я, находясь в городе, далеко отстоящем от Рима, в области, называемой Тиверия, услышал глас Святого Духа, обращенный ко мне: “Мать Господа твоего, оставляя этот мир, возносится на небеса. Иди в Вифлеем на прощание с ней”. И тут же облако светлое вознесло меня и поставило там же, где и вы стоите». И Фома сказал в ответ: «Я пришел в Индийскую страну, проповедуя благодать Христову; и укреплял (дух) сына сестры царицыной по имени Давдан, который жаждал принять от меня знамение в палате. И внезапно Дух Святой возгласил мне: “И ты, Фома, иди в Вифлеем попрощаться с матерью Господа твоего, ибо восходит она на небеса”. И облако светлое вознесло меня и поставило меня возле вас». Марк же сказал в ответ: «И я служил, как подобает, в Александрии канон третьего часа, когда Святой Дух вознес меня и принес меня к вам». Отвечая, сказал Иаков: «Я был в Иерусалиме, и повелел мне Святой Дух: “Будь в Вифлееме, ибо умирает мать Господа твоего”. И тотчас облако вознесло меня и поставило перед вами». Отвечая, сказал Матфей: «Я славил и славлю Бога, ибо был я на море волнующемся, среди вздымающихся волн, и внезапно облако светлое осенило меня, и мутные волны смирило, меня же оно, вознеся, поставило перед вами».
И отвѣщавьше же такожде и отшедше и преже повѣдаша, како приидоша. И Варфоломий рече: «Азъ въ Фиваидѣ[6] бѣхь, проповѣдаа слово. И се Святый Духь глагола къ мнѣ: “Мати Господа вашего преставление творить, иди убо на цѣлование въ Вифлеемь”. И се облакь свѣтелъ восхыти мя и приведе мя здѣ к вамь».	И отвечали все так (...), и прежде всего поведали, как они пришли. И Варфоломей сказал: «Я в Фиваиде находился, проповедуя (божественное) слово. И вот Святой Дух воззвал ко мне: “Мать Господа вашего преставляется. Иди же на прощание с ней в Вифлеем”. И тотчас облако светлое вознесло меня и доставило меня сюда к вам».
