Не подобаеть же хвалити чюжѣ вѣры. Аще ли хвалить кто чюжюю вѣру, то обрѣтается свою вѣру хуля Аще ли начьнеть непрѣстанно хвалити и свою и чюжюю, то обрѣтается таковый двовѣрье держа и близъ есть ереси. Ты же, чадо, такыхъ дѣяний блюдися, ни присвоися к нимъ, нъ бѣгай от нихъ, якоже можеши, и свою вѣру едину непрѣстанно хвали, подвизаяся въ ней добрыими дѣлы.	Не подобает хвалить чужой веры. Если кто чужую веру хвалит, то становится он свою веру хулящим. Если же начнет непрестанно хвалить и свою и чужую, то окажется держащим двоеверие и недалеко от ереси. Ты, чадо, блюдись от таких деяний, не свыкайся с ними, но бегай от них, сколько можешь, и одну свою веру непрестанно хвали, подвизаяся в ней добрыми делами.
Милостынею же милуй, не токмо своея вѣры, нъ и чюжея. Аще ли видиши нага, ли голодна, ли зимою, ли бѣдою одьржима, аще ти будеть ли жидовинъ, ли сорочининъ, ли болгаринъ, ли еретикъ, ли латининъ, ли от поганыхъ, — всякого помилуй и от бѣды избави, якоже можеши, и мьзды от Бога не погрѣшиши. Богъ бо и самъ нынѣ набьдить поганыя, якоже и крестьяныя. Поганымъ же и иновѣрнымъ въ семь вѣцѣ попечение от Бога, въ будущемь же чюжи будуть добрыя дѣтели. Мы же, живущеи въ правовѣрнѣй вѣрѣ, и сдѣ есмы набьдими Богомь, и въ будущемъ вѣцѣ спасаеми Господемь нашимъ Исусъ Христомь».	Милостыней же милуй всякого, не своей только веры, но и чужого. Когда видишь нагого или голодного, страждущего от зимней стужи или какой беды, будь он жидовин или сарацын, болгарин или еретик, латынин или язычник, — всякого, как можешь, помилуй и от беды избавь, и не останешься без Божьего воздаяния. Бог ведь и сам в этой жизни сохраняет и язычников, и христиан. Язычникам и иноверным в нынешнем веке дано попечение от Бога, в будущем же чужды они будут благого воздаяния. А мы, живущие в правой вере, и здесь пребываем Богом соблюдаемы, и в будущем веке будем спасаемы Господом нашим Исусом Христом».
Рече ми отець: «Чадо, аще ти ся лучить по вѣрѣ сей святѣй Господа ради умрети, то с дерьзновеньемь не останися правыя сея вѣры, нъ умри за Христову вѣру. И святии бо, — рече, — по вѣрѣ умроша, да и живи суть по Христѣ. Ты же, чадо, аще узриши нѣкыя иновѣрныя, съ вѣрными прю дѣюща и прѣльстию хотяща отвести от правыя вѣры, невѣжамъ сущемь вѣрнымъ, ты же, вѣдѣние имы, и не скрый въ собѣ, нъ помози правовѣрьныимъ на кривовѣрныя. И аще имъ поможещи, то яко овьця избавиши от устъ лвовъ. Аще ли умолчиши то яко отемь у Христоса, прѣдаеши ихъ сотонѣ, тъ бо есть кривовѣрныя кривѣй вѣрѣ научилъ».	Сказал мне отец: «Чадо, если придется тебе умирать за эту святую веру Господа ради, то не оставь правой сей веры, но с дерзновеньем умри за веру Христову. Ибо святые, — сказал он, — умерли за веру, а теперь вот живут во Христе. И ты, чадо, если узришь каких-нибудь иноверцев, стязающихся с православными о вере и стремящихся соблазном отвести от правой веры несведущих верных, то ты, многосведущий, не скрой в себе своего знания, а помоги правоверным против кривоверных. Если поможешь им, то как овец избавишь их от уст львиных. Если же промолчишь, это равносильно тому, как если бы, отняв у Христа, предал ты их сатане, ибо тот научил кривоверных кривой их вере».
И аще ти речеть прьць: «Сию вѣру и ону Богъ далъ есть», ты же, чадо, рци: «То ты, кривовѣрне, мниши ли Бога двовѣрна! Не слыши ли, оканьне и развращене злою вѣрою, Писанье тако глаголеть: “Единъ Богъ, едина вѣра, едино крещенье”,[54] и Господь рече: “Тако бо лѣпо есть намъ исполнити волю”, да сее все исполнивъ, толи възнесеся, а ученикы посла на проповѣданье. Ты по проповѣдании апостольстѣмъ толико лѣтъ дѣржавъ правую вѣру, съвратилъся еси на зловѣрье по научению сотонину. Не слышите ли Павла глаголюща: «Аще и ангелъ пришедъ с небесе благовѣстить вамъ не якоже мы благовѣстихомъ, да будеть проклятъ».[55] Вы же отринувше проповѣдание апостольское и святыхъ отець исправления, приясте неправедное ученье и вѣру развращену и исполнену многыя погыбели. Того ради и от нас бысте отвѣржени. Да того ради и намъ с вами недостоить сужатия имѣти, ни къ Божьствьнамъ Тайнамъ обьще с вами намъ не приступати, ни вамъ к нашей службѣ, ни намъ къ вашей, занеже мертвымъ тѣломъ служите,[56] акы мертва Господа мняще. А мы службу творимъ живымъ тѣломъ, самого Господа жива видяще и одесную Отця сѣдяща, и пакы приидеть судить живымь и мертвымъ. Вы же есте, о латинине, мрьтви иже мрьтву жертву съдѣваете. Намъ живу Богу живу жрьтву чисту и непорочну приносяще, животъ вѣчьный обрѣсти. Тако бо и писано есть: «Въздасться комуждо по дѣломъ ихъ о Христѣ».[57]	И если скажет тебе спорящий с тобой: «Бог дал и ту, и другую веру», ты ему, чадо, скажи: «Ты, кажется, мнишь, кривоверный, что Бог двоеверен! Не слышал ли, окаянный, развращенный злой верою, как гласит Писание: “Един Бог, едина вера, едино крещение”. И Господь сказал: “Так надлежит нам исполнить всю волю”, и только когда он исполнил все, тогда вознесся, а учеников послал на проповедь. Ты, столько лет по апостольской проповеди державший православную веру, совратился в зловерие наущением сатаны. Не слышал разве Павла, глаголющего: «Если и ангел, придя с небес, благовестит вам иначе, чем мы благовестили, да будет проклят». А вы, отринувши апостольские заповеди и предание святых отцов, приняли неправедное учение и веру развращенную, исполненную многой погибели. Потому и от нас отвержены. Потому и не подобает нам иметь с вами общения, ни к Божественным Тайнам сообща приступать, ни вам к нашей службе, ни нам к вашей, ибо на мертвом теле служите, будто мертвым Господа помышляюще. А мы совершаем службу телом живым, видя самого Господа, живого и одесную Отца сидящего; и снова приидет судити живым и мертвым. Мертвые вы, о латыняне, мертвую жертву совершаете. Мы же, Богу принося жертву живую, чистую и непорочную, сподобимся обрести живот вечный. Так ведь и писано: «Воздается каждому по их делам о Христе».
 	МОЛИТВА ЗА ВСЕХ ХРИСТИАН
МОЛИТВА СВЯТАГО ФЕОДОСИЯ ПЕЧЕРЬСКАГО ЗА ВСЯ КРЕСТЬЯНЫ	МОЛИТВА СВЯТОГО ФЕОДОСИЯ ПЕЧЕРСКОГО ЗА ВСЕХ ХРИСТИАН.
Владыко Господи человѣколюбче! Иже суть вѣрнии, Господи, утверди ̀я, да будуть вѣрнѣйши того; иже суть неразумливии, ты, Владыко, вразуми я. Иже суть погани, Господи, обрати ̀я на крестьянство, и ти будуть братья наша, Иже суть в темьницахъ, или въ оковѣхъ, или в нужи, ты, Господи, избави ̀я от всякоя печали. Иже суть в затворѣхъ, и въ столпѣхъ[58], и в печерахъ, и въ пустыни, братья наша, ты, Господи, подажь имъ крѣпость к подвигу.	Владыко Господи человеколюбче! Того, кто верен, укрепи, Господи, да будут вернейшими; того, кто неразумен, вразуми, Владыко. Язычников, Господи, обрати в христианство, и будут нам братьями. В темницах сущих, в оковах и беде — избави, Господи, от всякия печали. И братьям нашим в затворах и столпах, пещерах и пустынях дай силы, Господи, на подвиг их.
Помилуй, Господи, князя нашего, имярек, и град сь, и вся сущая люди в немь. Милостью своею помилуй и мене, раба твоего грѣшнаго, имярек, аще и многогрѣшенъ есмь, но правою вѣрою рабъ твой есмь.	Помилуй, Господи, князя нашего, имярек, и град сей, и всех людей в нем. Помилуй милостью своей и меня, грешного раба твоего, имярек, хоть я и многогрешен, но правой верою раб твой.
Спаси и помилуй, Господи, епископа нашего, имярек, и весь чинъ мнишьскый съ иерѣи и дьяконы, и вся правовѣрныя крестьяны, имярек.	Спаси и помилуй, Господи, епископа нашего, имярек, и весь чин монашеский, иереев и дьяконов, и всех православных христиан.
Помилуй, Господи, сущихъ в недостаточьствѣ и озлобленыя нищетою, подажь имъ богатую милость, моления ради святыя Богородица, и силою честьнаго креста и святаго тридньвнаго въскресения твоего, и славнаго пророка и предотеча ради Иоана, и всѣхъ пророкъ и апостолъ твоихъ, святитель и мученикъ, и преподобныхъ отець, и святыхъ женъ, и всѣхъ святыхъ твоихъ, и святыхъ отець 300 и 18, иже в Никѣи,[59] и святыхъ отец, поручникъ нашего покаяния: Василья, Григорья Богословця, Иоана Златоустаго, и Николы, и святаго отца нашего Антония[60] всея Руси свѣтилника, обѣщавшаго молитися за ны.	Помилуй, Господи, того, кто беден и замучен нищетой, подай богатую им милость, моленья ради святой Богородицы, силою честного креста и святого тридневного воскресения твоего, и славного ради пророка и предотечи Иоанна, и всех ради твоих пророков и апостолов, святителей, и мучеников, и преподобных отцов, и святых жен, и всех святых твоих, собравшихся в Никее святых отцов трехсот и восемнадцати, и святых отцов, поручителей о нашем покаянии — Василия, Григория Богослова, Иоанна Златоуста, Николы, и святого отца нашего Антония, светильника всей Руси, обещавшегося молиться за нас.
И покой, Господи, душа рабъ своихъ, правовѣрныхъ князь нашихъ и епископъ, имярек, и вся сродникы наша по плоти, имярек.	Покой, Господи, души рабов своих, правоверных князей наших и епископов, имярек, и всех наших сродников по плоти, имярек.
И покой, Господи, душа рабъ своихъ, всѣхъ правовѣрныхъ крестьянъ, умершая въ градѣхъ, и в селѣхъ, и в пустыняхъ, и на путихъ, и на мори.	Покой, Господи, души рабов своих, всех православных христиан, умерших по городам и селам и в пустынных местах, в пути и на море.
Покой я на мѣстѣ свѣтлѣ, в лици святыхъ, въ оплотѣ благаго рая и жизни бесконечной и неизглаголанѣмъ и немерцаемѣмъ свѣтѣ лица твоего.	Покой их в месте светлом, с сонмом святых, в ограде благого рая, в жизни бесконечной, в неизглаголанном и немерцающем свете лица твоего.
Яко ты еси покой и въскресение усопшимъ рабомъ твоимъ, Христе Боже нашь, и тебе славимъ съ Отцемь и Святымь Духомь, и ныня и присно.	Ибо ты — покой и воскресение усопшим рабам твоим, Христе Боже наш, и славим тебя со Отцом и Святым Духом, и ныне, и присно.
