ПОУЧЕНИЕ МОИСѢЯ О БЕЗЪВРЕМЕНЬНѢМЬ ПИЯНЬСТВѢ	ПОУЧЕНИЕ МОИСЕЯ О ЧРЕЗМЕРНОМ ИЗЛИШЕСТВЕ
Богъ вложилъ есть всякое похотѣние человѣку духовнымь и телеснымь дѣломь: спанию время и мѣра, похотѣнию ѣдению время и мѣра, питию врѣмя и мѣра, женоложью похотѣнию врѣмя и мѣра, — что ли боле въ имена писати? Всему есть похотѣнию время и мѣра уречено, живущему въ вѣрѣ честьнѣй, въ крестьяньствѣ. Да аще вся та похотѣния дѣяти будеть безъ времене и без мѣры, то грѣхъ будеть въ души, а недугъ в телеси. Недугъ всь ражаеться въ телеси человѣчи, въ кручинѣ. Кручина же съсядеться от излишнаго пития и ѣдения, и спания, и женоложья, иже без времене и без мѣры. Кручины же три въ человѣцѣ: желта, зелена, черна; да от желтое огньная болѣзнь, а от зеленое зимная болѣзнь, а от черное смерть, рекши души исходъ; дьяволъ же тогда радуеться о погыбели человѣчи. Того же недуга Богъ не створи, нъ самъ в себе стваряеть недугъ безвременьнымь дѣяниемь и безмѣрьннымь, и самъ ся осужаеть на муку; аще ся не покаеть, ни въстягнеться от того. И творилъ бы в подобно время и въ мѣру, и спасенъ бъ былъ. Да всякому вѣрному человѣку держати той норовы: похотѣнию время, а на излишное похотѣние мѣру налагати узду въздержания; аще будеть похотѣние будеть, то твори, его же хощеши, нъ въ мѣру, а не без мѣры. Колико больше суть кони, колико ны вышии есть песъ, и коеждо бо от тѣхъ животныхъ видимъ, ѣдъша или пивша, чересъ сыть не брегуть: аще и тмами нудящеи будуть, не хощеть излише мѣры прияти — не убо ли сихъ и конь хужьши мы? Аще видимъ и скота грязяща, тъ не презримъ, егда ли видимъ друга, всегда погружаема, то посмѣемъся. Нъ мы, братье, не створимъ тако, да не будемъ осужени в муку: вѣкъ бо сий коротокъ, а мука долга и бес конца грѣшьному.	Бог вложил человеку любое желанье духовных и плотских поступков: сну свое время и мера, желанию пищи и время, и мера, и питью свой срок и умеренность, потребности в женщине время и мера, — стоит ли дальше слова продолжать? Любому желанию время и мера назначены живущему в вере одной, в христианстве. Но если же все те желанья исполнить кто хочет без меры и времени — грех будет в душе, а в теле недуг. Рождается всякий недуг в человеческом теле из желчи. Желчь же свернется от чрезмерной еды и питья, и лежанья, и от женской ласки без меры и срока. Желчи же три в человеке: желта, зелена и черна; от желтой — горячка, зеленая даст лихорадку, от черной же — смерть, то есть кончина души; дьявол тогда возликует о гибели человека. Такого недуга Бог не создал, но сам в себе человек создает тот недуг непотребным поступком без меры и сам осуждает себя на мученье; и коль не покается, то не удержится он от того. А делал бы в нужное время и в меру, и был бы спасен. Пусть каждый, веры достойный, обычая держится так: желанию — время, а на избыток желанья узду налагать воздержания; если же будет желание впору, то делай что хочешь — но в меру, а не безмерно. Насколько больше нас кони, насколько быстрее нас пес, а каждый из этих животных, как видим, в еде и в питье пренебрегает обжорством: хоть не раз понуждаемы будут, не захочет сверх меры принять, — неужели коней тех мы хуже? Если видим: скотина завязла — не отвергаем ее; если же видим друга в постоянном шатанье — лишь посмеемся. Так не поступим же, братья, мы так, дабы не быть осужденным на муку: жизнь коротка, а мучение — долго и бесконечно для грешных.
СЛОВО ОТЦА МОИСѢЯ О РОТАХѢ И О КЛЯТВАХѢ	СЛОВО МОИСЕЯ О ПРИСЯГАХ И КЛЯТВАХ
Пророкъ глаголеть: того ради завяза небо, не пустить дъждя на землю, зане человѣци кленуться Богомъ и его святыми, и другъ друга догонять до клятвы, и Церковь святую невѣсту Христову ротою скверняще. Приводяще, закалають сына предъ матерью. Слугы же тоя матере своего брата, рожьшагося по духу святымь крещениемь, пиють кровь заколенаго сына матери тоя. И того ради вся силы небесныя трепещють страхомь, занеже Господь Богъ не велить догонити человѣка до клятвы и до роты. Тому же подобна и другая вина: жертву приносят бѣсомъ, и недугы лѣчать чарами и наузы; немощнаго бѣса, глаголемато Трясцю, прогонять нѣкыми писмены лживыми; проклятыхъ бѣсовъ елиньскыхъ, пишюще на яблоцѣхъ и покладають на святѣй трапезѣ в годъ святыя литургия. И тогда ужаснуться страхомъ ангельская воиньства, и того ради Богъ гнѣваяся не пущаеть дъждя на землю, занеже не велить Богъ недугъ лѣчить чарами и наузы, ни бѣсъ искати — или на ловы идуще, или куплю дѣюще, или милости от царя хотяще. Горе крестьяномъ тако дѣющи, и мука горши поганыхъ, аще ся не остануть того и придуть на покаяние, то вѣкъ сь коротокъ, а мука долга и бес конца.	Пророк говорит: оттого закрылись небеса, не пуская дождь на землю, что люди клянутся Богом и его святыми, и друг друга понуждают на клятвы, и Церковь святую, невесту Христову, оскверняют присягой. Приведя, приносят в жертву сына на глазах матери. Слуги той матери и брата своего по крещенью святому и духу пьют кровь закланного сына той матери. И вот почему все силы небесные объяты ужасом, ведь Бог запрещает понуждать человека на присягу и клятву. Похожа на то и другая причина: жертву приносят языческим богам и болезни лечат колдовством и заклятьем; бессильного демона, называемого трясцей, изгоняют какими-то лживыми знаками; отверженных бесов языческих, на шарах их рисуя, помещают на священном столе во время святой литургии. И тогда содрогается в ужасе множество ангелов, и Бог потому, прогневясь, не пускает на землю дождь, что не велит Бог болезни лечить колдовством и заклятьем, ни бесов просить — на охоту идя, или торгуя, или на царскую милость надеясь. Беда христианам, так поступающим, и мученье страшнее языческого, если того не оставят и не покаются! Ибо век этот короток, а мука долга и бесконечна.
ПОУЧЕНИЕ ФИЛОСОФА, ЕПИСКОПА БѢЛГОРОДЬСКАГО	СЛОВО МУДРОГО ЕПИСКОПА БЕЛГОРОДСКОГО
