ИЗ ЛАВРЕНТЬЕВСКОЙ ЛЕТОПИСИ	ИЗ ЛАВРЕНТЬЕВСКОЙ ЛЕТОПИСИ
Начаша вои пристраивати, кождо свою власть: князь великий Мьстиславъ Романовичь Ростиславича Киевский, и Мьстиславъ Святославичь Черниговский Всеволодича Козельский, и Мстиславь Мьстиславичь Галичьский, сии бо старѣйшии земли Руской; съ ними же и младии князи: Данило Романовичь Мьстиславича, и князь Михайло Всеволодичь Черниговский, и князь Всеволодъ Мьстиславичь Киевьского сынь, и инии князи мнози. Бывшу же съвѣту ихъ въ Киевѣ всѣхъ князей, послаша къ Володимеру къ великому князю Юрию Всеволодичу на помочь; онъ же посла имъ Василка Ростовскаго. Съвѣщаша же князи, яко срѣсти ихъ на чюжой земли (тогда же половецкий князь крестыся Бастый), и съвъкупивше всю землю Рускую, поидоша противу татаромъ. Пришедши же имъ кь Днѣпру на Зарубъ, къ острову Варяжскому,[41] то же слышавше татарове, оже идутъ князи рустии противу имъ, послаша къ нимъ послы своа, глаголюще: «Се слышахомъ, оже идете противъ насъ, послушающе половецъ. А мы вашеа земли не заяхомъ, ни городовъ вашихъ, ни селъ вашихъ, ни на васъ приидохомъ. Но приидохомъ, Богомъ пущони, на конюхи и на холопы свои, на поганыа половци, а вы възмѣте съ нами миръ. А половци, аще прибѣжатъ къ вамъ, то не приимайте ихъ, и бийте ихъ отъ себе, а товаръ ихъ възмите къ собѣ. Зане же слышахомъ, яко и вамъ много зла творятъ, того ради и мы биемъ». Князи же русстии того не послушаша, по послы изъ избыша, а сами поидоша противу имъ. И не дошедше Олѣшиа,[42] и сташа на Днѣпрѣ. И прислаша къ нимъ татарове второе послы, ркуще тако: «Аще есте послушали половець, а послы наши избыли, а идѣте противу насъ, то вы поидите. А мы васъ ничимъ не заимали, а всѣмъ намъ Богь». Они же отпустиша послы ихъ.	И начали князья собирать воинов каждый в своей области: великий князь Мстислав Романович Киевский, внук Ростислава, и Мстислав Свято-славич Козельский, внук Всеволода Черниговского, и Мстислав Мстиславич Галицкий — эти старшие князья в Русской земле; а с ними и младшие князья: Даниил Романович, внук Мстислава, и князь Михаил Всеволодович Черниговский, и князь Всеволод Мстиславич, сын киевского князя, и многие другие князья. Когда все князья собрались на совет в Киеве, они послали во Владимир к великому князю Юрию Всеволодовичу за помощью, а он отправил к ним Василька Ростовского. Посоветовавшись, князья решили встретить врага на чужой земле (тогда же крестился половецкий князь Бастый) и, собрав всех русских воинов, выступили в поход против татар. Когда они пришли к Днепру на Заруб, к острову Варяжскому, услышали татары, что русские князья идут против них, и прислали своих послов, говоря: «Слышали мы, что идете вы против нас, послушавшись половцев. А мы вашей земли не занимали, ни городов ваших, ни сел ваших, и пришли не на вас. Но пришли мы, посланные Богом, на конюхов и холопов своих, на поганых половцев, а вы заключите с нами мир. И если прибегут половцы к вам, вы не принимайте их, и прогоняйте от себя, а добро их берите себе. Ведь мы слышали, что и вам они много зла приносят, поэтому мы их также бьем». Князья же русские не стали слушать этого, но послов татарских перебили, а сами пошли против татар. Не доходя до Олешья, остановились они на Днепре. И прислали татары вторично послов, говоря: «Если вы послушались половцев, послов наших перебили и идете против нас, то идите. А мы вас не трогали, и пусть рассудит нас Бог». Князья отпустили этих послов.
Ту прииде къ нимъ вся земля Половецкаа и съ князи своими. Тогда же Мъстиславъ Мъстиславичь Галичский, въ тысячи войска, перебродися рѣку Днѣпръ на сторожи татарскиа, и побѣди ихъ. А останокъ ихъ въбѣже въ курганъ Половецкий съ своимъ воеводою Гемябѣкомъ, и ту имъ не бысть помочи. И погребоша воеводу своего Гемябѣка живого въ землю, хотяще его ублюсти. И ту его налѣзоша, испросивше его половци у Мстислава, и убиша его. То же слышавше князи рустии, поидоша за Днѣпрь на множествѣ людей: Мъстиславь князь великий Романовычь съ кианы, Володимерь Руриковичь съ смолняны, черниговьстии князи, галичане, и волинцы, и куряне, и трубчане, и путивльци, и вся страны руския, и вси князи и множество вой. Приидоша же выгонцы галичьские[43] въ лодиахь по Днѣстру въ море, бѣ же тысяща лодей. Изъ моря выидоша въ Днѣпрь, и възведше порогы, сташа у рѣки Хортици,[44] на бродѣ у Протолчии; воевода же у нихь Юрий Домарѣчичь, а другой Держикрай Водиславича.	И пришли к Олешью все половцы со своими князьями. Тогда князь Мстислав Мстиславич Галицкий с тысячью воинов перешел Днепр вброд, ударил по татарским сторожевым полкам и победил их. А оставшиеся татары убежали на курган Половецкий с воеводой Гемябеком, и не было им здесь помощи. И зарыли они своего воеводу Гемябека живым в землю, желая его уберечь. Но здесь его нашли половцы и, выпросив его у князя Мстислава, убили. Услышав это, князья русские стали переправляться через Днепр на множестве ладей: великий князь Мстислав Романович с киевлянами, Владимир Рюрикович со смольнянами, черниговские князья, галичане, и волынцы, и куряне, и трубчане, и путивличи, все земли русские, все князья и множество воинов. А выгнанные галичане спустились на ладьях по Днестру в море, и была у них тысяча ладей. Из моря вышли они в Днепр и, пройдя пороги, остановились у реки Хортицы на броде у Протолочи; а воеводой у них был Юрий Домамерич, а другим воеводой Держикрай Володиславич.
Приидоша же имъ вѣсти, яко татарове приидоша къ нимъ посмотрити рускыхъ полковъ; Данило же Романовичь и инии князи, всѣдше на коня, погнаша видѣти рати татарскиа. И видѣвше послаша къ великому князю ко Мстиславу Романовичу, рекуще: «Мьстиславе и Мстиславь! Не стойте, поидемъ противу имъ». И поидоша въ поле, и срѣтоша ихъ татарове, и ту стрѣлци русстии погнаша ихъ въ поле далече, ихъ сѣкуще; и взяша скоты ихъ, и съ стаду утекоша. И оттуду идоша по нихъ осмь дний до рѣки Калка,[45] и послаша въ сторожехъ Яруна съ половци, а сами станомъ сташа ту. И ту срѣтошася съ сторожи, и убиша Ивана Дмитриевича и ина два съ нимъ; а татарове възвратишася. Князь же Мьстиславъ Мьстиславичь Галицкий повелѣ Данилу Романовичу перейти рѣку Калку съ полкы, а самъ по нихъ прииде; перешедъ сташа станомъ. Поиха же и самъ на сторожи Мьстиславъ, и видѣвь полки татарьские, прииха и повелѣ въоружатися воемъ своимъ. А два Мьстислава въ стану бяху, того не вѣдающе: не повѣда бо имъ зависти ради, бѣ бо межи ихъ пря велика.	Пришла весть русским, что пришли татары осматривать русские полки; тогда Даниил Романович и другие князья сели на коней и погнались, чтобы увидеть татарские войска. И, увидев их, послали к великому князю Мстиславу Романовичу, призывая: «Мстислав и другой Мстислав! Не стойте, пойдем против них». И вышли в поле, и встретились с татарами, и тут русские стрелки погнали их далеко в поле, рубя их; взяли они их скот и вернулись назад со стадами. И оттуда шли русские полки за ними восемь дней до реки Калки, и отправили со сторожевым отрядом Яруна с половцами, а сами разбили здесь лагерь. И здесь они встретились с татарскими дозорами, и убили татары Ивана Дмитриевича и с ним еще двоих; а татары поворотили назад. Князь же Мстислав Мстиславич Галицкий повелел Даниилу Романовичу перейти реку Калку с полками, а сам отправился вслед за ними; переправившись, стали они станом. Тогда Мстислав сам поехал в дозор, и, увидев татарские полки, вернулся, и повелел воинам своим вооружаться. А оба Мстислава оставались в стане, не зная об этом: Мстислав Галицкий не сказал им ничего из зависти, ибо между ними была великая распря.
Тако съступишася полкы, и напередъ иха на татарове и Данило Романовичь, и Семень Олюевичь, и Василко Гавриловичь. Ту Василка събодоша, а Данилу убодену бывшу въ перси, но не чюяше, буести ради и мужества; бѣ бо младъ, осминадесяти лѣть, но крѣпокь бяше на брань, избиваше татаръ мужественѣ полкомъ своимъ. Тако же и Мьстиславь Нѣмый потече на нихъ, и той бѣ крѣпокъ, и видѣвь яко събодоша Данила. Бѣ бо ужика отцу его, любовь имѣа къ нему, ему же и власть по себѣ обѣща. Тако же и Олгу Курскому крѣпко биющюся; тако же и Ярунь съ половци прииде, съступыся съ татары, хотя съ ними бытися. Но пакы половци въскорѣ побѣгоша назадъ, не успѣвше ничто же, и потопташа бѣжучи станы рускыхъ князей. А князи не успѣша исполчитися против имъ; и тако смятошася полци рустии, и бысть сѣча зла, грѣхъ ради нашихъ. И бысть побѣда на князи рускиа, яко же не бывала отъ начала Руские земли.	И так встретились полки, а выехали вперед против татар Даниил Романович, и Семен Олюевич, и Василек Гаврилович. Тут Василька поразили копьем, а Даниил был ранен в грудь, но он не ощутил раны из-за смелости и мужества; ведь он был молод, восемнадцати лет, но силен был в сражении и мужественно избивал татар со своим полком. Мстислав Немой также вступил в бой с татарами, и был он также силен, особенно когда увидел, что Даниила ранили копьем. Был ведь Даниил родственником его отца, и Мстислав очень любил его и завещал ему свои владения. Также и Олег Курский мужественно сражался; также и Ярун с половцами подоспел и напал на татар, желая с ними сразиться. Но вскоре половцы обратились в бегство, ничего не достигнув, и во время бегства потоптали станы русских князей. А князья не успели вооружиться против них; и пришли в смятение русские полки, и было сражение гибельным, грехов наших ради. И были побеждены русские князья, и не бывало такого от начала Русской земли.
Князь великий же Мьстиславъ Романовичь Киевьский, внукъ Ростиславль Мьстиславича, сына Владимерова Манамахова, и князь Андрѣй, зять его, и Александрь Дубровский, видѣвше се зло, не двигошася никамо же съ мѣста. Стали бо на горѣ надъ рѣкою Калкою, бѣ бо мѣсто то каменно, и учиниша себѣ городъ колиемъ. И бишася съ ними изъ города того по 3 дни. Татарове же поидоша по рускыхъ князехъ, гониша ихъ биюще до Днѣпра. А у города того осташася два воеводи, Чегыркань и Тешукань, на Мьстислава Романовича, и на зятя его Андрея, и на Александра на Дубровского; тии бо два князя съ Мьстиславомъ. Быша же съ татары и бродницы,[46] а воевода у нихъ Плоскиня. И той окаянный воевода цѣлова кресть къ великому князю Мьстиславу, и кь обѣма князема, и кь всѣмъ сущимъ съ нимъ, яко не збыти ихъ, но окупь взяти на нихъ, и солгавь окаянный, предасть ихъ татаромъ, связавь. А городъ вземъ людей изсѣкоша, и ту костию падоша. А князей издавиша, подкладше подъ дощки, а сами на верху сѣдоша обѣдати; и тако издохошася и животъ свой скончаша.	Князь же великий Мстислав Романович Киевский, внук Ростислава, правнук Мстислава, который был сыном Владимира Мономаха, и князь Андрей, зять Мстислава, и Александр Дубровский, видя это несчастье, никуда не двинулись с места. Разбили они стан на горе над рекой Калкой, так как место было каменистое, и устроили они ограду из кольев. И сражались из-за этой ограды с татарами три дня. А татары наступали на русских князей и преследовали их, избивая, до Днепра. А около ограды остались два воеводы, Чегирхан и Тешухан, против Мстислава Романовича, и его зятя Андрея, и Александра Дубровского; с Мстиславом были только эти два князя. Были вместе с татарами и бродники, а воеводой у них Плоскиня. Этот окаянный воевода целовал крест великому князю Мстиславу, и двум другим князьям, и всем, кто был с ними, что татары не убьют их, а возьмут за них выкуп, но солгал окаянный: передал их, связав, татарам. Татары взяли укрепление и людей перебили, все полегли они здесь костьми. А князей придавили, положив их под доски, а татары наверху сели обедать; так задохнулись князья и окончили свою жизнь.
А иныхъ князей, опроче того, до Днѣпра гоняще, избиша 6: князя Святослава Каневского, Изяслава Иньгваревича, Святослава Шумского, Мьстислава Черниговского съ сыномъ, Юриа Несвѣжского, а вой толко десятый прииде. И Александрь Поповичь ту убиенъ бысть съ инѣми седмидесятию храбрыхъ. Князь же Мьстиславъ Мьстиславичь Галичский переже всѣхъ пребѣгь за Днѣпръ, повелѣ лодии пережечь, а иныя отъ берега отрѣа, боячися погони; а самъ едва убѣже въ Галичь. А Володимеръ Руриковичь, братаничь Романовь, внукъ Ростиславль Мьстиславича, сѣде в Киевѣ, мъсяца июня 16 день. А злоба случилася мѣсяца маа 30, на память святаго мученика Еремеа. Войска же остатокъ десятый прииде кождо во своа, а иныхъ половци избыша ис коня, а иныхъ ис порта. И тако за грѣхы наша Богъ вложи недоумѣние въ насъ, и погыбе множество бес числа людий. Татарове же гнашася по Руси до Новагорода Святополчего.[47] Христиане же, не вѣдуще лести татарскыя, выидоша противу ихъ съ кресты, и тако избыша ихъ. Глаголаху же, яко единѣхъ же киань изгыбе тогда 30 тысячь.	А других князей, которых татары преследовали до Днепра, было убито шесть: князь Святослав Каневский, Изяслав Ингваревич, Святослав Шуйский, Мстислав Черниговский с сыном, Юрий Несвижский, а из воинов только десятый вернулся домой. И Александр Попович тут был убит вместе с другими семьюдесятью богатырями. Князь же Мстислав Мстиславич Галицкий раньше всех переправился через Днепр, велел сжечь ладьи, а другие оттолкнуть от берега, боясь погони; а сам он едва убежал в Галич. А Владимир Рюрикович, племянник Романа, внук Ростислава Мстиславича, сел на престоле в Киеве месяца июня в шестнадцатый день. А случилось это несчастье месяца мая в тридцатый день, на память святого мученика Ермия. Только десятая часть войска вернулась домой, а у некоторых половцы отняли коня, а у других одежду. Так за грехи наши Бог отнял у нас разум, и погибло бесчисленное множество людей. Татары же гнались за русскими до Новгорода-Святополча. Христиане, не зная коварства татар, выходили им навстречу с крестами, и все были избиты. Говорили, что одних киевлян погибло тогда тридцать тысяч.
