ИЗ ЛАВРЕНТЬЕВСКОЙ ЛЕТОПИСИ	ИЗ ЛАВРЕНТЬЕВСКОЙ ЛЕТОПИСИ
И бысть плачь и вопль по всѣмъ градомъ и по селомъ. Татарове же възвратишася отъ рѣки Днѣпра, и не свѣдаемъ откуду были пришли, и камо ся дѣли. Единь Богь вѣсть, откуду приведе за грѣхы наша и за похвалу и гордость великого князя Мьстислава Романовича. Глаголють бо, яко прииде слухъ про сихъ татаръ, яко многы земли плѣнуютъ, а приближаются Рускимъ странамъ, и сповѣдаша ему о нихъ; онъ же отрече: «Дондеже есмь на Киевѣ, то по Яико, и по Понтийское море,[48] и по рѣку Дунай саблѣ не махивати». Василка же Костантиновича тогда Богъ съблюде, прииде бо съ полки ко Чернигову въ помочь. Слышавъ се зло, случившеся въ Руси, възвратися въ свой Ростовь, съхранень Богомъ. <...>	И был плач и вопль во всех городах и селах. Татары же повернули назад от реки Днепра, и мы не знаем, откуда они пришли и куда исчезли. Один только Бог знает, откуда он привел их за наши грехи, и за похвальбу, и высокомерие великого князя Мстислава Романовича. Говорят, что когда распространился слух про этих татар, что завоевывают они многие земли и приближаются к русским пределам, великому князю сказали о них; а он ответил: «Пока я нахожусь в Киеве — по эту сторону Яика, и Понтийского моря, и реки Дуная татарской сабле не махать». А Василька Константиновича, который пришел на помощь с войсками к Чернигову, тогда сохранил Бог. И услышав о несчастье, случившемся на Руси, он возвратился в свой Ростов, сохраненный Богом. <...>
Въ лѣто 6745. <...> О плѣнении Рускыа земля отъ Батиа. Слышано бысть на восточнѣй странѣ въ родѣ Измаиловѣ, сына Агарина, рабыни Авраамовы,[49] яко смири Господь Богъ Рускую землю нахождениемъ безбожныхъ иноплеменникъ, таурмень. Еже на Калкы и побѣждение рускыхъ князей прослу, и храбрыхъ онѣхъ 72 избиение вѣдомо тамо бысть, и межиусобныа брани Рускыа земля, и глады, и морѣ велицѣи, и оскудѣние рускаго воинства, и разньствие въ братии, и просто все земское неустроение. Наипаче же обнажися грѣховнаа злоба, и вопль грѣховный въ уши Господа Саваофа вънииде. Тѣмъ и попусти на землю нашу таковую всепагубную рану. Еще бо и сеа крови не отмыхомъ, Калкацкого бою, и пакы народися людий по велицѣмъ мору по всей земли, кромѣ Киева. Но киевьстии людие на Калкахъ съ великымъ княземь Мьстиславомъ Романовичомъ, и съ инѣми 10-ю князи и съ 72-ю храбрыми костию тамо падоша; новгородстии людие отъ гладныя смерти изъмроша, а живыи разыдошася по чюжимъ землямъ; тако же и смоленскаа, и вси просто гради столнии смерти тоа вкусивше, въскорѣ осиротѣша. Не много бо лѣтъ мину, отъ Калкатцкиа рати до потрясениа земли 8 лѣтъ, тогда же и гладъ бысть, а отъ потрясениа земли до Батыева прихождениа 8 лѣтъ. Того ради не исполнися земля наша, но и наипаче всѣмъ животнымъ опустѣ.	В год 6745 (1237). <...> О пленении Русской земли Батыем. Стало известно в восточных странах среди потомков Измаила, сына Агари, рабыни Авраама, что Бог смирил Русскую землю нашествием безбожных иноплеменников, таурмен. Распространились слухи о поражении русских князей на Калке, и стало известно о гибели семидесяти двух богатырей, и о междоусобных войнах в Русской земле, и о голоде, и о великом море, и об оскудении русских войск, и о ссорах между братьями — о всех этих бедах Русской земли. Особенно же обнаружилась греховная злоба, и дошел вопль греховный до ушей Господа Саваофа. Поэтому он напустил на нашу землю такое пагубное наказание. Не отмыли мы еще кровь после битвы на Калке, и снова народились люди после великого мора по всей земле, кроме Киева. А киевляне полегли костьми на Калке с великим князем Мстиславом Романовичем, и с другими десятью князьями, и с семьюдесятью двумя богатырями; так же и Смоленск, и все другие города постигла такая же смерть, и вскоре опустели они. От битвы на Калке до землетрясения прошло немного времени — восемь лет, и тогда случился голод, а от землетрясения до нашествия Батыя прошло восемь лет. Поэтому не разбогатела наша земля, но, напротив, еще более обезлюдела.
Мы же приведемъ слово къ повѣсти, како ублюде Богь великого князя Юриа Всеволодича, и Ярослава, брата его, и братанича ихъ Василка Ростовского Костантиновича от Калокъ, тако же и люди оставшая отъ мору, и како не угоньзнуша своеа смерти, обща бо есть всей Руской земли.	Мы же приложим к повести рассказ о тех, кого Бог спас при Калке — о великом князе Юрии Всеволодовиче, и брате его Ярославе, и племяннике их Васильке Константиновиче Ростовском, также и о людях, оставшихся после мора, и расскажем, как они не избегли смерти, постигшей всю Русскую землю.
Слышавше бо безбожнии татарове таковое смирение руское, и имѣние великое, многыми лѣты събраное, двигнушася съ восточныа страны, и поплѣниша прьвое Болгарскую землю.[50] А на третий годъ на Русскую землю приидоша бесчисленое множество, яко прузи траву поядающе, тако и сии сыроядци христианьский родъ потребляюще.	Узнали безбожные татары о таких невзгодах русских и о великом богатстве, собранном за многие годы, и двинулись они из восточных стран, и пленили сначала Булгарскую землю. А в третий год пришло их на Русскую землю бесчисленное множество — как саранча, пожирающая траву, так и эти варвары христианский род истребляли.
Въ лѣто 6746. Зимоваша окааныи татарове подъ Чернымъ лѣсомъ и оттолѣ приидоша безвѣстно на Рязаньскую землю лѣсомъ съ царемъ ихъ Батиемь. И прьвое приидоша и сташа о Нузлѣ,[51] и взяша ю, и сташа ту станомъ. И оттолѣ послаша посломъ жену чародѣицу, а съ нею два татарина, въ Рязань къ княземъ рязаньскымъ, просяще у нихъ десятыны: десятого въ князехь, десятого въ людехъ, и въ конехъ, десятаго въ бѣлыхъ, десятаго въ вороныхъ, десятаго въ бурыхъ, десятаго въ пѣгыхъ, и въ всемь десятого. Князи же рязаньстии, Юрий Иньгваревичь и брата его Олегь и Романь Иньговоровичи, и муромские князи, и проньские хотѣша съ ними брань сътворити, не вьпустячи въ свою землю. И выидоша противу ихъ въ Вороножь,[52] и ркоша посломъ Батыевымъ: «Коли насъ не будетъ всѣхъ, то все то ваше будеть». И оттолѣ послаша ихъ къ великому князю Юрию Всеволодичу въ Володимеръ, и оттолѣ пустиша татаре въ Воронажи. Послаша же рязаньстии князи пословъ своихъ въ Володимеръ къ великому князю Юрию, просяще помощи, или самому поити и вмѣстѣ постоати за землю Рускую. Князь великий же Юрий не послуша молбы рязаньскыхъ князей, самъ не поиде ни посла къ нимъ; но вьсхотѣ самъ о себѣ съ татары брань сътворити. Но уже бяше Божию гнѣву не възможно противитися, яко же древле речено бысть Господемь Исусу Навгину;[53] егда веде ихъ Господь въ землю обѣтованную, тогда рече: «Азъ послю во нихъ прежде въ васъ недоумѣнное, и грозу, и страхъ, и трепетъ». Тако же и у насъ отъятъ Господь преже силу, а за грѣхы наша вложи въ насъ грозу, и страхъ, и трепетъ, и недоумѣние.	В год 6746 (1237). Окаянные татары зимовали около Черного леса и отсюда пришли тайком лесами на Рязанскую землю во главе с царем их Батыем. И сначала пришли и остановились у Нузы, и взяли ее, и стали здесь станом. И оттуда послали своих послов, женщину-чародейку и двух татар с ней, к князьям рязанским в Рязань, требуя у них десятой части: каждого десятого из князей, десятого из людей и из коней: десятого из белых коней, десятого из вороных, десятого из бурых, десятого из пегих — и во всем десятого. Князья же рязанские, Юрий Ингваревич, и братья его Олег и Роман Ингваревичи, и муромские князья, и пронские решили сражаться с ними, не пуская их в свою землю. Вышли они против татар на Воронеж и так ответили послам Батыя: «Когда нас всех не будет в живых, то все это ваше будет». Потом они послали к великому князю Юрию Всеволодовичу во Владимир, и тогда отпустили татарских послов от Воронежа. А к великому князю Юрию во Владимир послали рязанские князья своих послов, прося помощи, или чтобы сам пришел вместе постоять за землю Русскую. Но великий князь Юрий не внял мольбе рязанских князей, сам не пошел и не прислал помощи; хотел он сам по себе биться с татарами. Но гневу Божьему уже невозможно было противиться, как в древности сказано было Господом Иисусу Навину; когда Господь вел иудеев в землю обетованную, тогда он сказал: «Я пошлю сначала на них недомыслие, и грозу, и страх, и трепет». Так и у нас Господь отнял сначала силы, а за наши грехи послал на нас грозу, и страх, и трепет, и недомыслие.
Погании же татарове начаша воевати землю Рязаньскую, и оступиша Рязань, мѣсяца декабря въ 16 день, на память святаго пророка Аггеа, и острогомъ оградиша его. Князь же Юрий Рязаньский затворися въ градѣ съ людми, а князь Романь отступи къ Коломнѣ съ своими людми. И взяша градъ татарове, в 21 день, приступивше, того мѣсяца, на память святыа мученицѣ Иулианы, князя Юриа Иньгваревича убиша и княгыню его, а люди изсѣкоша, мужа, и жены, и дѣти, и чрьнца, и чрънорызыца, иереа, овыхъ огнемъ, а иныхъ мечемъ; поругание чрьницамъ, и попадиамъ, и добрымъ женамъ, и дѣвицамъ предъ матереми и сестрами. А епископа же ублюде Богъ, отъиха въ то время прочь, егда татарове городъ оступиша. И изсѣкше люди, а иныхъ плѣнивше, зажгоша градъ. И кто, братие, отъ насъ не поплачется о семъ, кто насъ осталъ живыхъ, како они горкую и нужную смерть подъяша! Да и мы, то видѣвши, устрашилися быхомъ и плакалися грѣховъ своихъ день и нощь сь въздыханиемь; мы же творимъ съпротивное, пекущеся о имѣнии и о ненависти братни. Мы же на предлежащее възвратимся.	Поганые же татары начали завоевывать землю Рязанскую, и осадили Рязань, и огородили ее острогом месяца декабря в шестнадцатый день, на память святого пророка Аггея. Князь же Юрий Рязанский заперся в городе с жителями, а князь Роман отступил к Коломне со своими людьми. И взяли татары приступом город двадцать первого декабря, на память святой мученицы Ульяны, убили князя Юрия Ингваревича и его княгиню, а людей умертвили,— одних огнем, а других мечом, мужчин, и женщин, и детей, и монахов, и монахинь, и священников; и было бесчестие монахиням, и попадьям, и добрым женам, и девицам перед матерями и сестрами. Только епископа сохранил Бог, он уехал в то время, когда татары окружили город. И, перебив людей, а иных забрав в плен, татары зажгли город. И кто, братья, из оставшихся в живых не оплачет это,— какая горькая и мучительная смерть их постигла! И мы, видя это, должны устрашиться и оплакивать свои грехи с покаянием денно и нощно; а мы поступаем по-другому, заботимся о своем имуществе и ненавидим братьев. Но вернемся к прежнему рассказу.
Князь же великий Юрий Всеволодичь Володимерский посла въ сторожехъ Иеремѣя воеводою, и сняся съ Романомъ Ингваревичемъ. Татарове же, вземше Рязань, поидоша х Коломнѣ, и ту прииде противу ихь сынь великого князя Юриа Всеволодича изъ Володимера и Романъ Ингваревичь съ своими людми. И оступиша ихъ татарове, и ту бысть имъ бой, и бишася крѣпко, и пригониша ихъ къ надолобамъ, и ту убиша князя Романа Ингваревича и Еремеа Глѣбовича, воеводу Всеволожа, и ту паде много людей съ княземъ и съ Иеремѣемъ; а москвичи побѣгоша, ничего же не видѣвше. А Всеволодъ Юриевичь бѣжа в малѣ въ Володимеръ. А татарове пришедше взяша Москву, и князя Володимера, сына великого князя Юриа, поимаша. И поидоша къ Володимеру многое множество кровопролитецъ крови христианскыа.	Великий князь Юрий Всеволодович Владимирский послал передовое войско с воеводой Еремеем, и оно соединилось с Романом Ингваревичем. А татары, захватив Рязань, пошли к Коломне, и здесь вышел против них сын великого князя Юрия Всеволодовича Владимирского и Роман Ингваревич со своими людьми. Окружили их татары, и произошло сражение, и бились ожесточенно, и оттеснили русских к городским укреплениям, и убили здесь князя Романа Ингваревича и Еремея Глебовича, воеводу Всеволода, и убито было с князем и с Еремеем много народа; а москвичи обратились в бегство, ничего не видя кругом. А Всеволод Юрьевич с остатками войска убежал во Владимир. А татары пошли и захватили Москву, а князя Владимира, сына великого князя Юрия, взяли в плен. И пошли в несметной силе кровопускатели крови христианской к Владимиру.
Слышавъ же то князь великий Юрий, уряди въ себе мѣсто въ Володимери сыны своа, Всеволода и Мстислава, а самъ поиде къ Ярославлю, и оттолѣ за Волгу, а съ нимъ сыновци его Костантиновичи, Василко, и Всеволодъ, и Вълодимеръ, и пришедъ ста на Сити, ждучи къ себѣ брата Ярослава и Святослава. А въ Володимери затворися сынь его Всеволодъ съ материю, и съ владыкою, и съ братомъ, и съ всею областию своею.	Услышав об этом, великий князь Юрий оставил вместо себя во Владимире сыновей своих Всеволода и Мстислава, а сам пошел к Ярославлю и оттуда за Волгу, а с ним пошли племянники Василек, и Всеволод, и Владимир Константиновичи, и, придя, остановился Юрий на реке Сити, ожидая на помощь братьев Ярослава и Святослава. А во Владимире заперся его сын Всеволод с матерью, и с епископом, и с братом, и со всеми жителями.
Безаконнии же татарове приидоша къ Володимеру, мѣсяца февраля 3 день, на память святаго Симеона богоприемца, въ вторникъ мясопустныя недѣли. Приведоша же со собою Володимера Юриевича къ Золотымъ воротамъ, глаголюще: «Знаете ли княжича вашего?» Братиа же его, Ослядюковичь и вси людие видѣвше и, многы слезы излиаша, видяще его въ мнозѣ истомлении. Татарове же отступльше отъ вратъ града, и градъ объихавше, и потомъ сташа станы противу Золотыхъ воротъ на зрѣимѣ. Юриевичи же, Всеволодъ и Мьстиславъ, хотѣша выйти на нихъ, не дасть имъ брати Петрь воевода, глаголя: «Нѣсть мужества, ни думы, ни силы противу Божия посѣщениа, за наше съгрѣшениа».	Беззаконные же татары пришли к Владимиру месяца февраля в третий день, на память святого Симеона-богоприимца, во вторник мясопустной недели. Привели они с собой Владимира Юрьевича к Золотым воротам, спрашивая: «Узнаете ли княжича вашего?» Братья его, воевода Ослядюкович и все люди проливали обильные слезы, видя горькие мучения князя. Татары же отошли от городских ворот, объехали город, а затем разбили лагерь на видимом расстоянии перед Золотыми воротами. Всеволод и Мстислав Юрьевичи хотели выйти из города против татар, но Петр-воевода запретил им сражаться, сказав: «Нет мужества, и разума, и силы против Божьего наказания за наши грехи».
