ИЗ ЛАВРЕНТЬЕВСКОЙ ЛЕТОПИСИ	ИЗ ЛАВРЕНТЬЕВСКОЙ ЛЕТОПИСИ
И повержену на лѣсѣ, видѣ и етера жена вѣрна, повѣда мужю богобоязниву, поповичю Андрияну. И взя тѣло князя Василка, и понявицею обитъ, реку саваном, и положи его в скровнѣ мѣстѣ. Увѣдѣв же боголюбивый епископъ Кирилъ и княгыни Василкова, послаша по князя, принесоша и в Ростовъ. И яко понесоша и в град, и множество народа изидоша противу ему, жалостныя слезы испущающе, оставше такого утѣшения. Рыдаху же народа множество правовѣрных, зряще отца сирым и кормителя отходящим, печалным утѣшенье великое, омрачным звѣзду свѣтоносну зашедшю. На весь бо церковный чинъ отверзлъ бяшеть ему Богъ очи сердечнѣи, и всѣмъ церковником, и нищим, и печалным яко възлюбленый бяше отець; паче же и на милостыню, поминая слово Господне глаголющее: «Блажении милостивии, яко ти помиловани будут». И Соломонъ глаголеть: «Милостынями и вѣрою очищаются грѣси». Тѣм же и не погрѣши надежи, его же просяше у Бога: «Господи, спаси любящих тя». Сего бо блаженаго князя Василка спричте Богъ смерти подобно Андрѣевѣ;[28] кровью мученичьскою омывъся прегрѣшений своих с братом и отцомъ Георгием с великим князем. Се бо и чюдно бысть, ибо и по смерти совкупи Богъ телеси ею; принесоша Василка и положиша и в церкви святыя Богородица в Ростовѣ, иде же и мати его лежить. Тогда же принесоша голову великаго князя Георгия и вложиша ю в гроб к своему тѣлу.	Когда тело Василька было брошено в лесу, увидела его некая благочестивая женщина и рассказала об этом своему богобоязненному мужу, поповичу Адриану. Взял он тело князя Василька, и завернул его в понявицу, то есть в саван, и положил его в тайном месте. Узнав об этом, боголюбивый епископ Кирилл и княгиня Василька послали за телом князя, и принесли его в Ростов. И когда понесли его в город, навстречу ему вышло множество людей, проливая слезы жалостные, горюя, что остались без такого утешителя. Многие правоверные люди рыдали, глядя на погребение отца и кормителя сиротам, великого утешителя печальным, закатившуюся светоносную звезду во мраке пребывающим. Ведь Бог открыл ему глаза сердца на всех служителей Божьих, и он был как бы возлюбленным отцом для всех церковнослужителей, и нищих, и печальных; щедр он был на милостыню, помня слово Господа, гласящее: «Блаженны милостивые, ибо они будут помилованы». И Соломон товорит: «Милостынями и верой очищаются грехи». И так не обманули его надежды, то, о чем он просил Бога: «Господи, спаси любящих тебя». Этому блаженному князю Васильку послал Бог смерть, как Андрею: смыл он мученической кровью свои прегрешения со своим братом и отцом, великим князем Георгием. И удивительно было, что даже после смерти Бог соединил тела их; принесли тело Василька и положили его в церкви святой Богородицы в Ростове, где и мать его похоронена. Тогда же принесли голову великого князя Георгия и положили ее в гробницу, где уже лежало тело его.
Бѣ же Василко лицем красенъ, очима свѣтелъ и грозенъ, хоробръ паче мѣры на ловѣх, сердцемь легок, до бояръ ласковъ. Никто же бо от бояръ, кто ему служилъ, и хлѣбъ его ѣлъ, и чашю пилъ, и дары ималъ, тотъ никако же у иного князя можаше быти за любовь его. Излише же слугы свои любляше, мужьство же и ум в нем живяше, правда же и истина с ним ходяста. Бѣ бо всему хытръ и гораздо умѣя, и посѣдѣ в доброденьствии на отни столѣ и дѣдни; и тако скончася, яко же слышасте.	Был же Василек лицом красив, очами светел и грозен, храбр безмерно на охоте, сердцем легок, с боярами ласков. Кто из бояр ему служил, и хлеб его ел, и пил из его чаши, и дары получал, тот из-за преданности Васильку никакому другому князю уже не мог служить. Крепко любил Василек слуг своих, мужество и ум в нем жили, правда и истина с ним ходили. Был он сведущ во всем и искусен, и княжил он мудро на отцовском и дедовском столе; а скончался он так, как вы слышали.
В лѣто 6746. Ярославъ, сынъ Всеволода великаго, сѣде на столѣ в Володимери. И бысть радость велика христьяном, их же избави Богъ рукою своею крѣпкою от безбожных татаръ. И поча ряды рядити, яко же пророкъ глаголет: «Боже, суд твой цареви дажь, и правъду твою сынови цесареви — судити людемъ твоим в правду и нищим твоимъ в суд». И потомъ утвердися в своем честнѣмь княжении. Того же лѣта князь Ярославъ великый отда Суждаль брату своему Святославу. Того же лѣта отда Ярославъ Ивану Стародубъ. Того же лѣта было мирно.	В год 6746 (1238). Ярослав, сын великого Всеволода, занял стол во Владимире. И была радость великая среди христиан, которых Бог избавил рукой своей крепкой от безбожных татар. И начал князь творить суд, как говорит пророк: «Боже, даруй царю твой суд, и сыну царя твою правду — да судит праведно людей твоих и нищих твоих на суде». И потом он утвердился на своем честном княжении. В тот же год великий князь Ярослав отдал Суздаль брату своему Святославу. В тот же год отдал Ярослав Ивану Стародуб. В тот же год было мирно.
В лѣто 6747. Посла Ярославъ князь великий по брата своего Георгия в Ростовъ,[29] и привезоша и к Володимерю, и не дошедше ста. Изидоша из града противу ему епископъ Кирилъ и Дионисий архимандритъ; понесоша и в град с епископомъ, и игумени, и попове, и черноризци. И не бѣ слышати пѣнья в плачи и велици вопли, плака бо ся весь град Володимерь по нем. Ярослав же, и Святославъ, и князи рустии плакахуся по нем с дружиною своею, и множество бояръ и слугъ плакахуся лишения своего князя, убозии кормителя. Пѣвше обычныя пѣсни и положиша и в гроб каменъ в святой Богородици в гробници, иде же лежить Всеволодъ, отець его. Бѣ Юрьи, сынъ благовѣрнаго отца Всеволода, украшенъ добрыми нравы, их же имена вмалѣ повѣмы.	В год 6747 (1239). Великий князь Ярослав послал за телом брата своего Георгия в Ростов, и привезли его к Владимиру, и остановились, не доехав. Навстречу телу вышли из города епископ Кирилл и Дионисий архимандрит; понесли его в город с епископом, и игуменами, и попами, и монахами. И не слышно было пения из-за великого плача и вопля, ибо весь город Владимир оплакивал князя. А Ярослав, и Святослав, и князья русские оплакивали его с дружиной своею, и множество бояр и слуг оплакивало смерть своего князя, кормителя убогих. После заупокойной службы положили его тело в гробницу каменную в церкви святой Богородицы в усыпальнице, где погребен и Всеволод, отец его. Был Юрий, сын благоверного отца Всеволода, украшен добродетелями, о которых расскажем вкратце.
Се бо чюдный князь Юрьи потщася Божья заповѣди хранити и Божий страх присно имѣя в сердци, поминая слово Господнее, еже рече: «О семь познают вы вси человеци, яко мои ученици есте, аще любите друг друга. Не токмо же друга, но и врагы ваша любите и добро творите ненавидящим вас. Всякъ зломыслъ его прежемѣненыя безбожныя татары отпущаше одарены.[30] Бяхуть бо преже прислали послы своѣ злии ти кровопийци, рекуще: «Мирися с нами». Он же того не хотяше, яко же пророкъ глаголет: «Брань славна луче есть мира студна». Си бо безбожнии со лживым миром живуще велику пакость землям творять, еже и здѣ многа зла створиша. Богъ бо казнить напастми различными, да явяться яко злато искушено в горнилѣ — христьяном бо многыми напастми внити в царство небесное. Сам бо Христосъ Богъ: «Нужно е царство небесное, и нужници въсхытают е». Георгие, мужьство тезоимените, кровью омывъся страданья ти! Аще бо не напасть, то не вѣнець, аще не мука, ни дарове. Всякый бо держася добродѣтели, не может безъ многих враг быти.	Этот дивный князь Юрий старался Божественные заповеди соблюдать и всегда имел страх Божий в сердце, помня слово Господа, которое так звучит: «Все люди узнают, что вы мои ученики, если будете любить друг друга. Любите не только друзей, но и ваших врагов и делайте добро ненавидящим вас». Всякого его недруга эти безбожные татары отпускали, наградив. Ведь сначала злые эти кровопийцы прислали к нему послов своих, призывая: «Мирись с нами». Он же не хотел этого, как говорит пророк: «Славная война лучше постыдного мира». Ведь эти безбожники, лживый мир предлагая, великое зло землям творят, и нам они сотворили много зла. Бог наказывает людей различными несчастьями, чтобы они стали как золото, очищенное в горниле,— ведь христиане, преодолев много напастей, войдут в царство небесное. Ведь сам Христос Бог говорит: «Усилием берется царство небесное, и прилагающие усилие получат его». Георгий,— воплощенное мужество,— кровью омылись страданья твои! Если не будет испытания, не будет и венца, если нет мук, нет и воздаяния. Всякий, кто привержен добродетели, не может прожить без множества врагов.
Милостивъ же бяше паче мѣры, поминая слово Господне: «Блажении милостиви, яко ти помиловани будут». Тѣмь и не щадяше имѣния своего, раздавая требующим; и церкви зижа и украшая иконами безъцѣнными и книгами, и грады многы постави, паче же Новъгородъ вторый[31] постави на Волзѣ усть Окы, и церкы многы созда и манастырь святыя Богородица[32] Новѣгородѣ. Чтяшет же излиха чернечьскый чинъ и поповьскый, подая имъ еже на потребу. Тѣм и Богъ прошения его свершаше, исполни лѣт его в доброденьствии. И посѣдѣ в Володимерѣ на отни столѣ лѣт 20 и 4, а на 5-е убьенъ бысть от безбожных и поганых татаръ. Се же все сдѣяся грѣх ради наших.	Был Юрий милостив безмерно, помня слово Господа: «Блаженны милостивые, ибо они помилованы будут». Поэтому он не дорожил своим имуществом, раздавая его нуждающимся; он строил церкви, украшая их иконами бесценными и книгами, и много городов основал, прежде всего Новгород второй на Волге в устье Оки, и многие церкви воздвиг и монастырь святой Богородицы в Новгороде. Особенно же почитал он иноков и священников, наделяя их всем необходимым. Поэтому и Бог выполнял его просьбы, и было мудро правление его. И сидел Юрий во Владимире на отеческом престоле двадцать четыре года, а на двадцать пятый год был убит безбожными и погаными татарами. И все это произошло из-за наших грехов.
Но не предай же нас до конца имени твоего ради святаго и не остави милости твоея от нас молитвою святыя Богородица и блаженаго епископа Кирила. Не презрѣ Господь молитвы его и слезъ, иже приношаше Господеви, моляся день и нощь, абы не оскудѣла правовѣрная вѣра христьяньская. Еже и бысть: сдѣя Господь спасенье велико князем нашим, избавилъ есть от враг наших; «очи бо Господни на боящаяся его, а уши его в молитву ихъ». Гониша по них татарове и не обрѣтоша. Яко же и Саулъ гоняше Давида,[33] но Богъ избави от руку его, тако и сих Богъ избави от рукы иноплеменник, благочестиваго и правовѣрнаго великого князя Ярослава с благородными своими сыны. Бѣ же ихъ 6: Олександръ, Андрѣй, Костянтинъ, Офонасий, Данило, Михайло. А Святославъ с сыном с Дмитрием, Иванъ Всеволодичь, Володимеръ Костянтинович, Василковича 2 — Борисъ и Глѣбъ, Всеволодичь Василий, — си вси схранени быша Божьею благодатью; но мы на предреченая взидем.	Но не погуби нас, Господи, до конца ради твоего святого имени и не лишай нас своей милости ради молитвы святой Богородицы и блаженного епископа Кирилла. Не презрел Господь молитвы и слезы князя Юрия, что приносил он Господу, молясь днем и ночью, чтобы не оскудела правоверная вера христианская. Так и случилось: Господь послал нам великое спасение ради нашего князя, избавил нас Бог от врагов наших; «ведь очи Господа обращены к боящимся его, а уши его к их молитве». За князьями гнались татары, но не настигли их. Как и Саул преследовал Давида, но Бог спас Давида от его руки, так и этих князей Бог спас от руки иноплеменников, благочестивого и правоверного великого князя Ярослава и его благородных сыновей. А было их шесть: Александр, Андрей, Константин, Афанасий, Даниил, Михаил. А Святослав с сыном Дмитрием, Иван Всеволодович, Владимир Константинович, два сына Василька — Борис и Глеб, Василий Всеволодович. И все они были сохранены Божьей благодатью; но мы вернемся к прежнему рассказу.
Того же лѣта татарове взяша Переяславль Рускый, и епископа убиша, и люди избиша, и град пожьгоша огнем, и люди, и полона много вземше, отидоша. Того же лѣта Ярославъ иде г Каменьцю; град взя Каменець, а княгыню Михайлову со множьством полона приведе в своя си. Того же лѣта священа бысть церкы Бориса и Глѣба в Кидекшии[34] великым священьем на праздник Бориса и Глѣба священымъ епископомъ Кириломъ. Того же лѣта взяша татарове Черниговъ, князи ихъ выѣхаша въ Угры; а град пожегше, и люди избише, и манастырѣ пограбиша, а епископа Перфурья пустиша в Глуховѣ;[35] а сами идоша в станы своѣ. Того же лѣта Ярославъ иде Смолиньску на Литву, и Литву побѣди, и князя ихъ ялъ; а смольняны урядивъ князя Всеволода посади на столе, а сам со множеством полона с великою честью отиде в своя си. Того же лѣта на зиму взяша татарове Мордовьскую землю, и Муром пожгоша, и по Клязьмѣ воеваше, и град святыя Богородица Гороховець пожгоша, а сами идоша в станы своя. Тогды же бѣ пополохъ золъ по всей земли, и сами не вѣдяху и гдѣ хто бѣжить.	В тот же год татары взяли Переяславль Русский, и епископа убили, и людей перебили, а город сожгли огнем, и, захватив много пленников и добычи, отступили. В тот же год Ярослав пошел к Каменцу; он захватил город Каменец, а княгиню Михаила и большую добычу забрал с собой. В тот же год освящена была великим освящением церковь Бориса и Глеба в Кидекше в праздник Бориса и Глеба священным епископом Кириллом. В том же году татары взяли Чернигов, князья же оттуда выехали в Венгрию; а город сожгли, и людей перебили, и монастыри разграбили, а епископа Порфирия отпустили в Глухове; а сами татары вернулись в станы свои. В тот же год Ярослав выступил в поход из Смоленска против Литвы, и победил Литву, а князя их взял в плен; уладив дела со смольнянами, он посадил у них князем Всеволода, а сам с большой добычей и с великой славой вернулся в свои земли. В тот же год зимой захватили татары Мордовскую землю, и Муром сожгли, и воевали по берегу Клязьмы, и город святой Богородицы Гороховец сожгли, а затем вернулись в станы свои. Тогда было смятение большое по всей земле, и сами люди не знали, кто куда бежит.
В лѣто 6748. Родися Ярославу дщи и наречена бысть в святомь крещении Марья. Того же лѣта взяша Кыевъ татарове и святую Софью разграбиша и манастыри всѣ. И иконы, и кресты честныя, и вся узорочья церковная взяша, а люди от мала и до велика вся убиша мечем. Си же злоба приключися до Рожества Господня на Николинъ день.[36]	В год 6748 (1240). У Ярослава родилась дочь и была названа при святом крещении Марией. В тот же год взяли татары Киев и храм святой Софии разграбили и монастыри все. А иконы, и честные кресты, и все церковные украшения забрали и избили мечом всех людей от мала до велика. А случилось это несчастье в Николин день до Рождества Господа.
