СЛОВО И СКАЗАНИЕ О ЗВЕРЕХ И ПТАХАХ	СЛОВО И СКАЗАНИЕ О ЗВЕРЯХ И ПТИЦАХ
Фисилогъ и о лвѣ. Три естества имат левъ. Егда бо раждает лвица мьртво и слепо раждает, седит же и блюдет до третьего дьни. По трех же днех приидет левъ и дунет в ноздри ему и оживет. Тако и о вѣрных языцѣхъ. Прежде бо крещениа мьртви суть, по крещении же просвѣщаються от Святаго Духа.	Физиолог о льве. Три свойства имеет лев. Когда львица родит, то приносит мертвого и слепого детеныша, сидит она и сторожит его до трех дней. Через три же дня приходит лев, дунет ему в ноздри, и детеныш оживет. То же и с верными народами. До крещения они мертвы, а после крещения очищаются Святым Духом.
Второе естество лвово. Егда спит, а очи его бдита. Тако и Господь наш рече ко июдеом, якоже: «Азъ сплю, а очи мои божественыа и сердце бдита»[1].	Второе свойство льва. Когда спит, то глаза его бодрствуют. Так и Господь наш говорит иудеям: «Я сплю, а глаза мои божественные и сердце бодрствуют».
А третье естество лвово: егда отбегает лвица, хвостом своим покрывает стопы своя. Да не может ловець осочити слѣда его.	А третье свойство льва,— когда львица бежит, то следы свои заметает своим хвостом, и охотник не может отыскать ее следов.
Тако и ты, человѣче. Егда твориши милостыню, да не чюет леваа рука, что творит десница твоя. Да не возбранит дьяволъ дѣло помысла твоего.	Так и ты, человек. Когда творишь милостыню, то пусть левая рука не знает, что делает твоя правая. Да не помешает дьявол делам помысла твоего.
О утропѣ. Утропъ имать два рога. Живет же близъ рѣкы акиана на крайны земли. Да егда ся вожедает, пьет от нея и упиваеться и бореться со землею и чешет роги своими. И есть же тамо древо нарицаемо танисъ, подобно зѣло виннѣй лозѣ добрами вѣтми и густо прутиемъ и чеша прутиемъ соплетаеться в них и обрѣтаеть его ловець и удолѣеть ему.	Об антилопе. У антилопы два рога. Живет она около реки-океана на краю земли. Когда же захочет пить, то пьет из реки и упивается, упирается в землю и роет ее рогами своими. И есть там дерево, называемое танис, сильно напоминающее виноградную лозу широкими ветвями и густыми прутьями,— и, продираясь сквозь прутья, антилопа запутывается в них,— тогда охотник ее ловит и одолевает.
Тако и человѣкъ. В рогъ мѣсто далъ ему есть Бог оба Завѣта, Вѣтхаго и Новаго. Рогы противныа сили, якоже рече пророкъ Давидъ: «О тобѣ врагы наша избодем рогы».[2] Рѣка акианьска есть богатъство. Танис же — сласть житейскаа. Да въплетаяся человѣкъ не брѣжет о вѣрѣ, но обрѣтъ и дьяволъ и удолеет ему.	Так и человек. Вместо рогов Бог дал ему оба Завета, Ветхий и Новый. Рога — это сопротивление силе; как говорит пророк Давид: «С тобою избодаем рогами врагов наших». Река океанская — это богатство. Танис же — житейские наслаждения. Запутывается в них человек, который не заботится о вере, и находит его дьявол и одолевает его.
О слонѣ. Слонъ живетъ на горах. Слоница обрящет былие, нарицаемое мандрагураи[3] и взимает от нея. Тако же и слонъ и гиниться с нею. И егда раждаеть, взаиит в реку до вымене и раждаеть в воде. Спить же при древѣ. Да егда падется от него, вопиеть и приидет слонъ великъ и не может возвести его и пакы друзии 12. Да ни ти. Да тогда же возопиете оба на десяте. И приидет инъ малъ и подложитъ ротъ свой и возмѣть и.	О слоне. Слон живет в горах. Слониха находит траву, называемую мандрагорой, и поглощает ее. Так же и слон; и сходится с нею. А когда слониха рожает, то входит в реку до вымени и рожает в воде. Спит же слон стоя около дерева. А если упадет, то вопит, и приходит большой слон, но не может поднять его; и затем приходят другие двенадцать. Но и они поднять не могут. И тогда завопят все двенадцать слонов. И приходит маленький слон, и подставляет хобот свой, и поднимает его.
Сиречь первый слонъ Евга, вторый Адамъ. Былие древо преслушаниа. А еже вкуси, яко преступи. А еже «увы мнѣ», яко съгрѣши. И что озеро? Рожеству рай. И что приклоннаа древеса? Оплота райскаа. И кто сикырою изпадаа? Дьяволъ. И кто сикира? Языкъ змиевъ. И еже паде, яко изгнан бысть. И кто великий слонъ? Моиси. И кто 12 слона не могше извести его[4] и кто изведе его? Христос. То бо возведе того Адама от ада[5].	Таким образом, первый слон — это Ева, второй — Адам. Трава — древо ослушания. И если вкусил, то совершил преступление. А «увы мне»— это значит согрешил.— А что такое озеро? — Рождества рай. А что такое склоненные деревья? — Оплот райский. И кто от топора падет? Дьявол. А что топор? — Это язык змеи. И когда упал, то был изгнан. А кто большой слон? — Моисей. А кто двенадцать слонов, которые не могли поднять его, и кто поднял его? — Христос, который вывел того Адама из ада.
О елени. Елень живеть 50 лѣт. И по сем ходит по странах и во дрязгах горьских пухает змии, да идеже налезет ю, облинавшюю трижды, обухает ю и помѣтаетъ ю. И шедъ пьеть воду. Аще ли не пьеть, то умирает. Аще испьеть, да живет другую 50 лѣт. Да сего дѣля рече пророкъ, якоже желает елень на источьники водныя.[6]	Об олене. Олень живет пятьдесят лет. А затем уходит в долины и горные леса, и учует запах змеи, и где найдет ее, трижды сменившую кожу, обнюхивает ее и отбрасывает ее. И после этого идет и пьет воду. Если же не пьет, то умирает. Если же выпьет, то живет другие пятьдесят лет. Об этом говорит пророк: как стремится олень к источникам водным.
Тако и ты, человѣче, три обновлениа имаши в собѣ: крещение, покоание и неистлѣние. Да егда согрѣшиши, тѣци ко церкви и ко источнику живу книжну и на сказание пророческое и пий воды живы, сиречь святое комкание.	Так и ты, человек, заключаешь в себе три обновления: крещение, покаяние и нетление. А когда согрешишь, то устремись к церкви, и к живому книжному источнику, и к пророческому сказанию, и испей живой воды, то есть святого причастия.
О орлѣ. Орелъ живет лѣт сто. И ростеть конець носа его. И ослепнете очи его. Да не видит и не может ловити. Да возлетит на высоту, свержет себе на камень и уломиться конецъ носа его и куплеться во златѣ езерѣ. И сядет прямо солнцю. Да егда ся согрѣет, спадут чешюи с него и пакы птенець будет.	Об орле. Орел живет лет сто. И растет кончик клюва его. И ослепнут глаза его, так что он не видит и не может охотиться. Тогда он взлетает в высоту, бросается на утес, и отломится кончик клюва его; и искупается в золотом озере. А потом садится на солнцепек. Когда же он согреется, с него сходит чешуя, и он опять становится птенцом.
Тако и ты, человѣче, егда много согрѣшиши, взыди на высоту, сиречь в вѣру и плачися предложение грѣха и измыйся слезами своими. Согрѣйся въ церкви и сверзи с себѣ грѣхи.	Так и ты, человек, если много нагрешишь, возвысься, то есть обратись к вере, и оплакивай проявление греха, и умойся слезами своими. Отогрейся в церкви и сбрось с себя грехи.
О финиксѣ. Финиксъ красна птаха есть паче всѣх и павы краснѣй. Пава бо ни златом, ни сребром образъ имѣта, а финиксъ уакинфовъ[7] и камениа многоцѣнна. Вѣнець носит на главѣ и сапогы на ногу, якоже царь. Есть же близъ Индѣя, близъ Солнечна града.[8] Лежить же лѣт 500 на кедрех ливаньских безъ брашна. Питаеть же ся от Святаго Духа. И по пяти сотъ лѣт исполняеть крылѣ свои от добрых вонь. И клепает ереи Солнечнаго града и идет птаха та ко иерееви и входит во церковь. И сядет на степени олтарном[9] иерей со птахою. И будет все попелъ. И заутра прииде ерей и обрящет птицю птенець младъ бывшь. И по двою дньма обрящеть ю совершену, якоже и преже была. И целует ю иерей и пакы отиде на свое мѣсто.	О фениксе. Феникс самая красивая птица из всех, и красивее павлина. У павлина в обличье ни золота, ни серебра, а у феникса — иакинфы и многоценные камни. Голова его украшена венцом, а на ногах — сапоги, как у царя. Обитает же феникс близ Индии, около Солнечного города. Возлежит он лет пятьсот на кедрах ливанских без еды. Питается же от Святого Духа. И по пятьсот лет наполняет крылья свои благовониями. И бьет в било иерей Солнечного города, и та птица идет к иерею и входит в церковь. Иерей же садится на солее с птицей. И превращается птица в пепел. А назавтра приходит иерей и находит птицу в виде малого птенца. А через два дня он находит ее зрелой, какой была раньше. И целует ее иерей, а она опять уходит на свое место.
Да како неразумнии жидовѣ не яша вѣры тридневному воскресению Господа нашего Иисус Христа. Яко сию птицу самъ оживляеть, да какъ самъ себѣ не востави. Сего дѣля пророкъ Давидъ глаголеть: «Праведникъ яко финиксъ процвѣтеть, яко кедръ ливаньский умножится, насаждение в дому Господни».[10]	А неразумные иудеи не верят в тридневное воскресение Господа нашего Иисуса Христа. И что эту птицу он сам оживляет и будто сам себя не воскрешает. Сего ради пророк Давид говорит: «Праведник процветает, как феникс, как кедр ливанский, умножится насаждение в доме Господнем».
О иряби. Ирябь много яець пологает на гнѣзде своем. Любива же и чадом своим. Да идет на чюжда гнѣзда и крадет яйца ихъ. Да ся умножать чада ея.	О куропатке. Куропатка кладет много яиц в гнезде своем. Она весьма чадолюбива. И даже идет к чужим гнездам и таскает оттуда яйца. Только чтобы увеличить число птенцов своих.
Тако и ты, человѣче, елико богатьство сбираеши не имаши сыти, но еси на все несытъ.	Так и ты, человек: когда собираешь богатство, не можешь насытиться, и все тебе мало.
О горлици. Горлица мужелюбица птах есть. Да аще бо погибнет единъ ею, отходит другаа в пустыню и сядет на усохле древѣ, плачющись подруга своего. И к тому не спряжеться сь имъ николиже.	О горлице. Горлица — птица-однолюб. Если погибнет одна из четы, то другая улетает в пустыню, садится на сухом дереве и оплакивает супруга своего. И уже не сочетается больше ни с кем другим никогда.
Тако и ты, человѣче, отлучился еси жены своея к тому не приле-пися к ней.	Так и ты, человек, если разлучился с женой своей, то не прилепись к другой.
О неясыти. Неясытъ чадолюбива птах есть. Проклеваеть бо жена ребра птенцем своимъ. А онъ приходит от кормли своей. Проклюет ребра своя, да исходящи кровь оживляет птенца.	О пеликане. Пеликан — чадолюбивая птица. Самка проклевывает ребра птенцам своим. А самец прилетает с кормом, раздирает клювом грудь свою и вытекшей кровью оживляет птенца.
Тако и Господь наш, от жидовъ копием ребра его прободоша. Изыиде кровь и вода. И оживи вселеную, сиречь умершаа.	Так и Господь наш. Его ребра прокололи иудеи копьем. Выступили кровь и вода. И оживил он вселенную, то есть умерших.
Сего дѣля и рече пророкъ яко уподобихся неясыти пустыннѣй.[11]	Сего ради и говорит пророк, что уподобился пеликану в пустыне.
О ластовици. Ластовица в пустыни гнѣздо имат на распутии. Егда же ослепнет едино от птенець ея, идет в пустыню и принесет былие и положит на очию его. И прозрит.	О ласточке. Ласточкино гнездо в пустыне на распутье. Когда ослепнет один из птенцов ее, она отправляется в пустыню, и приносит травы, и кладет их на очи его. И он прозревает.
Тако и ты.человѣче, егда съгрѣшиши, иди к молитвѣ и приими покоание и единосущныя ради Троица избавишися грѣха того.	Так и ты, человек, когда согрешишь, то обратись к молитве и прими покаяние, и ради единосущной Троицы ты избавишься от того греха.
О вдодѣ. Овдод творит гнѣздо свое и воспитает птенца своя. И посемъ облинают сами и будут нази. Да исходит единъ от птенець их и приносит пищу родителемъ своим, дондеже опернатеють и возлетита оба.	Об удоде. Удод свивает гнездо свое и выкармливает птенцов своих. А затем птицы линяют и делаются нагими. Тогда выходит один из их птенцов и приносит пищу родителям своим, пока они не оперятся и не взлетят оба.
Тако и ты, человѣче. Егда ся состарееши, не отчай себѣ, но шед к церкви помолися и обрящеши милость.	Так и ты, человек. Когда состаришься, не отчаивайся, но, идя в церковь, помолись и обретешь милость.
О дятлѣ. Дятелъ пестра птица есть, живет же в горах и ходит на кедры и клюет носом своим. Да гдѣ налезѣть мякко древо, ту творит гнѣздо свое.	О дятле. Дятел — пестрая птица, живет она в горах, садится на кедры и стучит своим клювом. А где найдет мягкое дерево, там делает себе гнездо.
Тако и дьяволъ бореться со человѣкы. Да в нем же налезет слабость и небрежение молитвы, внидет в онь и вогнѣздяться. В нем же ли обрящет бодрость; бежит от него.	Так и дьявол борется с людьми. И когда в ком-то найдет слабость и пренебрежение к молитвам, то войдет в него и угнездится. Если же в другом найдет крепость, то бежит от него.
О лисици. Лисица егда будет голодна, идеть на мѣсто солнечно и ляжет на присолньи и держит душю свою надмѣться. Видѣвше же ее птици, мняще мьртву, приидут да едят. Да егда ся приближат к ней воскочивши и имет от них и есть. И тако ся кормит[12].	О лисице. Лисица, когда будет голодна, идет на солнечное место, и ложится на солнцепеке, и сдерживает свое дыхание. Увидев это, птицы, принимая ее за мертвую, слетаются, чтобы клевать ее. Когда же они приблизятся к ней, она вскакивает, хватает какую-нибудь из них и съедает. Так и кормится.
О жене и о мужи. Есть жена на западе, а мужь на востоцѣ. Да совокупляетася оба. И изьес мужа своего жена главу и зачнет и родит двое. Да яко же родит, ту изьедят своя чада. И абие умрет. И отидет мужь на востокъ, а жена на западъ.	О жене и о муже. Жена на западе, а муж на востоке. И вот они сходятся, и жена съедает голову своего мужа, и зачнет, и родит двойню. А как родит, сразу тут съедает своих детей. И тотчас умирает. И уходит муж на восток, а жена на запад.
Тако и ты, человѣче, егда ти найдет житейскаа напасть, теци въ церковь и прослезися и возопи. И отступить от тебѣ неприазнъ.	Так и ты, человек. Когда настигнет тебя житейская беда, устремись в церковь, прослезись и плачь. И отступит от тебя неудача.
О Горгони. Въргони[13] обличие имат жены красны и блудница. Владь же главы своеа суть змиа. А видение ея смерть. Играет же и смѣеться во время свое. Живет же в горах западных. Да егда приидут днье ея, да ся гонит. Станеть и начнет звать. Наченши от лва и прочаа звѣри, от человѣка до скотины и птиць и змиа, глаголющи: «Идете ко мнѣ». Да елико их услышат глас ее, идуть к ней. И видевше ю, измирают.	О Горгоне. У Горгоны обличие красивой женщины и блудницы. Волосы же на ее голове — змеи. А взгляд ее — смерть. Играет она и все время смеется. Живет она в горах на западе. И когда приходит ее брачная пора, встанет она и начнет звать. Начиная от льва и прочих зверей, от человека до домашних животных и птиц и змей, зовет, говоря: «Идите ко мне!» Как только они услышат ее зов, то идут к ней. А увидев ее, умирают.
