Тако бо разумѣет всякъ языкъ всем звѣрем, которым же образомъ уловляеть ю волхвъ, разумѣет хитростию своею от звѣздъ день, в ня же ся гонит. И поидеть на мѣсто ея, волхвуя отдалеча. Она же начнет звати, наченши от лва и прочая звѣри.	И знает она язык всех зверей. Каким же образом одолевает ее волхв: он своей мудростью по звездам узнает день ее брачной поры. И идет на место ее, волхвуя издалеча. Она станет звать, начиная от льва и всех прочих зверей.
Егда же доидет языка волхвова, отзовется ей, глаголя: «Ископай яму на мѣсте и вложи в ню главу свою, да ее не вижу и умру. И прииду и лягу с тобою». И сотворит тако.	Когда же дойдет до языка волхвов, он ей отзовется так: «Выкопай на этом месте яму и вложи в нее свою голову, чтобы я не видел ее и не умер. Тогда я приду и лягу с тобой». И она сделает так.
Тогда шедше волховъ посечеть ю за ся зря и не видить главы ея, да не умреть. И вложит ю во сосудину. Да егда узрит змиа или человѣкъ или звѣрь, кажеть имъ главу Горгонину и абие оцепенѣють и Александръ[14] бо имяше ю и одоляше языком всем. И ты, человѣче, имѣй смыслъ ко Господу и удобь одолееши противным силамъ.	Тогда волхв, придя, убьет ее, не глядя на нее и не видя головы ее, поэтому и не умирает. И прячет голову в сосуд. А если он увидит змею или человека, или зверя, то покажет им голову Горгоны, и тотчас они оцепенеют; и Александр ведь имел эту голову и победил все народы. И ты, человек, имей уважение к Господу и непременно одолеешь вражьи силы.
О змии. Змиа егда поидет пити води, ядъ свой въ гнѣздѣ своем оставляет. Да не последи пьющиа уморит.	О змее. Когда змея идет пить воду, то яд свой в гнезде своем оставляет. Чтобы не отравить пьющих после нее.
И ты, человѣче, егда идеши во церковъ святую, всяку злобу остави домаси.	И ты, человек, когда идешь в церковь святую, всякую злобу оставь дома.
И пакы, егда состареет змиа и не видит, шедши влезеть в камену расселину узку и поститься днии 40 и смирит себѣ и излинет и пакы млада будет.	И еще: когда состарится змея и не видит, влезает в узкую расселину в скале, и постится сорок дней, и затаится, и полиняет, и опять станет молодой.
И ты, человѣче, постился еси 40 день, да совлачися от льсти дьяволя и облечися в новый, обновляющийся во Христа.	И ты, человек, постился сорок дней, чтобы сбросить с себя лесть дьявола и принять новый облик, обновляющийся во Христе.
И пакы, егда узрит человѣка змиа, бѣжить от него. Аще ли не узрит его совлечена, пришедши бореться с ним. Аще ли есть оболоченъ вѣрою, бежит от него.	И еще: когда змея видит одетого человека, то убегает от него. Если она увидит его раздетым, то нападает и борется с ним. Если же он защищен верою, то она бежит от него.
Сего ради Господь рече: «Бывайте умни, яко змиа и цѣли яко голуби».[15]	Сего ради Господь говорил: «Будьте мудры, как змея, и чисты, как голуби».
О голуби. Голубъ славно есть во птицах. Разумѣй же о бѣлей и о чернѣй голубици, како ходят белыи и пестрыа и черныа и чермьныя и кормят птенци свои во сыне голубичи. Да не могут о собѣ возлетати, дондеже обыйдет чермнаа голубица и подаст имъ пищу не возлетять.	О голубе. Голубь — славнейшая из всех птиц. Различай же белую и черную голубку, как ходят белые, и пестрые, и черные, и красные и кормят птенцов своих как сына по-голубиному. Не могут они сами возлететь,— пока красная голубка не появится и не подаст им пищу, они не возлетят.
Тако и Спасово пришествие рѣша пророци, Моиси и Аронъ, Самуилъ, Данилъ, Малахиа, Исайя, Иеремиа и прочии пророци о Иисусѣ. И не могоша урѣснити своего слова, дондеже прииде черьмнаа голубица, Иоан Креститель, то бо крести Иисуса, глаголя: «Се агнець Божий, воземляй грѣхы всего мира»[16]. И ты, человѣче, не вдаляй себѣ от церкви; да не вуслышиши: «Не вѣде васъ».	Так и Спасово пришествие предсказали пророки Моисей и Аарон, Самуил, Даниил, Малахия, Исайи, Иеремия и прочие пророки о Иисусе. И не могли удостоверить свое слово, пока не пришла красная голубка — Иоанн Креститель; он же и крестил Иисуса, говоря: «Это агнец Божий, принявший грехи всего мира». И ты, человек, не отдаляйся от церкви, чтобы не услышать: «Не знаю вас».
О ехиднѣ. Ехидна есть, от полу и выше имать образъ человѣчь. А полъ ея и ниже имат образ коркодилъ. Ходита же и мужь и жена оба накупь, Да егда ся разгорит жена и хощется гонити, идеть к мужеви, изьесть лоно его. И зачнет и абие умрет муж ея. Да егда приближать родит жена, изьедят чрева ея чада своя. И умрет и та. И потом изыидут отцюубийци и материубийци, якоже и жидовѣ отцуубийци и материубийци.	О ехидне. Ехидна от пояса и выше имеет человеческий образ. А от пояса и ниже — образ крокодила.Идут же и самец и самка на соитие. И когда распалится самка и хочет сойтись с самцом, она идет к самцу, съедает лоно его. И зачинает, и тотчас умрет самец. А когда приблизятся роды у самки, съедают чрево ее детеныши. И она умирает. И потом выходят отцеубийцы и матереубийцы, как и иудеи отцеубийцы и матереубийцы.
Убиша отца, сиречь Христа, убиша матерь, сиречь церковь. Сего ради Иоан поноси ими, глаголя: «Чада ехиднова, кто показа вам бежати от грядущаго гнѣва?»[17]	Они убили отца, то есть Христа, убили мать, то есть церковь. Того ради Иоанн поносил их, говоря: «Порождения ехиднины! кто велел вам бежать от грядущего гнева?»
О стерце. Стеркъ чадолюбива птица есть. Да егда мужь принесет кормлю, блюдет жена его птенца. И измѣняета кождо их корьмлю. И блюдета гнѣздо свое.	Об аисте. Аист — чадолюбивая птица. И когда самец приносит корм, то сторожит самка его птенца. И по очереди кормят птенцов. И сторожат гнездо свое.
Тако и ты, человѣче, ни вечеръ, ни за утра ушибайся молитвы, ни церкви. Николи же ти удолеет дьяволъ.	Так и ты, человек, ни вечером, ни утром не забывай молиться, не забывай и церкви. И никогда не одолеет тебя дьявол.
О утропѣ. Утропъ имать от пулу и до выше образ коневъ, а полъ его и до ниже образъ рыбий китовъ. Ходить же в мори и есть воевода всѣм рыбам. На странѣ же крайнѣй земли стоить рыба злата и не приходит от мѣста своего, да погрѣшится ловцем, ходя ко утропу. Да то акы воевода сый рыбам, идет на крайную землю ко златой той рыбѣ. Оближеть ю и того пакы облизают вси мужи рыбии. И отходят на своа мѣста мужи прежде, а жены послѣди. И помѣтают сѣмя мужи, а жены идучи послѣди, беруть й и будут чреваты. И за седми деньми раждають. Егда же ходят на крайны земли, ставят рыбари мрежа своя на пропутие рыбамъ. Понеже будут чреваты, потоле не влавляют их.	О водном коне. От пояса и выше имеет образ коня, а ниже пояса образ рыбы кита. Плавает же в море и воевода над всеми рыбами. На окраинной же стороне земли стоит золотая рыба и не сходит со своего места, чтобы не попасться рыбакам на пути к водному коню. А он как воевода над рыбами идет на окраину земли к той золотой рыбе. Оближет ее, и затем ее облизывают все рыбьи самцы. И уходят на свои места сначала самцы, а потом самки. И самцы мечут семя, а самки, идя за ними, принимают его и становятся чреваты. И через семь дней родят. Когда же они ходят на окраинные земли, то рыбаки ставят сети свои на пути рыб. Пока же будут чреваты, их не ловят.
Утроп же сказаемо есть Моисий начал пророчества. Море же весь миръ, а рыбы человѣци. Златаа рыба сказаеться вход правовѣрию. Ходят бо прежде пророци и облизаються Святаго Духа. Лижуще бо человѣци от учениа пророчества, последующе берут духовную благодать. Рыбари же суть бѣси. Мрежа же есть пагуба и льстиваа вождеваа, иже не идоша во слѣд утропа, сиречь Моисеова закона, но отдалишась и впадоша во мрежа рыбарь тѣх и погыбоша. А шедших во слѣд пророкъ ни сѣть, ни мрежа не постиже их.	Водный конь толкуется: Моисей начал пророчества. Море же — весь мир, а рыбы — люди. Золотая рыба толкуется как вход-правоверия. Идут же прежде пророки и приобщаются к Святому Духу. Люди, приобщающиеся к учению пророчества, от них получают духовную благодать. Рыбаки же — это бесы. Сеть же — это пагуба и льстивые вожделения,— если не следуют водному коню, то есть Моисееву закону, тогда отдаляются и попадают в сети тех рыбаков и погибают. А идущих за пророками не настигнет ни сеть, ни невод.
О стерце и о прочих птахахъ. Стеркъ добра птица есть. Егда бо настанет весна, сберуться вси накупь со иными прочими птицами, со гусми и утками и всякъ птиць род, от Египта и Лувиа и Срацинъ[18]. И возлетять вси и приидут во Лукию на реку нарицаемую Ксанфонъ[19] и составят тамо брань со вранми и вронами, и галицами, и гиппосы, и елико плотоядець есть.	Об аисте и о прочих птицах. Аист — добрая птица. Когда настанет весна, соберутся все вместе с другими прочими птицами, с гусями и утками и со всякими птичьими родами, из Египта, и Ливии, и из Сарацин. И взлетают все, и прибудут в Лукию на реку, называемую Ксанфон, и вступают там в бой с воронами и воронами, и галками, и коршунами, и сколько хищников есть.
Достоить и тѣмъ вѣдущим врѣмя обрѣстися тамо всѣмъ. Да неясыче воинъство и жеравино и прочих водных птиць и житоядець на единой странѣ рѣкы той исполчится по бѣрегу. А враново и прочих всех плотоядець птиць на друзѣм берѣзѣ рѣкы.	Следует и тем знающим время находиться там всем. Да пеликаново воинство, и журавлиное, и прочих водных птиц и травоядных выстроится по берегу на одной стороне реки. А вороново и всех прочих хищных птиц — на другом берегу реки.
Строять же ся, бо шесть месяць соберуться на брань. Вѣдят бо и дьни, в ня же ся хотят бити. Да есть слышати до небеси голву и кровь тѣкущу во брани бьюшимся птицам и отпадению пѣрию бес числа.	Строятся же шесть месяцев и соберутся на бой. Знают же и дни, в которые хотят биться. Да слышен до небес шум, и течет кровь птиц, дерущихся в бою, и выпадают перья без числа.
Тѣм же и лукиане вси перины имѣют на постѣлях своих от них. По расходу же брани той видят враны уязвлены и прочих плотоядець птиць множество такоже и стерково. И неясытиць немало и прочих птиць. Многы же от нихъ во брани той падають мьртвы.	Оттого-то лукиане все имеют перины на постелях своих. По окончании же боя того видят ворон раненых и прочих хищных птиц множество, а также и аистов. И пеликанов немало, и других птиц. Многие же из них в бою том падают замертво.
Брань же ихъ межи собою творять, знамение являет от обоих побѣда всѣм человѣком. Аще бо стерково воинъство побѣдит, да будет гобина пшени-ца и прочих всъх семенъ. Аще ли враново побѣдит, да будет множество овець и говядъ и инехъ четвероногъ.	Бой же их между собой и победа одной из сторон являет собой знамение всем людям. Если аистово воинство победит, то будет изобилие пшеницы и прочих всех злаков. Если же вороново воинство победит, то будет множество овец, и коров, и других четвероногих.
Стеркови же имѣють и другое естество изрядно. Егда бо ся состаре-ють родители их и не могут летаги, чада их оба полы дръжаще и под пазуха-ми преносят от мѣста на мѣсто. Тако ся кормят. Аще ли не видети начнут, да влагають имъ кормлю во уста чада своя. Да глаголеться от них мъзда и воздание.	Аисты же имеют и другое примечательное свойство. Когда состарятся их родители и не могут уже летать, тогда их дети, поддерживая с обеих сторон и под пазухи, переносят их с места на место. Так и кормятся. А если начнут слепнуть, то их дети влагают корм им в рот. И таковы им награда и воздаяние.
